market_type,symbol,name,date,open,close,high,low,volume,market_cap,sector,exchange,country,currency,last_updated
stock,MSFT,MSFT Inc,08-03-2024,47536.20817743171,49741.830640201704,51230.74908681415,45530.2244971417,1560789.2088416903,1129874955353.6138,Finance,NASDAQ,US,usd,2024-08-03 23:00:00
stock,GOOGL,GOOGL Inc,2023-06-13,43310.14552728901,44186.00670200739,45750.35168540758,41189.2141231024,9699128.611767782,183670000382.91638,Retail,NASDAQ,Global,USD,2023-06-13 12:00:00
crypto,BTC,BTC Coin,13/08/2024,10624.832142807025,9948.72087971569,10722.264249378351,9602.625893481061,5248039.559890746,333814843116.16656,blockchain,COINBASE,US,$,2024-08-13 02:00:00
crypto,SOL,SOL Coin,08-15-2024,14568.544718500116,14894.45149823145,14998.335725320594,14052.9236013979,3664252.0710936235,175618282363.6357,Crypto,BINANCE,US,USDT,2024-08-15 22:00:00
crypto,SOL,SOL Coin,29/03/2024,39260.94631003675,36902.728007201345,40270.412843903185,36150.67729195225,465457.67678725725,185147643765.7292,blockchain,BINANCE,Global,USD,2024-03-29 19:00:00
stock,GOOGL,GOOGL Inc,2024-03-13,8534.500943127703,7792.087425151899,8939.414168758143,7778.697515006511,8084165.083816495,1826559107185.3008,Technology,NASDAQ,Global,USDT,2024-03-13 00:00:00
stock,TSLA,TSLA Inc,2023-10-27,4892.63 USD,5072.905748066181,5184.548353842046,4677.851920438645,4952273.92420259,920795169828.3783,TECHNOLOGY,NASDAQ,Global,$,2023-10-27 05:00:00
stock,AMZN,AMZN Inc,08-24-2023,45466.92689991832,43273.42031124052,46973.069513532784,41784.189516242805,5201160.143756931,112821678134.503,Artificial Intelligence,NYSE,US,$,2023-08-24 16:00:00
stock,AMZN,AMZN Inc,07-22-2023,9250.874231721096,10119.687898240996,10511.893010845839,9222.889847597311,8948378.676926062,1644663735236.4062,tech,Unknown,Global,usd,2023-07-22 22:00:00
stock,MSFT,MSFT Inc,2023-04-25,46094.49300880561,42300.847111357834,46546.17954288686,40281.46238746324,3253977.9773018803,1797720936645.1445,finance,NYSE,Global,USDT,2023-04-25 08:00:00
stock,AAPL,AAPL Inc,2024-06-25,13574.738098377056,14467.243216347111,14725.305073622967,13086.681813048312,5427418.1354993265,1172145096171.5513,tech,NASDAQ,US,usd,2024-06-25 09:00:00
stock,AMZN,AMZN Inc,22/05/2024,40111.82706789445,36698.716866521645,42091.11897471865,36280.800630199075,1987958.0996601898,431363432674.5403,AI,NASDAQ,Global,USD,2024-05-22 16:00:00
stock,,AMZN Inc,03/04/2024,40774.91680845716,42461.83500577816,44009.58411014746,40308.595179181764,741372.4726891696,26511130199.571175,TECHNOLOGY,NYSE,Global,USD,2024-04-03 21:00:00
crypto,SOL,SOL Coin,2024-05-08,5802.294285661234,6223.660872273629,6417.620680458535,5608.177957315129,636519.9445099504,146593962774.98767,blockchain,COINBASE,US,$,2024-05-08 21:00:00
stock,,MSFT Inc,2024-04-04,16265.914268117085,17012.865150572477,17555.199114867788,16174.184875127608,4722677.036694331,939837141929.83,TECHNOLOGY,NYSE,US,USD,2024-04-04 15:00:00
stock,AAPL,AAPL Inc,01-24-2023,35665.10691327752,37525.29224133871,38578.39678469846,35256.68291259902,4938462.168047543,367586795355.5221,RETAIL,NYSE,Global,USD,2023-01-24 17:00:00
stock,MSFT,MSFT Inc,2023-12-01,21382.775507743896,19353.20425312388,21498.126415874296,18415.95681297292,6364467.70222654,1572971159852.1624,Automotive,NYSE,US,USD,2023-12-01 17:00:00
stock,GOOGL,GOOGL Inc,2023-07-17,25433.44885132349,27506.613064946203,27849.472309311004,24683.649062881483,7555755.834291943,949924383418.2168,Automotive,,Global,USDT,2023-07-17 15:00:00
stock,AAPL,AAPL Inc,2023-11-28,3858.2256923413615,3695.988423112253,3889.3270979731487,3682.99658995928,8081395.675264605,694106514819.9512,ai,NASDAQ,US,USD,2023-11-28 13:00:00
crypto,BTC,BTC Coin,02/03/2023,43574.31490348401,46220.77544472342,46651.94608454743,43340.23150181684,5393883.076914592,255194483821.61728,Blockchain,COINBASE,US,USDT,2023-03-02 14:00:00
stock,MSFT,MSFT Inc,11-27-2023,44805.60408317543,43174.71123419055,45052.151231124364,41508.02741362435,4271650.778473937,2424246063940.547,tech,NASDAQ,Global,usd,2023-11-27 17:00:00
crypto,ADA,ADA Coin,2024-07-03,43037.921856984605,38793.97072139433,44136.996981834556,37663.923697071696,2221855.996896832,328115832539.38477,crypto,COINBASE,US,usd,2024-07-03 05:00:00
crypto,BTC,BTC Coin,04-02-2023,16887.38241846736,18383.299527831536,18680.37634321208,16481.064078768726,7030486.569992883,52346820096.80471,Blockchain,COINBASE,Global,USD,2023-04-02 02:00:00
crypto,BNB,BNB Coin,06-19-2023,48589.38631522082,53083.392368095054,53751.66528812693,47367.96698683335,3009482.21985788,148633692939.82114,Blockchain,COINBASE,Global,USD,2023-06-19 22:00:00
stock,MSFT,MSFT Inc,23/03/2024,1853.9784982530944,1894.6044821279243,1942.2233786519785,1766.0515982371596,2787185.9959018775,861673078188.6282,automotive,NYSE,Global,usd,2024-03-23 01:00:00
crypto,SOL,SOL Coin,2024-08-17,11985.698914441951,11134.462285224152,12279.020585318422,11126.473561348372,2421310.659843493,363765024956.8282,Crypto,BINANCE,US,usd,2024-08-17 18:00:00
crypto,SOL,SOL Coin,2023-12-30,38083.36457028259,36085.03555794416,39470.011004793865,34944.35715113627,6323426.000105201,270493541225.32202,crypto,COINBASE,US,$,2023-12-30 14:00:00
stock,AMZN,AMZN Inc,01-18-2023,26793.376456897175,24597.872371062345,27912.40516788258,23762.50410737702,1865998.5854881424,1904253835175.0752,tech,NASDAQ,US,USDT,2023-01-18 18:00:00
crypto,BNB,BNB Coin,2023-03-05,29548.73822998021,30598.098799390427,30623.476600810525,28827.88650493497,2265731.256204182,21106180914.131744,Blockchain,BINANCE,Global,$,2023-03-05 03:00:00
stock,GOOGL,GOOGL Inc,2023-12-25,8726.577785959522,9059.824390724789,9235.01210688324,8698.971252219151,1376071.9205157866,1939066643324.2551,ai,NYSE,US,usd,2023-12-25 15:00:00
crypto,SOL,SOL Coin,2024-01-16,5682.541326817048,6165.209134237728,6435.6581640022605,5471.702458446087,6600180.476295756,139721208664.8521,Crypto,BINANCE,US,$,2024-01-16 04:00:00
crypto,ADA,ADA Coin,2023-03-17,27764.48857185712,27929.13520063998,28266.871467197143,26505.51167990202,8972260.363775315,327802769079.4802,blockchain,COINBASE,US,$,2023-03-17 03:00:00
crypto,BTC,BTC Coin,2023-01-20,31658.741849090664,30639.51899097399,32211.518637785317,30219.689681892796,8971205.489265818,360665132579.5155,crypto,COINBASE,Global,USDT,2023-01-20 18:00:00
crypto,BTC,BTC Coin,2024-04-04,38995.97853742262,40103.71114243611,40272.42738502091,37361.32310384473,8985643.331082266,355399137584.7213,crypto,BINANCE,Global,USDT,2024-04-04 12:00:00
crypto,BTC,BTC Coin,07/04/2024,469.7606103153161,432.31801606506133,485.3449601153907,410.8115259561355,1608919.706123569,244539478565.53802,Crypto,COINBASE,Global,usd,2024-04-07 11:00:00
stock,MSFT,MSFT Inc,2023-03-13,34597.84093265774,35649.3472294972,36049.099953791156,34099.94205681116,2373253.625880504,1650714030206.0925,Retail,NYSE,Global,$,2023-03-13 23:00:00
crypto,ETH,ETH Coin,10-12-2023,37327.10534185003,38444.177938918394,40076.56273406506,36688.089360010206,5683517.72475138,133532880772.91075,crypto,BINANCE,US,USDT,2023-10-12 20:00:00
stock,,AMZN Inc,10/11/2023,18392.112994941082,17528.428078032615,18616.487249472255,17504.773950538227,3931584.148942937,290087555805.9965,AI,NYSE,Global,USDT,2023-11-10 17:00:00
stock,MSFT,MSFT Inc,2023-02-07,31560.62 USD,33421.50541306555,34261.449829466685,30892.961129391697,4925684.42049482,2677219199979.569,tech,NASDAQ,Global,$,2023-02-07 18:00:00
crypto,ETH,ETH Coin,07/08/2023,36125.38124192265,34541.44484480463,36169.30241980275,33929.14988796074,1771929.6833910823,82120980180.22757,blockchain,BINANCE,Global,USDT,2023-08-07 21:00:00
crypto,SOL,SOL Coin,03-07-2023,47696.88956435934,51654.43776526534,52610.45474254616,45348.90671272218,9283257.307314666,376481140819.4011,crypto,COINBASE,US,USD,2023-03-07 09:00:00
crypto,SOL,SOL Coin,08-14-2023,48333.07440399304,52814.71017355953,55067.28253185026,46628.00169422202,3851592.1882906505,174132738585.33917,Crypto,COINBASE,Global,$,2023-08-14 03:00:00
crypto,ADA,ADA Coin,08-28-2023,15852.93103776232,14805.029298909198,16294.27763853688,14757.767776951943,6960601.936953055,341198985249.15845,crypto,COINBASE,US,USD,2023-08-28 16:00:00
crypto,ADA,ADA Coin,04/04/2024,4867.852923600719,4979.820576545272,5226.335103277126,4658.5556965766245,5183778.193985004,230174162185.29916,blockchain,COINBASE,Global,$,2024-04-04 20:00:00
crypto,ETH,ETH Coin,21/02/2024,37041.02320153268,38500.55612818725,39852.85752342245,35854.76804510987,2936624.8508006693,351562363411.5424,blockchain,BINANCE,US,$,2024-02-21 21:00:00
stock,TSLA,TSLA Inc,02-03-2023,40507.568600012244,43481.41002522207,45466.85937109049,39517.852035009346,5015661.430577309,2429989854880.756,Finance,NASDAQ,Global,USD,2023-02-03 09:00:00
crypto,BTC,BTC Coin,06-15-2023,32501.69689958048,33814.55014525741,35160.01870155118,32322.94624753956,3380613.5733585064,320326595691.87616,blockchain,BINANCE,Global,USDT,2023-06-15 19:00:00
stock,AAPL,AAPL Inc,24/04/2024,4708.157172645041,4781.868214106402,4790.46177493697,4582.354746444772,5426903.702441059,1132993028393.4326,finance,,Global,usd,2024-04-24 16:00:00
crypto,BNB,BNB Coin,05-20-2024,29545.754695844847,26771.409806832584,29600.928717000766,26533.948152328452,3602546.223471218,118183794590.67235,Crypto,Unknown,US,USD,2024-05-20 07:00:00
stock,AAPL,AAPL Inc,07-20-2024,26116.94057013967,27527.221686259127,27824.269349682218,25624.49321856623,854389.3024726862,389910932829.1355,TECHNOLOGY,NASDAQ,US,USD,2024-07-20 00:00:00
crypto,ETH,ETH Coin,2023-12-03,26572.41803209172,26788.372719733445,27642.158208935292,26208.497252945013,9758544.942545883,25414279861.60004,Blockchain,COINBASE,Global,$,2023-12-03 09:00:00
crypto,SOL,SOL Coin,2024-03-11,16154.594082332886,17108.31671337226,17339.99090991162,15701.434633978468,785485.3570413173,208938637578.97214,Blockchain,BINANCE,US,$,2024-03-11 03:00:00
crypto,ETH,ETH Coin,08-28-2023,48132.79424974947,51367.12665227348,53154.636411830004,46710.35693382806,1733769.9063883869,15013543649.105717,crypto,BINANCE,US,usd,2023-08-28 17:00:00
crypto,ETH,ETH Coin,2023-06-11,12519.642479248121,12642.902527761413,13094.630857633045,12306.93211139789,2800059.0355624827,66792631855.07899,Crypto,BINANCE,US,USDT,2023-06-11 21:00:00
stock,MSFT,MSFT Inc,01-17-2024,36897.46686562147,37298.5722359318,38439.387758013814,35826.7024923525,2478062.1640220736,2865047189182.95,Automotive,NASDAQ,US,USD,2024-01-17 16:00:00
stock,AAPL,AAPL Inc,03-08-2023,37894.72706211381,34214.34182052167,38114.65411368323,32582.322235434553,408247.2943873824,1074358309167.2721,Automotive,NASDAQ,US,$,2023-03-08 15:00:00
crypto,BNB,BNB Coin,10/06/2023,35185.85639040738,35004.11320223789,35357.97532674449,34114.336429356335,4735244.236034877,342906930684.34784,blockchain,COINBASE,Global,$,2023-06-10 20:00:00
stock,MSFT,MSFT Inc,06-25-2023,21698.243945406273,21257.790138936354,22366.38722847324,20869.9350094253,453994.7937106731,527873591030.9454,ai,NYSE,Global,usd,2023-06-25 18:00:00
stock,MSFT,MSFT Inc,08-17-2024,31296.737186554677,31316.368118660692,32657.475676488026,30762.64840098871,1630181.3363872154,1130091717733.149,RETAIL,Unknown,Global,$,2024-08-17 13:00:00
stock,GOOGL,GOOGL Inc,2024-04-02,32124.539717533717,29082.418475471986,33065.428263842754,28995.50601891912,5755166.304580914,221000554727.28522,RETAIL,NASDAQ,US,$,2024-04-02 09:00:00
stock,AMZN,AMZN Inc,12-26-2023,32167.978039933234,31899.394019553318,33045.547484779934,31806.032163110944,3861640.2753699417,1170628079357.5005,TECHNOLOGY,NYSE,US,USDT,2023-12-26 04:00:00
stock,AMZN,AMZN Inc,15/01/2024,45268.478591383624,42514.26409096366,45425.472619570515,40602.77601467144,183200.03468984572,2883959785833.5034,RETAIL,NASDAQ,Global,USD,2024-01-15 13:00:00
crypto,BNB,BNB Coin,2024-06-25,34153.508603083676,31224.426166300975,34698.21544975428,30982.24219634074,233696.08542252282,42304969498.59171,Blockchain,COINBASE,Global,USD,2024-06-25 10:00:00
stock,MSFT,MSFT Inc,04-08-2023,14099.920190922263,13023.151099597924,14591.117112206459,12781.534430949314,8774842.663257003,2445260762940.918,AI,NYSE,US,$,2023-04-08 21:00:00
crypto,SOL,SOL Coin,01/02/2024,40176.01170993858,38424.61539699119,40532.452369373605,37945.488784297035,8068540.557933372,295353062302.53485,crypto,COINBASE,Global,usd,2024-02-01 07:00:00
crypto,BTC,BTC Coin,05-14-2023,20636.75766880221,20108.531318905458,21437.889974889702,19445.75768609877,9307642.498710044,396249531090.2659,blockchain,COINBASE,Global,usd,2023-05-14 07:00:00
crypto,ADA,ADA Coin,06-07-2024,21455.411428477168,22531.919823470766,23381.98480058313,20493.269108751872,9025626.513888987,344073036977.9897,blockchain,BINANCE,US,usd,2024-06-07 00:00:00
crypto,ETH,ETH Coin,12/04/2024,41324.608730726,39837.3327650564,43174.96608207011,38620.70396622615,109365.6771515033,204574687116.90356,Crypto,COINBASE,US,$,2024-04-12 01:00:00
stock,GOOGL,GOOGL Inc,2023-03-03,4573.420972538816,4408.150012679667,4790.672638804897,4397.263457386993,5734805.443344737,2717092109493.598,Automotive,NYSE,US,$,2023-03-03 17:00:00
crypto,BNB,BNB Coin,20/11/2023,22427.791643696204,21500.226498392898,22796.352640907535,21148.18012997354,7523992.919847363,254575698807.0707,Blockchain,COINBASE,US,USDT,2023-11-20 12:00:00
stock,MSFT,MSFT Inc,07/05/2023,39483.01095829975,36254.92817569683,40459.07107372864,34546.521202426266,5495739.294355032,2376821340740.287,finance,NASDAQ,US,USDT,2023-05-07 21:00:00
stock,MSFT,MSFT Inc,26/04/2023,44386.332096087404,43062.864943406516,44646.140869520095,41217.60327084977,7615344.806543005,1330176199106.3972,Automotive,NASDAQ,US,USDT,2023-04-26 20:00:00
stock,GOOGL,GOOGL Inc,2024-07-14,5065.122579378284,4643.812577986949,5242.647308138323,4428.516837295911,8218778.732844272,1858472009315.6206,finance,NASDAQ,US,USD,2024-07-14 15:00:00
stock,GOOGL,GOOGL Inc,09/08/2024,4076.6255442885695,3738.133308331461,4277.73354972477,3621.1803493124717,3707050.828521842,2121664259197.9236,RETAIL,NASDAQ,US,USD,2024-08-09 07:00:00
crypto,,ETH Coin,03/07/2024,47362.9563834191,51966.64582104669,53924.17268717941,45885.84688116535,835923.666269989,326055829066.7135,Blockchain,N/A,Global,USD,2024-07-03 16:00:00
stock,AAPL,AAPL Inc,2023-07-15,27924.628444292895,27501.41399708625,29190.108916424204,26279.247697048693,4926758.417804301,2333669278623.036,ai,N/A,Global,usd,2023-07-15 17:00:00
crypto,BNB,BNB Coin,2023-03-28,23438.34549328637,21358.442069524663,23577.590261900543,20416.0288427203,6492453.81085852,9484689683.130531,Blockchain,BINANCE,US,$,2023-03-28 20:00:00
crypto,BNB,BNB Coin,2024-06-01,29172.60456720701,31869.159966900235,32466.500490186514,28130.722624505284,8686122.682766413,299687727309.8422,Blockchain,COINBASE,Global,usd,2024-06-01 14:00:00
crypto,BTC,BTC Coin,02-04-2024,48161.49474663616,43462.42080575689,50497.03544750385,41383.09147822581,8911539.993867014,93320356215.18379,blockchain,BINANCE,US,$,2024-02-04 20:00:00
crypto,BNB,BNB Coin,2024-04-27,49648.31015800382,45416.254089119095,51023.20662271862,45346.545897008364,5231455.343857318,213441938089.08844,crypto,COINBASE,US,USDT,2024-04-27 17:00:00
stock,TSLA,TSLA Inc,2024-05-30,34790.47696234101,34474.169354555146,35882.12920872579,33757.64841410375,9011678.9468994,1891901928024.435,automotive,NYSE,US,usd,2024-05-30 01:00:00
crypto,SOL,SOL Coin,2023-05-31,14055.349847715594,15321.488044540558,16003.496340609165,13672.803108873677,6201705.845417566,22951320234.87586,blockchain,COINBASE,Global,USD,2023-05-31 09:00:00
crypto,ETH,ETH Coin,10/08/2023,9414.176774590827,9345.826847971903,9580.502791507466,9151.272953579246,778268.6350128833,114565567277.54741,Blockchain,COINBASE,Global,usd,2023-08-10 04:00:00
crypto,ETH,ETH Coin,09/07/2024,49310.67511653535,51264.972696648045,52639.12097581822,47608.292147023116,8138136.40204978,389885949028.13574,crypto,BINANCE,Global,$,2024-07-09 05:00:00
stock,AMZN,AMZN Inc,07-26-2023,8139.220797851116,8808.146215138055,9170.397630291245,8118.791318361701,7257469.364375211,2057346205936.099,Artificial Intelligence,NYSE,Global,usd,2023-07-26 00:00:00
stock,AAPL,AAPL Inc,23/03/2023,20917.96938416804,22728.32961745938,23712.53889497659,19919.36505280334,264643.37799802277,1844111435848.0117,AI,NASDAQ,Global,USD,2023-03-23 03:00:00
crypto,SOL,SOL Coin,08/06/2024,40529.56100578383,44479.37852773028,44813.90101954819,39707.07580915835,3809527.675453584,153703029916.8296,Blockchain,BINANCE,Global,$,2024-06-08 12:00:00
stock,TSLA,TSLA Inc,25/09/2023,42107.524967554076,44956.76184372697,46010.30818186129,40875.49984676195,2734797.312235132,2910044049465.6636,tech,NASDAQ,Global,USDT,2023-09-25 23:00:00
crypto,BTC,BTC Coin,14/12/2023,43237.47158899011,45943.28128747573,48239.796801068005,43230.2008559168,5554761.624320672,27268321177.11621,Crypto,BINANCE,US,USDT,2023-12-14 17:00:00
crypto,ADA,ADA Coin,08-29-2023,47238.83883682258,50542.226184407744,51167.302369637175,45941.0559848209,1292464.9920997983,308750028996.30164,Blockchain,COINBASE,Global,USD,2023-08-29 16:00:00
stock,TSLA,TSLA Inc,07-22-2024,30312.669976199493,28667.55775971131,31330.722034658596,28120.191223537517,3582269.017610372,2862612571503.58,RETAIL,NASDAQ,US,USDT,2024-07-22 20:00:00
stock,TSLA,TSLA Inc,2023-09-22,33581.944047684054,33718.338462781714,35020.403109460385,32776.25192479937,8521962.821685083,349537200676.89075,finance,NYSE,US,USDT,2023-09-22 04:00:00
stock,AAPL,AAPL Inc,10-09-2023,28051.28919705396,30164.41302411026,30772.954215339392,26836.68973370517,288797.9804570764,1660201447935.7117,TECHNOLOGY,NASDAQ,US,USD,2023-10-09 05:00:00
stock,AAPL,AAPL Inc,01-14-2023,31019.274472159697,32285.3557403366,32629.136926049483,29679.817960121683,146432.1120131514,2267860394464.1206,Artificial Intelligence,NASDAQ,US,usd,2023-01-14 06:00:00
crypto,BTC,BTC Coin,16/10/2023,29499.98516586311,28864.225351644847,30145.260351369965,28725.906099638432,3483206.41476598,143482085728.6058,Crypto,COINBASE,Global,$,2023-10-16 06:00:00
stock,MSFT,MSFT Inc,2024-01-05,39184.81410692974,38374.0237383775,40403.63169227087,38109.94082298677,9495256.715952763,1546828572587.8342,Technology,NYSE,Global,usd,2024-01-05 13:00:00
crypto,ADA,ADA Coin,22/02/2024,46330.1153818231,46257.06477157081,46928.33999715306,45006.12515375514,9800345.720279485,63094024966.969986,Blockchain,COINBASE,US,usd,2024-02-22 18:00:00
crypto,ETH,ETH Coin,12/11/2023,16444.292998272536,16883.02954519336,17085.748824042406,15684.454288121056,1289668.3393845817,199584147127.1835,Crypto,COINBASE,Global,USD,2023-11-12 15:00:00
crypto,BNB,BNB Coin,2023-01-30,7603.615648679594,7054.371776295435,7847.263910601057,6765.805674183441,3457327.1659553084,55578106388.320114,blockchain,BINANCE,Global,USD,2023-01-30 12:00:00
stock,MSFT,MSFT Inc,2024-03-04,23703.342396740987,24497.678086218486,24708.749922846295,22746.0698995017,409645.29404852213,2691397345618.9756,Technology,NYSE,US,USDT,2024-03-04 15:00:00
stock,AAPL,AAPL Inc,20/08/2023,13936.73 USD,13036.44744580245,13998.542216020945,12463.258233196406,4608326.901559225,515115838585.772,RETAIL,NYSE,Global,USD,2023-08-20 10:00:00
crypto,BTC,BTC Coin,04-30-2024,18219.850353793292,18232.302786512068,18861.6771644027,17344.670901353238,7994304.578691517,86501818770.28804,Blockchain,BINANCE,US,usd,2024-04-30 21:00:00
crypto,BTC,BTC Coin,11-02-2023,4097.134007124107,4403.254344156609,4605.9961140593905,3904.789536088257,2769499.60382389,253020653848.90857,Blockchain,BINANCE,US,usd,2023-11-02 09:00:00
stock,TSLA,TSLA Inc,11/03/2023,37415.50192227908,35054.74104093706,37807.14742276571,33951.34417020237,4845745.328925022,2420541826581.2534,Artificial Intelligence,NASDAQ,US,USDT,2023-03-11 08:00:00
crypto,BNB,BNB Coin,2024-03-23,18451.992842092925,18313.731012145297,19141.60926209875,17431.63477705815,2525117.0064958637,249210634754.4669,blockchain,COINBASE,Global,usd,2024-03-23 16:00:00
crypto,BNB,BNB Coin,2023-02-24,44761.39 USD,44865.92952370168,46059.61783012793,42763.17873403107,4474676.255867723,286773086424.3982,blockchain,COINBASE,Global,USDT,2023-02-24 04:00:00
crypto,ETH,ETH Coin,03/07/2024,12131.100476700136,11571.233766493786,12359.94408124463,11004.284504242076,3221469.5766661996,215383820249.73416,Crypto,COINBASE,Global,USDT,2024-07-03 04:00:00
stock,TSLA,TSLA Inc,29/08/2023,16381.592635373952,15135.812263157943,17111.005392562365,14828.246846891114,6791344.0891257515,642229540919.6685,Finance,NASDAQ,US,usd,2023-08-29 08:00:00
crypto,BNB,BNB Coin,2024-03-30,24927.125524463572,22867.747558372765,25596.551633859643,22395.346907642863,7454649.302369116,316722639249.8986,Crypto,COINBASE,Global,USD,2024-03-30 20:00:00
crypto,BTC,BTC Coin,04-14-2023,6387.739336750233,6111.5027063336975,6503.703090109391,6003.303819440296,5708212.26838445,175505520760.72336,Crypto,COINBASE,Global,USDT,2023-04-14 08:00:00
stock,MSFT,MSFT Inc,11/07/2023,49325.89728716105,50369.38486219422,50966.83324082292,47110.62801230836,1529438.5327041359,1074729210434.5603,Finance,NASDAQ,Global,$,2023-07-11 04:00:00
crypto,ETH,ETH Coin,04/12/2023,8042.461849245188,7538.307298972637,8157.105200126408,7226.7391059669835,8967757.480839625,102153302711.8807,Crypto,BINANCE,Global,usd,2023-12-04 00:00:00
stock,AMZN,AMZN Inc,07/09/2023,26230.32436461703,25760.260306185017,27518.72985313586,24616.554855089176,3979158.1348583708,249898899528.3102,RETAIL,NASDAQ,Global,USD,2023-09-07 03:00:00
crypto,BNB,BNB Coin,12/05/2023,43276.7 USD,46021.06787959395,46614.51605508267,41482.638715381785,6686763.556024386,387940821143.7707,Crypto,COINBASE,US,usd,2023-05-12 16:00:00
crypto,ETH,ETH Coin,27/11/2023,27842.57702176635,28241.353386226652,28636.70281246743,27521.6814836831,1871250.4418266763,372103515705.39636,blockchain,BINANCE,US,USDT,2023-11-27 00:00:00
crypto,ADA,ADA Coin,03-31-2023,21277.567566434675,21309.953635767604,21568.240643698813,20335.8616029881,6106589.804373885,132853298379.67625,Blockchain,COINBASE,Global,USDT,2023-03-31 17:00:00
crypto,ADA,ADA Coin,16/01/2023,29066.098688916387,27056.83320323456,29765.341973101757,26424.500715190512,519183.5446874467,119009068529.90103,crypto,BINANCE,US,USD,2023-01-16 11:00:00
stock,MSFT,MSFT Inc,03-01-2023,6729.389700179322,6141.745704871112,7062.481109750925,5933.649186768666,8098934.584100494,1016446791799.8225,Automotive,NASDAQ,Global,$,2023-03-01 19:00:00
stock,MSFT,MSFT Inc,26/08/2023,34078.321083974224,35851.94679683747,36919.687218757856,33177.93126822396,4118997.300558538,771375557743.6539,RETAIL,NASDAQ,US,usd,2023-08-26 04:00:00
stock,MSFT,MSFT Inc,2023-03-03,46477.16192094881,49550.412270940506,51941.2863347444,44442.15293401447,7308943.884561239,1053116116963.5559,tech,NYSE,US,USD,2023-03-03 17:00:00
stock,AMZN,AMZN Inc,30/07/2024,9069.84097762135,8283.478993983628,9405.933299335968,8107.236842566155,8418445.938805962,2815637965894.9033,ai,NYSE,Global,USDT,2024-07-30 20:00:00
stock,,AAPL Inc,19/11/2023,39765.41291987591,37392.43035541363,40090.80522711823,35829.9237080885,8145932.62759359,427919406112.6056,finance,NASDAQ,US,USD,2023-11-19 16:00:00
stock,GOOGL,GOOGL Inc,07-22-2023,26158.040584208276,25419.496999098184,27305.332951562217,24647.310010665296,8166177.795276299,1998939689881.6384,finance,NYSE,Global,USDT,2023-07-22 17:00:00
crypto,SOL,SOL Coin,08-24-2023,18853.45202695113,18712.72905284841,19137.55269157804,18476.583188636298,5027701.180534699,178458288885.23627,Crypto,BINANCE,Global,USD,2023-08-24 02:00:00
stock,AMZN,AMZN Inc,2023-12-11,44979.73291799568,43935.224547582155,46202.17604398166,43729.76610727045,6242755.721144007,704315958488.9838,automotive,NYSE,US,USDT,2023-12-11 09:00:00
crypto,BTC,BTC Coin,2024-01-10,46992.20785943762,48192.464534488856,48999.460882326995,44969.83257584637,7940457.867513689,51174726079.80381,Crypto,COINBASE,Global,USD,2024-01-10 17:00:00
crypto,ADA,ADA Coin,06-12-2023,26677.71998789631,28779.35119508484,29914.116999749607,25546.1509870369,3117908.955887687,249928738591.76285,blockchain,COINBASE,US,$,2023-06-12 07:00:00
stock,TSLA,TSLA Inc,01-31-2024,37199.87516570812,33729.36812637196,38259.866422480016,33328.76220467824,8767779.601980733,752982528045.2526,ai,NYSE,US,usd,2024-01-31 14:00:00
crypto,ETH,ETH Coin,19/07/2023,41064.652660553926,37866.7981647584,42802.61612824432,36214.83762876149,3973475.6183131123,140122290742.78345,crypto,COINBASE,US,usd,2023-07-19 09:00:00
stock,AMZN,AMZN Inc,06-22-2024,7504.372193165202,7098.012532974313,7775.374797699756,6998.653324355771,6411835.181220088,2393913143680.865,finance,N/A,US,$,2024-06-22 20:00:00
crypto,ETH,ETH Coin,06/03/2023,27140.794922946334,25793.5207545686,27609.918126215034,24738.04694070516,9084597.16277495,279109635564.5045,blockchain,COINBASE,US,USD,2023-03-06 00:00:00
stock,AAPL,AAPL Inc,2024-05-28,20048.562324014358,19896.216521296068,20998.145777649755,19053.96133124337,5862712.090335956,1754341466350.7002,finance,NYSE,US,$,2024-05-28 21:00:00
crypto,BTC,BTC Coin,2023-01-28,30576.597229378043,27629.687065728205,31909.92630427285,27535.909535105107,5651766.7027085,204826028159.36407,blockchain,BINANCE,US,usd,2023-01-28 08:00:00
stock,AMZN,AMZN Inc,23/02/2023,46125.74406505301,48037.551306399204,48403.93141141035,45148.543332236535,6067543.7487821765,2092985963391.908,TECHNOLOGY,NYSE,US,USDT,2023-02-23 17:00:00
crypto,ADA,ADA Coin,03-22-2024,36824.847338879896,40023.94714046269,41876.19240223556,35813.709523251586,1133267.2203617117,172531615164.44247,crypto,BINANCE,Global,USD,2024-03-22 03:00:00
crypto,BTC,BTC Coin,23/06/2024,41946.51534143225,38797.69682120841,43877.8207492444,38545.31074620592,5188861.7332035955,394012273590.12213,crypto,BINANCE,US,$,2024-06-23 10:00:00
stock,MSFT,MSFT Inc,17/03/2023,19956.145166467813,18179.09689259826,20290.607407152074,17999.89957959934,47315.59802302399,1777913552877.3384,Automotive,NASDAQ,Global,$,2023-03-17 05:00:00
crypto,BTC,BTC Coin,05-05-2023,19914.452992611255,20063.39558797878,20986.166943774442,19263.5948941797,3470185.0657603806,136732172818.00195,blockchain,COINBASE,US,USDT,2023-05-05 13:00:00
crypto,BNB,BNB Coin,04-30-2023,22616.37486508146,21370.68675299649,23128.00195011311,20452.662978321525,1764693.478075727,296312993003.3506,Crypto,COINBASE,US,usd,2023-04-30 03:00:00
crypto,ADA,ADA Coin,08-24-2023,20952.08322073235,22690.46038932406,23101.604609985996,20512.705831296396,6323010.614907384,201855270232.0945,Crypto,COINBASE,Global,USDT,2023-08-24 20:00:00
stock,TSLA,TSLA Inc,14/03/2023,33180.233227115365,31043.664885114496,34774.66009118008,29722.233435922502,4146826.6131465104,49152425199.11757,Technology,,US,USD,2023-03-14 11:00:00
crypto,BTC,BTC Coin,01-12-2023,49843.74384977891,49865.62535631853,51350.087667140855,47518.72379515468,7499854.743521378,38713118891.06432,Crypto,COINBASE,Global,USD,2023-01-12 10:00:00
stock,MSFT,MSFT Inc,2023-07-09,44903.73392914128,42255.667703131905,45331.86346275306,40220.105848937754,4721197.384154882,637617723355.8014,Technology,NYSE,US,USDT,2023-07-09 06:00:00
stock,AMZN,AMZN Inc,01-24-2023,3294.7748850233347,3476.335179346746,3555.124375478729,3216.4235352387245,4408186.706635343,1698874988455.2231,RETAIL,NASDAQ,Global,USDT,2023-01-24 09:00:00
stock,GOOGL,GOOGL Inc,2023-01-03,27986.42 USD,26056.701895624898,28240.996017065096,25876.63135207791,9461208.505874194,1208281552017.2246,Retail,NASDAQ,US,$,2023-01-03 19:00:00
stock,AAPL,AAPL Inc,02-18-2023,13544.526210446253,13934.60732798488,14219.38483677395,12884.492207905401,1562369.8210645374,1126194855676.4614,TECHNOLOGY,NASDAQ,US,USD,2023-02-18 23:00:00
stock,AMZN,AMZN Inc,30/06/2024,32949.60785608846,29833.207535971876,33315.302640621405,28686.2322773205,6719255.543243686,2150756964253.7185,tech,NYSE,Global,USD,2024-06-30 15:00:00
stock,GOOGL,GOOGL Inc,2024-07-25,5214.388013408847,5527.163781528539,5576.506061003137,5123.852186767509,2382589.6276862184,68934507885.54883,Retail,NYSE,US,$,2024-07-25 23:00:00
crypto,BTC,BTC Coin,03-07-2023,12166.17782806271,12707.005631713479,13250.672623676674,12062.899062095183,3972438.11265493,44279350139.94134,crypto,BINANCE,US,USD,2023-03-07 17:00:00
stock,AAPL,AAPL Inc,08-17-2024,10257.16492783689,9832.821358554853,10716.858143901829,9347.572570187043,855999.8000138263,2007574558346.232,ai,NYSE,US,$,2024-08-17 18:00:00
crypto,BTC,BTC Coin,05-27-2023,1336.3448716522475,1251.2024471306718,1375.302101650346,1215.006696223252,8926824.43905867,87115070782.68079,crypto,COINBASE,US,USD,2023-05-27 21:00:00
crypto,BNB,BNB Coin,2023-09-07,17097.45 USD,16274.80027608258,17422.037998403004,15941.406876948959,2681368.34458794,327890206886.68414,Crypto,N/A,Global,USDT,2023-09-07 21:00:00
stock,AMZN,AMZN Inc,04-25-2023,20476.48849304011,20689.63719300226,21140.80217590491,19754.145305230824,9484584.616314605,1876205234468.9106,Technology,NYSE,US,USDT,2023-04-25 12:00:00
crypto,SOL,SOL Coin,2024-07-26,7014.257656564962,7531.163520793148,7714.709723750809,6977.27576407117,7998752.704217205,306624288693.1055,Blockchain,COINBASE,US,usd,2024-07-26 10:00:00
stock,AMZN,AMZN Inc,23/12/2023,1133.2407229226687,1080.8118756268718,1163.9308203717655,1061.0048209924817,2579618.96664659,1281388378363.008,Automotive,N/A,Global,USDT,2023-12-23 15:00:00
stock,AAPL,AAPL Inc,23/05/2023,41748.16253759696,45792.742732312625,46996.38249606709,40019.11914721379,2723800.95786717,426674661477.74414,ai,NASDAQ,US,$,2023-05-23 22:00:00
crypto,BNB,BNB Coin,2023-03-09,45715.79733995935,42220.834534356705,47033.59285784721,40688.33481393442,5542225.847155418,12264317236.24936,blockchain,COINBASE,Global,usd,2023-03-09 22:00:00
crypto,SOL,SOL Coin,2023-05-05,41488.79276732301,39052.74736395929,41511.602950148845,37367.397992203005,9000286.399839202,262311053398.98636,Blockchain,BINANCE,US,usd,2023-05-05 16:00:00
stock,GOOGL,GOOGL Inc,20/04/2024,29874.68097749371,30475.262805156643,31488.621176749875,28642.90497869356,9144205.047303673,2622931331911.9204,AI,NASDAQ,Global,USDT,2024-04-20 06:00:00
stock,MSFT,MSFT Inc,2023-05-26,19163.09502719238,19235.59938399867,19280.770310077027,18364.26547567848,7380598.130647278,1262123869427.2986,Artificial Intelligence,NYSE,US,USD,2023-05-26 02:00:00
crypto,BTC,BTC Coin,08/05/2023,30161.573952224746,28625.439620155405,30748.662374834938,27607.36689567997,3557371.4919330264,37705473830.42496,blockchain,BINANCE,Global,USDT,2023-05-08 17:00:00
crypto,BTC,BTC Coin,09-27-2023,14863.114564002519,15060.510519265352,15418.988623766354,14613.169863982897,9368360.563508255,289023132547.777,blockchain,BINANCE,US,$,2023-09-27 01:00:00
crypto,ETH,ETH Coin,2024-02-19,10754.86952575193,9746.45668297434,10895.900304638963,9549.128912553826,515206.7090290192,294365978398.0489,blockchain,BINANCE,US,USD,2024-02-19 04:00:00
stock,AMZN,AMZN Inc,2024-01-22,29846.174017355293,28856.73688153195,30996.61300661033,27567.703924590962,752302.6795763518,1494135079131.6968,Artificial Intelligence,NASDAQ,Global,USD,2024-01-22 09:00:00
stock,MSFT,MSFT Inc,31/10/2023,24779.61089714786,25713.31851226176,26272.361205029625,23845.917677687026,8191204.074424323,2187284381048.774,automotive,NASDAQ,Global,USDT,2023-10-31 10:00:00
stock,TSLA,TSLA Inc,2023-11-14,34737.876578012794,33154.83775789168,35763.04458092562,32095.497419391115,916729.1511930148,2400253478117.248,ai,NYSE,Global,$,2023-11-14 23:00:00
stock,MSFT,MSFT Inc,2024-04-19,6849.563359638881,7466.349216013228,7632.850958676328,6570.489177958719,5419467.5728362035,2752767590632.106,tech,NASDAQ,US,USD,2024-04-19 13:00:00
stock,TSLA,TSLA Inc,16/05/2023,36613.92207161396,38858.80326721069,40138.77992934682,36050.57397729633,8492107.320001628,2620108049270.461,Finance,NYSE,Global,$,2023-05-16 23:00:00
stock,AAPL,AAPL Inc,2024-02-09,24476.353932520593,23111.59865750692,25685.079519098268,23046.954753016973,395228.68687369046,756507346488.966,RETAIL,NASDAQ,Global,$,2024-02-09 13:00:00
stock,MSFT,MSFT Inc,2023-05-29,46263.16 USD,43307.64438792817,47576.91053742262,43124.6442501944,340425.8398794026,2119669765821.9084,Artificial Intelligence,NYSE,US,USD,2023-05-29 06:00:00
crypto,BTC,BTC Coin,10/03/2023,14874.476878553813,16137.011157648696,16920.51004449671,14833.02653760167,4742667.95235798,280481005562.5018,Crypto,COINBASE,US,$,2023-03-10 23:00:00
stock,MSFT,MSFT Inc,03-27-2023,42229.024432768165,40701.18232571081,43979.2390232986,38741.435933825196,5963102.514942048,2587507526458.0474,automotive,NYSE,Global,USD,2023-03-27 04:00:00
stock,TSLA,TSLA Inc,04/07/2023,6037.138620006168,5526.340187103315,6247.3182129827055,5343.936411291236,7247942.948516086,697726423490.2322,finance,NYSE,Global,usd,2023-07-04 10:00:00
crypto,ETH,ETH Coin,2023-09-19,15771.36398815221,15895.930297435008,16524.394313077377,15234.15387603841,6259287.872993654,30815754615.582237,Crypto,BINANCE,US,USDT,2023-09-19 11:00:00
stock,GOOGL,GOOGL Inc,20/11/2023,30797.000777233407,29152.191324520376,30834.574321661497,28962.84620045484,213672.839093021,2659073467226.1997,RETAIL,NYSE,US,USD,2023-11-20 02:00:00
stock,AAPL,AAPL Inc,04-25-2023,26451.567330020327,28774.373087950513,29923.5974300781,26448.835029304137,3507767.44270165,2625358001325.7563,Retail,NASDAQ,US,usd,2023-04-25 12:00:00
stock,,MSFT Inc,03-27-2023,20102.526371326014,20021.616196616564,20733.248627450936,19895.156779786055,9840850.608523753,2303892983904.0693,Artificial Intelligence,NASDAQ,Global,USD,2023-03-27 05:00:00
stock,TSLA,TSLA Inc,05-16-2024,20894.161440545016,20565.525542426756,21664.719624799367,19782.778139817707,1105630.6572008152,2307137507454.909,Artificial Intelligence,NYSE,Global,usd,2024-05-16 00:00:00
crypto,ADA,ADA Coin,2024-03-01,14369.077192787547,13783.704324645176,14536.91358317103,13123.529112414359,179721.4733994047,145075752268.10672,Blockchain,COINBASE,Global,$,2024-03-01 04:00:00
stock,AMZN,AMZN Inc,2023-12-11,21394.37895545576,20899.427046312976,22121.410531554826,20082.524754347833,9499661.878318302,2963289945310.7344,Technology,NYSE,US,$,2023-12-11 01:00:00
stock,TSLA,TSLA Inc,26/03/2023,4479.656005589853,4405.814051043632,4676.563385894594,4393.639029405568,4674547.710987448,2361171593102.5005,AI,NASDAQ,Global,USD,2023-03-26 16:00:00
stock,TSLA,TSLA Inc,2024-04-16,8360.02696514284,9181.2635569303,9287.615504384492,8336.088769519029,6496816.843274692,1844100053740.016,Artificial Intelligence,NYSE,Global,USDT,2024-04-16 01:00:00
stock,AAPL,AAPL Inc,07/01/2023,25639.298665715265,24258.211238302923,25865.601412488275,23312.730728125625,1865196.1831804009,1827133016687.7888,Technology,Unknown,US,USDT,2023-01-07 01:00:00
crypto,BNB,BNB Coin,08/01/2023,17512.761705744837,15964.0825373858,18361.344877248164,15871.319951163145,9277595.079668935,312935867058.86755,Crypto,COINBASE,US,$,2023-01-08 02:00:00
stock,TSLA,TSLA Inc,13/02/2023,8703.023508482169,8522.421878745607,9032.971872436588,8392.88985197631,1539805.1674922106,2984774389712.8413,ai,NASDAQ,Global,USDT,2023-02-13 04:00:00
stock,TSLA,TSLA Inc,04/09/2023,11229.784186114666,10609.490469805,11531.289530242491,10393.555475708241,5801281.992170274,2449341043721.9473,Retail,NASDAQ,US,USDT,2023-09-04 22:00:00
stock,TSLA,TSLA Inc,2024-08-03,43874.268522892715,41817.44318824917,44158.38714459687,41584.82964576603,9556559.330799304,283545643819.2871,ai,NYSE,Global,USDT,2024-08-03 18:00:00
crypto,ETH,ETH Coin,06-12-2023,40477.708575496654,41734.4765056945,42883.96370527829,38629.87438260286,4085123.6774939164,345540408819.85297,crypto,COINBASE,US,$,2023-06-12 10:00:00
stock,GOOGL,GOOGL Inc,05-05-2024,12995.09 USD,13575.764620954009,13912.359233987605,12397.997217850774,2202611.8362961635,1124338665866.8188,Retail,NYSE,US,USDT,2024-05-05 07:00:00
crypto,ETH,ETH Coin,2023-07-06,3815.781665920106,4083.807446634441,4184.911600344184,3716.6832551566167,5924485.438810516,274887211645.5404,Crypto,COINBASE,Global,usd,2023-07-06 12:00:00
stock,TSLA,TSLA Inc,01-16-2024,17396.982303030632,18016.37107417536,18525.99292376887,16759.407492406415,8786421.233565224,2475796088116.196,AI,NASDAQ,Global,USDT,2024-01-16 12:00:00
crypto,SOL,SOL Coin,02/06/2024,32926.00721457469,35234.658522865706,36762.59927334972,32445.885077938798,8370296.270308357,319983278534.7366,crypto,BINANCE,US,usd,2024-06-02 10:00:00
stock,AAPL,AAPL Inc,02/02/2023,34010.237180297416,34817.03740137349,36127.405570979216,32579.43518373372,8808826.721230086,2095439670391.1582,finance,NYSE,US,usd,2023-02-02 10:00:00
stock,AMZN,AMZN Inc,17/04/2024,1472.0716788976117,1567.9968011009785,1578.100178098812,1423.134043673706,7435339.054659786,2616812147958.2437,Artificial Intelligence,NYSE,Global,USDT,2024-04-17 20:00:00
crypto,BTC,BTC Coin,05-03-2023,40900.17153571192,43617.04050598078,44723.75254092702,38868.222121357496,2871094.293615953,68500158939.08174,blockchain,COINBASE,Global,USDT,2023-05-03 10:00:00
crypto,SOL,SOL Coin,01-04-2024,49059.4970395909,50352.83810728136,51006.930490132145,48161.722233326305,5400313.811778839,248686132758.41818,blockchain,BINANCE,US,USDT,2024-01-04 23:00:00
stock,TSLA,TSLA Inc,01-21-2024,5357.962134959651,5637.677658514412,5790.251983409554,5348.047762858939,3419379.7882208223,2341737731501.9194,Retail,NASDAQ,US,USDT,2024-01-21 20:00:00
stock,AAPL,AAPL Inc,06/10/2023,46602.08499444577,42897.30990631703,48785.92507551622,42227.86676148461,679302.7539926139,1901539460470.505,Automotive,NASDAQ,Global,usd,2023-10-06 08:00:00
crypto,ADA,ADA Coin,2023-11-17,35411.52271137763,32347.367910947138,36442.29983499889,31289.4198402708,6209534.262157003,123880608943.99242,Blockchain,COINBASE,Global,USD,2023-11-17 01:00:00
crypto,ADA,ADA Coin,01-22-2023,43578.12493955729,47704.877230820246,50015.88718772346,43032.639751822484,1301732.315066189,23068103355.942577,crypto,COINBASE,Global,USDT,2023-01-22 10:00:00
stock,TSLA,TSLA Inc,01-21-2023,1239.0999537754876,1120.672616733325,1259.1492241549613,1092.0194380386445,7704303.770660124,2277206955827.7773,Retail,NASDAQ,Global,USD,2023-01-21 09:00:00
stock,AMZN,AMZN Inc,08/11/2023,22300.68 USD,21291.020604505207,23412.503826804335,20680.161318637995,4514418.8562724255,2053053176053.4504,automotive,NASDAQ,US,usd,2023-11-08 12:00:00
crypto,ADA,ADA Coin,29/02/2024,39742.52934200897,41282.01365023826,41737.704358673436,37919.10443103917,6805312.521445056,69631409370.70932,Crypto,COINBASE,US,usd,2024-02-29 09:00:00
stock,AAPL,AAPL Inc,2024-04-08,13670.243754640484,14902.926713850211,15015.486948388185,13282.237672601777,9436215.585755821,1966988530700.5942,Technology,NYSE,US,USDT,2024-04-08 10:00:00
stock,MSFT,MSFT Inc,06/01/2024,31929.912123727638,31275.95174892256,32367.695489426802,31250.896033456924,4093930.729144115,1264984677609.1057,tech,NYSE,Global,USD,2024-01-06 05:00:00
stock,TSLA,TSLA Inc,2024-04-18,11505.430748495399,10845.2599565137,11523.34130022268,10656.371764999889,3685894.9108938877,2683356619000.612,TECHNOLOGY,NASDAQ,US,$,2024-04-18 06:00:00
stock,TSLA,TSLA Inc,27/01/2024,23665.76323551094,25881.794198201358,26121.880858998527,23510.30658542124,7766191.931064625,2594431167020.5146,AI,Unknown,Global,usd,2024-01-27 16:00:00
stock,AAPL,AAPL Inc,2023-10-14,42240.71357356321,44445.88150101353,45837.52721145136,40405.871759194,326229.2687330279,2315056315485.7153,Finance,NASDAQ,Global,USD,2023-10-14 16:00:00
crypto,ADA,ADA Coin,2024-05-08,30836.349222891695,32665.17471532202,33451.625302396526,29475.399575824576,1252732.736233302,368734899887.1963,blockchain,COINBASE,Global,usd,2024-05-08 23:00:00
crypto,BNB,BNB Coin,2023-08-21,21520.99168602414,20231.99071265377,22049.97179369,19285.344907949755,5820132.047742073,275798288455.4437,blockchain,BINANCE,US,$,2023-08-21 05:00:00
crypto,BNB,BNB Coin,2023-04-01,39879.979440853036,38367.427204986736,40787.68795017525,36471.34835568773,725396.4310577943,111252394751.86359,Crypto,COINBASE,Global,USD,2023-04-01 16:00:00
crypto,ADA,ADA Coin,02-19-2024,24002.142347509005,24482.28383423609,24839.312136025408,23636.087938121032,8601363.849494856,160034954780.6405,crypto,COINBASE,US,usd,2024-02-19 01:00:00
crypto,SOL,SOL Coin,14/02/2024,1990.5450791643736,1982.7847191216097,2000.9884916796807,1907.6416411051175,9866639.270078197,313041140612.87317,crypto,BINANCE,Global,USD,2024-02-14 23:00:00
stock,AMZN,AMZN Inc,05/04/2024,24949.41879103329,25539.002170646258,26436.0148910227,24400.0933204899,98698.7033444174,436061673275.52454,finance,NYSE,Global,USDT,2024-04-05 10:00:00
crypto,BNB,BNB Coin,02-12-2024,25890.405052801725,23756.34439820783,26344.29871637305,22607.96640267438,786706.3930530524,133952216756.3768,Crypto,COINBASE,US,USDT,2024-02-12 12:00:00
crypto,ADA,ADA Coin,08-12-2024,6644.460544612587,6734.215044897304,6966.365313301996,6578.210854120553,2002302.2922038562,161784694099.63043,Blockchain,BINANCE,Global,USD,2024-08-12 10:00:00
crypto,ADA,ADA Coin,2023-01-06,5237.346338316669,5380.252831893269,5570.30373329802,4983.750400398041,9362186.250190655,71155619992.33255,crypto,COINBASE,US,usd,2023-01-06 08:00:00
crypto,ETH,ETH Coin,07/04/2023,27069.40380170051,28201.232525702537,29429.352664776074,26682.428987385996,8017479.102614848,25528657042.331604,Crypto,COINBASE,US,usd,2023-04-07 10:00:00
crypto,SOL,SOL Coin,12-23-2023,40743.10743618815,37321.62225126624,42565.98799386638,36477.39292922708,8173160.401854974,139082826054.4084,Crypto,BINANCE,US,USDT,2023-12-23 17:00:00
stock,AMZN,AMZN Inc,20/05/2023,32182.448982874284,32352.389440592004,33535.822896516256,30704.679170339186,604460.4878216474,1362431670709.7175,AI,NASDAQ,US,USDT,2023-05-20 09:00:00
stock,MSFT,MSFT Inc,12-19-2023,7985.638558858285,8579.424395843995,8673.460887396486,7976.001991671339,3369621.0219192975,748838669690.3379,Retail,NASDAQ,Global,usd,2023-12-19 14:00:00
stock,TSLA,TSLA Inc,12/06/2024,39487.02837205253,40740.408058866225,41755.24289794023,38609.15976808381,7192298.580944366,554532567909.2109,automotive,NYSE,US,usd,2024-06-12 04:00:00
crypto,BTC,BTC Coin,06-09-2024,49816.732463676526,54547.26125052639,56320.9355060811,47822.92348514687,6802602.196070482,95239622825.86299,Blockchain,COINBASE,Global,USD,2024-06-09 23:00:00
stock,MSFT,MSFT Inc,2023-12-06,1542.3185852682452,1467.5725483527108,1577.994184475785,1457.9065656064138,7271963.528593314,225873242847.73578,automotive,NYSE,Global,$,2023-12-06 19:00:00
stock,GOOGL,GOOGL Inc,29/11/2023,21280.411789059286,20624.698428882264,21675.20467236006,20611.962227711818,402051.80493341235,2230692498387.9434,AI,NYSE,Global,USD,2023-11-29 22:00:00
crypto,BTC,BTC Coin,06-27-2023,28937.983674533945,28582.714475062,29987.358391380138,27849.094721140045,8734358.957578523,347477440968.3672,Crypto,BINANCE,Global,$,2023-06-27 01:00:00
crypto,BNB,BNB Coin,29/07/2023,21091.829134404037,20150.407140750667,21716.516730324,20062.11142743682,2107411.22786766,360777236284.4471,Crypto,COINBASE,Global,USDT,2023-07-29 20:00:00
stock,TSLA,TSLA Inc,2023-12-20,31581.695402425103,33054.116296076725,33271.55897432683,31132.95893210592,9090416.174135745,1872670084854.8135,RETAIL,NASDAQ,Global,$,2023-12-20 01:00:00
crypto,BNB,BNB Coin,2024-07-15,11884.790812944644,13005.277229531297,13122.96000163843,11798.260677717193,4923286.2866239,75974828003.74557,Crypto,BINANCE,US,USD,2024-07-15 00:00:00
stock,TSLA,TSLA Inc,13/10/2023,43538.787564612845,43062.518987944924,44659.51373497889,41682.86772809172,5929915.5634978395,749220912465.4994,Finance,NASDAQ,US,$,2023-10-13 05:00:00
crypto,BTC,BTC Coin,02-02-2024,19560.166017221516,21396.52260830306,21672.680499740487,19224.45162576164,3252575.452182724,69591929671.08398,Blockchain,COINBASE,Global,usd,2024-02-02 22:00:00
stock,AMZN,AMZN Inc,2023-05-21,6552.374299310308,7168.0629675198625,7330.702567851857,6302.090133813375,735893.9765527966,2322684645802.936,ai,NYSE,US,usd,2023-05-21 15:00:00
stock,AAPL,AAPL Inc,02-13-2023,25993.49968831532,25146.128111789374,27070.77866395129,24430.579349788477,2487894.011603711,517576136211.7468,finance,NASDAQ,US,usd,2023-02-13 18:00:00
crypto,SOL,SOL Coin,02-15-2024,35341.793072103435,32988.32587357404,35637.99125495193,31399.39602899197,7364283.748641339,248772269708.59186,Crypto,BINANCE,US,USD,2024-02-15 06:00:00
crypto,SOL,SOL Coin,19/04/2023,23736.797478733195,25370.6983278025,26392.71904791302,23244.67950484545,8682844.533852072,267202788410.613,crypto,COINBASE,Global,usd,2023-04-19 12:00:00
crypto,BNB,BNB Coin,2024-08-14,5604.861773692416,5346.757453535165,5620.859970566181,5221.42131250492,9366120.31725732,86307277964.52345,Crypto,BINANCE,US,USD,2024-08-14 03:00:00
stock,TSLA,TSLA Inc,2023-04-27,6114.27460136124,6055.820947903844,6399.773016387073,5848.759138674946,5072840.852075236,127637186598.84384,ai,NASDAQ,US,usd,2023-04-27 04:00:00
stock,AMZN,AMZN Inc,06/08/2023,7425.676616094822,8148.3882010433945,8541.596290975687,7056.22692033551,9518166.042446967,134302848560.67236,RETAIL,NYSE,Global,usd,2023-08-06 16:00:00
stock,AAPL,AAPL Inc,2024-03-03,43397.235543055904,43004.40251390188,44516.0076579218,41905.310143452436,6668975.711203497,1920968614068.3462,RETAIL,NASDAQ,US,usd,2024-03-03 15:00:00
stock,AAPL,AAPL Inc,01/01/2023,1508.3797577351709,1450.436840100999,1561.5260676440378,1392.5537822589833,6734650.900815848,427557251721.3756,Retail,NASDAQ,Global,USD,2023-01-01 11:00:00
crypto,ETH,ETH Coin,2024-08-18,4704.096782313025,4866.484196105672,4974.4593675688775,4673.083202467734,1772320.7446844117,388115258212.3718,Crypto,BINANCE,Global,usd,2024-08-18 04:00:00
stock,GOOGL,GOOGL Inc,19/05/2024,41907.38332950903,45633.9070353587,47192.870885611796,40853.77883388654,6178854.554771937,2080951597156.232,RETAIL,NASDAQ,Global,USDT,2024-05-19 12:00:00
crypto,ADA,ADA Coin,20/03/2024,28534.781234475096,25854.720731189223,29863.002102815677,25453.360773860026,6765457.3443866875,348217468869.0937,Blockchain,Unknown,Global,USDT,2024-03-20 01:00:00
stock,TSLA,TSLA Inc,11-15-2023,32947.684656930534,32248.300238253996,34020.51559521839,30807.757428575165,6578795.2007257575,654868705669.1743,Technology,NYSE,Global,USDT,2023-11-15 07:00:00
crypto,,ETH Coin,19/02/2024,2420.1198226391957,2651.083563056335,2705.0209133737935,2404.4802157968697,7824072.4550986765,399768421679.41327,blockchain,BINANCE,US,USDT,2024-02-19 21:00:00
stock,TSLA,TSLA Inc,2024-02-14,36925.075970473816,39720.41914188558,40523.05029029135,35682.608388729466,6676266.262250284,1705378620350.1367,Automotive,NYSE,Global,USD,2024-02-14 15:00:00
crypto,BNB,BNB Coin,23/03/2024,38116.63388748302,40386.964651531016,41266.55904843835,37769.45656303886,1202970.3446507137,324099147066.7971,Blockchain,COINBASE,US,USDT,2024-03-23 02:00:00
crypto,ETH,ETH Coin,09/03/2023,297.8754383010973,287.4251237405612,303.3334328171128,278.7473667989542,6954976.599691932,220073193694.53558,blockchain,BINANCE,Global,USDT,2023-03-09 22:00:00
crypto,BTC,BTC Coin,13/07/2024,22440.19419490031,21262.282060746023,22858.98632928815,20440.781503644208,732886.0417606679,158480450001.78656,Blockchain,COINBASE,Global,usd,2024-07-13 06:00:00
stock,MSFT,MSFT Inc,28/07/2023,33413.95779976526,34212.486875574185,35005.35107009588,32377.76721136998,8633473.16206868,1814311294210.3198,automotive,NASDAQ,US,USD,2023-07-28 05:00:00
stock,GOOGL,GOOGL Inc,01-16-2024,23964.302062710252,21690.77069853869,24373.1903636841,21018.568962995407,3988828.986188108,1562054537557.292,Artificial Intelligence,NYSE,US,usd,2024-01-16 03:00:00
crypto,BTC,BTC Coin,2023-11-29,26684.791310876655,27260.67628739143,28303.238036918636,26435.269484150715,7181512.639188717,234168085844.79626,Crypto,COINBASE,Global,$,2023-11-29 04:00:00
stock,TSLA,TSLA Inc,08-20-2024,921.4468079913179,865.3819271888009,921.7952473417103,850.1284766264172,8980407.458950918,2867015850905.255,Technology,NYSE,US,usd,2024-08-20 19:00:00
crypto,ETH,ETH Coin,10-21-2023,46352.456894367366,42275.91952703721,48518.12717701969,40905.382172166515,1015106.8636637159,101175507147.63821,blockchain,BINANCE,US,usd,2023-10-21 09:00:00
stock,AMZN,AMZN Inc,12/01/2024,12846.260620348192,12293.544866768925,13043.63696912123,12172.46936863964,5392073.60547587,1462756559967.1138,tech,NYSE,US,USD,2024-01-12 04:00:00
crypto,ADA,ADA Coin,06-17-2024,30520.58582771281,31839.99486858221,32274.012207802614,29625.64457868107,1219739.0472761386,127966541166.62144,Blockchain,BINANCE,Global,USDT,2024-06-17 04:00:00
crypto,SOL,SOL Coin,2023-09-01,34059.08151970949,31889.098062731897,34953.410644483636,31425.185448149306,1069662.3540243437,76553993066.19873,Crypto,COINBASE,Global,USDT,2023-09-01 21:00:00
crypto,BTC,BTC Coin,2024-03-04,12835.573557231175,14023.959948977403,14363.021188132532,12711.063712330584,5502715.195020461,229088326753.4169,Crypto,COINBASE,US,usd,2024-03-04 20:00:00
stock,MSFT,MSFT Inc,05/07/2023,31661.237265945176,34519.6349299943,35558.00595004534,31375.00204484445,8842180.42702073,139803473235.9093,TECHNOLOGY,NASDAQ,Global,usd,2023-07-05 16:00:00
stock,TSLA,TSLA Inc,06-26-2023,10610.12154701225,10845.625903235576,11068.51895419072,10525.166994964035,9000331.210856713,691958518127.3081,tech,NYSE,Global,$,2023-06-26 13:00:00
stock,MSFT,MSFT Inc,2023-12-30,11851.159243134358,12516.069753717824,12688.044329200982,11746.047945197042,4237958.798233979,1066729924115.1272,ai,NYSE,Global,usd,2023-12-30 04:00:00
stock,TSLA,TSLA Inc,03-22-2024,4785.810338595063,4904.363785908771,5015.145438070918,4686.889664053937,1680974.0632408892,2005974198881.4966,Finance,NYSE,US,USD,2024-03-22 22:00:00
crypto,ETH,ETH Coin,11-19-2023,43141.225906386,40697.18745147162,43347.68806949723,38710.42927726881,6420073.032932217,296065129252.95197,blockchain,COINBASE,Global,USD,2023-11-19 05:00:00
crypto,BNB,BNB Coin,05-19-2023,27339.40366157636,25873.722353187746,27873.760502365927,25349.102017635738,4968171.821732835,244802144255.0684,blockchain,BINANCE,Global,$,2023-05-19 02:00:00
stock,AAPL,AAPL Inc,2024-06-09,6830.623230311089,7097.2150151403275,7240.691876734968,6635.335580641593,7176260.058816104,2963478705442.513,automotive,NYSE,US,usd,2024-06-09 19:00:00
crypto,BNB,BNB Coin,2023-06-08,49562.88712517239,45879.31674780146,49820.88586522582,45246.959411600255,5784290.7831470845,278512279773.126,crypto,BINANCE,US,USDT,2023-06-08 03:00:00
stock,AAPL,AAPL Inc,2023-05-14,3980.1742557594403,3650.343782150922,4158.126030713097,3502.845677832626,3234392.249593092,829740393013.8196,RETAIL,NYSE,US,USD,2023-05-14 09:00:00
stock,MSFT,MSFT Inc,2023-09-20,17756.265328538546,16227.180430069966,18217.093496975696,15470.679472003989,8003764.721715793,687702642658.6942,Retail,NASDAQ,Global,$,2023-09-20 10:00:00
stock,MSFT,MSFT Inc,09-22-2023,27005.195611079485,29058.017632535048,30003.67793585462,26374.56729443885,3244013.1974006407,708799124912.1947,Finance,NASDAQ,US,USD,2023-09-22 09:00:00
crypto,ADA,ADA Coin,08/02/2024,33477.65289035752,36786.17809324257,38003.504808586906,32737.434227575202,7306774.451882222,136535755657.98817,Crypto,BINANCE,US,USDT,2024-02-08 02:00:00
stock,AMZN,AMZN Inc,03-18-2024,3016.515706613253,3054.099571326795,3200.333719871774,2892.13012523446,6900358.903315837,1400964780728.3174,tech,NASDAQ,Global,usd,2024-03-18 13:00:00
stock,GOOGL,GOOGL Inc,2023-07-29,26796.02594680933,24634.532282764183,27399.433511492487,24334.192165461594,3476367.670865582,610791729090.5789,Retail,NYSE,US,USD,2023-07-29 10:00:00
crypto,ETH,ETH Coin,20/01/2024,39774.54353987856,43172.70409590974,43679.21075432943,38579.94677686082,1525007.7172908438,267640131172.4511,crypto,BINANCE,US,usd,2024-01-20 00:00:00
stock,GOOGL,GOOGL Inc,2023-07-12,46350.77838653552,46721.18720465476,48688.2269636104,45240.579854870455,6236233.294339594,2977525671453.542,automotive,NYSE,US,USD,2023-07-12 16:00:00
stock,MSFT,MSFT Inc,02-21-2023,37765.96832063543,34954.016163989145,39325.8305183764,34573.066476645894,7087738.232732021,276482052026.88965,RETAIL,NASDAQ,US,USDT,2023-02-21 13:00:00
crypto,BNB,BNB Coin,07-31-2024,15163.386513706977,14444.98338117085,15436.430890914402,13786.034113136498,9369641.272487598,19283350307.281036,Crypto,BINANCE,Global,usd,2024-07-31 00:00:00
crypto,BNB,BNB Coin,2023-05-31,15283.160289794598,14968.27069232156,15624.893695221537,14669.350085606287,5157278.597537281,223751885081.38864,Crypto,BINANCE,Global,USDT,2023-05-31 20:00:00
stock,MSFT,MSFT Inc,07-22-2023,24853.204510462456,27299.545269235856,28461.720978101832,23869.652007734563,9306021.551224519,2758981999911.108,Automotive,NASDAQ,Global,usd,2023-07-22 19:00:00
stock,AAPL,AAPL Inc,01/05/2023,40874.31092747467,39898.42280348744,42668.64069548517,39635.20630527821,8059448.075776094,357935529677.5735,Automotive,NYSE,Global,usd,2023-05-01 12:00:00
crypto,ADA,ADA Coin,2023-01-25,15240.910163511058,13963.475851855925,15547.999398622831,13386.452327999084,6949815.937935715,317062022341.28925,blockchain,COINBASE,Global,usd,2023-01-25 20:00:00
crypto,ETH,ETH Coin,25/10/2023,48780.753940987146,50156.09878449364,52218.71960439219,46664.94891654429,8620282.808243953,141709391982.4253,Crypto,BINANCE,US,usd,2023-10-25 06:00:00
crypto,BNB,BNB Coin,2023-08-15,24358.225321758604,24875.851921526028,25827.116689295766,23353.251989558477,5026158.198557961,369489090252.7908,Blockchain,COINBASE,US,usd,2023-08-15 22:00:00
stock,TSLA,TSLA Inc,2023-02-01,7327.235868190833,7133.114561733611,7352.211597718173,6785.664798113305,1352527.7252590728,1202002453039.216,tech,NASDAQ,US,USD,2023-02-01 10:00:00
stock,MSFT,MSFT Inc,2023-02-07,27480.9814993919,30041.231537923577,30690.86998305239,26535.383093648703,5061912.4865396,2889714183651.63,Technology,NYSE,US,$,2023-02-07 09:00:00
stock,TSLA,TSLA Inc,02-24-2024,5292.177566244578,5441.23313891266,5500.008844809746,5191.517161693632,6502360.722889136,1324139949012.4014,RETAIL,NYSE,US,USDT,2024-02-24 22:00:00
stock,MSFT,MSFT Inc,03/06/2024,3076.8678592623014,3249.6411193201993,3324.3504375082807,2931.972581947361,9948668.3053805,464554310854.65784,finance,NASDAQ,Global,$,2024-06-03 02:00:00
crypto,BTC,BTC Coin,2024-01-26,34754.81109063907,38116.84502584973,38572.68457413298,33264.26303293143,1214728.0092848665,27823321593.564823,crypto,BINANCE,US,usd,2024-01-26 14:00:00
stock,AMZN,AMZN Inc,07-08-2024,5061.280092422228,5255.79656707216,5272.166218010596,4937.132491593312,9966971.841675915,916792691227.1107,tech,NYSE,Global,USDT,2024-07-08 03:00:00
crypto,BNB,BNB Coin,08-12-2023,30764.819717168233,29572.705231697433,31724.521863458438,28873.37206296964,4261407.755519824,326518256454.87744,blockchain,BINANCE,Global,$,2023-08-12 17:00:00
crypto,ETH,ETH Coin,25/02/2024,44331.34 USD,43886.12191120467,44762.7386029596,42498.79240097375,4141883.3955367412,56630598812.37879,crypto,COINBASE,US,USDT,2024-02-25 11:00:00
crypto,BNB,BNB Coin,11-06-2023,36683.38288426449,38659.185789474766,38680.50877452676,35612.510562753545,4813960.172201601,331877468748.91534,crypto,COINBASE,Global,usd,2023-11-06 16:00:00
stock,MSFT,MSFT Inc,09-21-2023,12998.062305164261,13674.7149728326,13768.461780125252,12696.058911966371,2152803.5183003577,67384907700.93949,finance,NYSE,Global,USD,2023-09-21 15:00:00
crypto,BNB,BNB Coin,2024-02-03,12067.660865401078,13216.197483200984,13745.861121238991,12043.270098032315,4879052.585219698,9787705984.337843,blockchain,COINBASE,Global,USDT,2024-02-03 07:00:00
crypto,SOL,SOL Coin,07-05-2024,27402.49485379491,27152.459882807496,28559.369384521793,25927.99605566444,4882923.12908076,48345798477.613884,blockchain,BINANCE,US,USDT,2024-07-05 08:00:00
stock,AMZN,AMZN Inc,04-22-2023,16240.549585234097,17011.51146217866,17416.40085537674,15733.753722643316,3945368.309421783,458645507435.01294,TECHNOLOGY,NYSE,US,$,2023-04-22 15:00:00
crypto,BTC,BTC Coin,01-07-2024,39252.977026414475,42331.07528389046,44353.092510675946,38834.74320222809,3154753.550584379,186481473520.36472,Crypto,BINANCE,Global,USD,2024-01-07 12:00:00
crypto,BNB,BNB Coin,14/01/2023,21885.78017152904,20811.935204425426,22805.93669851915,19811.32477844148,9017718.1593621,276813208904.18414,blockchain,BINANCE,US,USDT,2023-01-14 13:00:00
crypto,BNB,BNB Coin,2024-02-10,31863.701825645938,32879.22299802839,34350.76178833747,31284.849380063875,6139721.9140158575,187283598526.77,Crypto,COINBASE,US,$,2024-02-10 11:00:00
crypto,ADA,ADA Coin,16/07/2024,25925.21701704075,24111.32810241947,26881.123541530687,23523.27923699679,6802597.564304325,31327556021.472534,Crypto,COINBASE,Global,USDT,2024-07-16 03:00:00
stock,GOOGL,GOOGL Inc,05-01-2023,4248.752882129703,4432.57380583038,4448.549762808299,4051.4528493964062,122072.64387363961,134601972801.12895,Finance,NASDAQ,US,USDT,2023-05-01 21:00:00
crypto,ETH,ETH Coin,25/04/2024,36878.04 USD,35795.68271911307,37424.82548360307,34631.79187604899,7746760.658280637,382818052328.2946,Blockchain,COINBASE,Global,$,2024-04-25 21:00:00
crypto,BTC,BTC Coin,21/01/2023,9267.926437694721,8663.860296323694,9313.52261986137,8516.705807346258,7643962.249555138,266241391372.8137,blockchain,BINANCE,Global,USD,2023-01-21 10:00:00
stock,TSLA,TSLA Inc,22/01/2023,1057.0386019353314,968.7064666433938,1108.191872840415,934.5811066351439,7692462.255233498,802488820691.7621,TECHNOLOGY,NYSE,Global,USD,2023-01-22 02:00:00
crypto,ETH,ETH Coin,09-25-2023,19103.162586248265,17978.701769951833,19219.105810341338,17632.623418305426,7746563.172597242,251742109697.4342,Blockchain,COINBASE,Global,$,2023-09-25 21:00:00
crypto,ADA,ADA Coin,05-04-2024,26519.803641125425,24090.33091859528,27804.010251647258,23847.878831982365,2928927.5449729464,259342180148.7466,crypto,COINBASE,US,usd,2024-05-04 10:00:00
stock,MSFT,MSFT Inc,2024-06-10,30098.06066591974,30594.213099313354,31738.54861258075,29814.79244905864,6565129.594707695,2940111284782.9634,AI,NYSE,Global,$,2024-06-10 13:00:00
stock,GOOGL,GOOGL Inc,16/04/2024,16919.992624664974,18368.627032076274,18574.921052053338,16388.846158355434,4321336.7525590155,393006281634.93805,ai,NYSE,Global,usd,2024-04-16 09:00:00
crypto,BTC,BTC Coin,2023-01-23,30650.849728901332,33366.97991314536,33768.53935719314,29304.513263798974,1975507.4281095131,178564970929.30862,Blockchain,BINANCE,US,$,2023-01-23 20:00:00
stock,AAPL,AAPL Inc,09-01-2023,32294.082524633748,30911.293761378878,33611.59541377249,30697.032123051336,8465296.87256409,2661905451625.716,Finance,NYSE,US,USD,2023-09-01 11:00:00
crypto,SOL,SOL Coin,13/03/2023,12619.528598466346,13263.230381190682,13568.642453789917,12519.833409446199,7285178.28093897,367975980787.624,crypto,BINANCE,Global,usd,2023-03-13 19:00:00
crypto,ADA,ADA Coin,2023-10-26,32811.53026567677,30694.719127000506,33705.68862792654,30671.191225028557,9373943.276904693,311696741367.39124,crypto,BINANCE,US,USD,2023-10-26 10:00:00
stock,AAPL,AAPL Inc,2024-03-04,8249.092638314562,7641.511945554752,8548.526414865759,7571.892166627078,2135900.1517404085,139089470033.06488,Technology,NYSE,US,USD,2024-03-04 19:00:00
crypto,ADA,ADA Coin,2024-01-17,42036.744370279885,43993.98817554892,45186.74703588647,41175.721899435914,5084097.108615884,204811813715.97244,Crypto,COINBASE,US,usd,2024-01-17 16:00:00
crypto,BNB,BNB Coin,2023-11-12,28255.449423022215,29322.85724278794,30603.27340222003,27741.611860404453,7611454.248894537,122531638270.93413,crypto,COINBASE,US,USDT,2023-11-12 00:00:00
crypto,BNB,BNB Coin,10-30-2023,23083.26 USD,20818.013169499052,23367.965741694064,20533.28698864207,9918107.703542285,68228295807.056335,Crypto,BINANCE,US,usd,2023-10-30 16:00:00
crypto,ETH,ETH Coin,02/03/2024,20080.7008499058,21285.827921143653,21502.98129156826,19633.990548071724,7330979.8890007185,44175349336.95029,blockchain,BINANCE,Global,USDT,2024-03-02 01:00:00
stock,AMZN,AMZN Inc,15/02/2023,9409.356483424652,9137.208854176633,9778.105298874785,8933.552582075126,53290.905815584454,1851796496277.9353,Automotive,NASDAQ,US,usd,2023-02-15 08:00:00
crypto,ADA,ADA Coin,2024-06-29,1775.214633462551,1862.4606748706692,1881.3162789073463,1771.4932048814394,3680039.5722695426,305591350211.09705,blockchain,BINANCE,US,USDT,2024-06-29 19:00:00
stock,AMZN,AMZN Inc,28/03/2024,7452.913636118909,7163.150637483508,7779.59375696608,7161.837752895399,3683726.9955379767,987525532850.8566,Retail,NYSE,Global,usd,2024-03-28 18:00:00
stock,TSLA,TSLA Inc,15/01/2023,36106.326200754826,38895.148366120244,40048.475734414336,35007.83761943643,4126805.7866453887,1351345786554.0823,AI,NASDAQ,Global,USDT,2023-01-15 05:00:00
crypto,ETH,ETH Coin,07-05-2023,170.8809975778913,174.96810663485465,178.0781035827971,169.12260931111308,930813.4075914985,279769167866.2387,Blockchain,COINBASE,Global,usd,2023-07-05 01:00:00
crypto,,BTC Coin,2024-06-17,24053.834765407326,24738.529702012136,24818.748830682096,23548.684736607527,5615284.395007278,237339895444.61426,blockchain,COINBASE,US,USDT,2024-06-17 16:00:00
stock,MSFT,MSFT Inc,09-24-2023,30178.348453156777,31243.45063324217,32500.982336833626,29076.568216094485,8250669.05239044,1686373682304.351,Technology,NYSE,US,USDT,2023-09-24 04:00:00
stock,AMZN,AMZN Inc,2024-06-13,3862.1433739252147,3521.155453216053,3926.6871893184093,3483.2848941136926,7077101.666474417,1499784489967.7263,AI,Unknown,US,USDT,2024-06-13 19:00:00
stock,AAPL,AAPL Inc,01/01/2023,25868.28013151605,25558.890316909503,26058.99729486295,24700.35793067927,4340759.642372578,2367958744370.495,Automotive,NYSE,Global,$,2023-01-01 09:00:00
stock,AAPL,AAPL Inc,07/02/2024,11038.39151603345,11255.241366564065,11669.24466232608,11037.47947522243,9331200.200104233,274915284742.05554,TECHNOLOGY,NASDAQ,Global,usd,2024-02-07 00:00:00
crypto,ADA,ADA Coin,05-03-2024,21068.19018417066,21641.992307861106,22492.145621618656,20139.43714376434,4099638.992073186,258813253816.40067,crypto,COINBASE,Global,$,2024-05-03 01:00:00
crypto,BTC,BTC Coin,10-27-2023,19197.80926713287,19473.767298055907,20046.071485973785,18414.99579987497,3622992.1810812317,336721902826.0688,Crypto,BINANCE,Global,usd,2023-10-27 14:00:00
crypto,BTC,BTC Coin,10-01-2023,1319.573459517919,1194.0006754801184,1374.4477267776224,1150.6029782841845,5181269.583621915,137131959053.0632,Crypto,COINBASE,US,USD,2023-10-01 06:00:00
crypto,ADA,ADA Coin,06-05-2024,47034.555463315875,44770.28147425035,48044.99132276392,44485.38634880226,8419493.734351294,122996601567.56535,blockchain,BINANCE,Global,USD,2024-06-05 03:00:00
stock,MSFT,MSFT Inc,05-08-2024,40134.13905668756,39798.51239627668,41103.31605030382,38074.201993305374,806934.5360574895,566443239360.3691,Artificial Intelligence,NASDAQ,Global,$,2024-05-08 16:00:00
stock,GOOGL,GOOGL Inc,2023-02-28,24828.093006241434,24514.517680491612,25733.70791373144,24227.100771315127,1589922.7685258663,2186538527851.5579,Retail,NYSE,Global,USDT,2023-02-28 11:00:00
crypto,BTC,BTC Coin,07-22-2024,6776.3505730615,7117.0317147147625,7350.8102488296945,6761.65084619732,690511.2055478554,246038934043.6683,crypto,COINBASE,Global,usd,2024-07-22 20:00:00
crypto,ETH,ETH Coin,2024-01-06,14116.53 USD,13443.754002206782,14290.856068253619,13380.739484291338,2496212.4522952116,27536614854.745457,blockchain,BINANCE,Global,usd,2024-01-06 12:00:00
crypto,ETH,ETH Coin,2024-06-18,37972.319138274004,37590.6201897924,39446.99419561244,35833.946900416224,4876224.36554017,112420141820.80925,Crypto,COINBASE,US,$,2024-06-18 16:00:00
crypto,BNB,BNB Coin,2024-05-17,3142.0336407331724,3397.4416709855846,3421.095572301923,3068.576143433056,4111544.9304044647,18277372072.39664,blockchain,COINBASE,US,usd,2024-05-17 14:00:00
crypto,BNB,BNB Coin,30/04/2023,44992.66895090675,40689.78062911685,46485.95243106298,40615.307007034084,5602121.666434958,142200613872.24286,crypto,COINBASE,US,$,2023-04-30 12:00:00
crypto,BTC,BTC Coin,15/08/2024,2622.3713855083283,2579.7805702339238,2656.4829028451254,2545.059428011072,9812989.607881969,375044872503.0713,blockchain,COINBASE,Global,usd,2024-08-15 00:00:00
crypto,ETH,ETH Coin,24/01/2024,32712.188327688982,30737.010908941284,33636.84781543333,29913.155258711802,9720081.290985739,106329374665.47789,Blockchain,COINBASE,Global,$,2024-01-24 10:00:00
crypto,BTC,BTC Coin,02-05-2023,17481.82354062007,16132.56166218594,17614.027059171196,15507.68054237528,2510415.64674164,245368272715.10428,blockchain,BINANCE,Global,usd,2023-02-05 09:00:00
stock,AAPL,AAPL Inc,14/06/2023,28065.52718624342,28196.82283806108,28358.628715432103,27869.26452431453,7228420.2177816285,2553342012945.002,Technology,NASDAQ,US,$,2023-06-14 19:00:00
crypto,SOL,SOL Coin,05-20-2023,35394.67651051614,35702.880734253646,35848.772247861794,34436.01283256377,4847478.17501334,31729002950.500626,Blockchain,COINBASE,US,usd,2023-05-20 15:00:00
crypto,ETH,ETH Coin,08-03-2023,47285.450368544116,50595.19898021644,52287.66489418523,46014.17054038153,4118243.6503035007,70480943364.49393,crypto,BINANCE,Global,$,2023-08-03 15:00:00
crypto,SOL,SOL Coin,2024-01-09,27276.139151651205,24888.239216774047,27975.093829823676,24647.325562483486,4592939.536091983,262134519524.6269,Crypto,COINBASE,US,usd,2024-01-09 03:00:00
stock,AAPL,AAPL Inc,16/04/2023,39316.04718720781,36967.80806053755,39824.444634610474,35423.85930051248,3302820.433650104,165350166887.26254,AI,NASDAQ,US,USD,2023-04-16 14:00:00
crypto,ETH,ETH Coin,13/01/2023,25974.09911660183,24441.010509326905,27114.1413894746,24293.853451894738,8705913.672035024,303916844747.01086,Blockchain,COINBASE,Global,usd,2023-01-13 06:00:00
stock,GOOGL,GOOGL Inc,05/08/2024,22567.454815607594,24756.451245806846,25712.065707352987,21469.737052375433,652980.70801366,724000672030.8025,automotive,NASDAQ,US,usd,2024-08-05 12:00:00
crypto,ADA,ADA Coin,2023-03-21,45461.91809101939,45813.809684719694,46954.14405980749,43428.57402187768,6568144.267138216,188252893840.87143,crypto,BINANCE,US,USDT,2023-03-21 07:00:00
crypto,BNB,BNB Coin,2023-04-17,19027.19617530304,20076.02032646196,21044.162971867496,18269.69158612636,5233772.982316218,329730748437.08905,crypto,BINANCE,US,USDT,2023-04-17 01:00:00
crypto,ETH,ETH Coin,08-01-2023,39644.79240750163,40260.026984013195,41537.44224672097,39244.20984797546,3960308.756151886,118419493443.40733,crypto,BINANCE,Global,usd,2023-08-01 13:00:00
stock,MSFT,MSFT Inc,03-14-2024,26656.113073634537,24832.594089876075,27583.611352722048,24575.901241513275,3168300.0089981994,2746119304537.059,tech,NYSE,US,usd,2024-03-14 09:00:00
crypto,ETH,ETH Coin,03-30-2023,45308.10130574066,43286.494488392185,47536.17583184829,41426.71520313936,2020954.668356497,343585806514.50745,Blockchain,COINBASE,Global,USDT,2023-03-30 11:00:00
crypto,ETH,ETH Coin,28/07/2024,44700.545603293445,46079.93785758354,46430.38565352127,43449.653175277395,6153364.95267295,77768811499.02032,Crypto,BINANCE,US,USDT,2024-07-28 02:00:00
crypto,ETH,ETH Coin,02/07/2024,44121.99425668286,46801.11294609487,47983.324909659495,44049.47229204623,4178192.031771722,37968313570.8064,Blockchain,COINBASE,Global,usd,2024-07-02 14:00:00
stock,AAPL,AAPL Inc,07/10/2023,33399.32074019332,34298.90655017304,34583.51012243773,33202.14410664848,4275469.389518231,2952489853919.1284,ai,NYSE,US,usd,2023-10-07 17:00:00
crypto,SOL,SOL Coin,2023-01-01,640.2499235881944,647.9016379648814,664.9867919166484,631.2657324965219,8902690.272125004,69082195284.07935,blockchain,BINANCE,US,USD,2023-01-01 02:00:00
stock,MSFT,MSFT Inc,01-17-2024,36577.509552114716,34290.77103198519,38147.00852007781,33980.548451110095,5408396.756100458,247425688082.65826,Artificial Intelligence,NASDAQ,Global,USD,2024-01-17 10:00:00
stock,AMZN,AMZN Inc,2024-04-24,15724.362158055583,15633.688878263967,16370.347965156621,15211.004894611799,3578624.8549890923,2133625967883.7014,tech,NYSE,Global,USD,2024-04-24 07:00:00
crypto,BTC,BTC Coin,2023-02-08,41414.18012933654,40049.23540732699,41773.98982522075,39472.55449263788,8259956.14886811,200213916663.86847,Crypto,BINANCE,Global,USD,2023-02-08 01:00:00
stock,GOOGL,GOOGL Inc,2024-04-08,12001.31 USD,11141.946090973217,12210.09447979258,10835.738102873613,7488514.5432961015,310906060785.3647,Retail,NYSE,Global,$,2024-04-08 09:00:00
crypto,BTC,BTC Coin,2023-01-27,31050.219088246773,30133.4610381099,32356.57563197432,29336.863661032094,9791070.27521353,262203296028.2613,blockchain,COINBASE,Global,USD,2023-01-27 21:00:00
stock,TSLA,TSLA Inc,05-13-2023,6321.974430809491,6544.732439354141,6651.118379152148,6222.82285869995,697341.840475895,1906084993504.2532,Finance,,Global,USDT,2023-05-13 18:00:00
stock,TSLA,TSLA Inc,2024-03-29,42788.30557270026,40453.6006765888,44579.08414489085,38995.80681080208,6429176.218677018,532895497156.1186,tech,NASDAQ,US,usd,2024-03-29 07:00:00
crypto,BNB,BNB Coin,2023-07-11,25637.611109721198,24639.3372781084,25910.195801024765,23448.258599258297,3040160.0660059974,279189476536.38324,Crypto,BINANCE,US,usd,2023-07-11 14:00:00
crypto,SOL,SOL Coin,19/05/2023,46915.85787423965,50398.93322066646,52329.37559643184,46419.59915539735,6650184.0498564765,262999302259.85678,Crypto,BINANCE,US,USDT,2023-05-19 23:00:00
stock,AAPL,AAPL Inc,2024-02-09,45360.679584984435,46909.58632401727,48224.088231940455,43344.37349325022,4471108.3825204475,788257704122.349,Technology,NYSE,US,usd,2024-02-09 03:00:00
crypto,BNB,BNB Coin,06-28-2023,43229.53484003827,43632.85101200503,44462.74903591057,43179.38928969198,1108095.2126698305,186841517124.7609,Crypto,COINBASE,Global,USDT,2023-06-28 05:00:00
crypto,SOL,SOL Coin,2023-08-04,2110.8135118185505,2212.092083749708,2313.6355774195063,2034.8281651790608,8583558.42631441,171906629183.2181,Blockchain,COINBASE,US,USD,2023-08-04 18:00:00
crypto,SOL,SOL Coin,03-22-2024,45539.400380579325,47852.454942440934,49778.29320602446,43303.43074879857,9628140.760383185,120426201032.44962,crypto,COINBASE,US,USDT,2024-03-22 19:00:00
stock,GOOGL,GOOGL Inc,07-18-2023,15244.507258352805,16248.799130213483,16477.518200410545,15147.517007536222,1126691.3237289581,2182746266290.2666,Automotive,NYSE,US,$,2023-07-18 15:00:00
stock,AAPL,AAPL Inc,05-19-2024,27039.516847479066,24857.61424937358,27366.551459704373,23630.150274350737,4688210.8866795935,2114021072607.7793,tech,NASDAQ,Global,usd,2024-05-19 08:00:00
stock,MSFT,MSFT Inc,02-27-2024,29921.890640044963,28708.48501130926,30370.597982813535,28339.85830105846,482380.2169475561,910783129672.4011,Finance,NYSE,Global,$,2024-02-27 11:00:00
crypto,ADA,ADA Coin,16/01/2024,42614.67108081516,44044.8593571179,45351.27738826732,42385.19639991495,1854116.4651076158,361643523100.83496,Blockchain,BINANCE,US,$,2024-01-16 06:00:00
crypto,BTC,BTC Coin,2023-09-16,11983.11339377781,12689.106377179463,12711.103112310338,11733.14974366263,9954379.724396909,36192819065.377304,Blockchain,COINBASE,Global,$,2023-09-16 16:00:00
stock,AAPL,AAPL Inc,05/05/2024,26077.069995289035,23801.276684966455,27161.059261632316,23324.035510791844,1150215.0375986088,2568531320574.2427,Automotive,NYSE,Global,USD,2024-05-05 19:00:00
stock,AAPL,AAPL Inc,2024-01-23,45482.24470363525,47021.366256209076,48971.07617231471,45207.02914005201,5718151.748131174,290633281621.835,finance,NYSE,Global,USDT,2024-01-23 00:00:00
stock,AMZN,AMZN Inc,2023-10-08,21527.0662419463,20738.945655859327,21994.84504384069,20504.4707792845,6019632.386720301,1557164591747.5735,AI,NYSE,US,$,2023-10-08 05:00:00
stock,MSFT,MSFT Inc,2024-03-11,22174.566918815595,22649.499924736952,23364.439943549096,21721.86998893656,7026635.0970820775,2678644636964.9897,AI,NYSE,Global,usd,2024-03-11 23:00:00
crypto,ADA,ADA Coin,10-11-2023,25623.065239514075,23594.870499949426,26115.68318119284,22990.449041512387,6522590.371195179,98786220008.04848,Blockchain,BINANCE,US,USD,2023-10-11 11:00:00
crypto,ETH,ETH Coin,2023-03-24,30036.54681675231,31499.890830254968,32297.257110513077,29487.03424717102,710251.2291216005,380459765771.5504,Crypto,BINANCE,Global,USDT,2023-03-24 04:00:00
crypto,BNB,BNB Coin,21/03/2023,18099.036129324882,17999.467377018158,18140.346044030182,17225.511966962615,2768866.2636052663,105484674432.52956,crypto,BINANCE,US,usd,2023-03-21 11:00:00
stock,TSLA,TSLA Inc,02-12-2024,16574.036885081507,16514.506452028032,16736.54342128182,16193.117700654177,2807551.471944227,2914882745794.1416,Technology,Unknown,US,USDT,2024-02-12 17:00:00
crypto,ADA,ADA Coin,2023-02-02,25833.465696014493,23278.56590116102,25843.365122241335,22369.61799158129,368176.9036457106,86762068483.17857,blockchain,COINBASE,US,USD,2023-02-02 09:00:00
crypto,SOL,SOL Coin,2023-06-16,16949.643860444194,17975.387761673857,18489.527570828992,16536.638436107238,2935594.7432580083,47670172881.62309,Crypto,BINANCE,US,usd,2023-06-16 08:00:00
crypto,ADA,ADA Coin,12-01-2023,19856.78191144721,18216.980135568123,20469.429673217597,17409.820716421127,3452886.2048741193,373042719175.96246,Blockchain,COINBASE,US,$,2023-12-01 04:00:00
crypto,ADA,ADA Coin,01/03/2023,43712.38400901194,43655.96513734313,45247.254251735496,43640.285746031506,1315759.7098599183,205427715793.53452,Crypto,N/A,Global,USD,2023-03-01 16:00:00
crypto,ADA,ADA Coin,2023-08-03,19734.858019126343,19426.316059599812,20140.430147288054,19336.577166361516,7140612.4120240975,113518952580.2102,Blockchain,Unknown,US,$,2023-08-03 21:00:00
crypto,BNB,BNB Coin,16/08/2023,15475.542165960476,16477.708514750317,17264.56895086022,15337.189490073471,16649.48680953757,245122559565.82797,blockchain,COINBASE,US,USDT,2023-08-16 19:00:00
crypto,BTC,BTC Coin,2023-05-19,2566.2577182906152,2441.849249955315,2573.8955043754354,2393.475661153094,6866212.545012576,256378541222.44577,Crypto,BINANCE,Global,usd,2023-05-19 03:00:00
crypto,BTC,BTC Coin,01-23-2023,19198.105763418524,19030.07053748894,19552.36171062229,18193.722725416137,4190058.954084567,50222617036.032524,crypto,COINBASE,US,$,2023-01-23 07:00:00
crypto,BNB,BNB Coin,2024-08-16,3559.6731500174405,3260.788763674771,3622.816642114718,3251.2877564365635,6686057.894582418,301715328884.32513,Crypto,BINANCE,Global,$,2024-08-16 04:00:00
crypto,ADA,ADA Coin,20/06/2024,18102.38034198487,18441.47699510251,18450.818694961545,17773.003953192547,9132956.18881479,273074632885.6631,crypto,BINANCE,US,USDT,2024-06-20 05:00:00
stock,TSLA,TSLA Inc,03/02/2023,43686.19268738259,45643.098698957314,45918.2316839025,43473.1205066862,665371.999713393,1841594670351.0093,ai,NYSE,Global,usd,2023-02-03 13:00:00
stock,AMZN,AMZN Inc,11/01/2023,7115.434818434948,6420.550861711561,7265.58268188918,6194.239512114427,4860518.937482232,1606562742917.8137,automotive,NYSE,Global,usd,2023-01-11 19:00:00
stock,GOOGL,GOOGL Inc,15/11/2023,2196.5162247242783,2030.9003489386218,2257.869579105389,1964.2022663568252,7292005.7020069305,1735827661336.307,RETAIL,NYSE,US,USDT,2023-11-15 23:00:00
stock,AAPL,AAPL Inc,10/04/2023,42281.76210586544,43909.5492867282,44853.453278356144,41590.38473223562,2754536.36137993,1960352029289.8997,RETAIL,NASDAQ,US,USD,2023-04-10 23:00:00
stock,AMZN,AMZN Inc,2024-02-05,39451.36814444046,39028.60346768079,41026.22798109412,38682.07312953915,8575765.814275177,925877361346.856,Retail,NYSE,Global,USDT,2024-02-05 00:00:00
stock,AAPL,AAPL Inc,04-21-2024,21554.951173459678,20774.087796063428,22182.414451263954,20120.9218318588,6011140.593835529,2750739355165.21,Finance,NASDAQ,US,USD,2024-04-21 10:00:00
crypto,BNB,BNB Coin,2023-05-18,34423.366874421925,33559.70447573324,34710.56137141273,32604.14112029281,1426798.8466750055,283706415744.3107,blockchain,COINBASE,Global,$,2023-05-18 18:00:00
crypto,SOL,SOL Coin,10-30-2023,17300.414262285492,16104.816358819224,17322.427101706326,15819.618087456174,6369386.272229978,356588328897.6043,Blockchain,BINANCE,US,USDT,2023-10-30 13:00:00
stock,MSFT,MSFT Inc,03-30-2023,3594.8773234940736,3529.902716206028,3650.8167592779746,3472.916079665715,6058186.715277451,1028406458078.0621,Automotive,NASDAQ,US,$,2023-03-30 15:00:00
crypto,ETH,ETH Coin,01-29-2024,10902.448787206955,11966.606212672237,12238.249143710671,10732.520078204008,1406389.1228160295,149014522638.0283,blockchain,COINBASE,Global,USDT,2024-01-29 10:00:00
stock,AMZN,AMZN Inc,2023-03-23,1386.5606262745796,1388.0733966158427,1454.9797424505762,1343.868889989675,390921.12973654096,1461913201981.5994,ai,NYSE,Global,USDT,2023-03-23 02:00:00
crypto,ADA,ADA Coin,03-05-2023,19405.458129744005,18085.983757619895,19428.116036120922,17865.5279266986,4585771.565810025,17227537413.140694,Crypto,BINANCE,Global,usd,2023-03-05 00:00:00
stock,GOOGL,GOOGL Inc,25/05/2023,45005.15831899387,41550.01294526008,47156.222230855936,40124.77835656757,8884148.319414504,874841868198.237,finance,NASDAQ,Global,USDT,2023-05-25 23:00:00
stock,,AAPL Inc,2024-05-17,41337.100913476956,45338.641107693395,45992.43663963195,41256.77359539398,3895429.4671293013,1812799200673.59,TECHNOLOGY,NYSE,US,USD,2024-05-17 16:00:00
stock,AAPL,AAPL Inc,28/07/2024,17025.95134168274,17166.952123257837,17299.262152071966,16646.02701495042,5417506.41928763,1162680595163.3977,Technology,NYSE,Global,USD,2024-07-28 12:00:00
crypto,SOL,SOL Coin,2024-06-19,41684.1615972599,41187.63112164161,42314.28699836952,39662.31906994279,1947043.7432120144,305951215978.92365,Blockchain,BINANCE,US,usd,2024-06-19 04:00:00
stock,MSFT,MSFT Inc,07-10-2023,17128.97446194732,16341.890179134267,17956.6613980517,15980.496489703159,3473423.113266045,182366270775.0844,Automotive,NASDAQ,US,usd,2023-07-10 14:00:00
stock,TSLA,TSLA Inc,05-20-2023,6968.443100271318,6890.457510313527,7186.637012084303,6714.371121640365,4018386.227742588,1745598126971.151,RETAIL,N/A,US,$,2023-05-20 12:00:00
crypto,SOL,SOL Coin,2023-03-17,44016.93495982486,45103.32536661665,46387.36598550615,43182.06681046223,2013919.7661165101,397570113615.3808,Blockchain,COINBASE,US,USD,2023-03-17 15:00:00
stock,AAPL,AAPL Inc,19/07/2024,1982.582049216057,1972.8856517938932,2036.4115888379313,1896.7075785320917,9640324.442807972,1191461852360.3127,finance,NYSE,US,USD,2024-07-19 09:00:00
stock,AMZN,AMZN Inc,2023-01-12,36109.940340440735,36351.058175017875,37932.273151659094,34540.3357404589,7905307.432954575,2729269286702.3535,automotive,NYSE,Global,USDT,2023-01-12 06:00:00
crypto,ADA,ADA Coin,16/06/2024,39712.59 USD,37931.620849716106,41454.167997455304,37825.49214568816,1488810.8980817513,54304221516.905075,Crypto,BINANCE,Global,USD,2024-06-16 17:00:00
crypto,SOL,SOL Coin,08-16-2023,49049.55903435263,48886.787444599344,51167.390293579934,47881.50771158784,3753923.749288099,187756864000.83044,Blockchain,BINANCE,US,$,2023-08-16 10:00:00
crypto,BTC,BTC Coin,30/09/2023,10169.122323393503,10701.573889826102,10908.403479584977,9920.627343027278,4923762.474531818,117884504432.71873,crypto,,Global,USDT,2023-09-30 07:00:00
stock,GOOGL,GOOGL Inc,07/08/2023,43280.20150977137,47441.50064256458,48408.320967212276,42906.95071937828,7645513.418752522,1736064297407.0625,TECHNOLOGY,Unknown,Global,USDT,2023-08-07 11:00:00
stock,AAPL,AAPL Inc,04-12-2023,47802.79670916054,44939.165540478825,48063.95345081143,44611.02417336901,4392059.016520849,1724851564852.164,Finance,NASDAQ,US,USD,2023-04-12 02:00:00
stock,TSLA,TSLA Inc,2024-05-24,44655.579357718794,40747.837427616636,46628.16089938241,39623.847155430594,5104814.457553318,2542436874079.111,TECHNOLOGY,NYSE,US,USDT,2024-05-24 07:00:00
crypto,ETH,ETH Coin,2023-02-20,46319.86651043704,41864.97084783085,47424.232800379796,41211.29546832761,7227346.870024586,252504041881.81805,Crypto,COINBASE,Global,$,2023-02-20 20:00:00
stock,TSLA,TSLA Inc,2023-06-08,6730.412119112011,6460.382046477897,6851.127285091026,6397.2115288545765,2788319.9642731156,2080671970295.953,tech,NYSE,Global,USDT,2023-06-08 02:00:00
crypto,ADA,ADA Coin,03-16-2023,47872.82647171443,43170.40592658427,50261.25170541048,42472.81814082665,8284864.5251917215,88228460727.54526,crypto,COINBASE,Global,USDT,2023-03-16 23:00:00
crypto,,BNB Coin,01-30-2024,725.6207305763282,760.1413413444197,791.8447309863844,716.2049356396342,1429360.0227210852,121374661556.74629,Crypto,COINBASE,Global,usd,2024-01-30 09:00:00
crypto,BTC,BTC Coin,2023-12-24,38448.449877560975,39667.57729162153,41187.07544054711,38152.245787373104,6136427.538260346,302604029291.5028,Blockchain,BINANCE,US,USDT,2023-12-24 07:00:00
crypto,ADA,ADA Coin,04-21-2024,24386.51420526387,22326.58210533716,24883.441901040303,21664.717822824245,661032.4315582756,39998862018.02323,blockchain,COINBASE,US,usd,2024-04-21 11:00:00
crypto,ETH,ETH Coin,29/07/2024,5558.794958577829,5901.478224868917,6181.116237328834,5300.9548335532345,9551196.957709722,142784110917.94434,Crypto,COINBASE,US,USD,2024-07-29 08:00:00
crypto,SOL,SOL Coin,2024-04-06,14985.288240914157,13717.11948738437,15360.388188785751,13576.186745933344,7071157.686189715,211417756738.01434,crypto,COINBASE,US,USDT,2024-04-06 17:00:00
crypto,BTC,BTC Coin,02/06/2023,3654.3627500414964,3583.3754984452767,3708.317679136004,3445.8427379961045,2810763.9845882272,24839274528.269638,crypto,COINBASE,US,$,2023-06-02 08:00:00
stock,TSLA,TSLA Inc,20/01/2024,46462.11040105638,45580.284584331785,48567.101871890976,44033.963632891086,4764893.426451572,2412413402457.685,RETAIL,NYSE,Global,USDT,2024-01-20 05:00:00
stock,TSLA,TSLA Inc,30/05/2023,32027.39734837044,35095.50104798428,36154.495677216364,30999.020173389312,6478526.642459293,685826703469.8391,Artificial Intelligence,NYSE,Global,usd,2023-05-30 09:00:00
stock,AMZN,AMZN Inc,26/12/2023,44434.06742246728,44461.47391784304,45460.411509627294,43513.981826873576,6248213.844031235,377532828611.50885,RETAIL,NYSE,US,usd,2023-12-26 10:00:00
crypto,,BTC Coin,02-23-2023,34134.03488895789,32372.252283389,35352.53909231005,32085.004863003087,8039781.11701765,33351443459.472645,Crypto,BINANCE,US,USDT,2023-02-23 14:00:00
crypto,ADA,ADA Coin,2024-07-01,26013.29291661445,24155.298471566006,27021.75824272476,23275.332277621364,4967457.532756647,223237882126.1162,blockchain,BINANCE,Global,$,2024-07-01 06:00:00
stock,MSFT,MSFT Inc,2024-02-14,6700.07986635466,6873.689249649781,6892.362325833472,6615.875016047494,3176550.3658159054,859979537853.2749,Technology,NYSE,Global,usd,2024-02-14 12:00:00
crypto,ETH,ETH Coin,02-14-2024,25561.345670469116,23244.73066926126,25914.308947025147,22904.16803781862,627833.5265970367,5053203736.771702,Blockchain,BINANCE,Global,USD,2024-02-14 22:00:00
crypto,SOL,SOL Coin,30/01/2023,200.95793370256956,190.78238328097015,208.4024611123782,184.26020276322097,1019821.9882720693,336538704480.6209,Blockchain,COINBASE,US,USD,2023-01-30 22:00:00
stock,GOOGL,GOOGL Inc,04-07-2023,13526.96038636243,14454.13045125458,14680.589035124813,13384.205281705761,8918829.575962536,1087099417213.2793,Technology,NYSE,US,USD,2023-04-07 16:00:00
crypto,ADA,ADA Coin,2024-08-20,45498.05776128106,44381.69970787126,47691.24253527463,42360.755765705326,6870505.645765924,176357880732.72916,blockchain,COINBASE,US,USD,2024-08-20 11:00:00
crypto,SOL,SOL Coin,06-19-2024,19388.563784727798,19903.18232994946,20603.632131400766,18423.365472087655,1670363.93438324,200056545980.48682,crypto,COINBASE,Global,USD,2024-06-19 09:00:00
crypto,ETH,ETH Coin,2024-04-24,33322.60682477454,36428.59037978855,37814.76707601781,33240.5877395087,7025702.474846534,286653190000.5559,Crypto,COINBASE,US,$,2024-04-24 18:00:00
stock,MSFT,MSFT Inc,2023-03-01,5277.192463320315,5574.640216845857,5754.185224630337,5026.047183226267,3601144.608543882,901176103831.935,RETAIL,NASDAQ,Global,usd,2023-03-01 12:00:00
crypto,SOL,SOL Coin,2023-02-03,25025.05327405296,24688.36188307327,25597.75112418418,23711.792402987685,3687703.0014770874,382935927116.293,Crypto,COINBASE,US,USDT,2023-02-03 05:00:00
crypto,BNB,BNB Coin,26/07/2024,2627.2274591717455,2767.8196633372936,2825.4601211618283,2603.8687649642993,8503629.663197834,151076236114.93475,crypto,COINBASE,Global,USD,2024-07-26 13:00:00
stock,MSFT,MSFT Inc,08-23-2023,32871.10057368473,32688.875053068787,34317.6866063259,31407.047305688513,6778454.189900132,643862223548.9875,TECHNOLOGY,NYSE,US,$,2023-08-23 13:00:00
crypto,SOL,SOL Coin,04/07/2024,14772.12086381592,13698.485789202648,15253.42592888784,13519.444838950862,3156957.810289737,245062088289.8254,blockchain,COINBASE,Global,$,2024-07-04 11:00:00
stock,MSFT,MSFT Inc,03-06-2024,19762.59407149905,20605.298289011822,20810.542797157792,19654.112254596956,2874808.555059332,1938049486026.7183,tech,NYSE,Global,$,2024-03-06 11:00:00
crypto,ADA,ADA Coin,2024-04-17,2914.0166844966857,2687.6047054928845,2989.1781940666824,2589.183637074717,8354966.7771962015,150275465163.6804,Crypto,BINANCE,Global,$,2024-04-17 11:00:00
crypto,,SOL Coin,28/03/2024,18960.91149311009,18344.096154775798,18979.234968070094,17540.962640531052,4137013.106511434,10803888518.706768,Crypto,COINBASE,US,USD,2024-03-28 06:00:00
stock,TSLA,TSLA Inc,2024-01-07,20220.444465270906,20345.55918691414,20950.973522704182,19219.455445707295,4641487.4993755855,1483665107497.8655,finance,NYSE,Global,USDT,2024-01-07 22:00:00
stock,MSFT,MSFT Inc,13/05/2024,25956.42368367614,26878.096146861168,27297.21148475222,25663.104906434608,7729441.897279275,2890862730253.889,Automotive,NYSE,US,USDT,2024-05-13 21:00:00
crypto,BNB,BNB Coin,13/01/2024,48800.931025727885,45146.23139733462,48842.284116994066,44627.406869495055,8071748.218111461,210911938823.3849,crypto,Unknown,US,USD,2024-01-13 03:00:00
stock,GOOGL,GOOGL Inc,2023-03-28,13286.485819600717,12004.479083034885,13481.337854495856,11868.313401566895,5180087.316598077,369419615070.52295,Retail,NASDAQ,Global,$,2023-03-28 07:00:00
stock,TSLA,TSLA Inc,12-24-2023,18593.247352367453,16738.956276680754,18871.960620636986,16443.060693394487,9741970.243719755,1050805823573.1814,Artificial Intelligence,NASDAQ,US,usd,2023-12-24 16:00:00
crypto,ADA,ADA Coin,11-16-2023,1189.512282630001,1284.3308295566335,1334.6251229495967,1176.4500177014443,4580499.594276711,339589026658.6403,Blockchain,COINBASE,Global,usd,2023-11-16 11:00:00
stock,GOOGL,GOOGL Inc,2023-07-30,15152.757284371299,13836.573206447472,15325.677037707814,13315.352008542572,4841286.620032306,1200035825933.9634,Retail,NASDAQ,US,$,2023-07-30 09:00:00
crypto,BNB,BNB Coin,05-22-2023,23695.75 USD,21600.31155047691,24830.530864522036,21538.452922885263,7852110.241940935,300240540605.6941,crypto,COINBASE,Global,$,2023-05-22 01:00:00
crypto,ADA,ADA Coin,2024-04-23,27228.671816685142,29748.785323923814,29861.243230059532,26365.088280055323,2254587.2987996517,396574521117.8671,blockchain,BINANCE,US,$,2024-04-23 07:00:00
stock,GOOGL,GOOGL Inc,03-22-2023,7048.739415144877,7221.31178719641,7503.42022352152,6900.116180473107,1470480.1331725086,595540921561.4674,Automotive,NYSE,US,$,2023-03-22 21:00:00
crypto,ADA,ADA Coin,03/07/2024,31801.375811114787,31090.078929509575,32873.2893548148,29939.598298975707,3452576.8927336107,325393889123.721,Crypto,BINANCE,US,$,2024-07-03 13:00:00
crypto,BNB,BNB Coin,28/07/2024,14532.320238514305,14445.09221890605,15179.111041820017,14233.992616455904,622970.0584208628,367406908037.1361,crypto,BINANCE,Global,USD,2024-07-28 16:00:00
crypto,BNB,BNB Coin,2024-04-16,402.0 USD,412.52726401941425,421.76113868735223,384.59999859429035,9579383.276446648,63184702490.19328,blockchain,BINANCE,Global,$,2024-04-16 06:00:00
crypto,BTC,BTC Coin,2023-08-16,12102.24577270333,12103.70668599445,12515.002944257634,11543.266771739902,2747763.446663872,214215590958.51987,Blockchain,N/A,Global,usd,2023-08-16 07:00:00
stock,AAPL,AAPL Inc,04-08-2024,22988.646871429035,23202.7959655212,23704.923035015145,21889.674541812383,1658332.0484217391,2422826817743.141,RETAIL,,US,$,2024-04-08 18:00:00
stock,TSLA,TSLA Inc,11-19-2023,10467.181415742312,9525.09118616077,10908.713119990338,9516.134042426127,7931635.597093398,1342169499838.254,RETAIL,NYSE,US,USDT,2023-11-19 02:00:00
stock,GOOGL,GOOGL Inc,16/07/2024,12106.436744549099,13221.747012925804,13351.932105157077,12077.036148122837,9948198.120365545,2562816915896.9546,Technology,NYSE,Global,USD,2024-07-16 05:00:00
stock,MSFT,MSFT Inc,2024-05-06,49057.375152273176,49739.66296311913,50385.13900412042,47676.399949814426,5936015.792852481,2138051189180.6858,Retail,NYSE,US,USDT,2024-05-06 09:00:00
crypto,BTC,BTC Coin,06-18-2024,31120.93979821613,34115.88109623919,34440.16559501454,30798.20805322387,9079080.039002415,33867217000.67092,crypto,BINANCE,US,USD,2024-06-18 20:00:00
stock,AMZN,AMZN Inc,2023-07-31,48007.178864228306,48213.222207121,50569.18037375955,47424.63624949734,1617552.690933382,2831667762532.4604,tech,NYSE,Global,usd,2023-07-31 18:00:00
crypto,BNB,BNB Coin,03-31-2024,35919.37545684648,34104.29984506596,37069.900321908935,33535.78198352618,1627834.7383418502,193375542054.84814,blockchain,COINBASE,Global,$,2024-03-31 21:00:00
stock,AMZN,AMZN Inc,30/01/2024,38583.6292798206,38575.107425791444,38606.97838836158,36663.78505028679,3570936.410356152,1699605084233.7412,Automotive,NASDAQ,US,USD,2024-01-30 01:00:00
crypto,BTC,BTC Coin,2023-05-29,11441.552212384402,11749.018044719198,11879.476715322826,11053.494800857527,8480572.853925237,370846657030.5539,Blockchain,BINANCE,Global,USDT,2023-05-29 23:00:00
crypto,BNB,BNB Coin,2024-03-07,4779.009872887399,4710.863123762849,4785.980002309925,4588.590350485358,6624677.682998979,292900269696.629,Crypto,BINANCE,Global,usd,2024-03-07 01:00:00
crypto,BTC,BTC Coin,01-13-2023,14451.358096069192,14156.078194234962,15115.781701956694,14151.304067780391,450068.07865716296,51808536321.26987,Blockchain,BINANCE,Global,$,2023-01-13 04:00:00
crypto,BNB,BNB Coin,15/07/2023,18592.486079453138,18192.592144355633,19293.66913031182,18118.390411868706,9509335.016430981,305598129780.6799,Blockchain,COINBASE,US,usd,2023-07-15 10:00:00
crypto,BNB,BNB Coin,2024-03-04,17862.49 USD,18889.755100854927,19126.822833844963,17473.15065916022,3586426.036787207,232963421485.13672,blockchain,COINBASE,US,$,2024-03-04 12:00:00
stock,MSFT,MSFT Inc,12-27-2023,12027.54165554641,11285.665917138662,12579.749598783395,10778.828739026867,5060073.119441582,1973326910386.5496,Retail,NYSE,Global,USDT,2023-12-27 20:00:00
crypto,ETH,ETH Coin,2023-10-03,1956.1088666501157,1774.5893259503277,1973.2465097524334,1762.767930610638,2825504.9610262895,92236849270.38852,Crypto,BINANCE,Global,USD,2023-10-03 19:00:00
crypto,ETH,ETH Coin,2023-06-28,29085.298426529786,28716.579385213223,29928.901270042734,28022.64092583064,7588003.761319494,380431372377.2418,crypto,COINBASE,US,$,2023-06-28 11:00:00
crypto,,ADA Coin,10/05/2023,17658.989076099115,19050.85047277663,19952.390548327327,17564.12342174246,4195060.491579179,116585946059.27664,Crypto,BINANCE,Global,$,2023-05-10 12:00:00
crypto,ETH,ETH Coin,22/04/2024,23822.023307721927,23810.30216781873,24065.818024151413,23323.536616484773,1862172.841635726,313244373687.71826,blockchain,COINBASE,Global,usd,2024-04-22 17:00:00
stock,GOOGL,GOOGL Inc,2023-12-01,42752.959778980556,40248.28454956081,42905.071144178604,38374.74218326081,9407904.420510575,1001378450210.9094,Technology,NYSE,Global,USD,2023-12-01 20:00:00
crypto,BNB,BNB Coin,2023-08-13,20476.509470132747,21749.65111174676,22658.597227857048,19792.78963840035,6936486.9566804785,205233572994.92468,crypto,COINBASE,US,USDT,2023-08-13 23:00:00
crypto,BTC,BTC Coin,08-20-2024,32735.987836429067,30454.911957729884,34169.63273483649,29753.070216866738,2825441.791273667,309593512261.4952,Crypto,COINBASE,US,USDT,2024-08-20 01:00:00
crypto,ADA,ADA Coin,27/07/2023,1888.17880904138,1747.6480050268572,1960.4532666241066,1660.2666214483645,4166241.7189944396,172965133247.8891,Blockchain,BINANCE,US,USD,2023-07-27 04:00:00
crypto,ADA,ADA Coin,02/04/2024,2741.174655848605,3000.5326299636404,3034.4574517074393,2645.8090140866034,3040121.180038018,211391521528.80743,blockchain,BINANCE,US,USDT,2024-04-02 13:00:00
crypto,ETH,ETH Coin,17/07/2023,83.67636609470769,87.5145138851122,91.74516458095933,80.43095097097313,6630808.8708424205,96014581536.35321,crypto,N/A,Global,$,2023-07-17 02:00:00
crypto,ADA,ADA Coin,18/08/2024,42422.78 USD,41766.3277172924,43065.34333019447,40357.3304900501,7126500.70965203,298049049148.69244,Crypto,BINANCE,US,usd,2024-08-18 14:00:00
stock,TSLA,TSLA Inc,2024-01-09,9088.882248152568,8854.281852168697,9498.763660308996,8768.702349145022,9848599.169221995,2452170604851.8516,tech,NYSE,Global,$,2024-01-09 06:00:00
crypto,,ETH Coin,2023-02-12,19665.828099385835,20022.32171191368,20684.073714648708,18759.68162427102,5445425.094079547,302928062574.4219,crypto,COINBASE,Global,USD,2023-02-12 19:00:00
stock,GOOGL,GOOGL Inc,10-08-2023,8374.391987013008,8844.415988155066,9102.572453826504,8354.386312262615,425180.55977071007,2130869277133.1025,Automotive,NASDAQ,Global,usd,2023-10-08 23:00:00
stock,AMZN,AMZN Inc,2023-08-06,30081.678426198207,28857.714566194463,31156.232324373035,28509.986727747324,1026057.124700678,803325151290.8462,Automotive,NYSE,US,$,2023-08-06 08:00:00
crypto,SOL,SOL Coin,2023-09-03,25449.438873996885,24784.09266438578,26636.559587196825,24570.33769677163,6972396.609714458,207972513361.67325,blockchain,BINANCE,US,usd,2023-09-03 10:00:00
crypto,ETH,ETH Coin,03-13-2024,23091.190029217825,25035.442926797943,25904.918135608663,22778.282538876705,8617047.346969666,287159021115.32404,Blockchain,COINBASE,Global,USD,2024-03-13 04:00:00
stock,AAPL,AAPL Inc,2024-01-03,40355.47448429648,37895.73247004871,41052.29640140526,36636.856046004345,9785276.158423016,829474052133.1511,automotive,NASDAQ,US,USDT,2024-01-03 01:00:00
crypto,SOL,SOL Coin,07/12/2023,35061.48138089709,36653.67066485405,37683.77221963936,34968.727401394564,4963091.2700707335,343332203380.4311,Blockchain,COINBASE,Global,USD,2023-12-07 20:00:00
stock,AMZN,AMZN Inc,02-29-2024,8160.136493210234,8627.231930725933,8944.042837832456,7908.949147360224,252908.9461783344,1147747952510.9846,AI,NYSE,Global,usd,2024-02-29 08:00:00
stock,,MSFT Inc,01-11-2023,580.7849928691409,604.4461478810017,633.7695565024052,564.4550997930664,2350499.0765545317,2518602009876.852,Technology,NASDAQ,US,$,2023-01-11 18:00:00
stock,GOOGL,GOOGL Inc,24/03/2024,40858.2358193591,41237.64798005432,43231.56099331971,38920.87866909043,5048451.187446977,2117564320029.7114,automotive,NYSE,Global,USD,2024-03-24 09:00:00
stock,AMZN,AMZN Inc,09-18-2023,43133.39715274746,40366.4381375282,44858.74054787214,39463.65702966013,3966140.266217642,2158177302494.4248,AI,NYSE,Global,USD,2023-09-18 04:00:00
crypto,BTC,BTC Coin,30/08/2023,43266.13498785653,40300.442260086245,43936.30115456353,38869.86830776434,8714268.927874353,57027436288.74196,Blockchain,COINBASE,US,usd,2023-08-30 10:00:00
crypto,SOL,SOL Coin,03-09-2023,39836.103045596705,37848.02574621945,41080.73049672015,37037.59729342459,8328470.937505922,270717682712.5147,Crypto,BINANCE,US,$,2023-03-09 22:00:00
crypto,ADA,ADA Coin,17/09/2023,617.7170061545665,639.216018837018,640.8727324943454,603.783122416517,2877039.657707738,362904388890.0979,blockchain,BINANCE,Global,usd,2023-09-17 10:00:00
crypto,ETH,ETH Coin,2023-03-14,17654.395587583305,18082.66456304503,18384.690236869283,17418.443752492516,4045869.3283531233,126176756811.24577,Blockchain,COINBASE,Global,USDT,2023-03-14 22:00:00
stock,AMZN,AMZN Inc,01-02-2023,39190.15452578052,37510.921652765726,40038.16457003727,36920.95716017265,3325229.1153299715,214376068926.77628,Finance,NASDAQ,US,USDT,2023-01-02 04:00:00
crypto,ADA,ADA Coin,08/09/2023,18702.31314017055,20364.75645382132,21018.19468927257,18395.108148435484,6323189.254222761,27351334177.95267,Crypto,BINANCE,US,usd,2023-09-08 16:00:00
stock,GOOGL,GOOGL Inc,23/03/2023,20922.509866472985,21972.56794790244,22083.93909188057,20167.05324560753,2763914.7655500704,604986495488.7161,ai,NASDAQ,US,usd,2023-03-23 07:00:00
stock,AAPL,AAPL Inc,19/04/2023,49018.63335969983,44778.54654107791,50289.93405304254,42941.20370208948,9706794.777552031,1301736593507.573,RETAIL,NYSE,Global,usd,2023-04-19 12:00:00
crypto,ETH,ETH Coin,05-11-2023,20186.014108055948,21146.404040049158,21891.343670212864,19603.373714064157,3465895.1553592295,49754884367.34836,Crypto,BINANCE,US,usd,2023-05-11 00:00:00
stock,AAPL,AAPL Inc,09-05-2023,13221.170395300378,12442.001709852415,13540.4879027564,11986.956496967106,2875329.1873076037,1198861011873.083,RETAIL,NASDAQ,Global,$,2023-09-05 17:00:00
crypto,BNB,BNB Coin,2023-07-21,48427.18121167761,49430.95271002958,49621.21112983616,46188.83721933095,9514280.785234815,264418645072.45004,Blockchain,COINBASE,US,USDT,2023-07-21 23:00:00
crypto,ADA,ADA Coin,2023-05-21,4612.43 USD,4703.795852231181,4850.471679059721,4531.366312638448,2674752.8765475554,122429862171.39679,Blockchain,BINANCE,US,USDT,2023-05-21 11:00:00
stock,GOOGL,GOOGL Inc,07-20-2023,48251.11831902905,45847.18049373873,49882.06953960892,45174.670828381604,6100464.163377778,55180945801.28035,ai,NASDAQ,Global,$,2023-07-20 19:00:00
crypto,SOL,SOL Coin,2024-05-08,13562.101725665647,13827.019162742672,14425.795208878504,13525.981596321257,1059952.1382331725,128598420714.39105,Crypto,BINANCE,US,usd,2024-05-08 09:00:00
crypto,BNB,BNB Coin,04-08-2023,47237.36557656615,49472.02578708359,51656.2004506743,45354.08888855753,5876271.125222909,66157301976.09934,Blockchain,BINANCE,Global,usd,2023-04-08 20:00:00
stock,TSLA,TSLA Inc,08/05/2023,34008.79315349416,33384.06312413163,34034.97123785166,32687.88198177778,2531762.290256908,2106407387308.246,finance,NYSE,Global,$,2023-05-08 06:00:00
crypto,ADA,ADA Coin,06-07-2023,47879.47494404003,46912.64774820563,49889.93794325273,45009.26231198275,6724932.519752263,182850427226.44168,crypto,COINBASE,Global,USDT,2023-06-07 23:00:00
stock,TSLA,TSLA Inc,11-18-2023,5103.636112638111,4601.764892895451,5214.278552553025,4392.988683055341,7484095.112412637,2931250793772.441,RETAIL,,US,$,2023-11-18 15:00:00
stock,MSFT,MSFT Inc,07/01/2024,21706.708425710854,20659.19321966077,22178.181734952734,20373.525971342988,91532.56164212941,2744500504907.1914,automotive,,US,USDT,2024-01-07 14:00:00
crypto,BNB,BNB Coin,05-17-2024,30668.45 USD,31512.988387179998,31894.330336973926,30229.973320754336,914823.4718314323,237834325846.45538,Blockchain,BINANCE,US,USD,2024-05-17 22:00:00
stock,TSLA,TSLA Inc,06-16-2023,43874.72763225755,45969.510275786044,46001.104095104594,42225.86328934685,2144850.4234486525,605818306035.7344,automotive,NASDAQ,US,USDT,2023-06-16 20:00:00
crypto,BTC,BTC Coin,07-21-2023,12385.512916291522,11301.845673368545,12669.723601097492,11150.815422287333,6067710.515449647,111968499574.60417,blockchain,COINBASE,Global,usd,2023-07-21 18:00:00
stock,TSLA,TSLA Inc,02/07/2024,4066.6474350265953,4433.858142722349,4619.745834976904,4027.015987209022,8230015.066612633,2021886289108.2585,ai,NASDAQ,US,$,2024-07-02 16:00:00
crypto,ADA,ADA Coin,08-17-2024,27217.255766023747,25585.755570549078,28056.613626384424,25256.827007765238,7379436.0161469,373420650712.44073,crypto,BINANCE,US,usd,2024-08-17 08:00:00
crypto,ETH,ETH Coin,04-15-2023,3432.2513794855668,3343.7768205113603,3590.266502589697,3274.301315346793,5383781.100613879,210972364545.91763,Blockchain,COINBASE,US,usd,2023-04-15 03:00:00
crypto,BTC,BTC Coin,02-15-2024,18428.76150662978,19885.909264546295,20548.570449110877,18232.851817769944,4543999.885253483,111197138180.96645,Blockchain,COINBASE,Global,usd,2024-02-15 05:00:00
crypto,ADA,ADA Coin,2023-01-03,12426.696601072945,12937.336481340431,13213.937598039933,12080.330713257721,6493573.923444239,253947651685.18237,crypto,COINBASE,Global,USD,2023-01-03 18:00:00
stock,GOOGL,GOOGL Inc,2023-02-28,3209.68 USD,3418.1414642676195,3468.111805925192,3120.435312691342,220111.37442131454,2809479058192.091,Artificial Intelligence,NYSE,Global,USD,2023-02-28 20:00:00
crypto,,BNB Coin,11-19-2023,25136.53581908022,22905.296633256065,25753.758088692084,22821.818999885603,1054826.7878599444,123913200744.55365,Blockchain,COINBASE,US,USDT,2023-11-19 17:00:00
crypto,,SOL Coin,01-03-2023,20489.455958265873,21125.340956191263,21400.220299277124,19628.378644803845,1605465.680097993,306954087589.8242,crypto,COINBASE,Global,USDT,2023-01-03 15:00:00
crypto,BTC,BTC Coin,24/03/2024,9290.47877801314,9595.614120248814,10018.632264483635,9204.135709343487,6851657.964434966,32844318529.042137,Blockchain,BINANCE,US,usd,2024-03-24 05:00:00
crypto,BNB,BNB Coin,02/03/2023,14466.480440334532,13916.19541672781,14647.28030413388,13578.731615953488,5356002.594981846,48620586047.38555,blockchain,,US,USD,2023-03-02 11:00:00
crypto,BTC,BTC Coin,06-25-2023,17695.920045234438,18858.73876342648,19602.992145141572,17083.46056435666,9137970.65028872,145969960192.58853,blockchain,COINBASE,Global,USD,2023-06-25 05:00:00
crypto,ETH,ETH Coin,2023-07-31,16343.859676081742,15868.008034228798,16757.06035862989,15821.293263240572,8763318.011989973,381361931715.98987,blockchain,COINBASE,Global,$,2023-07-31 11:00:00
crypto,ADA,ADA Coin,10-29-2023,19642.609856138097,19852.279747700635,20351.69607746291,18850.87819378111,8588308.894910378,45514345220.517975,Blockchain,COINBASE,US,USDT,2023-10-29 21:00:00
stock,AAPL,AAPL Inc,2024-03-08,41897.03965884166,44903.271906857786,46583.45322586986,40722.26887485673,6105857.00339923,2034052941160.5437,Technology,NASDAQ,Global,USD,2024-03-08 04:00:00
crypto,BNB,BNB Coin,2023-05-07,33685.534419570635,31524.629320818698,34854.33756039948,30310.297700303294,1176395.4502020495,68344335417.298546,blockchain,COINBASE,Global,usd,2023-05-07 16:00:00
stock,GOOGL,GOOGL Inc,07/08/2024,109.5868396013227,114.38103628455659,118.56967583291627,106.92899354237237,1614466.6477527816,504200625527.4427,AI,NYSE,US,USDT,2024-08-07 01:00:00
crypto,BNB,BNB Coin,08-07-2024,966.2570321999776,901.662397293374,1009.2968034675645,867.4685118148757,3543359.000844939,38003963316.72245,Crypto,BINANCE,Global,USD,2024-08-07 11:00:00
crypto,BNB,BNB Coin,2024-04-25,11125.841624361032,11168.619530320408,11508.007454621744,10706.037092622168,578263.8600919469,46611466370.12661,Blockchain,BINANCE,Global,USD,2024-04-25 13:00:00
stock,GOOGL,GOOGL Inc,06/07/2023,11717.826512607444,11060.582817860532,12280.201802512514,10848.385805230962,5569227.553277787,1179188278690.9219,AI,NYSE,Global,USD,2023-07-06 16:00:00
stock,GOOGL,GOOGL Inc,07-28-2023,21452.927228172914,21628.43364229421,22381.56793569402,21133.43532201099,1717767.3831467903,1253167559534.7324,Technology,NASDAQ,US,USDT,2023-07-28 14:00:00
crypto,ETH,ETH Coin,2023-12-27,20603.785170754756,22130.636773351933,22829.321913217213,20122.17588156643,1154831.0271469948,202544537070.26767,Blockchain,BINANCE,US,USD,2023-12-27 13:00:00
crypto,ETH,ETH Coin,03-06-2023,5869.0232449548685,5677.935566528788,5910.940385547386,5590.5162669571955,2063314.8862476898,244226966282.74753,crypto,COINBASE,US,USD,2023-03-06 15:00:00
crypto,SOL,SOL Coin,18/05/2023,44784.78213316275,42136.356863198205,45921.87909093829,40912.868036914166,182222.2864162516,159784452409.27026,blockchain,COINBASE,US,usd,2023-05-18 08:00:00
stock,AAPL,AAPL Inc,07-26-2023,3461.60485666684,3443.7810677826474,3558.6471921062575,3379.8001710826675,6886627.661449448,2380346759582.7104,automotive,NYSE,US,$,2023-07-26 14:00:00
crypto,ETH,ETH Coin,08/06/2023,508.83904515588415,531.5784171156456,545.8155914755823,504.6695595849853,8214062.240644042,105042591491.47246,Crypto,COINBASE,Global,USDT,2023-06-08 11:00:00
stock,TSLA,TSLA Inc,2024-03-02,24259.88 USD,23452.650953604727,25220.03748400013,22809.220571439077,1835238.5218379416,2531545241685.7705,Retail,NYSE,US,$,2024-03-02 14:00:00
crypto,BNB,BNB Coin,03-17-2024,44129.16823984964,43831.82375198325,44296.196539957855,42490.18880536707,8035573.056966571,342714737726.78235,Blockchain,BINANCE,US,USDT,2024-03-17 16:00:00
stock,GOOGL,GOOGL Inc,14/03/2023,10181.6 USD,9299.821895461877,10628.244071306086,9015.90062957462,5418067.881711365,2706304345353.2236,Automotive,,Global,usd,2023-03-14 22:00:00
stock,GOOGL,GOOGL Inc,31/01/2023,3337.57 USD,3436.5751170595677,3449.308559622566,3233.3499166401452,8038341.637389274,2904516778031.769,Technology,NYSE,US,USDT,2023-01-31 12:00:00
stock,GOOGL,GOOGL Inc,2024-03-27,49859.14587160849,50448.07497225359,51258.175589975035,47914.916713341976,3505854.822327332,1306081975939.347,AI,NYSE,US,usd,2024-03-27 23:00:00
stock,AMZN,AMZN Inc,2023-09-20,3444.996749420809,3355.1334576177346,3524.9617589936865,3308.6208654178404,6567638.117731358,1123874488541.057,RETAIL,NASDAQ,US,USDT,2023-09-20 19:00:00
crypto,ADA,ADA Coin,28/01/2024,428.1004570240864,403.92711396961215,442.26382433756817,393.5055797051726,54129.44320779111,284962433815.5159,Crypto,BINANCE,Global,$,2024-01-28 05:00:00
crypto,ADA,ADA Coin,04/12/2023,38642.750568783966,39016.96049644587,39146.62034425963,38191.6255336601,5837552.163725908,322775383760.5698,blockchain,,US,$,2023-12-04 06:00:00
stock,AMZN,AMZN Inc,2024-03-18,37589.83214986806,39867.79155505953,40900.38343582248,35974.07929664492,6711903.576323507,2348060331702.298,ai,NASDAQ,US,USD,2024-03-18 14:00:00
stock,MSFT,MSFT Inc,2023-01-26,37115.236828082365,34664.74789970732,37477.064364077465,34474.80157681736,7500028.006722256,1865216617305.392,Retail,NYSE,US,usd,2023-01-26 17:00:00
stock,MSFT,MSFT Inc,18/05/2023,37938.178904984394,38675.35798103011,39940.29886961331,37727.86467212785,5788488.738364893,2725603181213.9653,Technology,NASDAQ,US,USDT,2023-05-18 04:00:00
crypto,BTC,BTC Coin,2023-11-14,7832.271033019993,7791.419818567763,8112.821850426424,7507.400243107292,2023339.5510648247,254794573109.713,Blockchain,COINBASE,Global,$,2023-11-14 03:00:00
crypto,BNB,BNB Coin,25/08/2023,12082.616393361744,11393.696144304882,12339.28188130032,11341.193145853953,5071089.407740444,128961589248.64415,Blockchain,BINANCE,Global,USD,2023-08-25 16:00:00
stock,AAPL,AAPL Inc,08/06/2024,3857.813752349895,4009.1605272141014,4085.895612026336,3823.446601124587,6595448.175639061,571881938637.8159,tech,,US,USDT,2024-06-08 01:00:00
crypto,BTC,BTC Coin,13/01/2024,13604.582510528253,14127.97507697981,14314.508133906344,13563.135115587731,6364106.4410522105,319515372963.8406,crypto,BINANCE,US,$,2024-01-13 03:00:00
stock,TSLA,TSLA Inc,2024-05-05,13482.89799599071,12649.456930640401,13951.186655620775,12155.315770442176,5953437.356008963,980290282524.2728,finance,NASDAQ,Global,$,2024-05-05 14:00:00
crypto,ADA,ADA Coin,24/09/2023,33101.82755024549,35186.843666819506,36555.656296788016,32706.014650125493,1878036.3345168284,109530835635.51614,Blockchain,COINBASE,Global,USDT,2023-09-24 03:00:00
stock,AMZN,AMZN Inc,04/02/2023,34950.451936084406,34030.187060777986,35705.98673636729,32381.67818046572,2596504.916301217,274270991483.71094,finance,NASDAQ,US,$,2023-02-04 01:00:00
stock,MSFT,MSFT Inc,22/02/2023,43960.496772336366,41704.41491650785,45185.53771454223,39700.47465878322,6668807.065665275,110692447584.64743,ai,N/A,Global,$,2023-02-22 18:00:00
crypto,ADA,ADA Coin,06/06/2024,44896.98015601371,48382.0470813656,49168.95838200083,44674.65232097099,9961580.57731429,132595801572.86708,crypto,COINBASE,Global,USDT,2024-06-06 12:00:00
stock,MSFT,MSFT Inc,15/01/2024,42245.1186742839,40124.4875284279,43463.26173825841,38253.193606066336,950084.4502798754,2477992835730.6045,Technology,NASDAQ,Global,USDT,2024-01-15 01:00:00
crypto,ETH,ETH Coin,03/09/2023,16338.696078801288,17149.6963809241,17841.3994179497,16222.710347537528,9976285.345724164,399562581753.1498,crypto,,US,usd,2023-09-03 20:00:00
crypto,ETH,ETH Coin,04-28-2023,2027.1378347163884,1991.1324279330076,2040.322407085164,1893.808452293147,3604907.8445877195,100391111676.4628,blockchain,,Global,USD,2023-04-28 00:00:00
crypto,SOL,SOL Coin,09-29-2023,28313.372754341293,27253.195438480387,29239.704209858224,26206.697507218196,144800.07927477817,314576609174.7184,crypto,BINANCE,US,usd,2023-09-29 10:00:00
stock,GOOGL,GOOGL Inc,05/09/2023,31190.916812351814,32827.20868044602,32891.12000041646,30936.897405416865,6195642.474162997,2295416625444.918,tech,NYSE,US,USDT,2023-09-05 08:00:00
stock,AAPL,AAPL Inc,2023-10-20,31234.456265245433,33511.0311274277,34494.473504483656,30580.01691362791,9906800.891500592,1694552098630.794,ai,NYSE,US,USDT,2023-10-20 04:00:00
stock,AAPL,AAPL Inc,08-22-2024,22120.267334502252,23037.802751522682,23486.15349310856,21267.39328859928,5968921.917000706,2272623199535.018,Artificial Intelligence,NYSE,US,USD,2024-08-22 01:00:00
stock,AMZN,AMZN Inc,01-08-2024,46457.684605572984,44988.7416600568,47683.418270532755,43215.36621539164,9956315.463879336,2785264473360.715,automotive,NASDAQ,Global,USDT,2024-01-08 05:00:00
stock,MSFT,MSFT Inc,11/02/2023,32478.951396075292,34456.36128578462,35688.34876142032,31818.2616745898,534426.6218919881,2943542544525.128,Retail,NASDAQ,US,USDT,2023-02-11 17:00:00
stock,TSLA,TSLA Inc,06-13-2024,33742.56724534885,34940.64172927796,35592.49891584729,33644.194142292145,1674402.9653355733,1369745384232.4565,Automotive,NYSE,Global,USDT,2024-06-13 00:00:00
stock,AAPL,AAPL Inc,20/03/2023,34547.28998777563,35909.391558399264,37074.00307233141,33295.44857540375,1562909.480297533,1506074744184.5261,automotive,NYSE,Global,USDT,2023-03-20 10:00:00
crypto,SOL,SOL Coin,20/12/2023,29969.112785810492,28047.229607463694,31025.732514975203,27283.18379524253,6677938.155439926,256196429096.55078,Crypto,BINANCE,Global,USD,2023-12-20 13:00:00
crypto,BTC,BTC Coin,2024-06-25,8494.724144560389,7677.777804587779,8825.637222147676,7527.944982275943,6996696.056651595,335759996509.20953,Blockchain,COINBASE,US,USD,2024-06-25 13:00:00
crypto,BNB,BNB Coin,15/09/2023,40142.52 USD,43843.01774905633,45017.8683077791,39115.86495206498,4019470.11170741,336071215120.5138,Blockchain,COINBASE,Global,usd,2023-09-15 07:00:00
stock,AAPL,AAPL Inc,07/05/2023,28634.6355717723,27357.602551173295,29953.70081486004,26787.457535360227,5928808.964900593,469536218104.1716,automotive,NASDAQ,US,usd,2023-05-07 05:00:00
stock,MSFT,MSFT Inc,2023-07-09,2608.9477053655974,2364.616499594942,2664.1706680125526,2256.383909032356,6068862.708445851,1071224736022.26,Finance,NASDAQ,US,$,2023-07-09 18:00:00
stock,GOOGL,GOOGL Inc,2023-12-01,44146.91167777092,45551.18441254342,46032.27741800456,43844.49833849219,8861048.259696769,2644109286862.5757,ai,NASDAQ,US,usd,2023-12-01 04:00:00
stock,AMZN,AMZN Inc,2023-07-05,36873.93002767616,35299.55738464856,38353.75516343086,35294.682339105806,301230.02728859877,597994219009.3466,Automotive,NYSE,US,USD,2023-07-05 23:00:00
crypto,ETH,ETH Coin,2024-08-10,31135.300374596914,34083.08238255894,34875.5302672853,30897.719243474457,624878.291914174,359459516987.4181,blockchain,COINBASE,Global,usd,2024-08-10 19:00:00
crypto,ADA,ADA Coin,2023-10-25,3360.1567221829864,3679.6022072436317,3829.9091568665267,3335.383533497808,9379714.349107508,137435224780.92682,Crypto,COINBASE,Global,$,2023-10-25 08:00:00
stock,AAPL,AAPL Inc,02-13-2024,19286.023649741535,17631.41739477926,19489.291686826346,16952.04871259175,4691603.003264739,264459423498.1582,AI,NYSE,Global,USDT,2024-02-13 12:00:00
crypto,BNB,BNB Coin,2023-05-23,5057.895559819877,4721.536491005586,5095.140780767882,4715.180546949996,7593165.776677818,111082056144.18883,Blockchain,COINBASE,US,USD,2023-05-23 19:00:00
crypto,ADA,ADA Coin,18/03/2023,21992.626920530347,21017.775061205575,22870.455143501298,20309.742881256585,2994534.3536797776,387265778781.477,Blockchain,COINBASE,Global,usd,2023-03-18 05:00:00
stock,MSFT,MSFT Inc,23/02/2024,6492.652121429525,6176.411996722336,6608.000497365265,6075.7346925318525,626585.8573522964,705192916701.4153,Technology,NYSE,US,USD,2024-02-23 23:00:00
stock,AAPL,AAPL Inc,03/04/2023,40453.091778180904,37596.47181215505,41146.14455616209,37342.05446068569,1550098.186123283,639415749599.3754,TECHNOLOGY,NASDAQ,US,USDT,2023-04-03 09:00:00
crypto,BTC,BTC Coin,25/02/2024,24232.05437404974,23274.49814485978,24914.681480198098,23046.18100923613,1372347.733039279,37681050069.18501,crypto,COINBASE,Global,USDT,2024-02-25 13:00:00
stock,AAPL,AAPL Inc,06-13-2023,25280.38 USD,23480.818015255452,26069.12896504388,22628.04215716304,4878855.351121581,1746290262817.312,AI,NYSE,US,USDT,2023-06-13 04:00:00
crypto,ADA,ADA Coin,30/07/2024,22984.61 USD,22094.934793894907,23929.71246809985,21053.13511708246,4186654.141908381,37497568089.43944,Crypto,BINANCE,Global,USDT,2024-07-30 21:00:00
crypto,SOL,SOL Coin,04-01-2023,36253.053754192944,36791.68404479576,38019.07731983766,35848.92154260281,8622167.53360823,186080412531.918,Crypto,COINBASE,Global,USDT,2023-04-01 05:00:00
stock,AAPL,AAPL Inc,01-10-2023,26905.75504114151,28735.927970341207,30157.56779182043,26757.12672344986,3715301.1589811435,948487735200.1868,RETAIL,NYSE,Global,USD,2023-01-10 08:00:00
crypto,ADA,ADA Coin,2023-06-25,24474.73294495537,25657.554945379055,26289.460845241407,23842.28242739335,8382465.980396924,82090774301.36691,Crypto,COINBASE,US,USD,2023-06-25 23:00:00
stock,GOOGL,GOOGL Inc,05/11/2023,42991.13579383417,42189.822302310604,43696.69149474664,41038.01887122293,7624707.13979001,1090597299410.8872,Finance,NASDAQ,US,USDT,2023-11-05 10:00:00
stock,TSLA,TSLA Inc,19/10/2023,9828.99660144215,10716.446532878384,10810.47886496839,9616.556265294552,5793565.352152716,386746063313.3429,Automotive,NYSE,Global,USDT,2023-10-19 12:00:00
stock,AMZN,AMZN Inc,04-16-2024,32240.814976355163,30498.69366733215,33131.72907234531,29541.29888911299,6617010.9290322615,1473977141530.232,Retail,NYSE,Global,$,2024-04-16 14:00:00
stock,MSFT,MSFT Inc,2024-04-27,28548.16 USD,26751.171487393483,28945.89943404931,25706.150081745298,1829194.9609083023,432258394685.7169,automotive,NYSE,Global,usd,2024-04-27 03:00:00
crypto,SOL,SOL Coin,05-31-2023,14292.521307367908,15513.456458004152,16265.802103924445,13986.132863931161,1430868.2255345983,331155825866.46344,blockchain,COINBASE,Global,USD,2023-05-31 03:00:00
stock,AAPL,AAPL Inc,14/07/2023,39888.63584477722,38830.71525824846,40062.185751432495,37970.19731215312,8451363.394108852,1129899247704.948,AI,NYSE,US,usd,2023-07-14 00:00:00
stock,AAPL,AAPL Inc,2023-09-28,8764.405775116358,9067.241611974834,9167.20988362691,8421.808455160688,8740843.661278546,2389819897559.0723,RETAIL,NYSE,Global,usd,2023-09-28 08:00:00
stock,GOOGL,GOOGL Inc,01-09-2023,13169.734852435378,11854.482363808109,13743.058868618333,11731.548307359377,6273662.02197169,756510168693.2882,Artificial Intelligence,NYSE,Global,$,2023-01-09 00:00:00
stock,TSLA,TSLA Inc,10-21-2023,7610.907885550345,7547.4688290313825,7744.562805786894,7205.484158020797,4861818.721664025,2253294634177.138,Artificial Intelligence,NYSE,Global,usd,2023-10-21 21:00:00
crypto,SOL,SOL Coin,11/03/2024,2012.555361344217,1928.6160700246392,2033.4397425371767,1855.14993968752,9084437.084241873,368692161885.341,crypto,COINBASE,Global,usd,2024-03-11 12:00:00
stock,AAPL,AAPL Inc,09/06/2023,23320.307652861542,24535.64848264139,24725.176803180064,22722.45116852815,4300422.155996476,1409526472160.5276,Technology,,US,usd,2023-06-09 04:00:00
stock,MSFT,MSFT Inc,04-14-2023,49977.88958548942,52671.18700096238,53718.989943207394,49546.96285984931,1707912.9247614893,1794762964734.502,finance,NASDAQ,US,USD,2023-04-14 21:00:00
crypto,BTC,BTC Coin,09-12-2023,10230.37413948901,9903.844241631015,10491.54574835076,9713.259189369885,9106146.566427004,17033156092.03925,crypto,COINBASE,US,$,2023-09-12 05:00:00
crypto,ADA,ADA Coin,2023-02-26,25068.77 USD,22813.798613551084,25112.528958117593,22301.81130162416,4382347.953870197,206392333772.4308,blockchain,COINBASE,Global,USD,2023-02-26 03:00:00
stock,TSLA,TSLA Inc,03-16-2024,8042.372439745141,7278.301477207585,8222.939290324059,7000.80842986796,497094.1190150356,2519149380991.093,Automotive,NYSE,US,$,2024-03-16 08:00:00
crypto,ETH,ETH Coin,02-27-2023,5588.534067862801,5709.603511064261,5789.837643081091,5357.586793872095,3798135.477670255,291216323304.8134,blockchain,BINANCE,Global,usd,2023-02-27 22:00:00
crypto,BNB,BNB Coin,2023-03-06,19610.75790945959,20594.314485803214,20723.52969880024,19387.951675506672,2370096.31574158,321571081608.0667,crypto,BINANCE,US,USDT,2023-03-06 09:00:00
crypto,BNB,BNB Coin,10-08-2023,28293.419926501407,30721.814265163404,31316.77678806105,26972.350903786788,192535.70002697778,272570286306.10477,blockchain,BINANCE,Global,$,2023-10-08 02:00:00
crypto,BNB,BNB Coin,2023-11-27,26241.534526694995,27686.099784593847,28010.61631229295,25382.234151484583,302008.61824097804,331609131584.2375,blockchain,BINANCE,US,$,2023-11-27 05:00:00
crypto,ETH,ETH Coin,2023-10-31,33396.716655973665,36290.242169938414,36771.9886159809,32747.924671652076,6785321.182958085,384789468206.7743,blockchain,COINBASE,Global,$,2023-10-31 10:00:00
stock,TSLA,TSLA Inc,2024-06-19,42406.98065843135,46199.534160112686,48243.52887195004,41853.711573207096,2775369.332569815,959473603770.1895,Retail,NYSE,US,USDT,2024-06-19 17:00:00
stock,TSLA,TSLA Inc,04-21-2024,48168.382419097434,43450.621683831305,49892.93086621304,42812.43234088206,6227272.719957025,852031965895.8389,ai,NYSE,Global,USD,2024-04-21 05:00:00
crypto,ADA,ADA Coin,10/12/2023,15600.852993828625,15101.537908261042,15662.429094868115,14680.80765508412,2611224.213822246,396092994204.312,blockchain,BINANCE,Global,usd,2023-12-10 13:00:00
stock,MSFT,MSFT Inc,11/02/2024,41730.24379487883,45364.818778558154,45786.106136193164,40420.97603160968,9286376.990591826,1036726239511.1562,Automotive,NYSE,Global,usd,2024-02-11 06:00:00
crypto,ETH,ETH Coin,09/02/2024,4627.102800287812,4315.042648662585,4764.8083488655975,4131.755229571055,9680795.738125885,29414341972.24294,crypto,COINBASE,Global,$,2024-02-09 12:00:00
stock,AAPL,AAPL Inc,06/04/2023,25080.882837904817,23810.077722909373,25671.4877835361,23407.58458871093,7512020.192403474,1345676436502.9758,AI,NASDAQ,Global,$,2023-04-06 06:00:00
crypto,BNB,BNB Coin,04-18-2023,28898.776723577477,31235.87729428618,32512.499855178194,28547.726109182648,556999.6112829258,302777892670.41565,Blockchain,BINANCE,US,$,2023-04-18 02:00:00
crypto,ETH,ETH Coin,08-16-2023,10630.239387001693,10977.898376746265,11203.602589032558,10312.611161010587,8845984.295407908,7716795076.761478,crypto,BINANCE,US,usd,2023-08-16 20:00:00
crypto,ETH,ETH Coin,06-15-2024,45459.67145003875,43767.46315178353,47030.429960077076,42173.52475680574,1906907.7209114234,358747325012.0763,blockchain,COINBASE,US,usd,2024-06-15 04:00:00
stock,TSLA,TSLA Inc,2024-05-24,17111.959966971066,16872.247485707256,17822.918414455173,16129.776721442076,7349523.548101547,562051047468.6339,finance,NYSE,US,USD,2024-05-24 22:00:00
crypto,BNB,BNB Coin,2023-04-19,14404.387680372864,14383.701782753797,14620.411773108948,14093.209947727535,4339005.384629587,214924691104.7756,Blockchain,BINANCE,US,USD,2023-04-19 04:00:00
crypto,BTC,BTC Coin,08-13-2023,5837.99 USD,5892.509662395498,6158.383538300998,5646.489542748185,7330268.07211901,69940183986.1571,blockchain,BINANCE,Global,USD,2023-08-13 19:00:00
crypto,SOL,SOL Coin,2023-11-06,46578.43016633095,49568.588546128136,50972.879693466,45779.681116971755,8983966.279373765,265171235201.20795,blockchain,COINBASE,US,$,2023-11-06 22:00:00
stock,MSFT,MSFT Inc,06-28-2023,16346.467345830291,14747.165216370418,17022.026853026877,14600.416691750524,1045440.7264834137,1204561165914.935,AI,NYSE,Global,$,2023-06-28 08:00:00
stock,MSFT,MSFT Inc,01-07-2023,23204.4450913627,21434.91631994373,24342.122170520972,20593.2699230472,673274.5667255209,1734803569586.7737,ai,NYSE,US,usd,2023-01-07 10:00:00
stock,,AMZN Inc,01/04/2023,36945.9451898803,33491.08142677831,38162.792478681105,32707.878883454534,1033546.8237416091,1788593664710.7097,TECHNOLOGY,NASDAQ,US,usd,2023-04-01 19:00:00
stock,MSFT,MSFT Inc,2023-03-18,28403.035122830865,27246.22275165503,29735.585852690263,26999.29054748546,9835688.497930117,525846392069.62256,Finance,NASDAQ,Global,USDT,2023-03-18 00:00:00
crypto,ADA,ADA Coin,08-04-2023,48486.484403570874,47819.63882360177,49328.98263601729,45549.04169215236,528599.8133381666,107569981385.41353,Blockchain,BINANCE,Global,USDT,2023-08-04 15:00:00
stock,GOOGL,GOOGL Inc,2024-05-10,22901.870431757055,21649.237174475315,23604.923851977386,20840.484584425958,5776739.911689881,2079113655280.4976,automotive,NYSE,US,$,2024-05-10 02:00:00
crypto,BNB,BNB Coin,01-19-2024,41179.37580832483,43820.589353225274,44866.47814191129,39842.73261511101,3626235.4057943863,146887455058.1627,blockchain,COINBASE,US,$,2024-01-19 13:00:00
crypto,BTC,BTC Coin,09-08-2023,16415.69 USD,15460.493982671556,16485.203233324508,15048.23459289736,4821838.857099499,323257237638.94604,Blockchain,COINBASE,Global,usd,2023-09-08 16:00:00
crypto,ADA,ADA Coin,2024-08-04,11069.722435338737,10806.243721763938,11517.163792573141,10710.945409313374,3846726.1487117033,337158940609.1483,blockchain,BINANCE,US,usd,2024-08-04 13:00:00
crypto,SOL,SOL Coin,11-02-2023,15171.261683555653,16483.74233415525,16581.526997357156,15121.00644153909,6838980.651901597,186353989198.23895,Blockchain,BINANCE,Global,USDT,2023-11-02 05:00:00
stock,GOOGL,GOOGL Inc,26/07/2023,1642.6264486169487,1634.60918046492,1676.1153396994953,1566.0552089475832,6564439.625403068,1599400736533.3262,Artificial Intelligence,NASDAQ,Global,usd,2023-07-26 14:00:00
crypto,ADA,ADA Coin,25/04/2023,28113.81866511561,29321.32559945252,29421.678499808426,27295.238440999958,1164468.4931597942,388604608410.4729,blockchain,COINBASE,US,$,2023-04-25 23:00:00
crypto,ADA,ADA Coin,2023-10-19,46924.72308912559,48442.99814876924,48629.026645135,45410.61760756911,5507083.131029074,247054355036.9216,blockchain,COINBASE,US,usd,2023-10-19 14:00:00
crypto,SOL,SOL Coin,07-06-2023,41683.86408365386,44307.20476193346,45662.63087630427,40378.02939076478,2554108.401258678,164267063672.6346,blockchain,COINBASE,Global,USD,2023-07-06 01:00:00
crypto,SOL,SOL Coin,2024-01-27,17751.335197492837,17443.074447212777,18351.17316137646,17144.93726552149,702011.2882729282,46820355694.18608,Blockchain,COINBASE,Global,usd,2024-01-27 20:00:00
stock,GOOGL,GOOGL Inc,25/06/2024,9097.125572195922,8472.721989292877,9473.42914931129,8066.842688746123,4192409.5761453114,1191825353139.1619,Finance,NASDAQ,US,USD,2024-06-25 12:00:00
crypto,ETH,ETH Coin,2024-03-26,43967.717481766915,44469.30571630526,44983.77252909902,42873.86065854166,7315132.110671455,71440444027.77469,Crypto,N/A,US,USDT,2024-03-26 08:00:00
crypto,ETH,ETH Coin,04/03/2024,11030.095752228493,11882.020137098887,12437.09115203451,10984.001282391971,6354508.154262236,383456613523.17633,Crypto,COINBASE,Global,USDT,2024-03-04 18:00:00
crypto,ADA,ADA Coin,2024-08-07,20166.4995528593,21184.495908983696,21747.25570689484,19841.252303242098,4285150.580584106,253779158501.70953,Blockchain,BINANCE,US,$,2024-08-07 17:00:00
stock,AAPL,AAPL Inc,03-12-2023,41225.33116505141,38310.17468315057,42942.221333139394,37429.608674672396,8446814.424993154,2197174427488.9858,Automotive,N/A,Global,USD,2023-03-12 19:00:00
stock,AAPL,AAPL Inc,13/01/2024,18958.233864297923,20531.997551287586,20789.84789060071,18810.5609057779,4840721.704521532,1299592101959.6338,RETAIL,NYSE,Global,USDT,2024-01-13 03:00:00
stock,MSFT,MSFT Inc,25/07/2024,15430.329391659307,15655.742434667922,15910.313570956452,14689.10992191465,2720714.054838216,1547145373228.2666,tech,N/A,US,$,2024-07-25 04:00:00
stock,TSLA,TSLA Inc,28/06/2023,48917.95580497226,53474.63609022258,54531.17537679534,48253.578677834485,3458715.178005839,29073339785.70613,ai,NYSE,US,$,2023-06-28 22:00:00
crypto,BNB,BNB Coin,2023-08-04,40273.44785186849,43871.93071649041,44749.834978388695,39837.08098272778,2660018.5778705557,270081797048.96054,Crypto,COINBASE,US,usd,2023-08-04 12:00:00
stock,AMZN,AMZN Inc,02-13-2023,1298.2222422299137,1325.102922092168,1368.79858726334,1277.9729324114733,1204755.400312101,2971093588343.0083,ai,NASDAQ,US,USD,2023-02-13 00:00:00
crypto,SOL,SOL Coin,17/09/2023,9067.35211971364,9289.961785927408,9393.394399212088,8753.26648523239,5465038.958739515,375719264471.88654,Blockchain,BINANCE,US,USDT,2023-09-17 05:00:00
crypto,ETH,ETH Coin,08/03/2023,8019.67779281555,7491.880987629646,8187.347116406088,7400.960635608053,8979748.503831038,169791400333.00772,blockchain,COINBASE,US,usd,2023-03-08 06:00:00
stock,AAPL,AAPL Inc,01/10/2023,19661.26433889446,18089.328810436407,19677.575796282235,17783.364711432354,6024891.970223911,261541710155.5547,Automotive,NYSE,Global,$,2023-10-01 04:00:00
stock,GOOGL,GOOGL Inc,06/11/2023,11698.303526322276,10583.941273302218,12186.676818355665,10570.547611047998,1355459.9084101133,497427150306.50977,Finance,NYSE,Global,$,2023-11-06 12:00:00
stock,TSLA,TSLA Inc,14/12/2023,43421.79 USD,47125.35657689293,48114.11107910289,41360.60842032999,394878.9450945012,702110889158.2413,TECHNOLOGY,NYSE,Global,USD,2023-12-14 07:00:00
stock,AAPL,AAPL Inc,02/04/2024,19650.82649357002,17798.352620802634,20223.896071734704,16918.493316348548,7873932.209534581,1726110099546.3413,Technology,NYSE,Global,USD,2024-04-02 00:00:00
crypto,BNB,BNB Coin,04-20-2024,2022.4975704315127,2058.236000887644,2099.162419826546,2019.848140414939,5442442.426374518,126040964967.83177,crypto,BINANCE,Global,USDT,2024-04-20 22:00:00
crypto,ADA,ADA Coin,05-23-2024,35474.8488430524,33853.59150920722,37078.74354705378,32795.19615970095,5499135.759199276,113719476509.61827,Crypto,COINBASE,US,usd,2024-05-23 04:00:00
stock,GOOGL,GOOGL Inc,19/04/2023,21311.800685232018,22728.453787690687,23644.011369781136,20485.24227178466,2261564.6310346164,161213580434.4443,finance,NYSE,US,$,2023-04-19 12:00:00
crypto,SOL,SOL Coin,18/12/2023,46520.61702426458,42755.80510136261,47567.46730442503,41339.42131539525,8707013.866118936,327835598324.2285,crypto,BINANCE,Global,USD,2023-12-18 02:00:00
crypto,BTC,BTC Coin,10-07-2023,10564.18586847629,11097.610357310079,11126.07231479609,10296.138340485799,4421628.23976252,37992341298.607414,Crypto,COINBASE,Global,USDT,2023-10-07 13:00:00
crypto,BNB,BNB Coin,01-08-2023,19734.670042793,19852.84356358414,20013.02360970181,19312.344036841565,8054517.860670563,137088465700.55573,Crypto,BINANCE,US,$,2023-01-08 14:00:00
crypto,ADA,ADA Coin,02/06/2023,7703.456235641746,7163.057963746809,7806.749710913939,6934.225025260712,4085147.3585034176,305263567267.1128,Crypto,COINBASE,US,usd,2023-06-02 01:00:00
crypto,SOL,SOL Coin,06-07-2023,2843.4548039701117,2578.8273770527494,2899.1738026165863,2539.7792489787416,1935159.9942218692,273480400649.1714,crypto,COINBASE,Global,$,2023-06-07 19:00:00
stock,TSLA,TSLA Inc,2024-04-20,12998.81 USD,14002.54050316004,14629.637239303363,12542.087158470307,2300707.545878442,1928098398956.1926,Artificial Intelligence,NASDAQ,US,USDT,2024-04-20 18:00:00
crypto,BNB,BNB Coin,23/07/2024,12034.173943155634,12449.073374188043,12963.260367676397,11837.470635155596,8243680.122046245,167465068966.16135,Blockchain,COINBASE,US,$,2024-07-23 09:00:00
stock,GOOGL,GOOGL Inc,04-16-2024,7824.285365735955,8196.644588833153,8344.378658932194,7695.681822163447,2707168.775875675,1197006565000.3477,Technology,NYSE,Global,$,2024-04-16 10:00:00
stock,MSFT,MSFT Inc,03-27-2023,49629.163956433295,46216.67761025593,52081.88933480302,46164.17530866294,7938387.220976489,252876608071.95126,RETAIL,NASDAQ,Global,usd,2023-03-27 12:00:00
stock,AMZN,AMZN Inc,28/03/2024,28894.574442051726,31010.244113305733,31459.02362437867,28125.518200413804,6194280.303695653,1981674656625.1729,Retail,NYSE,Global,usd,2024-03-28 23:00:00
stock,AMZN,AMZN Inc,08-21-2024,21380.047839972496,20654.34345437604,21983.213001649998,20500.02920341564,2016082.2516851223,1239459522849.7783,automotive,NYSE,US,USD,2024-08-21 16:00:00
crypto,BNB,BNB Coin,01-15-2024,34457.491810874,36685.32862659342,37705.53054350265,34077.62673811826,162987.77299733262,374101050307.6094,Crypto,COINBASE,Global,$,2024-01-15 15:00:00
crypto,SOL,SOL Coin,03-18-2023,2016.5415656774724,2173.796871767344,2281.613147610199,1945.3644504232368,2103975.2443016507,328260267787.9164,Blockchain,BINANCE,US,USDT,2023-03-18 04:00:00
crypto,BTC,BTC Coin,22/02/2024,12658.786782603458,13584.302035466922,13654.154277165797,12105.569442229647,9791536.399451055,307318528723.9261,Crypto,COINBASE,Global,USD,2024-02-22 05:00:00
crypto,BTC,BTC Coin,2024-06-26,42345.89234920335,40858.106494085325,43778.2077508626,40029.180962551785,6031898.0511093475,271166364816.65182,Blockchain,BINANCE,US,usd,2024-06-26 20:00:00
stock,AAPL,AAPL Inc,06-06-2024,28772.205064723636,28363.998653277773,29169.150281960046,28035.80071236171,2263498.0276018586,2050772054017.7876,TECHNOLOGY,NASDAQ,Global,usd,2024-06-06 16:00:00
crypto,BTC,BTC Coin,01-01-2024,11674.30780423984,11966.936400481038,12413.948305926773,11218.25907703571,600373.0653122215,278479950930.9936,Blockchain,COINBASE,US,USD,2024-01-01 21:00:00
crypto,ETH,ETH Coin,03-21-2023,30303.788393878564,32421.69838373177,32494.642052047853,29900.977194339514,3413845.140854571,56734628482.69876,Crypto,COINBASE,US,USDT,2023-03-21 08:00:00
stock,AAPL,AAPL Inc,2024-06-02,46443.68889677982,44882.91626481134,47524.28708638316,42669.475785370974,816905.6013283788,1440799826059.3723,TECHNOLOGY,NASDAQ,Global,USDT,2024-06-02 14:00:00
crypto,ETH,ETH Coin,2023-01-22,1402.33 USD,1439.1799232935984,1469.8631210153123,1370.6509622567462,1747297.211777399,107143678498.23969,blockchain,BINANCE,Global,USDT,2023-01-22 05:00:00
crypto,ETH,ETH Coin,2023-10-07,33194.585497887725,36283.6917062776,36375.15703978799,33012.653146223776,5769235.131910773,121893151627.46336,crypto,COINBASE,Global,usd,2023-10-07 00:00:00
crypto,ADA,ADA Coin,2024-04-11,25018.923975035937,22864.26464944312,25131.355081071066,22408.021973391817,3410244.7557841474,227748228868.47137,blockchain,BINANCE,US,USD,2024-04-11 19:00:00
stock,TSLA,TSLA Inc,05-18-2024,20335.460962600017,18884.653768362405,21062.1678094958,18217.414969728183,5255177.6032515755,2752631519067.265,ai,NYSE,Global,USDT,2024-05-18 13:00:00
stock,MSFT,MSFT Inc,10-04-2023,45014.2029189915,47644.75366578055,49256.006489176565,44293.150072182674,9459300.515676834,2096520028660.4585,finance,NASDAQ,US,USDT,2023-10-04 04:00:00
crypto,SOL,SOL Coin,12-25-2023,65.5935888674085,62.601925092624185,66.30820274605794,61.5434347940437,6337482.286055525,121850518511.13174,blockchain,BINANCE,Global,USDT,2023-12-25 13:00:00
stock,GOOGL,GOOGL Inc,2024-06-07,822.01 USD,859.6212832132059,873.5269646301697,808.2433643048107,5566227.706593031,1784449534287.1243,Finance,NASDAQ,Global,$,2024-06-07 12:00:00
stock,AAPL,AAPL Inc,12-30-2023,6737.467592534346,6190.949685902973,7017.583983631435,6165.689850342019,6498230.679596231,1034765467029.4425,Retail,NYSE,US,USD,2023-12-30 14:00:00
crypto,ETH,ETH Coin,06/06/2023,20107.340572243153,21028.012265613415,21847.916421310678,19220.826648650407,1307.1577349787763,45856475369.89093,Crypto,BINANCE,Global,USD,2023-06-06 05:00:00
stock,MSFT,MSFT Inc,10-08-2023,17836.24283755042,16960.416719468678,17847.744957708215,16570.58103809308,8511656.203524392,2139289767183.009,Retail,NYSE,Global,USD,2023-10-08 17:00:00
crypto,SOL,SOL Coin,2024-03-17,28291.590081158327,28373.4168724476,28494.08388660509,27653.434792497417,3800410.810574981,383264500277.67224,Crypto,COINBASE,Global,USDT,2024-03-17 10:00:00
crypto,BTC,BTC Coin,13/03/2024,19442.43013034857,18432.58690092727,19534.747916770422,17801.195635710388,967351.698043235,244818435949.01288,crypto,N/A,US,USDT,2024-03-13 14:00:00
crypto,BTC,BTC Coin,06/01/2024,49366.9345673915,48815.04735764333,50679.7785021563,48506.58148240225,9955693.436006388,74874295575.47365,blockchain,BINANCE,Global,$,2024-01-06 05:00:00
stock,GOOGL,GOOGL Inc,11-20-2023,40625.56631399814,39219.442535589544,41246.617384917095,38048.16118103078,6725400.119473818,1752316203540.5977,Automotive,NASDAQ,US,USDT,2023-11-20 11:00:00
crypto,BNB,BNB Coin,2024-08-15,15768.82 USD,14612.050049864636,16267.426454041637,13975.202743421118,5785346.589785071,274465717255.764,Crypto,BINANCE,Global,usd,2024-08-15 10:00:00
crypto,BNB,BNB Coin,10-31-2023,35033.57 USD,36809.575225465276,38416.05445243415,34157.657654248724,7302761.646106183,278901740582.24207,blockchain,N/A,US,$,2023-10-31 16:00:00
stock,AAPL,AAPL Inc,2023-06-18,9340.130590486151,8454.106459018234,9473.013275517173,8218.673841982905,6171442.338342134,1861326478743.8518,TECHNOLOGY,NYSE,US,$,2023-06-18 20:00:00
crypto,ADA,ADA Coin,2023-07-26,9820.32337814122,9084.878947699244,10293.407610768842,8679.71358745889,4785432.210001784,340733935548.7661,blockchain,BINANCE,Global,USDT,2023-07-26 16:00:00
crypto,ADA,ADA Coin,2023-11-04,27073.30730116284,24831.81157607351,27150.502659525686,23721.188227025374,5856291.251042252,236297672873.35425,crypto,BINANCE,US,usd,2023-11-04 01:00:00
crypto,BTC,BTC Coin,05/01/2023,11694.702193916844,12016.947705698176,12509.68312006544,11134.279761867938,4981801.305536876,220016230615.55682,blockchain,COINBASE,Global,USDT,2023-01-05 07:00:00
stock,AMZN,AMZN Inc,04/11/2023,12623.073234213658,12137.768846167424,13010.373043649872,12075.826955390832,8099434.278608691,2071038132187.044,Automotive,NASDAQ,US,USDT,2023-11-04 21:00:00
crypto,ADA,ADA Coin,2024-04-09,36513.78367068489,35526.61505469089,37683.987502353106,34578.37699863494,1900171.4284391515,235336436544.33548,crypto,COINBASE,US,$,2024-04-09 09:00:00
stock,MSFT,MSFT Inc,2023-07-11,27827.66722106761,27040.820907140325,29095.689406418885,25717.08364833339,3158415.7393437107,2108197438892.999,Technology,NYSE,US,usd,2023-07-11 16:00:00
crypto,BNB,BNB Coin,2023-07-07,38328.70053791914,39878.003754960904,40538.687006109976,37707.129563186994,3959976.3247333025,27468152122.17039,Crypto,BINANCE,Global,USD,2023-07-07 12:00:00
stock,GOOGL,GOOGL Inc,03-13-2024,22714.641300207935,22316.13439679587,23776.24403735246,21480.26026248148,1205352.9526256577,2271198836353.0786,Retail,NASDAQ,Global,usd,2024-03-13 22:00:00
stock,AAPL,AAPL Inc,01-13-2023,48466.397396086104,47282.2587533428,48616.73231804609,45720.301787940814,5059810.611541265,1757783908645.78,TECHNOLOGY,NYSE,Global,usd,2023-01-13 20:00:00
stock,AMZN,AMZN Inc,01-08-2024,32908.52988064404,36184.57000890694,37001.86994362882,31846.783152045533,4007640.964177832,494149789830.319,ai,NASDAQ,US,USDT,2024-01-08 20:00:00
stock,AAPL,AAPL Inc,02-20-2023,44164.84733529693,43412.50495114023,45020.04309816918,42673.820065573884,4420892.175890304,354287073401.6514,Retail,NYSE,US,$,2023-02-20 01:00:00
crypto,BNB,BNB Coin,2024-01-26,3081.7000436380677,3275.0602920458814,3429.0706495752574,3027.5800573980764,9545704.722659249,261052220179.09918,Crypto,COINBASE,US,USD,2024-01-26 20:00:00
crypto,ETH,ETH Coin,03-13-2023,23876.04 USD,24362.183547061562,25070.80229608792,23161.499327216618,3381506.0092532476,64815764176.1355,crypto,BINANCE,US,usd,2023-03-13 16:00:00
stock,MSFT,MSFT Inc,19/05/2024,19593.205103608285,18271.293935783833,20312.63396963639,17548.50980925996,586594.487540054,389203827425.7522,TECHNOLOGY,Unknown,Global,USD,2024-05-19 11:00:00
crypto,ADA,ADA Coin,01-31-2024,29765.53 USD,31979.57253794982,32902.15380431855,28791.428732453183,8030315.803381679,223184624437.80756,blockchain,COINBASE,Global,$,2024-01-31 01:00:00
crypto,ADA,ADA Coin,17/12/2023,3973.221428713275,4025.5492001791495,4208.31286664265,3853.2922480825687,2963961.6931961006,218410162809.0313,blockchain,COINBASE,Global,USDT,2023-12-17 00:00:00
stock,AMZN,AMZN Inc,25/01/2023,7580.761641548513,7478.832971004556,7806.546979630916,7135.0367799619935,9395746.321662633,438973676483.87994,finance,NYSE,Global,USDT,2023-01-25 21:00:00
stock,AMZN,AMZN Inc,13/06/2023,29335.329675000296,31262.301013003143,31387.64213943898,28567.9744752582,6301301.175489772,2267849516161.1357,Retail,NASDAQ,Global,USDT,2023-06-13 22:00:00
stock,MSFT,MSFT Inc,22/06/2023,39175.64330686289,37428.952195791055,41018.62260272049,35790.21131373457,8751461.0525929,2487672189293.6846,tech,NYSE,US,USD,2023-06-22 14:00:00
crypto,ETH,ETH Coin,02-25-2024,8865.904625899051,9259.667935074958,9278.319461398783,8602.331399646413,5163316.708677542,388521398593.82434,crypto,BINANCE,US,USDT,2024-02-25 05:00:00
stock,AAPL,AAPL Inc,2023-07-05,46797.50303994549,48409.68345240205,49574.60911595925,46352.166386499266,9505377.676723136,1746129225469.806,RETAIL,NASDAQ,Global,$,2023-07-05 09:00:00
stock,AMZN,AMZN Inc,09/05/2023,49126.238400079375,45059.88415958167,51126.62635349088,43438.48252539617,1322664.3978809635,75977784560.04962,automotive,NASDAQ,Global,usd,2023-05-09 15:00:00
crypto,ETH,ETH Coin,24/03/2023,32201.3894065862,31434.68620727926,32289.243504598227,30805.145537846784,9024130.357830636,178742977686.96478,crypto,BINANCE,Global,USD,2023-03-24 20:00:00
crypto,ETH,ETH Coin,12-22-2023,10824.475553765044,10700.161530728536,10850.65060293811,10604.12093858692,8263581.768690918,156370069549.16443,Blockchain,COINBASE,Global,USD,2023-12-22 12:00:00
stock,GOOGL,GOOGL Inc,01-19-2024,17661.61341803009,18720.54499642966,19239.747166753976,17507.897604282163,6314956.467037623,1768121385654.5889,AI,NASDAQ,Global,USDT,2024-01-19 21:00:00
crypto,BNB,BNB Coin,08-01-2023,29932.16403095582,29418.175305017558,31365.833661560027,28743.1956077794,6051290.095886843,314840161919.05493,Blockchain,BINANCE,US,$,2023-08-01 12:00:00
crypto,BTC,BTC Coin,06-21-2023,31286.28296346955,31734.35040028402,32027.636724677923,29815.181754734185,6043988.837827996,92092617568.82596,crypto,BINANCE,Global,USDT,2023-06-21 05:00:00
crypto,ADA,ADA Coin,09-17-2023,26174.834532391193,24744.49826799561,27047.13965499832,23606.382155263218,4418895.214314744,306658446393.3766,Blockchain,COINBASE,US,USD,2023-09-17 00:00:00
crypto,ADA,ADA Coin,2024-01-28,9231.11 USD,8681.476623202521,9409.594692154931,8269.60575776067,3978536.615850053,69529869567.37598,Crypto,BINANCE,US,USDT,2024-01-28 18:00:00
crypto,BNB,BNB Coin,2024-08-08,24169.881305466595,23603.262429392198,25183.985001214347,22594.608510882423,5057461.741069959,207124441610.30682,crypto,COINBASE,US,$,2024-08-08 07:00:00
stock,GOOGL,GOOGL Inc,07-03-2024,3567.072387106708,3619.7693536533775,3722.2121610539816,3545.319222682461,5579178.882925072,195503836700.09735,Finance,NYSE,Global,usd,2024-07-03 20:00:00
stock,AMZN,AMZN Inc,2024-01-16,2444.2554715124893,2247.7410883163598,2449.640882675005,2156.1767533609686,5413159.8393058395,2879775151010.502,Automotive,NYSE,US,USDT,2024-01-16 03:00:00
crypto,ADA,ADA Coin,29/01/2024,2288.802045853953,2492.949862867936,2597.923665879571,2208.306306360604,772798.1147344531,260001011663.83408,blockchain,BINANCE,US,usd,2024-01-29 02:00:00
crypto,BNB,BNB Coin,2024-03-29,6355.951243611084,5877.073257320418,6520.748884109285,5655.4627659373255,3582039.025574915,72105393921.52762,Crypto,BINANCE,Global,usd,2024-03-29 02:00:00
crypto,ADA,ADA Coin,06-16-2024,34218.87 USD,37291.59145689887,37557.39949738876,33161.74487584458,5547763.30102026,395854606686.8074,Blockchain,BINANCE,US,usd,2024-06-16 14:00:00
stock,AAPL,AAPL Inc,05-17-2024,219.33 USD,226.80658991130892,234.08503470852182,212.86871340321352,4896951.116244295,239506605047.32666,Technology,NYSE,US,USDT,2024-05-17 19:00:00
crypto,ETH,ETH Coin,12-28-2023,1210.0121917959939,1170.1717190774616,1220.7257761950666,1117.4217932515662,9567247.618459608,169099985233.8754,Crypto,COINBASE,US,USDT,2023-12-28 09:00:00
crypto,SOL,SOL Coin,08-20-2024,36435.527648987765,35090.06376154117,37151.75380432773,33751.24447608786,970559.743983282,241747091391.65543,Blockchain,COINBASE,US,$,2024-08-20 07:00:00
crypto,BTC,BTC Coin,2023-02-06,39877.727124371326,41293.75175861041,42422.98902033841,38831.11598363942,9224420.402277589,75717496789.4256,blockchain,BINANCE,Global,USD,2023-02-06 22:00:00
crypto,BTC,BTC Coin,20/08/2023,14037.234653763418,13615.943141348362,14586.389390023038,13610.847116035062,2407464.4770567734,33730304372.57402,crypto,COINBASE,US,USD,2023-08-20 00:00:00
stock,AMZN,AMZN Inc,07-13-2023,41532.83179398525,39245.68019609271,42362.102438148875,38087.29070695157,9782228.464597056,2624178929069.871,RETAIL,NYSE,US,USDT,2023-07-13 17:00:00
stock,MSFT,MSFT Inc,06-26-2024,39959.90697552805,38634.77823202659,41420.18252694742,37514.39092072395,5784019.271402284,550866785122.906,finance,NYSE,Global,USDT,2024-06-26 17:00:00
crypto,,ADA Coin,07-07-2024,40210.23659354437,43157.02917424258,43285.674506702075,39591.10058748822,1400733.7798409068,333881650463.8218,Blockchain,BINANCE,Global,usd,2024-07-07 18:00:00
crypto,ETH,ETH Coin,2023-09-06,27433.934868583878,26900.28714043581,28146.684512130647,26895.61497589809,1353037.9198148344,169248334367.27234,Crypto,BINANCE,US,USDT,2023-09-06 19:00:00
stock,TSLA,TSLA Inc,2024-05-13,19806.088309616905,18352.360243295803,19963.286027285623,18305.812331885612,8796135.36562091,2029613575555.9124,Automotive,NYSE,Global,USD,2024-05-13 19:00:00
crypto,ETH,ETH Coin,18/10/2023,49576.72346361105,46684.57001398327,50457.799350440415,45912.451646144975,4838541.596066612,363281574363.9336,blockchain,COINBASE,Global,USD,2023-10-18 13:00:00
stock,TSLA,TSLA Inc,05-01-2023,17896.9843542863,18232.662454811707,18757.392489591824,17146.615553078216,4717926.635346872,1260984704801.2173,Retail,NYSE,Global,$,2023-05-01 05:00:00
stock,AAPL,AAPL Inc,2024-01-22,28518.64406718221,26865.174110588418,29577.07274902695,25555.764308548856,3548963.7235760833,1664880610867.4512,TECHNOLOGY,NYSE,US,USDT,2024-01-22 15:00:00
stock,AAPL,AAPL Inc,06-24-2023,28199.007123559564,26852.010670159587,29178.856521704292,26271.18952098315,7962639.850954415,2342835819121.5444,Technology,NYSE,Global,USD,2023-06-24 22:00:00
stock,,AAPL Inc,07-15-2024,30509.29502259137,30437.156864232322,30712.459660777684,29313.010723979736,4191575.6296979357,2207725306707.572,Finance,NYSE,US,USDT,2024-07-15 20:00:00
stock,AAPL,AAPL Inc,21/02/2024,25690.255682213086,24601.936945103316,25698.559232435036,23982.262400192696,2856974.2596338685,1801904868149.102,TECHNOLOGY,NASDAQ,Global,usd,2024-02-21 21:00:00
crypto,SOL,SOL Coin,01-29-2023,1207.0738008714698,1227.5524865939676,1285.3379386597042,1157.2463536758705,4717023.258015203,295170278780.6614,Crypto,COINBASE,Global,USD,2023-01-29 13:00:00
stock,GOOGL,GOOGL Inc,02-08-2024,31287.83879394502,31604.044209241387,32247.764111068544,30539.084864184646,8965850.010031633,283351755533.24316,AI,NYSE,US,usd,2024-02-08 07:00:00
crypto,BNB,BNB Coin,01/02/2024,1137.9999401503082,1220.3148635787172,1255.5280912618744,1131.77840659329,5969855.288908313,82536249412.87148,Crypto,BINANCE,Global,$,2024-02-01 12:00:00
crypto,ADA,ADA Coin,26/06/2023,21489.371434123845,22563.2380081155,23593.296604551233,21029.631006088563,1808670.720473233,325013630534.08246,blockchain,BINANCE,Global,$,2023-06-26 13:00:00
crypto,ETH,ETH Coin,21/10/2023,9940.242399101315,9436.98189763583,10092.534591170259,9227.07217757183,5880328.303008864,111175057936.92827,Crypto,BINANCE,US,$,2023-10-21 10:00:00
crypto,BNB,BNB Coin,2024-07-17,30774.884783243564,28199.488092297495,30909.96842728301,27031.788828745703,5181256.902905407,173467400160.53516,Crypto,COINBASE,Global,USD,2024-07-17 02:00:00
crypto,SOL,SOL Coin,12-19-2023,14171.387330593941,13888.846248497766,14746.650795790898,13204.030389791353,6494138.823545988,89527898085.83386,crypto,BINANCE,US,$,2023-12-19 18:00:00
stock,MSFT,MSFT Inc,2024-08-04,39934.80246002826,43391.18308710231,43434.873341639264,38245.12843208892,8861826.769265875,2009940827811.6492,Automotive,N/A,Global,$,2024-08-04 12:00:00
stock,AMZN,AMZN Inc,05-15-2023,28233.88604028384,29154.464338560934,30144.35549377472,28137.52435658797,9969497.224699285,1380970500939.176,Artificial Intelligence,NYSE,Global,usd,2023-05-15 14:00:00
stock,TSLA,TSLA Inc,2024-07-25,14368.18824816549,15459.459048937133,15497.505484571839,13815.789495489586,8973959.788919685,2163270808183.5112,TECHNOLOGY,NASDAQ,US,$,2024-07-25 19:00:00
stock,GOOGL,GOOGL Inc,2023-11-06,11040.346470491206,10241.302041963383,11514.591043555936,9985.29932341293,6749257.137338494,776012628173.6713,Technology,NASDAQ,Global,$,2023-11-06 03:00:00
crypto,BTC,BTC Coin,2024-07-19,37904.44064635071,39875.5135956983,40498.76393530927,36787.55338840444,2097693.0840245783,99431221709.63672,Crypto,BINANCE,Global,usd,2024-07-19 10:00:00
crypto,BNB,BNB Coin,06/12/2023,32283.672827149996,35089.40732196195,35621.68826776183,31931.604706878155,7658820.580203535,390741604212.5472,crypto,BINANCE,Global,$,2023-12-06 15:00:00
stock,TSLA,TSLA Inc,2023-03-25,48282.292373587356,47254.413896842736,48597.85897538003,46478.753624645346,7293368.694971585,2078050399080.9592,Artificial Intelligence,NYSE,Global,USD,2023-03-25 20:00:00
stock,TSLA,TSLA Inc,22/04/2023,10348.82647773848,10358.049231164696,10519.733064207065,10052.574000103474,6452540.539870795,1729431114641.856,Finance,NASDAQ,US,usd,2023-04-22 04:00:00
stock,AAPL,AAPL Inc,29/04/2023,11618.912298158142,11398.909031857584,11775.280532527453,10942.172765127829,7834088.812738388,2238192080645.595,RETAIL,NYSE,Global,usd,2023-04-29 01:00:00
crypto,SOL,SOL Coin,29/07/2023,18517.90696237199,19448.538911003656,20320.801300413194,18375.434084713856,1828951.0720037199,364154814302.612,blockchain,COINBASE,US,USDT,2023-07-29 21:00:00
stock,MSFT,MSFT Inc,03-24-2024,18840.055257068827,18234.31229175387,18898.865739853103,17765.848789014755,1091027.142793646,2869312725724.95,RETAIL,NASDAQ,Global,$,2024-03-24 09:00:00
crypto,BTC,BTC Coin,2024-07-15,15853.961662146396,16833.18580072615,17570.048956653205,15301.028049095312,8587122.514324494,103173229266.33327,crypto,COINBASE,Global,USD,2024-07-15 08:00:00
stock,MSFT,MSFT Inc,19/01/2023,38234.90100973983,35533.18554136244,39554.62229554039,35435.51203568401,6825722.247192804,2573120502735.6753,Retail,NYSE,Global,USDT,2023-01-19 16:00:00
crypto,BTC,BTC Coin,07-09-2023,25033.96 USD,25763.575061900978,26421.281014384094,23932.40693217768,3121328.3824755545,135988655397.5944,Blockchain,COINBASE,US,USD,2023-07-09 18:00:00
crypto,ETH,ETH Coin,26/03/2024,43072.29 USD,39947.82462560401,45123.36195456984,38607.22080786122,6623475.073568469,321946432068.6848,blockchain,BINANCE,US,USDT,2024-03-26 19:00:00
crypto,BTC,BTC Coin,07-01-2024,40599.19226954779,44218.607842500634,44910.45118152759,40311.966086719716,1317737.347458634,301970932652.88904,blockchain,BINANCE,Global,usd,2024-07-01 18:00:00
crypto,ETH,ETH Coin,2023-08-21,37101.466698404154,38420.22528139681,38904.92473160325,36865.95242574668,1689415.7752405796,283491158009.6691,Crypto,COINBASE,US,usd,2023-08-21 06:00:00
stock,AMZN,AMZN Inc,04-11-2024,35876.07488068949,35700.107865348335,37399.19008794362,34599.468436633215,1683617.6064886206,170368026647.2842,TECHNOLOGY,NYSE,Global,USDT,2024-04-11 01:00:00
stock,TSLA,TSLA Inc,18/07/2024,27449.992485687184,25743.67785300624,28438.719253087544,25114.39120313351,6043525.509420957,2510962155484.9106,AI,NASDAQ,Global,USDT,2024-07-18 13:00:00
crypto,BTC,BTC Coin,11/12/2023,41437.16210106214,44168.3908355071,45735.01897234107,39583.68069405165,8388699.765178785,187054843591.59985,crypto,BINANCE,Global,USDT,2023-12-11 14:00:00
stock,MSFT,MSFT Inc,17/03/2024,34854.23805855493,33899.11231882084,36386.56900707078,33433.62937034201,1126792.0748254154,2016328811793.4004,automotive,NYSE,Global,usd,2024-03-17 21:00:00
crypto,BNB,BNB Coin,04/09/2023,44320.15429438748,40306.49188523154,46450.66094057369,39659.90031840624,6314128.400456123,166072323590.43427,crypto,BINANCE,US,usd,2023-09-04 04:00:00
stock,AMZN,AMZN Inc,10-06-2023,12447.101519071462,13547.570226134369,13749.61357714728,12307.38610095984,3931824.8602725845,818972176899.0942,tech,NASDAQ,Global,USD,2023-10-06 15:00:00
stock,GOOGL,GOOGL Inc,07-31-2023,545.6577317909939,550.4876034171642,577.345310581576,528.4459461132387,3572566.147596455,426369671646.2649,Automotive,NASDAQ,Global,$,2023-07-31 14:00:00
crypto,BNB,BNB Coin,08/01/2023,26031.986426869873,25723.064237002767,27177.282707857972,25087.08821508482,5078070.624047499,140916189050.52963,crypto,BINANCE,Global,$,2023-01-08 16:00:00
stock,MSFT,MSFT Inc,2024-04-21,49137.149650110194,46680.02575451764,49317.39470819536,45893.80866585049,5954068.33519857,423731068214.46423,TECHNOLOGY,NASDAQ,US,usd,2024-04-21 21:00:00
crypto,ETH,ETH Coin,2023-08-08,21115.389771695096,22319.23693224372,22537.64477149467,20925.618710162737,6487822.3918362865,168982533327.13455,Blockchain,BINANCE,US,$,2023-08-08 15:00:00
stock,GOOGL,GOOGL Inc,28/06/2024,22906.85054302759,21791.9613321843,23768.279073545516,21261.190593203602,3209224.572955686,1262719623600.7778,ai,NASDAQ,US,$,2024-06-28 11:00:00
crypto,BNB,BNB Coin,2024-01-31,49786.76525804564,49142.14892082961,52078.67759032897,47532.784921176484,548272.3365429338,240439795725.57535,Blockchain,COINBASE,US,USD,2024-01-31 06:00:00
crypto,ADA,ADA Coin,2023-03-22,20940.570214950934,19766.369322233902,20940.807930438477,19682.363772398687,8438950.232898058,85675632015.5294,crypto,BINANCE,Global,USDT,2023-03-22 23:00:00
stock,AMZN,AMZN Inc,01-01-2023,8399.051636344971,7761.334451055038,8427.442425429006,7654.239362821921,9288150.798918165,2229453772145.9717,RETAIL,NASDAQ,Global,$,2023-01-01 22:00:00
stock,AAPL,AAPL Inc,05-13-2024,5965.842193082448,5980.6289156454295,6084.940625267771,5779.357400863633,6213684.910932917,1297302104529.9807,AI,NASDAQ,US,$,2024-05-13 16:00:00
stock,AAPL,AAPL Inc,23/07/2023,5539.073907669311,5024.593900667996,5814.457359429879,4831.8324777582775,539251.4185596823,2158967158653.985,Finance,NASDAQ,US,$,2023-07-23 20:00:00
stock,TSLA,TSLA Inc,10-19-2023,1957.5027389597265,1915.1466449372288,2036.0379235002083,1852.0659708432147,4442389.885376787,577727233996.8008,Technology,NASDAQ,US,usd,2023-10-19 17:00:00
crypto,SOL,SOL Coin,2024-01-10,25449.61456279331,27289.345241718733,28471.02256811716,24189.7450036686,7780685.018525508,271856775559.13834,crypto,BINANCE,US,usd,2024-01-10 23:00:00
stock,AMZN,AMZN Inc,03-26-2023,49442.13865977011,49276.33025384947,51881.850968502775,48671.6341932675,2486800.24124845,1387593464722.605,Technology,NYSE,US,USDT,2023-03-26 22:00:00
crypto,SOL,SOL Coin,08-04-2024,49606.86061753435,53154.05482258476,53412.827083108925,48878.56244615177,3456450.27912226,217666016818.34827,blockchain,BINANCE,US,$,2024-08-04 22:00:00
stock,AAPL,AAPL Inc,16/03/2024,20180.01364165971,19109.481764063712,21006.25329415166,18476.318331770457,8275409.415844217,30876963022.24087,Retail,NYSE,Global,USD,2024-03-16 17:00:00
crypto,SOL,SOL Coin,2024-05-07,15397.879309805696,14600.777951551996,15577.701411627908,13920.517938697516,1872055.5798346067,5236185839.744147,blockchain,BINANCE,US,USD,2024-05-07 11:00:00
crypto,ADA,ADA Coin,2023-10-19,14575.140031158846,14334.343508187441,14849.784408867159,14245.40243655115,9053084.691106144,224442080104.81985,Blockchain,BINANCE,US,USDT,2023-10-19 08:00:00
crypto,BTC,BTC Coin,17/07/2023,16514.495956277064,15215.798319524274,17301.74435608999,14500.828455898261,2977205.125405236,199718003804.06473,blockchain,COINBASE,Global,USDT,2023-07-17 10:00:00
stock,GOOGL,GOOGL Inc,11/05/2023,16026.860294149343,14950.774721793152,16654.441236208353,14294.807882611234,6349431.6848724745,901217941498.3124,ai,NASDAQ,Global,USD,2023-05-11 17:00:00
crypto,ADA,ADA Coin,2023-11-19,3536.076523271898,3825.6313344555965,3861.999462756108,3504.4728666719025,5446764.080200251,53919180548.7979,blockchain,,US,$,2023-11-19 05:00:00
stock,AMZN,AMZN Inc,01/04/2023,47772.855089988996,45355.17758970175,49826.240715604676,43470.23909978054,8539574.878536386,242790993630.2211,TECHNOLOGY,NASDAQ,US,USDT,2023-04-01 20:00:00
stock,TSLA,TSLA Inc,23/04/2024,25593.90502390834,26973.122581330783,28233.840285421356,25477.711428793096,8196429.070606901,49554150586.82902,Technology,NASDAQ,Global,usd,2024-04-23 22:00:00
crypto,BNB,BNB Coin,03-31-2024,9968.992094995454,9538.699084990325,10113.02834202748,9241.594330072703,3933813.3831815016,355835583116.2151,blockchain,BINANCE,Global,USDT,2024-03-31 03:00:00
stock,AMZN,AMZN Inc,07/03/2024,8002.389370688405,8308.475424580529,8378.086548270205,7726.430367095379,5033947.960930934,1638220420717.4797,AI,NYSE,Global,USDT,2024-03-07 22:00:00
stock,AMZN,AMZN Inc,01-07-2023,36976.06696960398,38052.324591406716,38348.70132511963,36138.642887868366,875377.5714970545,2391357278955.1973,Technology,NYSE,US,$,2023-01-07 20:00:00
stock,AMZN,AMZN Inc,04-12-2024,20681.691349195058,18778.1957948324,20965.018214524585,18736.554645468652,9536372.445689065,1138315898621.9858,ai,Unknown,US,$,2024-04-12 16:00:00
stock,AMZN,AMZN Inc,2023-07-22,2164.5744463267197,2025.649867521291,2207.023676979765,2020.3608651267634,1412849.436308312,1063457892215.0925,tech,N/A,US,USD,2023-07-22 21:00:00
stock,AMZN,AMZN Inc,2024-08-02,5443.040143340857,5966.941005946395,6080.795162800396,5381.869771960409,3426568.237028507,2292912372567.9546,Retail,NASDAQ,US,$,2024-08-02 21:00:00
stock,AAPL,AAPL Inc,23/04/2023,9608.884076154436,8928.615477960277,10059.571554809823,8891.850688502545,8874801.933188612,1886729942704.8381,Finance,NYSE,Global,usd,2023-04-23 03:00:00
stock,TSLA,TSLA Inc,2023-11-16,40415.32787870175,36931.825179034466,41091.858323612156,35664.51536816515,6356817.574204179,1880046015998.1145,Technology,NYSE,US,USD,2023-11-16 00:00:00
stock,AAPL,AAPL Inc,2023-12-29,7433.854014367604,7577.278445531059,7885.819131954705,7204.193827312995,1323554.8822697185,1074313742677.2151,tech,NYSE,US,usd,2023-12-29 04:00:00
stock,GOOGL,GOOGL Inc,28/03/2023,11881.790425417505,11406.275452685402,12263.668241129875,11178.689166485368,6961102.535808825,598097709965.341,ai,NYSE,US,USDT,2023-03-28 16:00:00
crypto,ADA,ADA Coin,02-08-2023,41201.642617480116,38763.227731247505,42167.90508009405,38377.414847779364,1802406.3186784599,148188283889.9477,crypto,N/A,US,$,2023-02-08 21:00:00
stock,GOOGL,GOOGL Inc,01/06/2024,44185.361544722604,42797.31961693532,45696.21398065962,40711.6962520149,6900778.837206087,338490710084.94104,AI,NASDAQ,Global,USD,2024-06-01 02:00:00
crypto,ADA,ADA Coin,05/02/2024,2796.49 USD,2857.9032248800445,2892.312925005992,2710.7460450469453,806727.5420528494,129860018061.05336,Crypto,COINBASE,Global,usd,2024-02-05 19:00:00
crypto,BNB,BNB Coin,04/05/2023,14905.882002437229,13682.882706982986,15584.715443743975,13002.875620764358,4839118.32842425,63129484182.5034,Blockchain,COINBASE,US,usd,2023-05-04 07:00:00
stock,AMZN,AMZN Inc,2023-01-10,15390.877683002647,16702.363797170023,16837.39785981017,15364.584153606293,2058737.9755172278,378509899816.3288,Retail,NYSE,Global,USDT,2023-01-10 10:00:00
stock,GOOGL,GOOGL Inc,08-06-2023,27338.396472216613,29440.602850251333,30256.097621100613,26702.176242164467,1955384.5456836305,2227282664315.8203,Artificial Intelligence,NYSE,Global,USD,2023-08-06 01:00:00
stock,GOOGL,GOOGL Inc,08-29-2023,45825.292664264554,44247.419679603736,46677.83157570727,43716.06051047219,3388896.000745651,507025792534.4596,AI,NASDAQ,US,USD,2023-08-29 21:00:00
crypto,SOL,SOL Coin,10-30-2023,36899.00917225003,37618.01767532243,39274.89416129635,35145.5791569968,2571369.8591998983,381064666422.40607,Crypto,BINANCE,US,USD,2023-10-30 00:00:00
stock,AMZN,AMZN Inc,29/07/2023,11356.657188181336,11910.646707903277,12458.064813350691,11029.454927704768,3421983.8685188377,1400458639320.5208,finance,NASDAQ,US,USD,2023-07-29 17:00:00
crypto,SOL,SOL Coin,04-12-2023,22248.173117048766,22199.44250050618,22639.351478871304,22099.043826883677,5689985.877335225,384812539194.3387,Crypto,BINANCE,Global,$,2023-04-12 23:00:00
crypto,SOL,SOL Coin,05-30-2024,40592.21785036081,39308.278221613225,41472.44858923198,39010.462539109925,3633190.261406427,306058961936.74963,crypto,BINANCE,Global,USD,2024-05-30 18:00:00
crypto,SOL,SOL Coin,01-12-2023,47050.20620549611,48209.62089739729,49997.29941615833,46591.69562257261,8450551.449317528,318604377713.48126,blockchain,BINANCE,US,usd,2023-01-12 17:00:00
crypto,BTC,BTC Coin,06-12-2023,2572.6603242081487,2522.1725194376286,2659.327620235829,2452.8569618224697,7489882.545453125,161046068453.43442,Blockchain,COINBASE,US,USDT,2023-06-12 11:00:00
crypto,BTC,BTC Coin,28/04/2024,31740.85961379044,29750.19862343144,32930.141118161075,29074.416865269537,2041439.8210774593,146008059640.12222,crypto,COINBASE,US,USD,2024-04-28 14:00:00
crypto,BNB,BNB Coin,01/04/2023,37432.9493420058,37302.69192918664,37837.28404023152,37241.64829404535,7151535.073149063,120304913531.63387,Crypto,COINBASE,Global,USDT,2023-04-01 03:00:00
crypto,ADA,ADA Coin,2023-05-02,21360.981217563556,21254.60498660198,22320.041442920625,20749.86055354146,7073081.840144766,383068258853.2195,Crypto,N/A,US,USDT,2023-05-02 00:00:00
crypto,SOL,SOL Coin,05-13-2024,22341.856170445,20659.29038263964,22571.954987222307,19627.300378005926,393611.25143495365,104608286610.73434,Crypto,COINBASE,US,$,2024-05-13 21:00:00
stock,MSFT,MSFT Inc,09-20-2023,12125.261219886748,12521.298222434962,13046.629100786226,11852.843254477717,1532291.856339478,2932078631299.0186,Artificial Intelligence,NASDAQ,US,$,2023-09-20 14:00:00
stock,MSFT,MSFT Inc,2023-11-25,30016.567990878157,31404.837798493387,32613.52619033163,29979.66317236508,5736059.236987073,2187068147635.1375,Automotive,NASDAQ,US,USDT,2023-11-25 12:00:00
crypto,ADA,ADA Coin,2024-04-04,32426.74319944285,29627.93074009824,33881.72681889699,28323.384819873878,3279100.5360202966,139948239512.78772,crypto,BINANCE,US,USDT,2024-04-04 00:00:00
crypto,SOL,SOL Coin,2023-07-17,29869.645792752282,29234.231925903645,30576.713565311788,29021.62216383591,3400703.8562128614,327219425347.31775,Crypto,COINBASE,Global,$,2023-07-17 21:00:00
crypto,SOL,SOL Coin,27/05/2023,4415.840204524808,4660.299738039909,4857.791038654976,4235.19207936314,4304034.977189632,348511625500.8077,Blockchain,COINBASE,US,USD,2023-05-27 12:00:00
stock,AMZN,AMZN Inc,03-29-2024,35333.14040842094,35582.929938830304,36713.26324555158,33913.60846759432,2118246.8746621427,504844326244.3303,ai,NASDAQ,US,USD,2024-03-29 13:00:00
crypto,SOL,SOL Coin,2023-11-06,16110.15608443453,16302.655248293966,17001.98610471263,15841.863543990445,4354527.837674115,21391443576.413017,Crypto,BINANCE,Global,USD,2023-11-06 20:00:00
stock,MSFT,MSFT Inc,02-10-2024,35965.067576785834,39059.25169481251,40089.61126677219,34632.38968488924,529214.0369608551,2859829142038.472,Finance,NASDAQ,Global,usd,2024-02-10 05:00:00
stock,GOOGL,GOOGL Inc,14/02/2024,6073.936870296651,5834.350586270966,6235.646604284469,5707.283269448109,6006231.386674373,2180993705936.713,AI,NASDAQ,US,USDT,2024-02-14 09:00:00
crypto,SOL,SOL Coin,2023-04-20,18993.07286703422,19438.248566079885,20380.82757382113,18734.41678461517,9226114.967182484,70670855488.13174,blockchain,BINANCE,Global,USDT,2023-04-20 16:00:00
stock,MSFT,MSFT Inc,12-06-2023,29589.9312749311,27767.32980662302,30576.290406005206,27244.44261642778,6025089.235402207,2289014054359.389,finance,NYSE,US,$,2023-12-06 08:00:00
stock,TSLA,TSLA Inc,17/06/2024,26437.543633423888,25562.157050792983,27124.011231979974,24536.54695261658,8051938.799206408,1474459745284.8398,Automotive,NYSE,Global,USDT,2024-06-17 09:00:00
crypto,ETH,ETH Coin,19/02/2023,4257.464831574426,4203.178771442921,4397.600870177469,4085.009936193978,2768264.565381135,78381897105.98958,Blockchain,BINANCE,US,usd,2023-02-19 05:00:00
stock,TSLA,TSLA Inc,06-20-2024,17356.646747255876,18859.273064421595,19729.29389588885,16924.788920644667,3279512.056188567,1678931839832.4177,finance,NASDAQ,US,USDT,2024-06-20 19:00:00
crypto,BNB,BNB Coin,2024-03-02,1845.28 USD,1835.9683947872888,1876.3105871194534,1828.6737146137161,121018.26969955275,296167303512.87244,Blockchain,COINBASE,US,usd,2024-03-02 23:00:00
crypto,SOL,SOL Coin,05-17-2024,37035.77241752063,36924.79833663742,37193.92077696429,36873.95545565287,5180586.303329603,223361875908.7479,Crypto,COINBASE,Global,usd,2024-05-17 11:00:00
stock,MSFT,MSFT Inc,13/05/2023,11838.12303754829,11799.05269777613,12092.139261913488,11253.285062218607,1062497.3751211248,1846416870513.844,Automotive,NYSE,Global,USD,2023-05-13 16:00:00
crypto,SOL,SOL Coin,2023-05-30,11998.6 USD,11266.584710033803,12301.510922881438,11136.313208336675,620403.2392713001,335801645249.41595,Crypto,BINANCE,US,USDT,2023-05-30 16:00:00
crypto,ETH,ETH Coin,12-10-2023,5969.330037600263,5415.926643019404,5985.072340497446,5371.018891783265,1180606.8637969876,232839128257.11105,blockchain,BINANCE,Global,usd,2023-12-10 10:00:00
crypto,ADA,ADA Coin,05-08-2024,21900.615358274186,23407.349101226104,23714.463325004657,21267.37288176878,400185.40310494846,22834788942.85532,crypto,,Global,$,2024-05-08 02:00:00
stock,AMZN,AMZN Inc,24/10/2023,28884.877901050313,29294.506219041097,29781.420009104957,27896.340875857033,1067129.5657470422,1352744757263.2788,tech,NYSE,US,USD,2023-10-24 03:00:00
crypto,ADA,ADA Coin,31/10/2023,4983.738496959503,5249.467391518451,5503.088662383026,4976.281442841875,8650845.922654564,149885336655.276,Crypto,BINANCE,US,USDT,2023-10-31 00:00:00
stock,GOOGL,GOOGL Inc,05-22-2023,35046.276205221555,33540.72885191334,36151.58392359422,32627.833308780646,4820691.380429548,1806368526525.4612,ai,NASDAQ,US,usd,2023-05-22 02:00:00
stock,AMZN,AMZN Inc,06/06/2024,14103.09859630661,13589.857536927726,14755.114313634247,12948.568667938285,4856857.349834991,2275751915521.722,Automotive,NYSE,Global,$,2024-06-06 20:00:00
stock,TSLA,TSLA Inc,02-19-2023,30522.046760829668,30805.33453865687,31190.007188169,29519.817949241773,8520632.109631125,2739274393219.5063,Finance,NYSE,US,usd,2023-02-19 08:00:00
stock,GOOGL,GOOGL Inc,04/02/2023,25741.962265901428,23680.441484990624,25762.59207583441,23637.44394677388,3770484.6867011297,1682062213987.69,tech,NASDAQ,US,USD,2023-02-04 21:00:00
stock,MSFT,MSFT Inc,2024-03-13,3994.956508632377,4141.263230146948,4334.363441168107,3910.1965656635352,1262027.1084317302,1813607055677.5178,Retail,NASDAQ,US,$,2024-03-13 16:00:00
stock,AMZN,AMZN Inc,26/03/2023,38319.69718310157,37602.47918713568,40005.45298667053,36941.95959041239,8992589.933973735,1749347367145.6953,tech,NYSE,Global,$,2023-03-26 10:00:00
stock,AMZN,AMZN Inc,26/05/2024,6573.085720521163,6322.9031812749045,6639.406495162741,6294.079119893203,7604240.272807539,1874280880629.5383,Artificial Intelligence,NASDAQ,US,$,2024-05-26 01:00:00
crypto,BNB,BNB Coin,2023-05-03,15055.306318384768,14103.945770448945,15624.736460612194,13733.123379691797,2258669.7319541406,272177355719.4524,Crypto,COINBASE,US,USDT,2023-05-03 21:00:00
stock,AMZN,AMZN Inc,17/11/2023,2026.2892684012143,1955.8433986834482,2073.7608688899313,1872.5203953016799,9846560.121430805,1853699714714.1726,Artificial Intelligence,NYSE,US,USDT,2023-11-17 00:00:00
crypto,SOL,SOL Coin,01/01/2023,6526.352970862845,6139.385759549748,6777.31119142145,5963.03364082933,5654593.981585627,87593459012.89763,Blockchain,BINANCE,US,USD,2023-01-01 11:00:00
crypto,ETH,ETH Coin,01-07-2023,1731.2211155799946,1712.4635251671136,1801.9116556389831,1702.637313451085,867978.9693888065,13298617009.612494,crypto,BINANCE,US,usd,2023-01-07 13:00:00
stock,AAPL,AAPL Inc,2023-05-26,45662.35201710073,44639.26651226275,47556.348367902785,42705.70698406301,9354009.50218832,1619705675282.058,Retail,NYSE,US,USDT,2023-05-26 23:00:00
stock,AMZN,AMZN Inc,12-16-2023,47067.30629541721,48729.88578115023,49615.31738608788,46921.82401103709,2756392.1963154757,2256755719418.5947,Retail,NYSE,Global,USDT,2023-12-16 02:00:00
stock,GOOGL,GOOGL Inc,02-14-2023,35043.412815906995,36902.93053811839,38617.81614843692,33650.0909434241,7980182.35415702,1003195840964.5803,Technology,NYSE,US,usd,2023-02-14 14:00:00
crypto,ETH,ETH Coin,2024-01-08,3199.0898671173572,3126.933205877407,3244.3194725399453,3018.1926065227526,9829485.848667454,296725691091.80054,Blockchain,COINBASE,US,USD,2024-01-08 18:00:00
crypto,BNB,BNB Coin,28/07/2023,35886.63112809705,39307.471395990826,40048.81380971435,35531.06668914005,4345875.102081649,258897078324.57153,Crypto,BINANCE,Global,usd,2023-07-28 01:00:00
stock,GOOGL,GOOGL Inc,2023-04-04,9041.070490152046,9850.582947013016,9958.334390021071,8736.48609559183,7562166.148833699,2609905678726.7896,automotive,NYSE,US,$,2023-04-04 06:00:00
crypto,ADA,ADA Coin,2024-03-22,30414.486724554667,30077.333021372186,31543.42675437095,28916.84612613746,585521.4143815332,160533280918.33563,Blockchain,COINBASE,US,$,2024-03-22 05:00:00
crypto,ADA,ADA Coin,19/10/2023,23720.690156772827,22145.731460733008,24141.49198559293,21481.340713295496,574861.0450390473,123472112001.86116,Crypto,BINANCE,US,USD,2023-10-19 20:00:00
stock,AAPL,AAPL Inc,2023-03-02,44218.32796428466,41138.458746098986,45540.03150409795,40448.85312670101,4193927.469512464,1754088672070.7715,Automotive,NYSE,Global,USDT,2023-03-02 17:00:00
stock,TSLA,TSLA Inc,06-23-2024,20542.469859115692,20561.522128816592,20569.081618232594,20225.8283459377,6613765.4467683,2106281786219.1672,Artificial Intelligence,NYSE,Global,USDT,2024-06-23 05:00:00
crypto,ADA,ADA Coin,08-21-2024,18418.822868682702,20183.463393482853,20608.059443928025,17960.143900592197,9099391.651439026,20168346543.9061,Crypto,COINBASE,Global,USDT,2024-08-21 01:00:00
crypto,BTC,BTC Coin,06-29-2023,29107.685854899937,30841.36687701884,32174.27873401323,28317.249285303908,4751608.540953422,288318440966.97375,Crypto,BINANCE,Global,USDT,2023-06-29 12:00:00
crypto,SOL,SOL Coin,2023-12-27,48335.63993952284,50241.671354643404,50450.73465172099,48004.44322428692,4806118.848421845,157490119582.47513,Crypto,COINBASE,US,usd,2023-12-27 21:00:00
crypto,ADA,ADA Coin,06-19-2023,27490.36558561392,27034.928734712747,28696.84818722535,25958.931276519397,8264819.630312337,32157793036.88255,crypto,BINANCE,Global,USD,2023-06-19 21:00:00
stock,GOOGL,GOOGL Inc,01/05/2024,2739.9690576413177,2998.5373627663726,3075.3921608747246,2642.8202837681806,4694599.013050592,1677489186644.5037,RETAIL,NASDAQ,US,usd,2024-05-01 10:00:00
crypto,SOL,SOL Coin,21/12/2023,15252.107188009324,14314.6406795713,15350.537612663315,13812.096158642193,7800700.822313394,343853824489.40814,blockchain,BINANCE,US,usd,2023-12-21 21:00:00
crypto,SOL,SOL Coin,2024-02-08,11381.805368640064,10621.921895925196,11571.158475742595,10590.01596497236,3430924.0991876535,191292414252.12836,Blockchain,COINBASE,Global,USDT,2024-02-08 09:00:00
crypto,BTC,BTC Coin,20/01/2023,24266.670483710153,22709.54578888263,25347.92063182897,22096.791570706675,7097003.76370174,395309010002.081,Blockchain,COINBASE,Global,usd,2023-01-20 14:00:00
stock,MSFT,MSFT Inc,04-11-2024,2518.2657624955004,2315.1397061124717,2608.980839764737,2232.0059335720794,1843829.6681040404,2951297633795.364,automotive,NYSE,Global,usd,2024-04-11 08:00:00
crypto,BTC,BTC Coin,24/11/2023,1102.1171321902282,1162.620189337806,1170.4349401768918,1072.7854207777355,6059362.2549796505,20547942528.79315,blockchain,BINANCE,US,usd,2023-11-24 02:00:00
crypto,SOL,SOL Coin,03/03/2023,1365.061550288293,1442.4609504146354,1443.2191962078493,1348.8098027922738,8933151.633387439,174198961224.69427,blockchain,COINBASE,US,USDT,2023-03-03 22:00:00
crypto,BTC,BTC Coin,01/04/2023,26781.768230158934,26658.483141287223,27302.952981016595,26508.42858498963,8939441.173189236,175971768817.58304,blockchain,COINBASE,US,$,2023-04-01 23:00:00
stock,TSLA,TSLA Inc,03-15-2024,30757.337003194752,33383.44495482128,34989.28630195761,30002.181389389192,4528795.228037983,1014090930278.1882,tech,NASDAQ,Global,USD,2024-03-15 13:00:00
stock,MSFT,MSFT Inc,2024-04-23,47944.004940788596,44519.022390562226,49333.97254373097,42922.014355340194,2790803.895187618,843296004626.2921,finance,NYSE,Global,usd,2024-04-23 03:00:00
stock,TSLA,TSLA Inc,11-03-2023,49939.66 USD,45494.692697772734,51384.26791333221,43407.78781064444,1546053.7790751993,1220856076254.8035,Automotive,NASDAQ,Global,USD,2023-11-03 15:00:00
crypto,ADA,ADA Coin,2023-12-04,25527.9019660086,24296.397215463112,25931.826296678926,23187.226618129123,3032894.618658661,178627362000.29498,crypto,BINANCE,US,USDT,2023-12-04 15:00:00
stock,AAPL,AAPL Inc,05/02/2023,47235.92200980736,45675.98676796428,48584.16261046012,45469.5207819953,62832.04258632585,2900009733747.8267,RETAIL,NYSE,Global,$,2023-02-05 08:00:00
stock,MSFT,MSFT Inc,2023-12-28,47418.99394391806,43543.20943818362,47801.778286230794,43457.747840201126,5375863.896259823,2433943875309.4,TECHNOLOGY,NYSE,US,USDT,2023-12-28 10:00:00
crypto,BNB,BNB Coin,2024-08-06,12889.023618188823,12759.988185271139,13335.569584161409,12589.744664154307,9954219.707741635,10607670616.330862,blockchain,COINBASE,US,$,2024-08-06 16:00:00
crypto,ETH,ETH Coin,2023-02-19,26915.622892405077,27095.007701930306,27644.555773379027,25797.496634906205,9774588.175275242,118566923756.58481,Blockchain,BINANCE,US,$,2023-02-19 09:00:00
crypto,ADA,ADA Coin,08-15-2023,24921.66808442892,25436.277715502514,25725.31147911558,24353.188724052827,6950006.3610816365,342060288733.3015,Blockchain,COINBASE,Global,USDT,2023-08-15 05:00:00
crypto,ETH,ETH Coin,04-23-2024,49514.355677541214,50616.9577513765,51555.835788233955,48950.26840028941,1705454.6533048388,208490976212.70258,crypto,COINBASE,US,usd,2024-04-23 23:00:00
stock,TSLA,TSLA Inc,04-05-2023,17354.477929375516,17117.7874767971,18032.846966111072,16676.29665628573,7940350.488209361,1159702282981.7368,automotive,NASDAQ,Global,USD,2023-04-05 01:00:00
stock,TSLA,TSLA Inc,04-03-2023,17110.051038531194,18170.80146358799,18387.297178310193,16446.508698432244,5045524.7376243025,1733701820388.199,automotive,,Global,USD,2023-04-03 22:00:00
stock,MSFT,MSFT Inc,12-20-2023,464.2608772113039,478.03062523370573,490.2465501852825,451.38965791923164,9669718.177668534,789939245426.6459,TECHNOLOGY,NASDAQ,US,USDT,2023-12-20 08:00:00
stock,MSFT,MSFT Inc,2024-04-01,43172.94457369133,40059.74558001691,44401.66052787502,39795.31045178997,5831474.4670417,1717885560049.112,Technology,NASDAQ,Global,USD,2024-04-01 14:00:00
stock,AAPL,AAPL Inc,2023-12-18,18608.457954932248,17091.680749586634,19034.498874403405,16574.21250263276,8670734.763607094,2156862392599.7346,TECHNOLOGY,NASDAQ,Global,USD,2023-12-18 23:00:00
crypto,BTC,BTC Coin,2024-02-07,48337.04403448005,52766.05252865282,53419.37974295603,46761.38196766575,8955661.852997975,101378144429.22653,Crypto,BINANCE,US,USD,2024-02-07 15:00:00
crypto,SOL,SOL Coin,08-18-2023,22177.52075077384,21383.55240382408,22760.89379556104,21049.722226935784,2735471.679234423,386815777253.96246,blockchain,BINANCE,US,USDT,2023-08-18 17:00:00
stock,AAPL,AAPL Inc,2023-01-09,2592.351282160905,2358.673882249076,2642.4209535467576,2282.426587446064,3157016.5204561558,2212054792111.028,Artificial Intelligence,NASDAQ,Global,$,2023-01-09 17:00:00
crypto,ADA,ADA Coin,03-20-2024,16043.471779755446,15056.021499655373,16291.720078630276,15037.129409249443,4111723.056531491,198952806254.21945,blockchain,BINANCE,Global,USD,2024-03-20 05:00:00
crypto,BTC,BTC Coin,19/10/2023,28831.48404765749,31618.57037848095,32000.524726606698,28372.02856036313,7160130.950723699,180661546859.04263,blockchain,,Global,USDT,2023-10-19 15:00:00
crypto,BNB,BNB Coin,03/07/2023,4438.031198435838,4595.024134088065,4609.749971291996,4348.4146223850785,7396072.191040205,244893144633.26105,Blockchain,BINANCE,US,$,2023-07-03 20:00:00
stock,MSFT,MSFT Inc,2023-07-03,42082.684157063275,38129.88966359902,43858.17966851326,37101.00997591696,2176661.8113765134,640799972953.6517,RETAIL,NYSE,Global,USDT,2023-07-03 11:00:00
crypto,BNB,BNB Coin,03/12/2023,47665.82530744281,43591.97581739975,48140.32291616917,42170.49019443239,6202728.2547622435,57842367272.61736,Blockchain,,US,USD,2023-12-03 02:00:00
stock,GOOGL,GOOGL Inc,09-28-2023,6290.918185691576,6026.357375482916,6366.016578621133,5789.383784515747,4112032.2204633905,1638955244975.5342,finance,NYSE,US,USD,2023-09-28 10:00:00
crypto,BTC,BTC Coin,02-25-2023,10880.472081539625,10590.352736085366,11093.140388986254,10577.886053189834,9546708.902433809,283092423773.70447,blockchain,BINANCE,US,USDT,2023-02-25 05:00:00
stock,AMZN,AMZN Inc,2024-05-13,12090.529451751067,11045.997936544634,12282.106392275717,10641.048641843774,5059752.075663792,2402411372428.707,RETAIL,NYSE,Global,USDT,2024-05-13 11:00:00
crypto,BNB,BNB Coin,05/08/2024,42917.56 USD,45877.708986247504,46702.76352261036,42246.406714941586,3129029.1410446763,312202524476.77826,crypto,COINBASE,US,usd,2024-08-05 13:00:00
crypto,BTC,BTC Coin,23/03/2024,35081.24762749109,31642.07542579656,35798.97941126552,30581.083838654235,6934082.007650006,29057689577.89717,Crypto,COINBASE,US,$,2024-03-23 10:00:00
crypto,BTC,BTC Coin,06/12/2023,15211.69085220448,16159.765613190595,16397.246911167997,14790.57523995952,7270458.251614326,307666961740.3497,blockchain,BINANCE,Global,$,2023-12-06 22:00:00
crypto,ADA,ADA Coin,22/04/2023,49368.54993088688,46654.86959109697,51003.433680121874,45744.357607674996,9151069.44644581,278703490543.7915,crypto,BINANCE,Global,USD,2023-04-22 11:00:00
crypto,BNB,BNB Coin,01/04/2024,37592.39019771078,38105.66628991745,38628.98258868584,36604.52780862714,3338432.194100908,66763045949.72565,crypto,BINANCE,US,USD,2024-04-01 16:00:00
stock,AMZN,AMZN Inc,2023-07-12,44451.14053462515,45067.277654996506,46490.77813637701,43381.5301806004,512603.89894831355,1742147074337.498,RETAIL,NYSE,Global,USD,2023-07-12 14:00:00
crypto,ETH,ETH Coin,2023-08-14,24605.166454309816,23671.327968186535,24828.782633222236,23084.436261806473,3228775.1246850556,96979129966.05722,Blockchain,COINBASE,US,USD,2023-08-14 12:00:00
stock,MSFT,MSFT Inc,01-31-2024,23204.631017844637,21502.730321916973,24281.030888564368,21360.492016387074,7076498.236819613,781741853088.51,automotive,NYSE,US,USD,2024-01-31 14:00:00
crypto,BNB,BNB Coin,2024-08-17,38796.103950939956,41185.612853694205,42766.65566909157,37077.37037356992,6439435.66272058,46954461897.4402,Crypto,COINBASE,US,$,2024-08-17 14:00:00
stock,MSFT,MSFT Inc,23/06/2023,28871.896526971188,29717.308244645355,30398.374684955343,28191.54085225986,344734.2066589004,2504631139290.7017,ai,Unknown,Global,USD,2023-06-23 01:00:00
crypto,ETH,ETH Coin,2023-09-13,4081.546172429048,4028.497985682166,4141.270437115361,3936.9358563361898,1335029.9388965475,257390393679.44742,blockchain,BINANCE,Global,$,2023-09-13 14:00:00
stock,MSFT,MSFT Inc,09-01-2023,39752.62673105423,37076.1177510481,39959.962692287394,35492.06932221693,8771398.491423119,2078013771900.2214,Automotive,NASDAQ,Global,USDT,2023-09-01 20:00:00
stock,TSLA,TSLA Inc,09/07/2023,23368.377190415056,21530.27587926538,24127.33067902488,21388.175619131664,8282030.507365206,1589285892651.505,Technology,NYSE,Global,$,2023-07-09 08:00:00
crypto,SOL,SOL Coin,11-11-2023,3773.1830454171645,3480.683652334613,3782.4856371246387,3351.459654700945,1357479.010136617,252291610047.4165,Blockchain,BINANCE,Global,USDT,2023-11-11 10:00:00
crypto,BTC,BTC Coin,2024-05-15,19259.052205390894,20965.33791829398,21605.17493582198,19100.1397815514,7103804.65562261,107718975899.71138,blockchain,COINBASE,US,$,2024-05-15 13:00:00
crypto,ADA,ADA Coin,03-13-2023,36798.6611146337,35143.44910627213,37974.57676849677,33985.40563935334,9976724.960383328,49438736558.01954,blockchain,COINBASE,Global,USDT,2023-03-13 19:00:00
stock,MSFT,MSFT Inc,27/02/2023,13963.73223400574,15166.490645463466,15185.179102082457,13751.964546157542,7253538.580968046,798018923695.3657,automotive,NASDAQ,US,$,2023-02-27 02:00:00
stock,MSFT,MSFT Inc,2023-03-17,48722.22113881738,53356.69751465666,53530.84512506723,48288.20194306366,6463453.026640155,2510771946457.094,TECHNOLOGY,NYSE,Global,usd,2023-03-17 00:00:00
stock,GOOGL,GOOGL Inc,08/09/2023,6426.212831468593,6619.239770695586,6944.404159272157,6397.879199472451,4391867.4773877,1945552981775.5427,Technology,NYSE,US,usd,2023-09-08 12:00:00
crypto,ETH,ETH Coin,12-09-2023,18121.05156511024,19303.95869848345,19981.044182568792,17631.188490310946,551960.2500531521,20779449448.007263,blockchain,COINBASE,US,USD,2023-12-09 05:00:00
crypto,ETH,ETH Coin,2023-11-06,23456.556736496997,25467.0441709112,26283.37257677541,22649.244115752375,5253657.326242764,173623417490.20453,crypto,COINBASE,US,USDT,2023-11-06 22:00:00
stock,AAPL,AAPL Inc,06-10-2023,48628.68610013034,47267.665479763906,49790.58918010886,45743.95440800331,6825434.789431885,207505370388.2586,AI,NASDAQ,US,$,2023-06-10 09:00:00
stock,MSFT,MSFT Inc,27/08/2023,35768.96230335149,34110.307087393885,36333.51900350717,32618.40963081248,6555444.20848928,1990074153405.4832,Finance,NYSE,Global,$,2023-08-27 05:00:00
crypto,BTC,BTC Coin,25/12/2023,29888.139952817717,32098.044422103,33527.74291552491,29064.77812647869,4593577.578442524,20719865297.582756,crypto,BINANCE,Global,$,2023-12-25 04:00:00
stock,,AMZN Inc,01-19-2024,33541.543621897355,35696.65099437361,36133.31929928531,32571.02053576495,8388554.528315938,240137857193.97192,automotive,NASDAQ,Global,USD,2024-01-19 17:00:00
crypto,ADA,ADA Coin,04-26-2023,12166.567213408654,12289.621418243103,12407.90481558906,11620.214594314366,9111293.893418184,351462584726.60376,blockchain,Unknown,Global,$,2023-04-26 01:00:00
crypto,BNB,BNB Coin,10-04-2023,38004.14474114066,34574.394714760034,39607.40429916209,33602.93041816278,3424608.8378353007,329100464171.6831,Blockchain,COINBASE,Global,$,2023-10-04 09:00:00
crypto,ETH,ETH Coin,06/08/2023,4576.748603750556,4811.669951031755,4951.794218926269,4390.609971829926,1883133.765490687,220858162605.02368,Blockchain,BINANCE,US,$,2023-08-06 17:00:00
crypto,BNB,BNB Coin,2023-02-03,2859.54935372118,2909.762153552885,3032.022819700594,2719.0737363600665,490997.4450677642,77778217371.20631,blockchain,COINBASE,US,$,2023-02-03 00:00:00
stock,MSFT,MSFT Inc,05-20-2024,40976.589312448756,39556.659447451086,41692.88959433189,38758.30024078654,2742854.6783523457,1722583127293.968,automotive,NYSE,Global,USDT,2024-05-20 03:00:00
crypto,ADA,ADA Coin,01-16-2024,36764.07361989879,37687.954149841484,38782.32942307423,36289.236434952145,6752633.144782813,15510304600.685232,blockchain,BINANCE,US,USDT,2024-01-16 15:00:00
stock,AMZN,AMZN Inc,03-01-2024,17630.527536698122,16312.152448132689,17744.99991924299,16048.055230693391,8586142.469718,625587144653.1803,Automotive,NASDAQ,Global,$,2024-03-01 02:00:00
stock,AMZN,AMZN Inc,01-19-2023,31421.072406296724,29435.89736795099,31587.054764001776,29160.452388233203,5787986.007123632,2888570425744.8057,tech,NASDAQ,Global,USDT,2023-01-19 09:00:00
crypto,ADA,ADA Coin,2023-09-24,39075.289816847915,40663.91313421011,42360.53002962337,37231.3540583846,7475458.846828301,249222583300.41934,crypto,BINANCE,Global,usd,2023-09-24 14:00:00
stock,AAPL,AAPL Inc,03-28-2023,14313.890772491133,14715.960160337843,14947.119981103564,14283.810894308412,335202.30078260205,2554049744393.0654,Finance,NASDAQ,Global,usd,2023-03-28 10:00:00
stock,MSFT,MSFT Inc,04/06/2024,8333.51231700526,8687.220255757507,8763.620137402784,8014.915166767339,4944213.739646535,1743580603060.5356,finance,NYSE,Global,USDT,2024-06-04 05:00:00
stock,AMZN,AMZN Inc,2024-08-16,10593.6 USD,9839.845577076865,10995.616367518354,9594.154242774737,9117939.338705333,2745356500490.6655,Finance,NASDAQ,US,USDT,2024-08-16 22:00:00
crypto,ADA,ADA Coin,28/11/2023,32299.935372221735,30574.338109047927,32553.10295794022,30090.391304229892,5937252.514467424,62912750078.1377,blockchain,COINBASE,Global,USD,2023-11-28 08:00:00
stock,GOOGL,GOOGL Inc,2024-01-12,15480.034196544657,15318.954088866003,15793.869967310915,15306.767450314692,2923197.3184371395,2266934100503.3706,TECHNOLOGY,NYSE,Global,USD,2024-01-12 23:00:00
crypto,BNB,BNB Coin,2024-03-24,17733.86495934208,17962.96550229715,18189.58873982988,17658.753121441492,2657589.963097769,121452809146.97292,crypto,BINANCE,US,usd,2024-03-24 00:00:00
stock,GOOGL,GOOGL Inc,11-15-2023,5182.718431692767,5345.002512381229,5587.39450611852,4967.311551344344,9683301.274032451,2688489037364.982,AI,NASDAQ,US,USD,2023-11-15 06:00:00
stock,GOOGL,GOOGL Inc,05/01/2023,47286.298270966814,48958.53133564197,49696.79384659809,45367.18982533879,3038046.727204769,1364121247642.38,Finance,NASDAQ,Global,USD,2023-01-05 19:00:00
stock,AAPL,AAPL Inc,2023-06-29,7201.959637503055,6632.51572715648,7354.2607540515155,6564.724245434359,1414694.1586091856,288122053695.3982,finance,NASDAQ,US,USD,2023-06-29 17:00:00
stock,AMZN,AMZN Inc,22/03/2023,32175.013186371365,30226.384876724343,32332.043399535316,28967.22709993693,9237390.227371885,399658095185.2843,automotive,NASDAQ,Global,USDT,2023-03-22 02:00:00
crypto,ETH,ETH Coin,2023-08-02,17709.687472131154,18261.59489033831,18752.17042518628,17423.786052828254,6827028.85347513,329481144846.5954,blockchain,COINBASE,Global,USDT,2023-08-02 22:00:00
crypto,BNB,BNB Coin,2023-03-05,13312.407413180057,12085.020544846964,13615.641943468245,12019.141402675079,5695403.087927241,253349935948.6972,Blockchain,BINANCE,US,usd,2023-03-05 04:00:00
crypto,BTC,BTC Coin,2023-11-21,49581.3009046318,46245.63166421933,51296.26266890152,45492.506693152434,9799574.518135427,333794461472.2536,blockchain,COINBASE,Global,$,2023-11-21 04:00:00
crypto,BNB,BNB Coin,03-31-2024,34337.063800089236,32576.36075106793,35708.06693818044,31121.873697861192,7807212.342412115,394312289911.35614,blockchain,BINANCE,US,USD,2024-03-31 15:00:00
stock,AMZN,AMZN Inc,19/04/2023,19147.84140447408,19648.118186506625,20070.692948371892,18609.562126517052,3104398.5201920923,2731486411192.642,automotive,NASDAQ,Global,$,2023-04-19 07:00:00
stock,AMZN,AMZN Inc,2023-06-17,46809.466442683595,50935.72895366749,51380.85956129565,46516.30729627689,7374576.982829794,2288767565146.4707,TECHNOLOGY,NYSE,Global,USD,2023-06-17 08:00:00
stock,GOOGL,GOOGL Inc,07/10/2023,3373.5577999465127,3217.02287396429,3527.4271605650015,3158.0192442883804,7210825.554317821,765983828063.9648,Automotive,NASDAQ,Global,$,2023-10-07 14:00:00
stock,TSLA,TSLA Inc,04-08-2023,35972.21 USD,32577.311075254845,36647.27088370158,31969.34246163816,1461819.558847661,778885529816.1965,RETAIL,NYSE,US,usd,2023-04-08 04:00:00
stock,AMZN,AMZN Inc,12-06-2023,11759.214627607813,12117.355885480427,12362.851784498678,11521.704124559057,1075398.0757364524,2470780687596.335,tech,NYSE,US,usd,2023-12-06 23:00:00
crypto,ADA,ADA Coin,30/05/2023,45479.12572474126,43383.72056584429,47343.03539789784,43382.311246706,2115101.1487311125,11680555969.034893,crypto,COINBASE,US,usd,2023-05-30 02:00:00
crypto,ETH,ETH Coin,2023-05-07,33146.36078385694,36231.94645762209,37891.03327906055,32322.467415537267,7951307.71498472,109742442767.42546,Crypto,COINBASE,US,USD,2023-05-07 01:00:00
crypto,SOL,SOL Coin,2023-10-01,48872.134828358576,53410.92160071679,53848.16732736937,47160.20045324594,1002449.8200701625,58619611974.460915,Blockchain,BINANCE,Global,USD,2023-10-01 09:00:00
crypto,SOL,SOL Coin,2023-03-10,40799.62991286618,39806.69427410033,40979.958090116554,38497.502902278684,9813851.95907856,112328451564.78098,Blockchain,COINBASE,US,usd,2023-03-10 00:00:00
stock,AMZN,AMZN Inc,03-17-2023,20813.89 USD,19425.759857036643,21840.194268311265,19251.75265082641,2815491.547206743,1892753949825.0168,automotive,NASDAQ,US,$,2023-03-17 18:00:00
crypto,BTC,BTC Coin,08-05-2023,2840.711613304126,2625.0323734313993,2923.2014163099097,2615.6824571559955,4967937.536631838,32677134809.869835,Blockchain,BINANCE,US,$,2023-08-05 19:00:00
stock,AMZN,AMZN Inc,02/09/2023,22299.872126791794,23230.14940646686,24080.225058151125,21378.846940269566,3612799.373699142,2530406992544.0293,Finance,NASDAQ,Global,USDT,2023-09-02 12:00:00
crypto,BNB,BNB Coin,2024-02-24,3544.1234431364655,3445.97970984015,3638.893209427668,3445.329193822023,4745861.092661785,256734351832.51944,blockchain,COINBASE,Global,$,2024-02-24 21:00:00
crypto,SOL,SOL Coin,11/07/2024,21609.043580480222,22889.987588868087,23571.43945983372,21486.51537814023,4110014.580948749,327342419060.15784,Blockchain,COINBASE,Global,usd,2024-07-11 23:00:00
stock,TSLA,TSLA Inc,02-27-2024,31504.63384413518,30984.06981056404,31731.958748918827,29579.808879796175,167698.83444573137,1816870215266.222,TECHNOLOGY,NYSE,Global,$,2024-02-27 01:00:00
crypto,ADA,ADA Coin,24/05/2024,11831.38086281234,11148.726157692698,12266.796620360008,10769.67845035109,5060940.879425954,350046034376.8598,blockchain,BINANCE,Global,USD,2024-05-24 18:00:00
crypto,BNB,BNB Coin,30/03/2023,47987.68861588384,51362.00436531658,53580.302684588765,46564.3107842691,7623849.77585802,69191870792.49524,Blockchain,COINBASE,Global,USD,2023-03-30 19:00:00
stock,MSFT,MSFT Inc,2023-02-09,440.8639395630961,398.538614754982,453.79451720843264,387.6863067524324,5180635.473736289,440189704615.4427,AI,NASDAQ,Global,USD,2023-02-09 14:00:00
stock,AMZN,AMZN Inc,06-21-2024,21140.104116674713,22062.100843138316,22550.43849790971,20857.058423724444,2330956.625003951,32314789847.48602,Finance,NYSE,US,USDT,2024-06-21 22:00:00
stock,MSFT,MSFT Inc,02-28-2023,29425.67771026808,27723.479346649594,29773.960731762887,27207.86485999513,8299565.992531221,2441294593400.3594,tech,NASDAQ,US,USDT,2023-02-28 09:00:00
crypto,ETH,ETH Coin,2023-10-26,12922.438452088334,13870.97543238919,14335.145634016837,12565.834386018396,4879514.052597739,169172973901.5163,Crypto,COINBASE,US,usd,2023-10-26 15:00:00
crypto,ADA,ADA Coin,28/01/2024,31343.863476941548,30458.352384013706,32904.23180139936,29666.714700655073,4859370.176289942,85681304834.87657,crypto,COINBASE,Global,USDT,2024-01-28 19:00:00
stock,MSFT,MSFT Inc,2024-05-27,45838.63259590615,48596.4506674401,49692.616676516576,45193.91054610457,5862768.752308835,1701896844357.909,tech,NYSE,US,usd,2024-05-27 12:00:00
stock,TSLA,TSLA Inc,12-14-2023,9623.865481489684,9554.45097163568,9742.15173220744,9513.769146431068,3354732.728149973,1482177475616.7344,Retail,,Global,USD,2023-12-14 00:00:00
stock,MSFT,MSFT Inc,2023-09-04,26657.433951834613,27358.761069093587,28101.46996387014,25497.010016814755,3758836.3688604017,2857269403454.783,automotive,NASDAQ,US,USDT,2023-09-04 02:00:00
crypto,BTC,BTC Coin,2024-04-22,31151.472668727252,30820.48325748372,32363.24154765588,29619.209433030057,1646496.0182349198,44162714349.66145,Blockchain,BINANCE,Global,usd,2024-04-22 00:00:00
crypto,ETH,ETH Coin,30/07/2023,46330.003307086874,48279.771984168525,49291.048838357696,45211.76420850159,843045.8987598063,165501231230.6883,crypto,COINBASE,Global,usd,2023-07-30 02:00:00
crypto,,SOL Coin,07-21-2024,33323.701161699,31893.475023090734,34299.766355041174,30473.389927320713,9658400.851407029,393907479068.5647,crypto,BINANCE,US,USD,2024-07-21 07:00:00
crypto,BNB,BNB Coin,2024-07-04,32405.035599580155,30755.32415895211,33567.66570706064,30412.127599158262,6734523.869385415,74040070213.92955,crypto,COINBASE,US,usd,2024-07-04 19:00:00
stock,AMZN,AMZN Inc,2024-08-18,44624.530006661065,40863.813010772465,45362.87580142134,39327.92101726138,9880151.60669215,1847353386163.0256,Retail,NASDAQ,US,USD,2024-08-18 01:00:00
crypto,ETH,ETH Coin,07/08/2024,36633.308835027536,37986.72763063833,38389.541240819424,35239.40718477841,2813564.350966788,158808962968.41504,Blockchain,COINBASE,US,$,2024-08-07 11:00:00
crypto,BTC,BTC Coin,2023-01-02,11723.910031869835,10597.59747182623,12239.406285902764,10579.374813625549,3416362.299928648,167395274912.4548,blockchain,COINBASE,Global,$,2023-01-02 23:00:00
crypto,SOL,SOL Coin,24/07/2024,364.51972059080566,377.6607067001034,393.2475174184477,348.96581539544144,1597503.8273221403,138710217373.06177,Crypto,BINANCE,US,USD,2024-07-24 02:00:00
crypto,BNB,BNB Coin,2024-02-12,30818.37451022369,28013.042952343014,31777.668825337652,27045.077076663983,3687882.8295529885,317082883738.7179,Blockchain,COINBASE,US,usd,2024-02-12 12:00:00
crypto,SOL,SOL Coin,03/05/2023,40548.650281703805,39740.5694234716,42468.938939974345,38561.19394533938,7718588.516265869,309043910227.2677,blockchain,BINANCE,Global,USD,2023-05-03 01:00:00
stock,MSFT,MSFT Inc,2024-01-13,44877.64100283898,48537.51354431976,48749.66326912196,44735.13952890168,8255522.880362636,1456793021047.1345,ai,NYSE,US,$,2024-01-13 05:00:00
stock,MSFT,MSFT Inc,12/01/2023,10053.557870879267,10667.06459542565,11120.485635204208,9696.229458376249,9522648.523544876,2376019035794.874,Retail,NASDAQ,Global,USDT,2023-01-12 07:00:00
stock,TSLA,TSLA Inc,23/06/2023,7503.963569824512,7560.365067994734,7778.0251322491085,7370.824527441248,170674.3240253491,159081837733.5011,automotive,NASDAQ,US,USD,2023-06-23 11:00:00
stock,GOOGL,GOOGL Inc,03/01/2024,2238.96 USD,2079.1248425356775,2240.5276521160076,2034.0970729520238,9322736.572325801,2881496656120.1694,tech,NASDAQ,US,usd,2024-01-03 04:00:00
stock,MSFT,MSFT Inc,03/05/2023,41134.64684933656,37130.44568720348,42249.427243831626,36127.11231164922,4990180.47426371,2001182026580.5881,Technology,NASDAQ,US,usd,2023-05-03 10:00:00
crypto,SOL,SOL Coin,09-29-2023,34224.923699854684,34246.96739041842,35557.16877591916,33344.129261012764,1494666.9806280944,33524208207.39924,Blockchain,BINANCE,Global,USDT,2023-09-29 23:00:00
stock,TSLA,TSLA Inc,05/01/2024,8627.59424163726,9270.168079720665,9554.352609149568,8264.029095582346,9623418.236754587,1948288292692.6877,automotive,NASDAQ,Global,usd,2024-01-05 10:00:00
crypto,ADA,ADA Coin,2024-02-06,3654.1936090640334,3746.8880068105473,3794.3234042117397,3618.3265023856643,8178402.91358834,209754358017.45166,Crypto,COINBASE,US,USDT,2024-02-06 13:00:00
stock,MSFT,MSFT Inc,06-15-2024,25098.45785591494,24872.355284744484,26044.011642352867,23793.480381974245,5469608.222417449,2937052594005.439,Artificial Intelligence,NASDAQ,Global,$,2024-06-15 15:00:00
stock,TSLA,TSLA Inc,2024-06-07,4482.761409291257,4409.22985400379,4674.015017598853,4377.5172667892175,993277.4115318903,1643280324391.2444,Finance,NASDAQ,Global,$,2024-06-07 06:00:00
crypto,BNB,BNB Coin,07-18-2023,13142.15 USD,14127.193024420305,14218.244609454308,12958.154737775181,1012555.030511419,40834748685.39319,Blockchain,COINBASE,US,USDT,2023-07-18 19:00:00
stock,,MSFT Inc,2023-04-04,17809.804282966048,18838.90450997369,19059.028112489388,17488.517042755197,2357589.663224274,1873182182705.9978,finance,NYSE,Global,$,2023-04-04 15:00:00
stock,AMZN,AMZN Inc,2024-05-14,43685.16494769183,40424.51995502597,45578.033727654496,39603.04369311869,1271977.7981793727,2143844246505.3398,RETAIL,NASDAQ,US,$,2024-05-14 18:00:00
crypto,BTC,BTC Coin,31/10/2023,8051.406071320043,8374.022513079335,8691.761455183056,7691.426305036488,5061892.387093749,173879032867.08624,crypto,BINANCE,Global,USDT,2023-10-31 04:00:00
crypto,SOL,SOL Coin,07-06-2024,46808.79044713431,46935.34144545587,49165.42543689208,45722.098562923464,3942510.7555044796,326776897130.2373,blockchain,COINBASE,US,USDT,2024-07-06 08:00:00
stock,GOOGL,GOOGL Inc,2023-05-20,24654.21 USD,24515.66143898431,25258.618944256352,24327.85308790751,8319583.475338833,2546127354373.1577,ai,Unknown,Global,$,2023-05-20 08:00:00
stock,MSFT,MSFT Inc,2024-07-28,16671.659994927544,16644.745347186174,17149.113421766466,16010.861188709949,7939756.89207119,1216524777396.2314,Automotive,NYSE,Global,USDT,2024-07-28 07:00:00
crypto,BNB,BNB Coin,03-16-2023,16708.93696551378,15395.016316568186,16908.479401998877,15355.975457149494,3051691.7685084464,197160692464.30704,crypto,BINANCE,Global,usd,2023-03-16 01:00:00
stock,TSLA,TSLA Inc,2023-03-11,23039.03 USD,22150.130491068463,23079.534610940576,21400.509403030228,5441542.130770747,514889275207.4356,RETAIL,NYSE,US,$,2023-03-11 23:00:00
stock,AAPL,AAPL Inc,08/12/2023,17834.380469632666,17646.41593069425,18695.351164834992,17097.037543160546,2583009.9057865697,1659619992339.7012,tech,Unknown,US,usd,2023-12-08 18:00:00
crypto,SOL,SOL Coin,21/01/2023,22893.652989079666,24081.92583475968,24329.955443482864,22560.889309688628,212477.08367081344,101169482406.37025,crypto,COINBASE,US,$,2023-01-21 11:00:00
stock,AAPL,AAPL Inc,2023-10-09,38795.494609487316,37544.207660499116,39889.017593501965,36051.786421639445,7420211.915870597,1262609604171.9985,AI,,US,usd,2023-10-09 03:00:00
stock,AAPL,AAPL Inc,03-24-2023,42628.60681732626,40055.51330147046,44492.32531210318,38758.77462210045,7227113.061170392,166314518773.59125,Artificial Intelligence,NYSE,Global,$,2023-03-24 12:00:00
crypto,ADA,ADA Coin,2024-08-07,45296.52444502003,41914.11633085606,45700.84074495534,40851.65661533938,820302.4519424231,131093992625.54445,Crypto,BINANCE,US,usd,2024-08-07 11:00:00
stock,AAPL,AAPL Inc,11-02-2023,47188.8814467786,51685.884272883275,52658.24908050152,47007.879103794396,5448701.932058644,595980752258.2682,ai,,US,USD,2023-11-02 16:00:00
stock,AMZN,AMZN Inc,2024-05-18,35122.912066819124,36239.13090273661,38031.382998656234,33832.228091939425,6720922.967114693,816529972962.5635,Automotive,NASDAQ,Global,USD,2024-05-18 12:00:00
stock,GOOGL,GOOGL Inc,07-18-2023,5691.17 USD,5126.5089510516245,5975.570280504808,5075.8266679800345,7867443.4243206745,165551027538.0462,Retail,NYSE,US,USD,2023-07-18 20:00:00
crypto,SOL,SOL Coin,2024-04-22,15010.353474442942,13963.42420256734,15224.006897209449,13527.74527542668,7563344.65970596,206341799738.831,Crypto,COINBASE,Global,$,2024-04-22 23:00:00
crypto,BNB,BNB Coin,29/10/2023,3883.4064915085796,3509.068636443023,3903.2763640232197,3405.638612697656,9331995.977573134,218166406616.7452,Crypto,BINANCE,US,$,2023-10-29 02:00:00
crypto,BTC,BTC Coin,08/03/2024,40093.276734777,39823.64619720736,40818.29565273308,38048.3087918826,8759454.288839864,256773980077.64255,Blockchain,BINANCE,US,usd,2024-03-08 00:00:00
crypto,ETH,ETH Coin,03-17-2024,8414.223698910278,8434.856324336206,8640.403148382038,8256.495521794945,9461922.753018621,314348211466.0216,blockchain,BINANCE,US,USDT,2024-03-17 18:00:00
stock,GOOGL,GOOGL Inc,2023-07-24,27015.46 USD,24585.814497730604,27100.434890034772,23586.827445759347,325675.246145791,1743516610869.8142,ai,NASDAQ,Global,usd,2023-07-24 23:00:00
crypto,ADA,ADA Coin,2023-01-06,36169.28189665822,33536.56496638358,37681.30056919385,32119.286313739678,3012454.6943865907,298624393750.1549,Crypto,COINBASE,Global,USDT,2023-01-06 18:00:00
stock,GOOGL,GOOGL Inc,2024-01-24,18621.63185766666,17707.91965107797,19076.885065096758,17183.240969936305,9865708.338302486,754440928492.4813,RETAIL,NASDAQ,Global,$,2024-01-24 09:00:00
crypto,BNB,BNB Coin,15/06/2024,7117.647005603708,6481.081518162718,7340.372840976196,6174.691395775304,8364560.934023857,27090908300.64914,crypto,BINANCE,US,$,2024-06-15 06:00:00
stock,GOOGL,GOOGL Inc,08-12-2024,26355.111152830872,26679.77717226263,26907.64075337353,25297.863090810286,3188854.4114071736,1540696505738.964,tech,NYSE,Global,usd,2024-08-12 04:00:00
stock,AMZN,AMZN Inc,22/08/2024,10513.787619251325,9707.026271818155,11023.767764733962,9232.34386092021,8027171.35595488,1784554283307.3357,RETAIL,NYSE,Global,$,2024-08-22 01:00:00
crypto,ETH,ETH Coin,02/05/2024,14867.73355111635,13784.252273851976,14975.991946947644,13575.718327947277,6428423.10427065,316273884082.1337,Blockchain,BINANCE,Global,usd,2024-05-02 19:00:00
crypto,ADA,ADA Coin,02-09-2023,46874.68380823124,48673.99070168504,49053.286513732455,45101.514402136025,8422095.115000272,314184541329.2978,blockchain,COINBASE,Global,usd,2023-02-09 00:00:00
stock,TSLA,TSLA Inc,22/07/2023,3635.39 USD,3783.191105079353,3859.3328114618685,3620.8563423888013,6502900.455865522,635825166744.2836,TECHNOLOGY,NYSE,US,USD,2023-07-22 13:00:00
stock,TSLA,TSLA Inc,2023-09-20,47393.3497970105,45104.79378496146,48192.43127269781,43756.747746065856,513191.7397467282,280352743597.0657,Retail,NYSE,Global,usd,2023-09-20 16:00:00
crypto,ADA,ADA Coin,04-02-2024,6174.69136885386,6052.39583504229,6282.967603898224,5983.652748394391,8031901.945815679,201123591781.08893,blockchain,COINBASE,Global,$,2024-04-02 02:00:00
crypto,ETH,ETH Coin,05-09-2023,18333.893857087518,17869.507916491908,18472.691007486454,17689.43108214046,7072576.055025897,65598088543.689766,crypto,COINBASE,Global,$,2023-05-09 09:00:00
stock,TSLA,TSLA Inc,2024-03-27,18342.428210604015,16896.32960409397,18918.569931034366,16154.050125982107,9859355.752080552,579241541028.1338,TECHNOLOGY,NASDAQ,US,USD,2024-03-27 05:00:00
stock,AMZN,AMZN Inc,13/06/2023,19518.025093703913,19824.707654041616,20728.0619080113,19082.870021977167,1745810.365493154,2344239403316.7085,Retail,NYSE,US,usd,2023-06-13 23:00:00
stock,AMZN,AMZN Inc,2024-05-22,42158.81180283697,43374.78168296214,44786.033088275064,41878.07940678495,8939836.601567585,1142323033187.6663,Artificial Intelligence,NYSE,Global,USD,2024-05-22 22:00:00
stock,AMZN,AMZN Inc,2024-02-21,4751.511170725274,4793.444208974697,4970.923762783425,4693.762930191152,6067555.303498069,2760179789620.5146,ai,NASDAQ,Global,USDT,2024-02-21 03:00:00
crypto,BTC,BTC Coin,01/01/2023,39873.05 USD,41628.355686611096,41807.6402133803,38804.076514423854,1740600.017818514,70880997397.5513,Crypto,COINBASE,US,USD,2023-01-01 16:00:00
stock,AMZN,AMZN Inc,2023-01-14,913.8737993622149,895.6566149945365,938.999704918146,878.6204466348621,6635239.960941972,1019056366681.7859,ai,NASDAQ,US,USDT,2023-01-14 06:00:00
stock,MSFT,MSFT Inc,17/06/2023,10780.990734713745,9962.67434352448,11240.01145273854,9542.554749988163,9747626.053280616,2510511026176.3555,Finance,NASDAQ,Global,USD,2023-06-17 08:00:00
crypto,ADA,ADA Coin,25/06/2024,25048.82152842106,27460.629398987057,27594.33071249308,24175.952460152515,6382605.925991074,337802600612.4616,Crypto,BINANCE,Global,USDT,2024-06-25 13:00:00
crypto,BTC,BTC Coin,2023-05-13,46419.343873519785,42386.67347700782,47694.510711550705,41519.58258039018,6527628.509648464,143252713046.9056,Blockchain,BINANCE,US,$,2023-05-13 15:00:00
crypto,BTC,BTC Coin,2024-05-26,18234.675711718024,19488.056313092497,19678.009096068527,18076.825278614757,5626991.573604521,105988158216.0667,Crypto,COINBASE,Global,USDT,2024-05-26 23:00:00
crypto,BTC,BTC Coin,20/03/2023,35683.232239510944,33595.84519199722,36698.08608825902,33373.64756795494,4321730.251782492,306064066921.6624,Crypto,COINBASE,Global,usd,2023-03-20 01:00:00
crypto,ADA,ADA Coin,05-27-2023,22616.232854084887,21000.46421009633,23056.610124389525,20949.750615794863,3197888.7725492027,386803354238.2101,blockchain,COINBASE,Global,usd,2023-05-27 06:00:00
crypto,SOL,SOL Coin,11-12-2023,44063.72157727767,42743.45372120553,44247.153690453626,42154.78640806842,3115811.4778408464,347898773147.4898,Blockchain,COINBASE,US,$,2023-11-12 07:00:00
stock,GOOGL,GOOGL Inc,07/05/2023,22138.31586453905,22073.081962192515,22999.396072568816,21391.4247213759,4431830.3258838225,2350941606630.1416,tech,NYSE,US,USDT,2023-05-07 04:00:00
crypto,BTC,BTC Coin,08/03/2023,18373.352358711225,18468.697478693808,19215.571091765174,17787.029574134136,5243022.950656829,153595235164.00073,crypto,BINANCE,Global,USDT,2023-03-08 11:00:00
stock,TSLA,TSLA Inc,2023-11-25,13479.277920719715,12879.511531971148,14108.364668419574,12701.474549422468,5772289.575556866,2015474703073.3765,ai,NASDAQ,Global,USDT,2023-11-25 12:00:00
crypto,SOL,SOL Coin,20/01/2024,1474.68 USD,1509.511957166967,1547.9674439876972,1441.1854866904498,3594878.84448134,260849421496.14172,blockchain,BINANCE,Global,$,2024-01-20 00:00:00
stock,GOOGL,GOOGL Inc,28/10/2023,9675.028288266489,10547.221858490322,10762.754106327293,9417.035510569218,528045.1887445365,253606954161.69626,TECHNOLOGY,NASDAQ,Global,usd,2023-10-28 08:00:00
stock,MSFT,MSFT Inc,2023-09-20,35861.90053786742,36135.12994901437,37054.237791289175,34504.750897390724,7447762.565567592,122323026336.50197,Finance,NYSE,Global,$,2023-09-20 17:00:00
stock,AMZN,AMZN Inc,26/09/2023,9504.837835614391,9430.152947564782,9640.890018863194,9075.325988280989,6452731.207888763,513027371534.39075,automotive,NASDAQ,US,USDT,2023-09-26 01:00:00
stock,AMZN,AMZN Inc,12-11-2023,41227.60831929846,40549.072525524076,41378.26449463877,39076.46480374678,9800074.626504973,1956405518203.448,ai,NASDAQ,Global,usd,2023-12-11 03:00:00
crypto,BTC,BTC Coin,04/08/2023,35489.756869203,31993.0066991809,36409.306641372255,30453.389093813163,5692732.890702388,240522137216.91733,blockchain,COINBASE,Global,USD,2023-08-04 05:00:00
crypto,ETH,ETH Coin,05-25-2023,48421.27233371539,48813.99476148896,49932.3351096525,48288.155221060755,6736424.710134954,368704485606.24976,Blockchain,BINANCE,Global,USD,2023-05-25 17:00:00
crypto,ETH,ETH Coin,10/04/2024,23291.621627598204,22081.598678435566,23838.746852307868,21480.389143158216,5821865.883344606,30635215417.671738,Blockchain,COINBASE,US,$,2024-04-10 16:00:00
stock,MSFT,MSFT Inc,04-27-2023,8221.879768301844,8227.99591710278,8569.541214240973,8083.757215079454,3384340.291386233,1076743766144.2612,ai,NASDAQ,Global,USD,2023-04-27 06:00:00
crypto,SOL,SOL Coin,06-20-2024,45611.26 USD,42959.859545951556,45701.15076599727,42404.192468200956,8276275.003230183,374531593989.7486,blockchain,BINANCE,US,USDT,2024-06-20 16:00:00
stock,AAPL,AAPL Inc,01/09/2023,44492.92 USD,45387.53844723283,46590.42699348521,42330.21175864404,2467317.8120009336,2903915052194.5522,automotive,NASDAQ,Global,$,2023-09-01 03:00:00
crypto,SOL,SOL Coin,2024-08-19,31428.909965177554,31788.782508118693,32969.15720605333,30297.102951022818,5649961.1239170795,186547826934.50595,crypto,BINANCE,US,usd,2024-08-19 10:00:00
stock,GOOGL,GOOGL Inc,07-25-2023,20689.139523924518,21724.261999208302,22477.44308972666,20679.459838114177,2779633.3687515724,273545307738.46848,tech,NYSE,US,usd,2023-07-25 14:00:00
stock,AMZN,AMZN Inc,15/01/2023,16483.225384562094,16287.414932941345,17189.49049126044,16030.244041718224,8824529.47228447,1499586004530.1975,Retail,NASDAQ,Global,$,2023-01-15 04:00:00
stock,AMZN,AMZN Inc,06-19-2023,43669.32228089349,39824.345655071134,45609.548698692495,38488.38576928081,3146561.7465072507,618498213912.3405,RETAIL,NASDAQ,Global,usd,2023-06-19 09:00:00
stock,AMZN,AMZN Inc,2024-03-23,47035.102484284354,42781.07251278169,47863.463484813954,42474.27230515658,3961148.719877232,1541144844329.0051,automotive,NYSE,US,USD,2024-03-23 02:00:00
crypto,SOL,SOL Coin,02/07/2023,21245.46 USD,20759.163148680385,22217.883090818967,20512.060991978313,5051650.441884319,83666974550.84146,Blockchain,BINANCE,US,usd,2023-07-02 10:00:00
stock,GOOGL,GOOGL Inc,05/06/2024,23269.223788483407,21213.33123329763,23574.369782897687,20615.19004853052,1569869.338837055,2965227994497.4976,ai,NYSE,US,USD,2024-06-05 15:00:00
crypto,ETH,ETH Coin,2023-05-29,38344.77640191048,36567.78130409893,39477.489788659455,36058.481988854444,9412848.010139072,379288224897.997,crypto,COINBASE,US,USDT,2023-05-29 21:00:00
crypto,BNB,BNB Coin,23/10/2023,25764.4593846493,27179.714638158246,27943.661337876823,25188.242261757634,1148304.8414235807,353245962924.28723,blockchain,COINBASE,Global,USD,2023-10-23 22:00:00
crypto,BNB,BNB Coin,2024-01-29,26481.385414972647,25257.212112646197,26509.23973107229,24907.196661826085,325833.4803049594,54824374916.380066,Crypto,BINANCE,US,usd,2024-01-29 12:00:00
stock,,AMZN Inc,12/11/2023,26964.297768424447,29492.549551414784,30206.583551697608,25701.831283452746,5517327.99009681,1789877754901.123,automotive,NYSE,Global,$,2023-11-12 16:00:00
stock,AMZN,AMZN Inc,2023-12-01,49842.495721229185,49148.121707757826,50640.72015634963,48918.730951636775,1913230.0486321375,2524877550142.143,Automotive,NYSE,US,$,2023-12-01 23:00:00
crypto,ETH,ETH Coin,02-10-2023,20291.664064805576,18429.223568058194,20644.01711751508,17752.160176546662,6861225.448280925,248094421438.006,Crypto,BINANCE,US,$,2023-02-10 15:00:00
crypto,ETH,ETH Coin,2024-03-04,13409.678897058102,14245.010543337043,14284.440602135286,13099.996449824921,706430.087035236,379772246588.3077,crypto,BINANCE,Global,USDT,2024-03-04 13:00:00
stock,GOOGL,GOOGL Inc,10-21-2023,38319.900515063935,39530.425491808564,41158.87421814779,37644.5501966999,9689475.027345737,2802758643480.6113,Artificial Intelligence,NYSE,Global,$,2023-10-21 07:00:00
crypto,SOL,SOL Coin,13/08/2023,46233.68389301652,46392.09798895834,46663.64117486206,45142.979788945966,1269601.40780287,287013389406.5848,Crypto,COINBASE,Global,$,2023-08-13 09:00:00
crypto,ETH,ETH Coin,2023-02-19,24129.82809577787,24721.372751473195,24733.79150965737,23158.410069476013,4913812.9886893965,239034924274.68,Blockchain,BINANCE,US,USDT,2023-02-19 19:00:00
stock,MSFT,MSFT Inc,05-23-2023,19186.61592735437,18896.406949459797,19872.24589558199,18522.06228472755,2989962.574833234,2852005649151.513,tech,NASDAQ,US,$,2023-05-23 12:00:00
stock,AMZN,AMZN Inc,02-10-2023,10892.81294487305,11908.069861393484,11985.850028487732,10550.689724644652,259363.8832278919,1238341022746.6091,TECHNOLOGY,NASDAQ,Global,$,2023-02-10 11:00:00
crypto,ETH,ETH Coin,02/09/2023,39025.75220762395,36693.37993998495,39181.97893302368,35729.17548257416,100682.37811045043,92602899313.75082,crypto,BINANCE,Global,USD,2023-09-02 20:00:00
stock,MSFT,MSFT Inc,26/08/2023,40383.21721945312,42575.81063040452,44523.94948630905,40089.46048176844,6832072.456834941,263450801734.73618,Automotive,NASDAQ,Global,USD,2023-08-26 18:00:00
crypto,ETH,ETH Coin,2023-11-25,39144.60241315301,41849.57907711298,43521.64164954262,38182.58277612317,2329785.484656167,25671478633.76182,blockchain,BINANCE,Global,USD,2023-11-25 20:00:00
crypto,BNB,BNB Coin,2023-03-06,36360.868858909525,39857.0476617912,40167.320026258516,34953.09343148686,2118769.7006651456,338905340397.04706,crypto,COINBASE,US,USDT,2023-03-06 14:00:00
stock,AMZN,AMZN Inc,26/07/2023,9353.495749541407,8542.846661570757,9820.497462544274,8126.304810089403,8352605.357528497,2379693905187.797,Retail,NYSE,Global,usd,2023-07-26 19:00:00
stock,MSFT,MSFT Inc,18/03/2023,42082.35683329318,42542.06863360461,44459.93151595512,41927.05817916821,91972.7146264792,1102446856236.452,automotive,,US,usd,2023-03-18 18:00:00
crypto,ADA,ADA Coin,22/05/2023,12525.432891247065,12949.582668269986,13524.720380302562,12187.209848924798,6070124.18962638,34787809517.15137,crypto,COINBASE,Global,usd,2023-05-22 22:00:00
stock,GOOGL,GOOGL Inc,2023-10-22,40250.292025745446,44012.3106165089,44603.393599843905,39233.62187715014,862074.9889532316,573614559858.7278,Artificial Intelligence,NASDAQ,Global,USDT,2023-10-22 09:00:00
crypto,BNB,BNB Coin,16/05/2024,25144.144257915563,23356.07619086429,25699.913089625134,22578.441066813873,5218786.922176588,225858979302.87253,Crypto,COINBASE,Global,usd,2024-05-16 08:00:00
crypto,BTC,BTC Coin,19/03/2024,434.69397457440334,457.38552019761164,473.6916408371874,420.92040009831356,530306.4197526138,236333462494.37567,crypto,COINBASE,US,$,2024-03-19 13:00:00
crypto,BTC,BTC Coin,2023-08-15,47759.20627230184,45277.17556727923,48531.77021038353,43429.44321234512,5769784.297325052,303198353215.0949,Blockchain,BINANCE,US,USD,2023-08-15 02:00:00
crypto,BNB,BNB Coin,06/05/2024,17816.13523363436,18518.137333442104,19036.752568243257,17269.591937392823,4203075.768473611,66162350885.744705,Crypto,COINBASE,Global,$,2024-05-06 01:00:00
stock,GOOGL,GOOGL Inc,03-21-2023,303.1777470791935,277.62046137952404,316.53663885818116,264.8204783547126,7068329.158508841,1690711539043.4563,Retail,NASDAQ,Global,usd,2023-03-21 03:00:00
crypto,ADA,ADA Coin,16/01/2023,13541.473379043538,13190.726027560184,13926.675082644251,13112.708798909423,9419113.967016941,368415074823.07574,blockchain,COINBASE,US,USDT,2023-01-16 04:00:00
crypto,BNB,BNB Coin,2023-11-17,4340.121845126155,4486.951774252289,4579.002424894232,4225.26073739054,492434.7550614252,297127483003.95087,crypto,BINANCE,US,$,2023-11-17 06:00:00
stock,AMZN,AMZN Inc,06/03/2023,39527.77524060705,39163.79426078716,40123.97710489574,37957.58674799688,8544140.733743476,581275796645.611,Retail,NYSE,Global,usd,2023-03-06 23:00:00
stock,GOOGL,GOOGL Inc,2023-09-11,13623.05 USD,12580.888646003352,13794.695882235073,12531.040932743626,5816306.789659704,2249507062040.8213,Artificial Intelligence,NYSE,US,USD,2023-09-11 10:00:00
crypto,SOL,SOL Coin,13/05/2024,29823.72 USD,29024.60905644257,31027.26257836925,28332.787544148032,1168362.2797851865,215724682454.18924,blockchain,COINBASE,Global,usd,2024-05-13 22:00:00
stock,MSFT,MSFT Inc,05-02-2023,26847.588733665893,29191.76026729244,29641.82732798657,26672.463481408766,7641191.770202215,395904723238.89825,ai,NASDAQ,US,USDT,2023-05-02 01:00:00
crypto,BTC,BTC Coin,31/05/2024,1826.6740083289603,1681.2149579070601,1893.2100550381822,1613.938597523473,3713337.9341334323,102885914948.22821,crypto,BINANCE,US,$,2024-05-31 02:00:00
stock,AMZN,AMZN Inc,21/03/2023,36276.15374082364,33470.05701938319,37013.22425047119,32608.325064792232,5408729.812651426,1510080506359.2102,Artificial Intelligence,NYSE,Global,usd,2023-03-21 03:00:00
crypto,SOL,SOL Coin,2024-04-28,8592.192970210413,9121.182417489288,9437.175944097504,8401.390786805165,6995579.176155317,328252453351.1106,blockchain,BINANCE,US,usd,2024-04-28 05:00:00
stock,AMZN,AMZN Inc,11-03-2023,6928.5 USD,7158.196060910428,7345.981422859718,6803.565822164957,3380649.811503872,1241933039465.4526,Technology,NASDAQ,Global,usd,2023-11-03 05:00:00
crypto,BNB,BNB Coin,13/04/2023,29372.61973009309,26937.0566961,30033.215808695066,26608.904157748388,7941551.482760991,363212298049.23517,Crypto,COINBASE,Global,USDT,2023-04-13 16:00:00
stock,TSLA,TSLA Inc,2024-05-24,44738.43106585674,42659.601144455606,45656.90814146298,42443.31037695844,8962670.907999318,1488845187763.6387,Retail,NYSE,US,USD,2024-05-24 22:00:00
stock,TSLA,TSLA Inc,2023-02-23,42950.437550639785,39417.96392728979,44808.03318600125,38078.97492646369,1784136.792769735,2060281178785.796,AI,NYSE,Global,usd,2023-02-23 02:00:00
stock,AMZN,AMZN Inc,05-07-2024,20904.245715614215,19864.01702126269,21239.306894941725,19004.876917441125,2962471.4788244264,725715810662.7185,AI,N/A,US,$,2024-05-07 00:00:00
stock,AAPL,AAPL Inc,2023-04-13,22098.266867472288,21420.816923475173,22923.031784836156,21306.761753127204,7568135.439801068,1721128605480.5835,Artificial Intelligence,NASDAQ,Global,$,2023-04-13 18:00:00
crypto,ADA,ADA Coin,14/07/2023,37224.66397019931,34633.67981772461,37467.21613599785,33500.51263369134,8077215.988071526,136140277336.48328,Blockchain,COINBASE,US,usd,2023-07-14 11:00:00
stock,AMZN,AMZN Inc,03/04/2024,3172.0379108449924,2938.39164753936,3308.236490641153,2884.5872406749663,2532758.4325363967,746581259254.4825,TECHNOLOGY,NASDAQ,Global,USD,2024-04-03 22:00:00
stock,GOOGL,GOOGL Inc,2023-07-25,26383.705325043265,27203.900735460902,27521.081289622427,26204.82774360231,3094376.2522380482,1670334517731.2622,finance,NASDAQ,US,USDT,2023-07-25 00:00:00
stock,AMZN,AMZN Inc,13/05/2024,816.0710721470224,795.28690563951,830.4220825583363,777.1338628310866,728289.8815101878,2085453645388.9482,TECHNOLOGY,NASDAQ,Global,$,2024-05-13 12:00:00
stock,TSLA,TSLA Inc,02-11-2023,10896.86228036075,11282.693617797804,11735.813432631001,10658.153956876315,7409091.184013133,2372492807441.064,Retail,NYSE,Global,$,2023-02-11 00:00:00
crypto,SOL,SOL Coin,2023-11-28,17782.934559628862,18881.416797192156,19159.635766967764,17401.679928446913,7454231.993676254,266434823324.9272,Blockchain,COINBASE,US,$,2023-11-28 17:00:00
stock,AAPL,AAPL Inc,2024-06-04,15145.352704795077,15022.208901837128,15764.769985873307,14969.572406162215,5451289.045186042,1143078170339.3977,Finance,NYSE,Global,$,2024-06-04 01:00:00
crypto,SOL,SOL Coin,11/05/2024,45164.65 USD,41538.35031667103,45688.735743966485,40933.7596407959,8237620.874661084,266279151102.84247,crypto,COINBASE,Global,USDT,2024-05-11 17:00:00
crypto,ETH,ETH Coin,2024-07-17,20761.20777097808,19056.047848624337,21215.651381403237,18323.089925759035,2912673.353511245,343526466190.5783,blockchain,COINBASE,US,$,2024-07-17 08:00:00
stock,AAPL,AAPL Inc,2023-07-18,3785.5990304340844,4033.617258290757,4119.869928561648,3709.1420308949373,897432.6601255543,2319079994944.1426,tech,NASDAQ,US,usd,2023-07-18 16:00:00
stock,GOOGL,GOOGL Inc,04/03/2024,4494.148941552141,4908.998188285376,5107.140486986118,4372.724397299223,2236801.8806883874,1018703644288.2661,AI,NYSE,US,USD,2024-03-04 22:00:00
crypto,SOL,SOL Coin,01-11-2024,17236.38382039132,16067.703329086418,17721.729698059735,16022.5322914006,39299.07471272543,373714766573.6916,crypto,COINBASE,US,USD,2024-01-11 19:00:00
crypto,ETH,ETH Coin,2023-02-02,46922.997544116275,43836.27107023892,47188.6836542754,42894.201584356226,8618576.389125004,99059313085.3295,blockchain,BINANCE,Global,USD,2023-02-02 12:00:00
stock,AMZN,AMZN Inc,2023-10-14,49728.26719165939,51510.2468212212,51701.02765890466,49710.44490811372,4079534.473565124,1436558354904.839,tech,NASDAQ,US,USDT,2023-10-14 03:00:00
stock,AMZN,AMZN Inc,01-05-2023,27898.3803870585,26806.48013861029,28018.98160810624,25468.07057419893,4496383.945849703,869333576197.9928,Finance,NYSE,US,USD,2023-01-05 09:00:00
crypto,BTC,BTC Coin,11/01/2024,28620.036129647528,31477.502316036538,31928.96311367189,27590.36602747392,1598334.852879208,335561051779.50397,blockchain,BINANCE,Global,USDT,2024-01-11 02:00:00
stock,MSFT,MSFT Inc,2024-08-02,14266.47793454229,15102.03714339132,15785.975778144848,14248.707017359673,2323664.25131043,500550128913.3522,ai,NASDAQ,US,USDT,2024-08-02 15:00:00
crypto,ETH,ETH Coin,2023-04-10,16419.471912974077,15148.081151944607,17133.739404382362,14872.466083086914,1648144.2299145362,353112530517.5662,Blockchain,BINANCE,US,$,2023-04-10 18:00:00
stock,AAPL,AAPL Inc,07-15-2023,14370.012166904611,15050.560333589103,15391.768750351059,14362.309800942054,548395.0776136916,1295195459963.8777,automotive,N/A,US,USDT,2023-07-15 00:00:00
crypto,ADA,ADA Coin,07-24-2023,24100.18935382777,24115.29320638479,24496.237455946288,23773.92129052058,8747595.98781626,145231030123.81744,Crypto,BINANCE,Global,$,2023-07-24 04:00:00
stock,AMZN,AMZN Inc,2024-02-06,40256.62 USD,43079.2525158993,44265.10651724183,39906.16034912292,3035735.5875703744,2816770712913.8105,ai,NYSE,US,usd,2024-02-06 03:00:00
crypto,ETH,ETH Coin,2023-01-01,15852.48156078903,15749.08322809704,16078.838840817041,15718.853998549976,3129133.4354286757,162399111033.13968,blockchain,COINBASE,Global,USD,2023-01-01 18:00:00
stock,AMZN,AMZN Inc,08-06-2024,26345.590130860164,24011.89290128744,26491.206378426832,23074.695982076024,4644038.148571535,303153168951.7101,Artificial Intelligence,NASDAQ,Global,USD,2024-08-06 09:00:00
crypto,BNB,BNB Coin,01-31-2023,39986.59618151953,41901.75143763418,42794.9255970399,38654.45114206359,3165371.3718309244,176134118262.066,crypto,COINBASE,US,usd,2023-01-31 09:00:00
crypto,ADA,ADA Coin,2023-12-17,2613.0995870012744,2358.4904777093147,2717.0414231005097,2296.833213036033,1309680.5043972062,310728059481.13354,crypto,BINANCE,US,USD,2023-12-17 23:00:00
crypto,BTC,BTC Coin,10/02/2024,46625.87261533815,49978.30060460245,51751.99313483979,45418.78759265176,5203715.938287666,98048544164.828,blockchain,COINBASE,Global,USDT,2024-02-10 06:00:00
crypto,ADA,ADA Coin,03-28-2023,48288.864489775515,45538.99759695705,50247.2304142433,43711.159382139056,2136161.24136163,390221591437.16364,blockchain,BINANCE,US,USDT,2023-03-28 12:00:00
crypto,ADA,ADA Coin,09/07/2024,20256.004918391543,22004.278044962353,22102.207792730365,19761.27796727799,9185296.78290077,272056748495.0078,crypto,COINBASE,Global,$,2024-07-09 10:00:00
stock,GOOGL,GOOGL Inc,21/03/2023,7834.895378652904,7625.919445212745,8077.432948455453,7305.400100514391,9680253.698285341,2713299844833.72,RETAIL,NASDAQ,US,USD,2023-03-21 08:00:00
stock,GOOGL,GOOGL Inc,2023-06-08,8355.839449933115,7722.726621495681,8391.522428433527,7687.75953017121,1937044.4741448124,2745100492895.7046,TECHNOLOGY,NYSE,Global,usd,2023-06-08 08:00:00
crypto,BNB,BNB Coin,04-30-2024,22448.07976894363,22892.601332646147,22974.711763939653,21580.190557081554,9314972.378802342,169432546775.0201,blockchain,COINBASE,Global,$,2024-04-30 20:00:00
stock,AMZN,AMZN Inc,05/01/2024,39066.71946381055,35311.636121392556,39705.47354819078,34654.76683340686,2752626.9275229834,2726146220733.023,tech,NASDAQ,US,usd,2024-01-05 09:00:00
stock,AAPL,AAPL Inc,07/01/2024,31698.13419700377,28984.182532335934,33138.8232540408,28922.977587917387,778046.4714988632,2729664218210.794,finance,NASDAQ,Global,usd,2024-01-07 19:00:00
stock,TSLA,TSLA Inc,2023-06-14,15175.180467886381,14849.943197186365,15311.492450573776,14536.66293126517,9579835.553135658,1601757102235.3315,Retail,NYSE,US,usd,2023-06-14 19:00:00
crypto,ADA,ADA Coin,2023-10-14,4154.899923910113,4254.618630176992,4326.994584707339,4124.969102969889,4347346.805016385,203713677107.28558,Crypto,BINANCE,Global,USD,2023-10-14 23:00:00
crypto,BNB,BNB Coin,18/07/2023,9563.370078330336,10077.428343137479,10211.2503426759,9452.068418653726,2059667.2203552274,81171645532.18701,crypto,BINANCE,US,USDT,2023-07-18 20:00:00
crypto,BNB,BNB Coin,2024-02-23,23279.693752260573,25343.18648288786,26523.838645363012,22356.504759936877,3582832.193389485,132066115637.01721,crypto,BINANCE,US,usd,2024-02-23 20:00:00
crypto,BTC,BTC Coin,09/06/2023,25504.15411488172,25303.092374501968,26652.810415066186,25214.538354928427,3836290.3426819136,64012758439.24007,blockchain,COINBASE,US,$,2023-06-09 06:00:00
crypto,BTC,BTC Coin,15/12/2023,44812.85009481519,47561.74029709296,47570.43532362394,43289.34665363297,4218320.645119322,199236487492.50082,Blockchain,BINANCE,Global,USD,2023-12-15 22:00:00
stock,MSFT,MSFT Inc,12/06/2024,9986.585078637978,9063.394208728603,10307.838403459433,8729.186210617012,524419.4371346997,696851688212.8628,AI,NASDAQ,Global,$,2024-06-12 15:00:00
crypto,ADA,ADA Coin,2023-05-17,40097.678502277966,42916.45854281637,43953.033167079986,38926.9679759778,9778559.081324317,96236827658.58514,Crypto,BINANCE,US,usd,2023-05-17 02:00:00
stock,AMZN,AMZN Inc,23/07/2023,10775.810549901878,10327.250576007475,10868.890556547185,10006.77822683568,9108431.435670549,609688332168.329,automotive,NASDAQ,Global,$,2023-07-23 04:00:00
crypto,ETH,ETH Coin,03/07/2023,20603.20796512706,22393.25915369643,22447.522759572235,19789.665758041912,5659320.162412488,248062397048.28683,Crypto,COINBASE,Global,$,2023-07-03 17:00:00
crypto,ADA,ADA Coin,2023-09-09,1987.479753065031,1948.9380519667086,2051.9887711511933,1919.5159619105123,6381760.885260177,248143286161.30576,Crypto,BINANCE,Global,usd,2023-09-09 12:00:00
stock,AAPL,AAPL Inc,03-13-2024,4685.070978659496,4616.774306262243,4715.232162553832,4604.683818882353,4752233.48936026,968484040839.1644,RETAIL,NASDAQ,US,usd,2024-03-13 00:00:00
crypto,ETH,ETH Coin,2024-01-26,38317.54051523381,38301.81953786535,38911.527579043715,37941.7206579531,8671654.357860219,130317373870.96269,Crypto,COINBASE,Global,USDT,2024-01-26 01:00:00
crypto,SOL,SOL Coin,2024-08-23,2357.751476159288,2389.0260498824437,2480.2026213076556,2255.955911263336,2287478.843094649,270838225684.0274,Blockchain,BINANCE,Global,$,2024-08-23 07:00:00
stock,GOOGL,GOOGL Inc,2023-06-22,1015.8848754351711,1067.2332108210571,1092.5145404296286,987.7840856099464,71958.22841637686,2648660364153.728,Retail,NYSE,US,USD,2023-06-22 13:00:00
stock,AMZN,AMZN Inc,03-12-2023,17997.646782821957,18144.383869427144,18758.844051822176,17730.04839047553,9559844.608201897,2460000710589.8135,TECHNOLOGY,NASDAQ,Global,$,2023-03-12 09:00:00
stock,GOOGL,GOOGL Inc,15/01/2024,19991.980353211635,21806.067150612256,22506.162095765354,19290.41213880025,1265515.989790308,1598706460177.4612,AI,NYSE,US,usd,2024-01-15 15:00:00
crypto,ADA,ADA Coin,04-29-2023,18115.458323679635,18696.8548335976,19136.994145905523,17389.87061425644,6017264.39959603,337809028078.7466,Blockchain,BINANCE,US,$,2023-04-29 22:00:00
stock,AAPL,AAPL Inc,05-10-2024,20672.99 USD,20865.723601245867,21320.64538320176,20413.204693989603,8279421.620498579,191442376162.54013,ai,NASDAQ,US,USDT,2024-05-10 21:00:00
crypto,SOL,SOL Coin,11-11-2023,1950.26 USD,1830.953621482897,2002.585449338183,1824.9867304283825,8349732.793746117,309641014243.10535,Crypto,BINANCE,US,usd,2023-11-11 03:00:00
crypto,BNB,BNB Coin,2024-08-23,15167.377606046148,14953.359528864557,15524.346348263773,14323.353245694223,311650.2343143187,337801130798.9617,blockchain,BINANCE,Global,USD,2024-08-23 17:00:00
crypto,SOL,SOL Coin,2024-02-11,12043.222157318702,11416.851532376586,12093.429780708913,11376.040713287899,5797791.41228278,379026645286.9042,blockchain,BINANCE,Global,USD,2024-02-11 16:00:00
crypto,ADA,ADA Coin,12-19-2023,45579.73 USD,44172.410433893434,46996.13532233173,42049.483184143544,1868538.5097830622,268479558564.51477,Blockchain,BINANCE,Global,usd,2023-12-19 22:00:00
stock,MSFT,MSFT Inc,14/05/2023,38340.7501333534,37195.455883867064,39063.11023970755,36327.9731094179,3409.8058466603584,2495424957218.928,automotive,NASDAQ,US,USDT,2023-05-14 00:00:00
stock,MSFT,MSFT Inc,07-09-2024,10419.51 USD,9899.539120223804,10839.365235526991,9542.994278401882,1916021.6991794314,731320564753.7034,finance,NYSE,US,usd,2024-07-09 22:00:00
stock,AAPL,AAPL Inc,01-19-2024,43283.59536827287,41044.53241607655,43453.561916012266,39723.72908196396,7476770.593825213,1517747747771.1643,tech,NYSE,US,USD,2024-01-19 07:00:00
stock,TSLA,TSLA Inc,2024-08-13,40841.50054502163,44595.58713443567,46363.04956194439,40032.43670645469,4933922.538935753,1656564728637.4358,automotive,NYSE,Global,$,2024-08-13 04:00:00
stock,AMZN,AMZN Inc,2024-04-22,49216.25572091392,48069.33114738182,49590.86085611745,47268.27702745994,2843598.602665498,129806568181.31734,automotive,NYSE,US,$,2024-04-22 23:00:00
stock,GOOGL,GOOGL Inc,2024-05-03,29342.527713151114,29024.04286632007,30569.219395556716,27957.361490641466,4486877.2835857235,1761477030083.8323,AI,NASDAQ,US,$,2024-05-03 03:00:00
crypto,SOL,SOL Coin,02/12/2023,33184.6 USD,35069.29823335378,35761.57895075167,32597.310265906726,1506958.9197321227,217388390793.43375,crypto,COINBASE,Global,USDT,2023-12-02 14:00:00
crypto,SOL,SOL Coin,04/07/2023,19159.109732985966,20038.59495492948,20058.975289968577,18397.71439567222,4871338.360691456,373395999714.27905,Crypto,BINANCE,US,usd,2023-07-04 17:00:00
stock,TSLA,TSLA Inc,12-12-2023,26367.48494603435,28634.40564016003,29327.067469370144,25695.706157481698,1198348.1382168185,2635974878519.7163,Finance,NYSE,US,USD,2023-12-12 22:00:00
crypto,SOL,SOL Coin,2023-12-20,12355.800969228454,13343.307445928904,13950.977825982252,12320.778520495911,5202784.660541797,322049216440.12683,Blockchain,BINANCE,US,USDT,2023-12-20 08:00:00
stock,AMZN,AMZN Inc,06-01-2024,38928.00884428256,36055.23560656543,40097.71219437745,34314.304771852236,4976163.26780387,2034510416503.0967,Automotive,NYSE,US,usd,2024-06-01 22:00:00
crypto,BTC,BTC Coin,02-21-2024,9154.317068844613,8907.237596103008,9352.250415668399,8739.412958730247,745209.7559667181,66162859239.98982,Crypto,BINANCE,US,USDT,2024-02-21 18:00:00
stock,AAPL,AAPL Inc,01-07-2024,9139.430261352525,9274.648452007315,9570.23363702784,8936.859019590609,7383216.8092725985,1516038366099.9595,finance,NASDAQ,US,USD,2024-01-07 10:00:00
crypto,ADA,ADA Coin,31/05/2023,38257.67851574021,37743.24344100362,39183.86725969676,37079.15508714579,184565.48160824037,137565651475.156,Crypto,BINANCE,Global,USDT,2023-05-31 15:00:00
stock,AAPL,AAPL Inc,08-20-2024,30933.071602115047,29756.669051551165,31065.765640007456,28404.13240337942,9232314.2461053,1965442722046.5425,automotive,NYSE,US,$,2024-08-20 08:00:00
stock,GOOGL,GOOGL Inc,19/08/2023,6363.859662399313,6181.5009337210195,6552.38359367671,6130.680250795404,437565.6262013723,2070945170465.253,automotive,NYSE,US,usd,2023-08-19 03:00:00
crypto,BNB,BNB Coin,09/12/2023,44488.55202486605,40121.249233617295,44936.549747986406,40039.04917120022,6134405.063375189,98470086930.6535,blockchain,,Global,USDT,2023-12-09 16:00:00
stock,AAPL,AAPL Inc,2023-02-11,3358.884808848422,3041.9346209974296,3399.9883353500654,3023.9090015738484,4159720.6293207975,792397386246.1443,AI,NYSE,Global,USDT,2023-02-11 19:00:00
stock,GOOGL,GOOGL Inc,04-14-2023,45915.06891864409,45070.60320999741,46354.19460233205,43982.4139032189,9080928.786911484,2163796773806.319,Automotive,NYSE,Global,USDT,2023-04-14 06:00:00
stock,AMZN,AMZN Inc,2023-01-19,3300.833869724058,3427.964033900794,3525.9862408041076,3285.5614356384376,1225691.687086122,2415079498271.7246,ai,NYSE,Global,$,2023-01-19 04:00:00
crypto,SOL,SOL Coin,23/10/2023,43974.3400486595,43183.011129037644,45034.11046936504,41175.99578397835,2782158.260848659,215944264715.83936,Crypto,COINBASE,US,$,2023-10-23 00:00:00
stock,TSLA,TSLA Inc,02-10-2023,47256.6712127569,45202.58779541548,48345.62732750075,44459.69326282546,1622671.540706366,980274881015.1526,finance,N/A,US,USDT,2023-02-10 22:00:00
stock,AAPL,AAPL Inc,20/01/2023,36929.56658340062,39639.12738659076,40880.34594485965,36318.48107131836,1263708.442373105,1464462737554.2048,Technology,NASDAQ,US,USDT,2023-01-20 08:00:00
stock,MSFT,MSFT Inc,28/04/2024,6637.378133449273,7001.9997628694255,7094.711953984212,6615.339762653853,7199875.434155426,2837871726766.578,AI,NYSE,US,usd,2024-04-28 03:00:00
crypto,ETH,ETH Coin,15/04/2023,10960.768061263567,10835.902940290336,11299.35341781764,10711.275762949364,1040489.7997479833,302756416626.45575,crypto,BINANCE,US,$,2023-04-15 17:00:00
crypto,ADA,ADA Coin,05-17-2023,44512.13132102226,42467.67658143858,46343.27192020083,41444.893388770535,4618603.009138624,385134299999.5387,Blockchain,COINBASE,Global,usd,2023-05-17 21:00:00
crypto,ETH,ETH Coin,08-29-2023,29052.61964571331,30388.39586517956,31012.775454681385,28514.01195784027,6993429.898631882,129201471795.50514,crypto,COINBASE,US,usd,2023-08-29 06:00:00
crypto,BTC,BTC Coin,2024-08-11,2607.7852455777006,2795.4142495365945,2859.464641836174,2511.612222601301,2418403.3102893364,285893117721.0379,Blockchain,BINANCE,US,USDT,2024-08-11 02:00:00
crypto,SOL,SOL Coin,2023-03-20,44342.70865805327,43263.82910945447,46004.952176206476,41310.075105583004,4761090.964808467,195790574573.36044,crypto,COINBASE,US,USDT,2023-03-20 00:00:00
stock,AMZN,AMZN Inc,05-05-2024,38524.185761588924,36293.85490478857,39490.066985654084,34903.11932325047,4096199.71169783,2975141559774.2793,TECHNOLOGY,NASDAQ,Global,USD,2024-05-05 23:00:00
stock,MSFT,MSFT Inc,10/10/2023,38563.52851636728,36466.44675029712,40341.73777777347,35723.56721691795,3799862.9853291833,2342451230967.5444,AI,NYSE,US,$,2023-10-10 00:00:00
crypto,SOL,SOL Coin,28/06/2023,30257.511959352807,30619.939656067978,31364.624297894246,29508.536879305393,1764942.6923684338,203264554408.43994,Crypto,COINBASE,US,USD,2023-06-28 12:00:00
stock,AMZN,AMZN Inc,02-20-2024,27092.598393851356,25093.59736460364,28130.457726840326,25008.83618429598,9473121.685470384,2440071383870.991,finance,NYSE,Global,usd,2024-02-20 06:00:00
stock,AAPL,AAPL Inc,2024-07-13,6784.488509302094,6809.45492039559,6847.79529393929,6762.095429273568,1836612.6939241048,1113363019909.4065,Finance,NYSE,US,usd,2024-07-13 13:00:00
crypto,BNB,BNB Coin,03-18-2024,20337.759978979673,19862.525379887466,21145.843137469175,19322.579332366244,1708511.8317733656,104842514680.70981,Crypto,BINANCE,US,usd,2024-03-18 02:00:00
crypto,BTC,BTC Coin,2024-08-06,25460.578125524225,23665.372709880347,26239.233481309508,23151.535117843516,7147308.461506194,110547908716.99927,Crypto,,US,usd,2024-08-06 17:00:00
stock,AMZN,AMZN Inc,08-21-2024,45613.605509446774,49683.02896344164,50290.93956817836,43632.98363376328,3023464.7282639886,2813736799984.309,RETAIL,NASDAQ,US,USD,2024-08-21 15:00:00
crypto,SOL,SOL Coin,2024-03-16,48602.95319642818,52095.80395226562,52382.3770338224,48475.195468941056,4234156.915480509,358558643242.6943,Crypto,COINBASE,Global,$,2024-03-16 19:00:00
crypto,SOL,SOL Coin,06-11-2024,22125.263100002197,20116.595289975652,22726.9352050008,19451.293243163993,4734875.901006893,8677564851.129704,Crypto,COINBASE,US,USD,2024-06-11 16:00:00
stock,AAPL,AAPL Inc,2023-09-10,43441.36677993283,44848.01193308611,45821.32337473871,43049.15173798556,9055915.79359375,1843379378621.92,Artificial Intelligence,NYSE,US,$,2023-09-10 07:00:00
stock,MSFT,MSFT Inc,2024-07-08,26601.329547864043,25454.875873361118,26663.924069546138,25033.020736676674,8627845.003814796,368082299632.26965,automotive,NASDAQ,Global,usd,2024-07-08 08:00:00
stock,GOOGL,GOOGL Inc,02-26-2023,40622.558744618786,43493.7265337592,45482.130192363824,39130.25876316133,9039626.698833702,497078936887.4082,Retail,NYSE,US,USD,2023-02-26 13:00:00
stock,AMZN,AMZN Inc,2023-02-28,27621.377292640587,25138.25674496763,27681.980097532825,24786.790246412216,4445355.299799932,968781636661.9324,TECHNOLOGY,NYSE,Global,usd,2023-02-28 07:00:00
crypto,SOL,SOL Coin,10/11/2023,9528.770666285262,9852.660233951681,9852.858047794214,9436.289739634065,793416.8116931582,106235488270.84094,Crypto,BINANCE,Global,USD,2023-11-10 01:00:00
stock,GOOGL,GOOGL Inc,2023-12-06,19317.957401001488,19259.45775676913,19660.846427244356,18605.32198861052,9639196.204719812,582553948575.2771,Automotive,NASDAQ,US,usd,2023-12-06 20:00:00
crypto,BTC,BTC Coin,04-19-2024,1181.4134388157365,1164.915214792339,1233.1007906636469,1124.227998959875,946468.891399108,258423974091.14075,Crypto,COINBASE,US,$,2024-04-19 05:00:00
crypto,ETH,ETH Coin,06/06/2023,30304.631458484702,30730.79038580551,30813.112886949904,29002.288421167228,6225871.412734925,304561984778.0175,crypto,COINBASE,Global,USDT,2023-06-06 22:00:00
crypto,,SOL Coin,2024-01-01,25208.463286623733,25434.74295352648,25795.289579027372,25143.457157971454,8424798.604248917,87090417376.24014,Crypto,COINBASE,US,USD,2024-01-01 08:00:00
crypto,BTC,BTC Coin,12-06-2023,3908.91338180636,3600.9926541634027,4005.2253616641638,3449.8794009483695,9782676.369831212,290337535514.9554,Crypto,BINANCE,US,$,2023-12-06 18:00:00
stock,AMZN,AMZN Inc,2023-04-24,24378.51709484406,23716.01166712032,25157.881735125557,22683.22253269955,4303733.9639958665,483975499741.9542,Automotive,NYSE,Global,usd,2023-04-24 02:00:00
crypto,BTC,BTC Coin,01-11-2024,44388.698718337684,40310.13823614715,46416.657440443414,39973.53676808838,2976409.5936917136,113508487958.82175,Crypto,BINANCE,Global,usd,2024-01-11 11:00:00
crypto,ETH,ETH Coin,2023-06-22,1570.3658813339905,1716.9958276041832,1762.2038935673897,1515.6606960567478,3626469.542734176,316769808597.45636,Blockchain,BINANCE,Global,USDT,2023-06-22 05:00:00
crypto,ETH,ETH Coin,29/10/2023,49467.58220696154,44909.559491628046,51087.41580457361,43658.23529126736,9489213.265668962,31230114616.896458,blockchain,BINANCE,Global,$,2023-10-29 15:00:00
crypto,ADA,ADA Coin,03-31-2024,26609.020328661187,26515.123527761953,27544.149703564333,25279.53233644236,1938697.511103525,102169897421.1841,Crypto,COINBASE,Global,$,2024-03-31 08:00:00
stock,AMZN,AMZN Inc,11-30-2023,36910.156234536065,34615.36837736575,37968.53976475785,33257.13716537706,8616387.8758897,651548812077.621,RETAIL,NYSE,US,usd,2023-11-30 15:00:00
stock,AAPL,AAPL Inc,07/07/2023,25929.4638173626,25163.553528753797,26232.913447787032,23968.00919714311,2685732.2618987565,2827134508924.019,automotive,NYSE,Global,$,2023-07-07 19:00:00
crypto,SOL,SOL Coin,20/07/2023,26685.51039614745,29055.40402572431,29631.103824119527,26277.039748100575,4893738.152003739,263423133078.40057,Crypto,N/A,Global,USD,2023-07-20 18:00:00
stock,AMZN,AMZN Inc,04-23-2024,13396.037987059834,13275.341766117412,13711.37067224584,13080.620726945948,9406459.351861952,1542602885613.3928,automotive,NYSE,US,USDT,2024-04-23 06:00:00
stock,AAPL,AAPL Inc,2023-03-04,2119.601424379109,2118.0308529259114,2177.3034751362457,2029.967424488678,7604885.598154391,994670619672.6877,Automotive,,US,$,2023-03-04 10:00:00
stock,GOOGL,GOOGL Inc,2023-08-24,47289.27810325296,44424.55075008012,49359.04288790454,43768.16387777008,4539011.791505309,2954938034240.06,finance,NYSE,US,$,2023-08-24 10:00:00
stock,AMZN,AMZN Inc,2023-05-07,42481.51274737308,42312.733184377124,43274.23342777574,41240.62900347184,5791718.9105464555,1626426873030.9397,AI,NASDAQ,US,$,2023-05-07 15:00:00
crypto,ETH,ETH Coin,08-09-2023,45046.37743604687,46615.675644329305,48091.68856664131,43018.15579214429,6042135.207787746,79685673242.4478,crypto,COINBASE,Global,$,2023-08-09 22:00:00
crypto,SOL,SOL Coin,2023-08-28,3944.096783017999,3965.6401461469,4045.505270352,3863.008178483655,893132.4584043287,52779461584.204475,Blockchain,BINANCE,US,USD,2023-08-28 18:00:00
stock,MSFT,MSFT Inc,06-05-2024,8747.587885107447,9599.778047200367,9869.123921726217,8610.879208679205,3254857.3885453953,1298639357913.3027,finance,NASDAQ,US,$,2024-06-05 04:00:00
stock,AMZN,AMZN Inc,08-18-2024,48793.78443054899,46707.93832025088,49827.74469191207,45890.23160281035,247948.27956342674,293269355190.239,RETAIL,NYSE,US,USD,2024-08-18 05:00:00
stock,MSFT,MSFT Inc,10-27-2023,26833.543719530728,25643.299958124877,26916.201747871615,24569.484740755186,8950443.554675516,2432674800246.688,TECHNOLOGY,NYSE,US,$,2023-10-27 21:00:00
crypto,BNB,BNB Coin,27/03/2023,12502.587064628124,11416.364213211598,12934.310968192089,11172.28675645623,4045790.725057892,275979568454.67694,Crypto,COINBASE,Global,$,2023-03-27 03:00:00
crypto,ADA,ADA Coin,11/04/2024,10848.545653696123,11216.552745681729,11760.930202296571,10401.431114336878,5971569.083535018,148626522430.07523,Blockchain,COINBASE,Global,usd,2024-04-11 04:00:00
crypto,SOL,SOL Coin,08-25-2023,22339.9692000158,21241.500762078853,23261.64358542255,20694.80358823974,5434515.116130442,172553097019.6606,Crypto,N/A,US,USD,2023-08-25 13:00:00
stock,AMZN,AMZN Inc,08-17-2023,9098.605198690819,8345.077619766484,9423.479605096023,8009.703254395373,6901063.4665337885,921235129264.004,Automotive,NYSE,Global,$,2023-08-17 15:00:00
stock,AAPL,AAPL Inc,01/08/2023,20794.582301472677,20666.394082625415,21176.899543233172,19737.046983587483,3097008.468218455,1177225573680.392,RETAIL,NASDAQ,US,$,2023-08-01 11:00:00
crypto,ADA,ADA Coin,06-24-2024,33292.56222942886,31869.13411855851,34058.46199575864,30583.927195349377,2104510.4432168277,267175072474.10568,Crypto,COINBASE,Global,usd,2024-06-24 08:00:00
crypto,BTC,BTC Coin,17/08/2024,44838.36002988815,42244.07228876447,45348.47232454182,40722.4438309614,1274953.3088825946,14103599920.609926,crypto,COINBASE,Global,$,2024-08-17 05:00:00
stock,GOOGL,GOOGL Inc,08-10-2023,3766.3962293475524,3490.848508909769,3887.8166945413222,3375.591271991431,7079770.319185189,1921396020712.275,Finance,NYSE,US,USD,2023-08-10 12:00:00
crypto,ETH,ETH Coin,04/11/2023,12808.498441345038,13194.874355095804,13271.585185209262,12511.60409705788,4372043.902345302,225182774144.7061,crypto,N/A,US,usd,2023-11-04 16:00:00
stock,GOOGL,GOOGL Inc,05-21-2024,30204.209836997612,32447.377385512016,34067.96927378073,29611.84905505978,4047654.037417372,810942012624.148,finance,NYSE,Global,usd,2024-05-21 18:00:00
stock,GOOGL,GOOGL Inc,2024-08-23,12862.233508861636,12809.382535165161,13098.434086685158,12754.183397731516,3683586.3810894396,683369229646.4427,automotive,NASDAQ,Global,$,2024-08-23 18:00:00
crypto,ETH,ETH Coin,18/10/2023,19182.890276574508,20474.359988646553,21140.583706517868,18812.822446093644,3342096.0808162377,152510613502.44702,Crypto,BINANCE,US,USDT,2023-10-18 23:00:00
stock,AMZN,AMZN Inc,21/05/2023,1927.8094291714997,2070.7746862002086,2123.8641618424567,1869.8064856098972,4972175.6398961395,2455533488728.994,TECHNOLOGY,NYSE,Global,usd,2023-05-21 14:00:00
crypto,BNB,BNB Coin,06/07/2024,648.143671629689,696.3074685188242,711.860871916668,626.8510670144278,1383317.410774937,268629134560.86328,Crypto,BINANCE,Global,USD,2024-07-06 08:00:00
crypto,ADA,ADA Coin,2024-03-01,24821.175336506098,24342.854878460235,25663.432395644453,23638.0032904589,9614214.360887887,178588822871.58466,Crypto,COINBASE,US,usd,2024-03-01 22:00:00
stock,AAPL,AAPL Inc,21/04/2023,40375.82200323893,37221.30669870539,41177.87012960995,35987.13694408604,5695254.398977782,1801839778292.5396,TECHNOLOGY,NYSE,US,usd,2023-04-21 15:00:00
crypto,ETH,ETH Coin,28/03/2024,3926.127505922713,3590.5023374984667,4093.050293061249,3449.189157196417,6687863.791243687,345139840424.2631,Crypto,BINANCE,Global,$,2024-03-28 20:00:00
crypto,BNB,BNB Coin,07-29-2024,41646.3508084126,38523.61505182909,41916.60015438461,37669.96710749524,9463840.154930351,219436862282.51804,Blockchain,BINANCE,Global,USDT,2024-07-29 14:00:00
stock,AAPL,AAPL Inc,08-08-2024,16353.8355917322,16702.791521926483,17479.845971765077,16220.492821169875,9954840.623721465,1250843297528.5552,Artificial Intelligence,NYSE,US,usd,2024-08-08 06:00:00
stock,GOOGL,GOOGL Inc,29/11/2023,5651.778654190984,5775.516167854485,6012.478792471141,5449.796615735341,2392871.6692541535,77480063775.1075,ai,NYSE,Global,$,2023-11-29 23:00:00
crypto,SOL,SOL Coin,03-31-2024,2828.5288741230465,2754.637883568214,2900.0636736680535,2694.0838737084346,7286422.952770976,315855440755.57434,Blockchain,BINANCE,US,USD,2024-03-31 12:00:00
crypto,SOL,SOL Coin,06-18-2023,30638.090390283614,31161.238374399214,32014.458166905733,30087.345122207316,2595232.261509695,145164060755.11002,Blockchain,BINANCE,US,$,2023-06-18 18:00:00
stock,AMZN,AMZN Inc,11/03/2023,5972.390885266774,5643.410551770828,6121.75976481405,5598.388198511821,7013232.1275417525,263099773218.04065,Automotive,NASDAQ,US,USD,2023-03-11 06:00:00
crypto,ETH,ETH Coin,2024-06-23,17555.27144006531,17220.505550834452,17900.831058545413,16524.687935147427,613105.3647775766,316671038659.8086,crypto,COINBASE,Global,$,2024-06-23 14:00:00
crypto,ETH,ETH Coin,02/05/2024,49460.9420041951,46165.15867599998,49576.395762670814,45656.260931418525,2526607.4808405573,238411856666.75458,Blockchain,BINANCE,US,$,2024-05-02 09:00:00
stock,AAPL,AAPL Inc,20/08/2024,35199.793985055425,38337.31732281129,39121.175982768465,34604.86438445178,4649082.953351893,2490634978005.256,automotive,NASDAQ,Global,usd,2024-08-20 01:00:00
stock,AMZN,AMZN Inc,01-30-2024,22485.44931132679,21085.200543284158,23056.464391471683,20588.205710685957,8106227.878753351,1895460204952.5452,Artificial Intelligence,NASDAQ,US,USD,2024-01-30 13:00:00
stock,MSFT,MSFT Inc,07-22-2024,33192.94328083279,30626.379239040492,34388.912063995034,29861.18704977651,8941101.261525486,2209206910322.8076,Artificial Intelligence,NYSE,US,USDT,2024-07-22 00:00:00
stock,MSFT,MSFT Inc,05/12/2023,2767.2779641832553,2944.738829057312,2950.2892775239006,2679.717086689255,5423457.45623517,2760414093050.3228,Retail,NYSE,Global,USDT,2023-12-05 11:00:00
crypto,ETH,ETH Coin,2023-11-01,37318.22749032815,33648.76129147739,37632.81837253386,32943.47792123284,7144161.232810887,63499815457.71534,crypto,N/A,US,USD,2023-11-01 00:00:00
stock,AAPL,AAPL Inc,18/02/2023,35277.777630211844,36489.775809718085,37209.246810862234,33516.154332607104,1202472.4280974837,2750762877054.809,TECHNOLOGY,NASDAQ,US,USD,2023-02-18 13:00:00
crypto,ADA,ADA Coin,09-18-2023,33759.74299336254,33202.35804949925,34993.11977535467,32408.59308613191,742687.7797475278,216149045178.63547,Crypto,BINANCE,US,usd,2023-09-18 13:00:00
crypto,ETH,ETH Coin,03-30-2024,42001.511179964706,43890.8462283373,45854.43926748365,40148.314726628414,9902235.123616124,80846419132.33978,blockchain,BINANCE,Global,USDT,2024-03-30 00:00:00
stock,TSLA,TSLA Inc,03-11-2023,598.8760155692341,658.4549491278602,667.7086736749569,588.9352561929455,1767646.4594488756,636126074710.3015,ai,NASDAQ,US,USD,2023-03-11 17:00:00
crypto,ETH,ETH Coin,23/07/2023,45202.70897286342,43577.04930154895,46717.57374371531,41807.61103412183,6248329.191788534,234190270218.66098,Crypto,COINBASE,US,USD,2023-07-23 11:00:00
crypto,SOL,SOL Coin,10-31-2023,10568.300846811704,10173.431188462026,10662.803157599488,10123.538702081634,3972471.676284971,137897888967.9165,crypto,BINANCE,Global,USD,2023-10-31 00:00:00
crypto,ETH,ETH Coin,16/04/2023,22425.907972386485,21620.980090872636,23260.621856331,21589.86740526577,4380898.53331977,101885325464.8751,crypto,COINBASE,US,USD,2023-04-16 00:00:00
crypto,BNB,BNB Coin,2024-03-15,28297.49504724538,26357.620633371724,29274.639728423466,25716.385186469553,6506414.625997783,345108192989.035,crypto,BINANCE,US,USD,2024-03-15 17:00:00
stock,AMZN,AMZN Inc,2023-08-21,22027.324187095743,23794.69809973919,24687.79522812223,21464.09093282727,6032618.134443979,2670165363589.2783,Technology,NYSE,Global,USD,2023-08-21 12:00:00
stock,TSLA,TSLA Inc,15/03/2023,49180.02901394132,50826.09602480839,50937.52424157736,47524.19130330804,6233521.023156816,983487586231.8442,RETAIL,NYSE,Global,usd,2023-03-15 13:00:00
crypto,ADA,ADA Coin,01-28-2023,1203.9707240439468,1191.936853539875,1223.9981858702915,1158.461224051379,2627670.4054901716,27251644730.699722,blockchain,COINBASE,US,USDT,2023-01-28 04:00:00
crypto,ETH,ETH Coin,18/07/2023,34460.27641544708,34560.70135430108,34906.57485029083,33287.91959309341,5918487.268725595,70063510042.47746,Blockchain,BINANCE,US,usd,2023-07-18 10:00:00
stock,GOOGL,GOOGL Inc,2024-04-11,7381.175933216316,6751.186077944956,7680.968790534512,6667.609511056617,7533376.005860692,225965751334.70874,RETAIL,NYSE,US,USDT,2024-04-11 21:00:00
stock,AMZN,AMZN Inc,03-31-2023,33472.58 USD,33318.549350916335,34547.512604001015,31716.52945118957,6215022.762145189,2151812776993.324,Retail,NASDAQ,Global,USD,2023-03-31 02:00:00
stock,AMZN,AMZN Inc,2024-01-04,25022.914435615665,24309.828077419483,25370.01570796952,23875.65703991116,6928319.185100458,2335854339555.2627,TECHNOLOGY,NYSE,US,USD,2024-01-04 23:00:00
crypto,BNB,BNB Coin,2023-04-11,17123.280782224927,18047.158175551343,18553.702043146943,17022.969598847423,5278593.270847912,349032201945.70435,Blockchain,COINBASE,Global,USD,2023-04-11 05:00:00
crypto,BTC,BTC Coin,18/07/2024,28898.075301231045,30339.02208256289,31802.41036956363,27559.46350364641,535292.5893077806,209463782217.19705,crypto,BINANCE,Global,usd,2024-07-18 05:00:00
crypto,BNB,BNB Coin,12/12/2023,26498.482519655125,27107.433624246652,27761.29691219661,25297.647412210095,7681125.694808247,375332383275.8987,Crypto,COINBASE,US,$,2023-12-12 13:00:00
crypto,BNB,BNB Coin,08-03-2024,15592.049041425671,14987.823603285186,16245.232236426404,14292.656313893149,8811170.378417302,300153734809.9918,Crypto,BINANCE,Global,usd,2024-08-03 10:00:00
crypto,,SOL Coin,2023-04-23,29653.30754029714,32239.041435440962,33332.142406708204,28785.10289742992,6895652.5548452465,106381367508.8862,blockchain,COINBASE,US,$,2023-04-23 21:00:00
crypto,SOL,SOL Coin,2024-07-19,13870.148233295815,15247.962371286469,15820.363430974412,13623.758904393671,3553541.1425499683,140871956344.96622,crypto,BINANCE,Global,$,2024-07-19 07:00:00
stock,AAPL,AAPL Inc,2023-10-12,1562.533232997429,1579.465235446283,1639.645445003969,1526.3902135370465,8408009.934319206,156990879173.594,tech,NASDAQ,US,USDT,2023-10-12 06:00:00
crypto,BNB,BNB Coin,11-05-2023,18343.936300532747,17379.303501367773,18754.17364237397,16573.230891482133,9541362.284069154,18203480571.822548,blockchain,BINANCE,US,USDT,2023-11-05 06:00:00
stock,GOOGL,GOOGL Inc,24/03/2024,46116.1656964244,45432.66098811088,48388.595407775545,44419.645273873764,9308397.808893899,677533649197.3892,finance,NYSE,US,usd,2024-03-24 21:00:00
crypto,ETH,ETH Coin,04/07/2023,37414.45792098319,40430.44226108897,40712.89047688543,35723.55985667159,4246301.49925237,7112850534.218023,Crypto,COINBASE,Global,USDT,2023-07-04 10:00:00
crypto,BTC,BTC Coin,07-09-2023,27123.904143920034,27272.84944194389,27465.29501077906,25768.779667884683,8101590.767363867,373803167922.5094,Blockchain,COINBASE,Global,usd,2023-07-09 17:00:00
stock,AMZN,AMZN Inc,08/08/2023,31696.152438578847,34324.50170775017,34682.59535522677,31165.674278180446,787907.0684983871,271847943328.8523,AI,NYSE,Global,$,2023-08-08 19:00:00
crypto,ADA,ADA Coin,2023-10-14,8204.946730450605,8592.144009428044,8721.555142678832,7984.804321058668,5994705.98973419,243483281815.85712,blockchain,COINBASE,US,usd,2023-10-14 17:00:00
crypto,BTC,BTC Coin,27/03/2024,37084.47455269487,35620.67869961835,38312.660171862655,34121.552249265325,6881488.474404296,72652997213.16464,blockchain,COINBASE,Global,usd,2024-03-27 03:00:00
crypto,ETH,ETH Coin,01/12/2023,21273.571248536482,20198.005328233827,22069.601958004067,19452.734282682817,8817291.346647566,55634288760.132385,blockchain,COINBASE,US,USD,2023-12-01 09:00:00
stock,AAPL,AAPL Inc,03/11/2023,9830.101347987065,10053.924783483724,10098.02011208558,9531.038749116757,7133503.973283221,2676542432105.7725,finance,NASDAQ,Global,$,2023-11-03 12:00:00
crypto,SOL,SOL Coin,05-26-2024,31238.78646363633,29880.15455871319,31829.23849730174,28539.949166520943,7190509.181515576,265472182505.71692,Blockchain,COINBASE,US,USD,2024-05-26 06:00:00
stock,TSLA,TSLA Inc,08/10/2023,35441.193960959274,33661.64571439352,36016.117870429545,32541.07534243217,258398.35506241478,1516627502405.9077,tech,NYSE,US,$,2023-10-08 08:00:00
stock,AAPL,AAPL Inc,17/01/2024,40167.1956301665,43358.86891063663,44482.33691137409,39073.64713374532,309215.36237500317,1029733139763.5645,finance,NYSE,Global,USDT,2024-01-17 19:00:00
crypto,SOL,SOL Coin,31/03/2024,660.3805691593772,719.1214313799569,736.7117258305026,638.6518854755134,9242260.129991759,352285713346.22614,blockchain,COINBASE,Global,USDT,2024-03-31 08:00:00
crypto,SOL,SOL Coin,06-03-2023,29075.430494505665,29359.9773375059,29681.93943796684,28245.163304789887,6522987.795431758,14634442278.48821,crypto,COINBASE,US,USD,2023-06-03 02:00:00
stock,TSLA,TSLA Inc,2023-10-28,45.84 USD,49.84046912633546,50.25047021349759,44.07929531975178,2635470.9834927884,2184122278676.9634,Retail,NASDAQ,US,USDT,2023-10-28 20:00:00
stock,TSLA,TSLA Inc,06-10-2023,6161.375658280343,6760.692573607279,6867.246746380447,5888.827541935736,1070805.6204850585,123082208290.58557,AI,Unknown,US,usd,2023-06-10 11:00:00
stock,MSFT,MSFT Inc,2024-03-21,42729.887514991715,40652.80733443562,42774.56057049561,39073.628744618574,566100.3922767766,2161185303333.216,Retail,NYSE,US,$,2024-03-21 06:00:00
crypto,SOL,SOL Coin,2024-06-17,21581.09091118364,20415.359672808503,22137.824656669025,19653.34999654586,9405432.473728374,45840999968.866394,blockchain,BINANCE,Global,USDT,2024-06-17 20:00:00
stock,AAPL,AAPL Inc,01/05/2023,28344.637189473196,27519.377363351323,28884.81069383187,26710.10441507432,7276065.642027305,2718772464099.531,tech,NASDAQ,Global,USDT,2023-05-01 14:00:00
stock,AMZN,AMZN Inc,2023-07-22,42837.93002582981,46642.750298733976,47426.222926027665,41896.98307249034,951470.3117888117,1360400596601.3254,finance,NYSE,US,USD,2023-07-22 03:00:00
stock,AAPL,AAPL Inc,11/02/2024,20679.153677840903,19464.057840241025,21585.48013268808,18644.899590391447,4557152.5547093665,609402452821.4133,automotive,NASDAQ,US,USDT,2024-02-11 09:00:00
crypto,BTC,BTC Coin,02-12-2023,34596.27676896061,33787.203879418455,36099.656365022944,33057.939436749926,4395638.29669507,244251199981.65088,blockchain,COINBASE,Global,usd,2023-02-12 02:00:00
stock,GOOGL,GOOGL Inc,2023-06-06,23239.826527573798,24730.595587920423,25490.493857611433,23044.800754566353,4940622.694322457,211049495815.58948,ai,NYSE,US,usd,2023-06-06 11:00:00
stock,AMZN,AMZN Inc,08/03/2024,691.8558933356948,664.6271500764924,716.0013343955902,657.6572019614923,2958232.5933686737,364200498232.5007,finance,NASDAQ,Global,usd,2024-03-08 16:00:00
crypto,SOL,SOL Coin,03-15-2023,21061.73403265974,20684.82496906511,21305.36428597072,19791.62434253047,1967688.8937539,200783298748.8826,Crypto,BINANCE,Global,$,2023-03-15 03:00:00
stock,AAPL,AAPL Inc,2024-02-08,9914.555783760616,8941.344767938053,10225.50520395751,8635.718609218657,9731473.96955766,175443837618.40485,Automotive,NYSE,US,USDT,2024-02-08 20:00:00
crypto,BNB,BNB Coin,14/10/2023,17297.970229776598,16806.15834863294,17305.279916140873,16671.043518511957,320912.60698310286,81518235056.63765,crypto,BINANCE,US,$,2023-10-14 12:00:00
crypto,ETH,ETH Coin,10-05-2023,44604.7968111701,44921.68638104167,46142.64787775602,43832.638541265995,3871113.069336935,376371034718.05035,crypto,BINANCE,Global,$,2023-10-05 08:00:00
stock,GOOGL,GOOGL Inc,12/10/2023,2247.971750537459,2047.474083376865,2299.363803877015,2001.36725006605,8878288.585717855,1945194627359.588,ai,NYSE,Global,USDT,2023-10-12 13:00:00
stock,AMZN,AMZN Inc,04-01-2023,41134.16988042253,38748.77746340076,41944.685067667946,37424.736454805636,4002152.5733811245,322935295384.6098,Technology,NASDAQ,Global,usd,2023-04-01 11:00:00
stock,MSFT,MSFT Inc,13/08/2024,25183.468019433712,26702.749322297197,27292.25792211801,24542.062183388643,8487827.085227862,459981539237.0308,Artificial Intelligence,NASDAQ,US,USD,2024-08-13 05:00:00
crypto,BTC,BTC Coin,08-01-2024,24527.81588190404,23339.176576184058,25613.08189768332,22845.57679953068,2212254.953496823,283892955282.02216,Blockchain,COINBASE,US,$,2024-08-01 17:00:00
crypto,SOL,SOL Coin,12-23-2023,40158.623115922936,36497.32580235278,42150.675927680044,34910.333898406876,7960889.185443977,111302302292.01408,crypto,COINBASE,Global,usd,2023-12-23 01:00:00
stock,GOOGL,GOOGL Inc,13/01/2023,24615.88700254047,26489.897323004436,27036.796073791334,24046.63692766303,493947.32442929025,1190378197147.3318,ai,NYSE,US,USDT,2023-01-13 08:00:00
stock,AAPL,AAPL Inc,2023-12-12,12247.545651356279,12689.885586233424,12766.827467351137,11704.833607980787,4110195.119750997,17018946863.684929,TECHNOLOGY,NYSE,Global,$,2023-12-12 16:00:00
crypto,SOL,SOL Coin,2023-08-22,35606.47889247404,33316.63103535295,35748.17157694873,33217.3425339205,2607403.1592384554,260895630250.24948,Crypto,BINANCE,Global,$,2023-08-22 00:00:00
stock,AAPL,AAPL Inc,2024-06-11,43175.93760863628,45529.221292412985,45913.56442435704,42791.24315477675,7692736.341856625,2561506027850.0845,Automotive,NASDAQ,Global,$,2024-06-11 19:00:00
crypto,BTC,BTC Coin,08-12-2023,16866.72973809595,16065.589100704072,16969.523358003393,15671.787024569343,5853023.494222955,240705581091.95575,Blockchain,BINANCE,Global,$,2023-08-12 22:00:00
crypto,ADA,ADA Coin,10-15-2023,23773.19979336662,23124.260178593326,24535.138046838783,23010.09479013569,1640038.7002074018,146938901253.73596,Blockchain,COINBASE,Global,USD,2023-10-15 15:00:00
stock,TSLA,TSLA Inc,08-01-2024,7052.021511503557,7228.242742832436,7491.665391366212,7028.013867784445,2789440.3906833883,1150412341610.339,RETAIL,NASDAQ,US,USD,2024-08-01 08:00:00
stock,GOOGL,GOOGL Inc,06/04/2023,3172.500964315533,3237.863280487938,3247.1126771917475,3155.6508897275116,5298560.761643471,2851131505537.636,Automotive,NYSE,Global,usd,2023-04-06 20:00:00
crypto,ADA,ADA Coin,24/04/2023,41580.380556263524,38672.337077543634,41660.613147845936,38438.139619958434,3150017.341361866,269392598551.30444,Crypto,BINANCE,US,USD,2023-04-24 15:00:00
stock,TSLA,TSLA Inc,23/07/2024,23428.377241983457,23889.007607300522,23926.000456338676,22578.976339075805,328965.9428946832,395646934702.2241,Retail,NYSE,Global,usd,2024-07-23 05:00:00
stock,GOOGL,GOOGL Inc,2023-09-24,44756.050453021555,49076.3735890373,50639.57277552361,42879.961169277136,9058588.050603058,1266802813694.542,finance,NYSE,US,USDT,2023-09-24 19:00:00
crypto,ADA,ADA Coin,2023-07-30,7695.93 USD,8345.04373822961,8661.099356161589,7592.689265326978,7092097.857240252,208917890164.0239,Blockchain,BINANCE,Global,usd,2023-07-30 17:00:00
crypto,ADA,ADA Coin,09-09-2023,10558.224518459228,10955.832468988998,11076.194750980749,10261.89300577327,7820236.254113819,84134229333.09473,Crypto,COINBASE,Global,usd,2023-09-09 05:00:00
crypto,,SOL Coin,14/05/2023,22668.556008567724,23993.260804754194,24999.324378390764,22277.2692476913,2285030.0972318933,314661244648.64716,Blockchain,BINANCE,Global,USDT,2023-05-14 12:00:00
stock,MSFT,MSFT Inc,2024-06-04,15748.90935888268,14541.925884083848,15964.007663968336,13967.170241441836,4553832.169336213,829295223352.7871,ai,NYSE,Global,usd,2024-06-04 09:00:00
stock,AAPL,AAPL Inc,04/02/2024,5232.971034530365,5463.502167700936,5651.250776922693,4996.376430205847,9225801.476653095,2726228268138.0723,automotive,NASDAQ,US,USDT,2024-02-04 21:00:00
stock,GOOGL,GOOGL Inc,2023-05-28,18192.638801572855,19126.061559212307,19372.180939242535,17913.84556003028,398072.36451489996,1709731884448.8906,Automotive,NYSE,US,$,2023-05-28 23:00:00
stock,AAPL,AAPL Inc,2023-07-16,22414.060642595712,23026.82929696212,23281.54957249815,22052.15617321762,7722630.518656872,2519830032451.723,RETAIL,NASDAQ,US,USDT,2023-07-16 06:00:00
stock,TSLA,TSLA Inc,09-02-2023,30890.168933849098,30620.349015617918,32271.100605782667,29851.577968410427,8418245.28157916,1424907428784.3523,TECHNOLOGY,NASDAQ,Global,USDT,2023-09-02 20:00:00
crypto,BNB,BNB Coin,15/06/2024,20531.14 USD,19422.801616930978,20948.002394132003,19254.034345191598,2277097.7256581043,321534063016.74817,blockchain,BINANCE,Global,$,2024-06-15 07:00:00
crypto,ETH,ETH Coin,28/03/2023,40306.776430557766,39125.60630014951,41601.04644356864,37649.85019819803,1093685.174236231,212152356613.811,Blockchain,BINANCE,US,usd,2023-03-28 00:00:00
crypto,SOL,SOL Coin,09/01/2023,4957.441484201254,4730.7688129827175,5169.399230308328,4576.1836772319875,9730480.449792096,318781768911.6782,blockchain,BINANCE,US,USDT,2023-01-09 10:00:00
crypto,SOL,SOL Coin,28/12/2023,13421.1182624733,12189.001149626309,13894.255148465709,11854.404842107324,1008427.6867518033,391995062235.6746,Crypto,BINANCE,US,$,2023-12-28 02:00:00
crypto,ETH,ETH Coin,02-03-2023,1568.433706504942,1684.5594999858642,1696.2379217416085,1499.9960332729365,1757547.3073878766,284471513496.3269,blockchain,BINANCE,Global,USDT,2023-02-03 14:00:00
stock,GOOGL,GOOGL Inc,30/09/2023,34661.53631908976,36750.7364034923,37481.40533076584,33511.31529408453,2345605.5838249163,2881196411891.279,finance,NYSE,US,$,2023-09-30 22:00:00
stock,MSFT,MSFT Inc,2024-08-11,27595.918389373084,28323.207955615853,28687.328998515448,27525.071499721664,1698415.2235731513,1447137604654.1028,AI,NASDAQ,US,USDT,2024-08-11 11:00:00
stock,GOOGL,GOOGL Inc,10/08/2024,752.6575641501144,749.8163859856841,765.2031554002544,729.1635714411365,5707075.12522891,2897302992551.5728,Artificial Intelligence,NYSE,Global,usd,2024-08-10 04:00:00
crypto,BTC,BTC Coin,2023-10-11,20748.194046576733,21713.91216301221,22458.565022608283,20575.228056903874,2500339.853413716,177057717415.02008,blockchain,BINANCE,US,USD,2023-10-11 08:00:00
stock,AAPL,AAPL Inc,01-13-2024,29263.887321788763,28501.49171680653,29975.08397869605,27523.580088881703,1419302.131772235,1832490244164.6501,tech,NYSE,US,usd,2024-01-13 15:00:00
stock,GOOGL,GOOGL Inc,10-12-2023,5284.627183596042,5478.118074303865,5659.095208022811,5271.57583802377,7297054.458058765,649265619881.5712,Technology,,Global,usd,2023-10-12 07:00:00
stock,TSLA,TSLA Inc,20/06/2024,44213.416244708416,47420.43783289578,48471.56001845885,43297.89577824227,9760807.246392716,165617057880.83304,Retail,NYSE,Global,USD,2024-06-20 09:00:00
stock,AMZN,AMZN Inc,2023-10-16,45267.03820052073,41492.118104852154,45699.45581247657,40331.90500803777,5847983.32656471,1601590047906.017,RETAIL,NYSE,Global,USD,2023-10-16 13:00:00
stock,TSLA,TSLA Inc,2024-06-18,49413.22313600791,48314.78197481634,49530.371106444196,47834.464201382994,6044202.810108998,2450521277069.7725,RETAIL,NASDAQ,Global,USDT,2024-06-18 00:00:00
crypto,ADA,ADA Coin,2023-01-20,24746.474546504793,25945.739411196322,26945.184584526178,24127.34053495418,3052840.0867584622,83424429252.93965,Blockchain,BINANCE,Global,USD,2023-01-20 20:00:00
stock,GOOGL,GOOGL Inc,23/04/2024,33171.49692171508,32562.717152808444,33636.66617063303,32124.916277423996,2422592.2724920833,2921490320295.0957,TECHNOLOGY,NASDAQ,Global,$,2024-04-23 00:00:00
stock,MSFT,MSFT Inc,09-06-2023,26496.4 USD,25383.48066272797,27329.582100964824,24263.991333244463,6549756.104568648,523412867031.32764,automotive,NASDAQ,Global,USD,2023-09-06 11:00:00
stock,AMZN,AMZN Inc,20/08/2024,22.14429238129145,20.492044978135393,23.178004976213963,20.35613624306594,2336856.7113303323,857056618713.1296,AI,NYSE,Global,USD,2024-08-20 16:00:00
crypto,BTC,BTC Coin,01-21-2023,30432.493942766974,33298.654898530694,33920.68319477882,29947.79654376178,636293.6885167619,312456902295.46906,blockchain,BINANCE,US,$,2023-01-21 21:00:00
crypto,BNB,BNB Coin,03-15-2023,48191.24488279714,48566.9522560714,49266.023760769654,46071.4830104783,7035579.873475123,161517701992.48035,crypto,BINANCE,US,usd,2023-03-15 11:00:00
crypto,ETH,ETH Coin,20/03/2023,18703.196293052693,20390.005217172944,20412.640990805852,18052.06681919766,9210773.793509515,259718137154.7421,Blockchain,BINANCE,US,$,2023-03-20 06:00:00
crypto,BNB,BNB Coin,01-06-2024,12620.119164419968,12706.492294657495,13229.87382404203,12054.199426884412,9430264.075747715,131769498136.17896,crypto,COINBASE,US,usd,2024-01-06 22:00:00
stock,AAPL,AAPL Inc,2023-08-09,9070.700275022082,9455.312409411492,9637.307658774796,8799.619983624316,7833117.634296225,2387267914731.6807,tech,NYSE,Global,USDT,2023-08-09 18:00:00
stock,MSFT,MSFT Inc,02-08-2023,6341.527083631225,6240.861983140353,6494.022295296813,6046.244389595381,3632528.048038534,2888726575862.389,tech,NASDAQ,Global,$,2023-02-08 11:00:00
stock,TSLA,TSLA Inc,2023-08-10,34280.075641925534,33842.7607207277,34613.95295638614,33531.464012616634,8025804.920768128,166283316009.17365,TECHNOLOGY,NASDAQ,US,USDT,2023-08-10 02:00:00
stock,AAPL,AAPL Inc,2023-10-11,14929.54855077655,15341.880961633991,15562.920749930867,14359.24571594453,7305416.02560924,1464310967985.7925,ai,NASDAQ,Global,USDT,2023-10-11 23:00:00
stock,GOOGL,GOOGL Inc,08-24-2023,4747.475867019352,4279.173618789041,4783.780571360208,4079.97594911128,9958027.875431405,130572466765.6426,Retail,NYSE,US,$,2023-08-24 15:00:00
stock,AAPL,AAPL Inc,12-02-2023,7471.907953335672,7084.857529370872,7821.640158501253,6914.877706531009,3648816.144982261,873541810162.7279,Technology,NYSE,Global,$,2023-12-02 21:00:00
crypto,SOL,SOL Coin,28/01/2024,19755.563624746133,19103.663885998416,19960.31277787259,18509.34586875665,3167526.8758132434,349989625874.14166,crypto,COINBASE,US,USD,2024-01-28 02:00:00
stock,AMZN,AMZN Inc,01/02/2023,14486.239406489649,14709.906208249153,14758.369586623092,13900.480462153728,4074645.310841876,2035138838301.4417,Automotive,NYSE,US,USD,2023-02-01 15:00:00
crypto,BNB,BNB Coin,08-23-2023,18868.826765927613,19488.00399986591,19736.56104040905,18045.234154555994,586307.4642004212,375094955293.9347,crypto,BINANCE,US,USD,2023-08-23 17:00:00
crypto,BTC,BTC Coin,02/07/2023,7891.47472957743,7376.967067260025,8191.65037244875,7013.960560285486,5578543.447228609,125638331924.38678,crypto,BINANCE,US,usd,2023-07-02 17:00:00
stock,TSLA,TSLA Inc,2023-07-08,25332.434495428275,25650.763069142504,26052.669093344863,24439.604064138806,7334285.091499723,1144589527974.4597,AI,NYSE,US,USD,2023-07-08 23:00:00
crypto,ETH,ETH Coin,2024-01-19,9637.15580660181,8861.593666926547,10069.765710037493,8573.545554817425,5513622.589237479,349154410307.85706,crypto,COINBASE,Global,USD,2024-01-19 11:00:00
crypto,BNB,BNB Coin,17/05/2024,6298.858793939105,6411.396277410315,6579.740582517909,6047.847242513374,4519238.577478126,147019542085.40137,Blockchain,COINBASE,US,$,2024-05-17 08:00:00
stock,AAPL,AAPL Inc,16/08/2023,29525.400894363487,27145.16539197977,30334.428614584464,26741.704490455504,7927241.354401733,2392873037006.7812,RETAIL,NASDAQ,Global,usd,2023-08-16 04:00:00
stock,AMZN,AMZN Inc,01/11/2023,7641.381645393779,7962.584473728682,8232.254057079452,7268.645319871926,4118064.9282348417,1891061560116.4575,Finance,NYSE,US,USDT,2023-11-01 20:00:00
crypto,BNB,BNB Coin,06-16-2024,33473.909092039634,31573.50028940165,34462.84874377358,31436.480709912725,7978225.919713869,136515347550.13745,Blockchain,BINANCE,Global,$,2024-06-16 17:00:00
stock,AMZN,AMZN Inc,23/10/2023,48925.51328696517,44137.37024639138,50448.91011655257,42841.584001630916,8598685.048860881,2765158631287.426,Technology,NYSE,Global,USD,2023-10-23 15:00:00
stock,TSLA,TSLA Inc,2023-12-08,49051.66416086266,50167.17718775737,52157.65376089369,46809.02097868865,1835395.3897038915,762925959007.3038,Artificial Intelligence,NYSE,US,$,2023-12-08 09:00:00
stock,GOOGL,GOOGL Inc,03-06-2024,1109.106236745787,1179.3965068342347,1180.219078030185,1090.0916550427983,3651574.108397827,2277626982372.2676,TECHNOLOGY,NYSE,Global,$,2024-03-06 18:00:00
stock,MSFT,MSFT Inc,10-13-2023,34804.61003538579,33708.09232195973,34992.48958063395,32140.06917285682,5889771.289602916,1838369609630.4053,TECHNOLOGY,NASDAQ,US,USD,2023-10-13 08:00:00
crypto,BNB,BNB Coin,2024-02-05,37112.62844596541,37184.890519067034,37970.32054169398,35995.70010041634,265442.57907407696,210658864724.97406,blockchain,BINANCE,US,usd,2024-02-05 19:00:00
crypto,BNB,BNB Coin,26/06/2024,48801.247674649465,52447.24331379038,53310.99189498886,47795.44274815024,8473120.158609403,137545094670.17957,crypto,BINANCE,US,$,2024-06-26 05:00:00
stock,AMZN,AMZN Inc,04-30-2023,907.7136088700465,830.4690800222362,930.8781298218686,829.2000973438683,6932402.212646459,1329410266882.7053,Artificial Intelligence,NYSE,Global,USDT,2023-04-30 07:00:00
crypto,BTC,BTC Coin,29/11/2023,9476.15018083522,9990.369951367049,10410.684676054667,9295.011005024056,6444587.2731285365,33011895618.234966,blockchain,COINBASE,US,usd,2023-11-29 23:00:00
crypto,BTC,BTC Coin,09-03-2023,41428.22767647961,43816.773867996744,44384.27808464876,40824.777317843225,2149331.209643556,16193292901.436934,crypto,COINBASE,Global,$,2023-09-03 05:00:00
stock,GOOGL,GOOGL Inc,10-28-2023,10064.81576409296,9417.907534619442,10234.784332184347,9144.058091503794,5085880.376085581,130587181544.02385,Technology,NYSE,US,usd,2023-10-28 02:00:00
stock,,TSLA Inc,07-18-2023,13541.023552204815,12265.921339023354,13950.708318114346,11895.334019733828,2987422.9017181094,1435494087769.9011,tech,NYSE,US,usd,2023-07-18 10:00:00
stock,AMZN,AMZN Inc,12-31-2023,37339.69795683001,40011.469459947344,41001.718908639195,35717.15972936468,6962518.139776602,2602153718063.232,Artificial Intelligence,NASDAQ,US,USD,2023-12-31 15:00:00
crypto,,BNB Coin,24/06/2024,22067.071157894923,20147.239449116318,22977.678120068747,19266.74528923846,9031071.972986048,86399143075.18422,blockchain,COINBASE,Global,USD,2024-06-24 14:00:00
crypto,ETH,ETH Coin,08-13-2024,23234.49239431791,24370.04663118075,25124.84189790093,23005.72051979993,4318619.202758335,346371087893.31506,Blockchain,BINANCE,Global,usd,2024-08-13 04:00:00
crypto,SOL,SOL Coin,2024-03-10,23128.216285086746,25167.96670819711,25780.01655026527,22506.78339977904,7850933.543773564,315394351276.51825,blockchain,BINANCE,Global,usd,2024-03-10 07:00:00
crypto,ETH,ETH Coin,02/12/2023,27728.910824915325,25953.139249807737,28377.43213860747,25911.70831091359,7530108.944198812,329523188245.531,blockchain,COINBASE,Global,USDT,2023-12-02 08:00:00
crypto,ETH,ETH Coin,2023-03-03,1650.946685973814,1640.3342232439038,1704.3235368584428,1626.3940629500141,493687.26217413193,325409228532.2572,Blockchain,BINANCE,Global,USD,2023-03-03 14:00:00
crypto,BNB,BNB Coin,12-29-2023,27424.562827728165,25764.35642152568,27859.59210852563,24839.325273303806,5309059.48385047,341713359828.53986,Blockchain,BINANCE,US,USD,2023-12-29 23:00:00
crypto,BTC,BTC Coin,2024-03-04,7935.222563411177,8431.480342054621,8487.382739117607,7631.0640024216245,4534252.685435969,25415843564.897068,Crypto,,US,USD,2024-03-04 09:00:00
crypto,SOL,SOL Coin,04/02/2024,38182.88787591179,37780.687866451524,39690.85348901927,37059.73091412182,1131884.2944988008,209262750804.76553,Blockchain,COINBASE,Global,usd,2024-02-04 14:00:00
crypto,ADA,ADA Coin,13/06/2024,21857.315935234044,21406.57171292873,22669.910035898807,20957.82268875395,3881942.6769414907,66750918165.17124,crypto,COINBASE,US,USD,2024-06-13 00:00:00
stock,AMZN,AMZN Inc,28/07/2023,11349.586745251503,11520.96781694539,11764.889059130206,11074.31812945545,1707603.6755870346,520573247516.653,Finance,NASDAQ,Global,usd,2023-07-28 22:00:00
crypto,ETH,ETH Coin,2023-07-01,42628.41165538979,40564.68078535085,43676.035193051765,40515.04448103925,3333084.1637667255,266847969676.1035,crypto,BINANCE,Global,USD,2023-07-01 01:00:00
stock,GOOGL,GOOGL Inc,08-14-2023,4518.883053010216,4614.696932624055,4635.3781060907795,4509.67253798629,7156910.858071041,1789188571322.046,Finance,NASDAQ,US,USD,2023-08-14 10:00:00
crypto,ADA,ADA Coin,24/07/2024,35208.17699497413,35840.016151727854,36646.260218776515,34958.85623934551,9568399.839763088,316323116313.60406,blockchain,BINANCE,US,$,2024-07-24 17:00:00
stock,AMZN,AMZN Inc,2024-03-21,46577.437107271544,47353.72378206277,48628.448585808976,45306.997297436414,2093668.3275396684,1502118156983.2031,ai,N/A,Global,$,2024-03-21 21:00:00
crypto,BTC,BTC Coin,03-04-2024,12082.896280534504,12106.393095335246,12336.390322462315,11749.701491173164,9806501.547420932,6469266023.13338,Blockchain,BINANCE,Global,USDT,2024-03-04 06:00:00
crypto,BNB,BNB Coin,2023-09-09,22614.625138611795,20957.043453554434,22668.852445689812,20721.705825457437,5707261.067544715,143357586414.3844,crypto,COINBASE,US,$,2023-09-09 10:00:00
stock,AAPL,AAPL Inc,2023-12-02,7501.641316338716,7609.408051859899,7705.911506187247,7212.101147938603,116248.61451579958,2284507370071.246,Retail,NYSE,Global,$,2023-12-02 21:00:00
stock,MSFT,MSFT Inc,2023-04-02,15470.31289386977,14284.911803880697,16232.889820980754,13791.105721884798,1304109.1430765793,399718763471.52496,finance,Unknown,Global,$,2023-04-02 07:00:00
crypto,ETH,ETH Coin,21/12/2023,29389.284384790408,26826.794613484642,30656.6004804838,26775.152603601724,2468227.459253141,83637513567.0433,Blockchain,BINANCE,US,usd,2023-12-21 11:00:00
stock,TSLA,TSLA Inc,07-26-2024,1116.5012069645586,1147.9218341125982,1171.6795720999344,1075.7521767839999,2069164.2690554683,1355784853086.6694,Automotive,NYSE,Global,USDT,2024-07-26 18:00:00
crypto,ADA,ADA Coin,2023-04-20,20816.689381305398,19483.002766015226,21533.93786626279,19059.317870384588,8586861.877240032,263339115675.2104,Crypto,COINBASE,US,usd,2023-04-20 14:00:00
stock,GOOGL,GOOGL Inc,06/02/2023,39285.47343120336,40648.811254878805,40882.564148047415,38686.01782578443,4416031.341509424,361252937640.71375,Technology,NYSE,US,usd,2023-02-06 10:00:00
stock,AMZN,AMZN Inc,10-22-2023,7089.151417388786,7291.664924379154,7430.9284493448995,7073.844050429232,3300418.9780074744,2835504508811.9707,ai,NYSE,US,USD,2023-10-22 23:00:00
crypto,SOL,SOL Coin,05-17-2024,45075.28 USD,43005.269810096426,46886.27113308702,42995.817685722875,2527377.358710652,385063434249.26105,Crypto,BINANCE,US,USD,2024-05-17 20:00:00
stock,,TSLA Inc,13/11/2023,26013.835020972318,24946.909500745027,26033.68987198099,23974.14124238093,2820086.9065332427,1315963736276.7258,RETAIL,NYSE,Global,USDT,2023-11-13 04:00:00
crypto,BTC,BTC Coin,2023-11-26,8563.41289588596,9202.679130193777,9527.032678685173,8171.722594505164,6501274.418948174,180221882020.68393,Crypto,COINBASE,Global,USD,2023-11-26 07:00:00
stock,AMZN,AMZN Inc,06-13-2024,47811.496470444945,43059.23329943701,48404.1975428849,42903.77112264773,9321407.020067433,1964432864452.805,Technology,NASDAQ,US,usd,2024-06-13 18:00:00
stock,AMZN,AMZN Inc,04/09/2023,38290.50841916652,35162.043371412954,39274.33676806563,33811.08776203157,1812999.218092559,2164553393918.2058,Retail,NASDAQ,Global,usd,2023-09-04 15:00:00
stock,MSFT,MSFT Inc,2023-09-01,6760.556452660566,6718.16997710368,7077.822011358574,6444.684045072623,9779956.243958607,2432806864378.764,Artificial Intelligence,NASDAQ,Global,USDT,2023-09-01 18:00:00
crypto,ADA,ADA Coin,2023-05-31,27785.30156257332,25952.264875216966,28224.455044415387,25205.479153018747,3093932.919357871,397743754375.61835,crypto,BINANCE,Global,usd,2023-05-31 11:00:00
crypto,BNB,BNB Coin,2023-07-31,48611.763163725715,45241.65378094912,50394.18129472043,42980.49920053952,5962230.511354366,115851054051.22372,blockchain,BINANCE,US,$,2023-07-31 02:00:00
stock,AMZN,AMZN Inc,05/10/2023,14403.825363720018,13497.899576957223,14873.159461644704,13303.935709814967,6880617.159000861,2748669581822.6167,tech,NASDAQ,Global,$,2023-10-05 22:00:00
crypto,ETH,ETH Coin,04-16-2023,12617.598083944951,13768.118119312068,14403.722953780225,12275.230038784697,8462092.46767758,131130167608.44275,Crypto,COINBASE,Global,usd,2023-04-16 14:00:00
crypto,SOL,SOL Coin,04-13-2024,21225.207013444793,19768.151515066882,21677.734854486233,19310.930912763757,226020.76995943597,183667773665.54694,crypto,BINANCE,Global,$,2024-04-13 00:00:00
stock,AMZN,AMZN Inc,2024-03-19,39069.99735757607,40476.87714693301,41762.335717296075,38893.31389897779,181302.0662424749,1337897885474.465,automotive,NASDAQ,US,USD,2024-03-19 02:00:00
crypto,BNB,BNB Coin,04-07-2023,39369.57 USD,39695.0401717189,40337.892520274865,37669.296786121835,8875743.155090097,225033796545.9325,Crypto,COINBASE,US,$,2023-04-07 07:00:00
crypto,ETH,ETH Coin,21/07/2023,43906.978697315215,44660.8801594737,46166.38082570392,43477.26363106809,6591896.290456744,190951144993.10318,crypto,BINANCE,Global,USDT,2023-07-21 04:00:00
crypto,SOL,SOL Coin,2024-02-08,25686.532862593263,27243.370628283024,27752.345303755872,24900.68094716168,957805.4704639536,162231662068.1804,Blockchain,COINBASE,Global,$,2024-02-08 02:00:00
crypto,BTC,BTC Coin,2023-07-05,4560.91 USD,4696.098991202934,4793.119099956755,4425.35969796253,6795838.813890266,366260851912.59033,Crypto,BINANCE,Global,USDT,2023-07-05 09:00:00
crypto,ETH,ETH Coin,02-23-2023,29689.352089742217,31304.641584409146,32600.98676147289,28458.031323890737,8974293.081731658,31502024388.802094,Blockchain,BINANCE,US,usd,2023-02-23 12:00:00
stock,GOOGL,GOOGL Inc,15/07/2023,44093.92149302593,43964.115312190625,45288.94028129184,43786.14478596137,8999195.524003362,1971876814623.8523,Automotive,NYSE,Global,USD,2023-07-15 06:00:00
crypto,,SOL Coin,24/06/2023,13727.89 USD,13434.578605224071,13994.046708532804,12955.546454022433,2686527.4637253326,182023544980.7558,blockchain,COINBASE,US,USDT,2023-06-24 17:00:00
crypto,BTC,BTC Coin,29/01/2023,3502.3974150262375,3626.810404039312,3658.149682071755,3387.607371799159,616368.7983142338,345119859909.4892,Crypto,COINBASE,Global,USD,2023-01-29 17:00:00
crypto,ETH,ETH Coin,2023-10-04,38423.36934515093,41382.08654887543,41840.44933752291,37392.754369742994,4703770.155324127,111639586557.90752,blockchain,COINBASE,US,USD,2023-10-04 01:00:00
crypto,ADA,ADA Coin,21/04/2024,38142.324653261516,38242.08375497267,39524.62228591542,37851.21299873809,96380.0013014239,350062245775.09503,blockchain,BINANCE,Global,usd,2024-04-21 22:00:00
crypto,ETH,ETH Coin,02-19-2024,45363.08593218116,47543.35406594058,48833.77904902091,44296.24714524231,3478353.2059467733,164141562264.7692,Blockchain,COINBASE,US,USD,2024-02-19 11:00:00
stock,TSLA,TSLA Inc,2023-08-18,32772.606141178025,32237.514943550897,33942.83913073771,32013.83853618207,1547693.7970004268,1566356395588.1284,automotive,NASDAQ,US,$,2023-08-18 09:00:00
crypto,BTC,BTC Coin,2023-03-08,20406.924363341204,21172.040378747482,21436.55058193629,20039.855744923698,8775014.92807315,183361074012.88266,blockchain,N/A,US,USDT,2023-03-08 17:00:00
crypto,BNB,BNB Coin,10/07/2024,45551.67484196121,50044.56169790994,50310.02820487384,43804.88925186159,9503847.13506945,170161981918.48096,Blockchain,BINANCE,Global,USD,2024-07-10 09:00:00
crypto,,BNB Coin,02-15-2024,4894.386696584057,4419.6297190685655,4933.810987116338,4418.7486180155565,1800816.166490258,383539436160.14777,blockchain,BINANCE,US,$,2024-02-15 09:00:00
stock,GOOGL,GOOGL Inc,06-06-2024,42422.40214426125,38353.25899643628,43704.59587911843,36966.837486069504,8623486.829480875,1512617344098.849,Technology,NYSE,US,$,2024-06-06 09:00:00
crypto,SOL,SOL Coin,06-22-2024,34340.91845689263,35537.49089518581,35931.0571439829,32683.6243583002,4093086.4882801874,116967153959.31128,blockchain,BINANCE,Global,$,2024-06-22 01:00:00
stock,AMZN,AMZN Inc,2024-02-14,40450.797703189295,42880.79190808725,43860.669357636434,39654.952984582866,6042990.900353265,874687524377.9504,ai,NASDAQ,US,$,2024-02-14 12:00:00
crypto,ETH,ETH Coin,22/05/2024,21255.87068201864,20301.25541490047,21537.548079329386,19830.46146481573,4492032.879119393,331727468628.91125,Blockchain,COINBASE,US,USDT,2024-05-22 19:00:00
stock,TSLA,TSLA Inc,2024-07-22,4565.955581094464,4765.58257506497,4816.511566859905,4382.621878393156,4128170.444453657,1325961105244.9592,Finance,NYSE,Global,USD,2024-07-22 05:00:00
crypto,BNB,BNB Coin,02-05-2024,29197.07478272769,28446.495883972988,29852.420239496932,27788.200334574616,2036151.6892955666,94972444939.03156,blockchain,COINBASE,Global,USD,2024-02-05 11:00:00
crypto,BNB,BNB Coin,2023-08-19,44022.290924651505,43438.76403757874,44929.35616322317,41344.173225328435,4980265.049571345,66521891031.88427,crypto,COINBASE,US,USDT,2023-08-19 03:00:00
stock,GOOGL,GOOGL Inc,10/08/2023,27946.45513902378,29103.612596196104,29361.880724618128,26901.569507362587,8107493.921838896,1666967467616.8904,Retail,NYSE,Global,$,2023-08-10 10:00:00
crypto,ETH,ETH Coin,2024-03-08,6805.278040892359,6802.078953869969,6878.154488374826,6482.406127884456,3255707.877923228,379132393653.1406,Crypto,COINBASE,Global,USDT,2024-03-08 18:00:00
stock,AMZN,AMZN Inc,2023-08-05,35499.55434097797,35739.00177203825,35996.0267927184,33740.980237419,8081762.333193103,439625999300.7961,automotive,NYSE,Global,USD,2023-08-05 18:00:00
crypto,ETH,ETH Coin,25/12/2023,30314.76994461609,29326.03500699878,31202.21352090749,28322.576722397327,870308.6673618495,74596790434.87778,Crypto,COINBASE,US,usd,2023-12-25 15:00:00
stock,AMZN,AMZN Inc,09/07/2024,9411.04773828899,9275.565076204297,9720.804743847242,8934.13434317723,121687.2830708789,676620525587.6832,RETAIL,NYSE,Global,USDT,2024-07-09 03:00:00
crypto,ETH,ETH Coin,24/03/2024,30291.92 USD,33096.16377851356,34071.624890604864,29490.95702947962,5734442.85735114,209980258884.57898,Blockchain,COINBASE,US,usd,2024-03-24 15:00:00
stock,MSFT,MSFT Inc,17/06/2024,41420.62349862629,39954.15725130877,41911.984682148715,38481.114621140994,5044705.976112415,2784422883287.461,finance,NASDAQ,Global,$,2024-06-17 01:00:00
stock,GOOGL,GOOGL Inc,26/03/2024,25165.928167076276,22990.567195848038,26076.40716359404,22767.524356108428,2895689.1533320765,2234707859173.4478,finance,NYSE,Global,USD,2024-03-26 22:00:00
crypto,BNB,BNB Coin,2024-07-18,21335.33 USD,22995.727039057492,23967.555850152465,20829.075908089602,6915363.952590131,267329667016.9234,blockchain,BINANCE,Global,USD,2024-07-18 21:00:00
stock,TSLA,TSLA Inc,2024-02-24,24790.893333812994,23864.95713927096,25725.09617552416,22934.30286921924,3885922.9489124143,2651215606056.091,automotive,NYSE,Global,USDT,2024-02-24 19:00:00
crypto,ETH,ETH Coin,2023-03-17,36223.87279006306,35527.005208119335,36612.81666694335,34382.9794914645,2841757.3881251025,346962258657.1835,Blockchain,COINBASE,Global,USD,2023-03-17 14:00:00
crypto,SOL,SOL Coin,12-30-2023,37169.21234914718,35326.138944464365,38013.26470618421,34241.378218839476,9820791.708977673,74555268737.8223,Crypto,COINBASE,US,USD,2023-12-30 18:00:00
crypto,ADA,ADA Coin,10-15-2023,4008.3243150097724,3679.5020331385426,4126.720940283873,3605.7949018421195,4188171.145836067,159481436438.54712,blockchain,COINBASE,US,usd,2023-10-15 16:00:00
stock,TSLA,TSLA Inc,05-11-2023,2706.089816215152,2715.0450848668083,2783.5646064552925,2591.0200198028374,1039290.0217231648,1301212640012.9688,Artificial Intelligence,NASDAQ,US,USD,2023-05-11 15:00:00
stock,AMZN,AMZN Inc,2023-07-01,5060.4 USD,5171.435557443834,5222.240426196701,4870.998822771835,1736547.8693702458,379481746892.47656,AI,NASDAQ,Global,usd,2023-07-01 15:00:00
crypto,ADA,ADA Coin,03-12-2023,42732.32698296025,40429.010436182114,43432.21048198409,38831.847909974436,4919267.718648776,383344945257.1587,Crypto,BINANCE,US,USDT,2023-03-12 22:00:00
stock,TSLA,TSLA Inc,03-10-2024,33571.68676475082,33727.17839509663,35242.60616747612,32169.04941174778,8041288.351365255,68635492098.01825,ai,NASDAQ,Global,USD,2024-03-10 23:00:00
stock,MSFT,MSFT Inc,09/07/2023,6367.787648952178,6238.596985033148,6421.962443288011,6006.12206309052,2633198.502130613,2377963433255.48,TECHNOLOGY,NYSE,US,$,2023-07-09 15:00:00
stock,TSLA,TSLA Inc,05-21-2023,20576.432478705672,22418.981240733134,22560.635732818067,20549.366378159983,2307155.763502425,1673146818137.0605,Automotive,NYSE,Global,$,2023-05-21 21:00:00
stock,TSLA,TSLA Inc,02-18-2023,16955.10660937934,15744.788011065271,17682.386739123518,15200.696079681262,6588895.186864195,2320893069781.7407,AI,NASDAQ,Global,$,2023-02-18 09:00:00
crypto,ADA,ADA Coin,09-09-2023,23593.097906449806,23573.371588229085,24456.885946349503,22498.15818481831,6682138.438917094,228745255609.2175,crypto,BINANCE,Global,USDT,2023-09-09 08:00:00
stock,MSFT,MSFT Inc,23/05/2023,2898.831969023009,2690.4948513847867,3002.701747429745,2614.795309975907,4036082.65951607,2688478183181.7505,Finance,NYSE,Global,USD,2023-05-23 19:00:00
crypto,SOL,SOL Coin,07/05/2023,25343.43 USD,23450.509458887715,25947.394297354913,23173.342375505912,2583385.314513748,59101820644.97316,Crypto,BINANCE,US,USD,2023-05-07 16:00:00
crypto,BTC,BTC Coin,16/06/2024,49600.88 USD,51452.48329721206,53616.97805834091,48149.674677153715,7678841.370335427,194910536430.99228,blockchain,COINBASE,Global,$,2024-06-16 11:00:00
stock,TSLA,TSLA Inc,18/05/2023,6154.330015286827,5788.84970280415,6278.017255004915,5744.201717041155,3463314.241828517,131122427094.55229,Retail,NASDAQ,Global,USD,2023-05-18 19:00:00
crypto,SOL,SOL Coin,2024-03-27,35468.621597226134,36079.975458329645,36724.43953054283,34718.554848297455,3423313.6623046724,263575371438.60785,blockchain,COINBASE,Global,$,2024-03-27 17:00:00
crypto,ETH,ETH Coin,02-17-2024,49640.27086951886,45938.918072200555,49819.84053804855,45659.90977417735,3019044.774268058,38130126728.04477,crypto,COINBASE,US,USDT,2024-02-17 16:00:00
stock,GOOGL,GOOGL Inc,13/07/2024,16456.99642581502,16099.729090300447,16672.67603799703,15570.888413751369,4107593.3054648447,1954387952479.7878,Finance,NASDAQ,US,USD,2024-07-13 08:00:00
crypto,BTC,BTC Coin,03-22-2023,25581.694349797242,27851.12431169949,27909.445114450824,24946.076635639263,5842663.663528349,289564347291.47546,Crypto,COINBASE,Global,$,2023-03-22 13:00:00
crypto,,BTC Coin,2023-04-10,2467.434595835165,2503.7056795649005,2610.567584580002,2373.9099083460674,8763047.19289085,368477809499.3382,Blockchain,COINBASE,US,USDT,2023-04-10 08:00:00
stock,TSLA,TSLA Inc,03-22-2024,36625.40691039515,39797.996503109935,41105.754015100094,35598.11780019274,449765.28371070756,66939793730.13255,RETAIL,NASDAQ,Global,USD,2024-03-22 23:00:00
stock,GOOGL,GOOGL Inc,09-27-2023,23520.108172351822,21304.498667802145,24331.34148321283,20752.53879075768,1244328.829106665,2761140301834.66,RETAIL,NYSE,Global,USDT,2023-09-27 09:00:00
stock,AAPL,AAPL Inc,07-02-2023,3233.89 USD,3281.9405298781076,3384.013717814915,3153.9703858956827,8171204.227893147,650672709837.6761,Technology,NYSE,Global,USDT,2023-07-02 03:00:00
crypto,ETH,ETH Coin,17/09/2023,30785.0635901895,27785.099038966593,31855.19804828848,26976.551569035386,5656009.274780643,345098484416.66534,blockchain,BINANCE,Global,usd,2023-09-17 17:00:00
stock,GOOGL,GOOGL Inc,2023-10-10,17518.328350210566,18979.702063806864,19106.842216554316,17230.600149249665,44591.439985847705,1950751000036.4644,RETAIL,NYSE,US,$,2023-10-10 17:00:00
stock,AAPL,AAPL Inc,13/06/2023,5634.081620572194,5177.590557946293,5727.891229816689,5015.419693817129,2143786.4231564635,2774706805161.4907,RETAIL,NYSE,US,$,2023-06-13 13:00:00
stock,AAPL,AAPL Inc,2024-01-16,22151.27576111776,20087.554764435536,22505.310810049115,19897.157802928865,6897325.647083824,1759513766172.1028,RETAIL,NYSE,Global,usd,2024-01-16 00:00:00
stock,MSFT,MSFT Inc,03-27-2023,34908.86503493534,33589.12157803508,35082.82275516687,32367.262167658955,8318021.216551407,2177363852203.8425,Technology,NYSE,US,USDT,2023-03-27 14:00:00
crypto,ETH,ETH Coin,08/05/2023,24697.412266930653,22275.585773171573,24870.349489986846,21520.53315857949,5786274.900580904,392285965124.3131,Crypto,BINANCE,US,$,2023-05-08 18:00:00
crypto,ADA,ADA Coin,05/09/2023,47168.431362506984,45895.67306323373,49320.689664791695,45392.01808397514,7554617.287883296,34661990093.099014,crypto,COINBASE,Global,usd,2023-09-05 10:00:00
stock,TSLA,TSLA Inc,08-09-2023,31342.92301442171,32208.007969846512,33220.50114205316,30643.54993008216,9864153.770810407,1824091543548.8738,tech,NYSE,US,$,2023-08-09 19:00:00
stock,AMZN,AMZN Inc,27/01/2023,38849.549955742135,41743.55250399204,42193.630991856786,37069.86015121815,4829461.471549388,2199548796602.831,AI,NASDAQ,US,USDT,2023-01-27 11:00:00
stock,MSFT,MSFT Inc,01-20-2024,41460.8 USD,40994.641656187676,42644.19825527182,40025.26378596578,382989.6347901532,1547101279901.6267,Finance,NASDAQ,Global,USD,2024-01-20 11:00:00
crypto,ADA,ADA Coin,04-03-2023,41403.88385585487,38567.7223502222,42634.265960022145,37784.04656582976,1642685.455599531,248009884155.781,blockchain,COINBASE,US,USDT,2023-04-03 00:00:00
stock,TSLA,TSLA Inc,25/11/2023,49002.79662939448,47961.18504637541,49560.011665481696,45973.97220303475,6676349.534118767,379156085454.9007,tech,NYSE,Global,USDT,2023-11-25 17:00:00
crypto,ADA,ADA Coin,2023-11-23,32181.170628141,29529.480962857087,33618.92007282641,28627.748647416873,3134380.6948971488,245730892444.27512,crypto,COINBASE,US,$,2023-11-23 12:00:00
stock,AAPL,AAPL Inc,27/07/2023,19509.402626723935,20928.036654735788,21900.417042273642,18829.942044292227,8639494.138792088,1392460727270.7402,Finance,NASDAQ,Global,usd,2023-07-27 14:00:00
stock,GOOGL,GOOGL Inc,2023-03-18,46541.07554051464,44174.46475517287,47883.69050999322,42572.13452153125,8241120.810353258,2346754157303.8706,Artificial Intelligence,NASDAQ,Global,USDT,2023-03-18 07:00:00
crypto,ETH,ETH Coin,2023-12-26,28245.309952690943,27336.960168080175,28701.02501884576,26851.60108405808,8514993.008690625,7103055275.570382,blockchain,BINANCE,Global,usd,2023-12-26 12:00:00
stock,AMZN,AMZN Inc,27/12/2023,42660.117202549656,40651.65424315487,43768.21770311046,39534.82431150025,117437.35013145908,1831494220266.0454,Artificial Intelligence,NASDAQ,US,USDT,2023-12-27 04:00:00
crypto,BNB,BNB Coin,19/02/2024,33079.600964067286,33687.69932827383,34927.87812085722,32370.60509667523,668435.7982527184,224940796540.59235,Blockchain,COINBASE,US,usd,2024-02-19 00:00:00
crypto,ADA,ADA Coin,2023-02-01,29827.76413142218,28485.390614127726,29946.54593757546,27672.991181222977,5543671.65823847,50995982013.46101,Crypto,COINBASE,US,USDT,2023-02-01 19:00:00
stock,AAPL,AAPL Inc,29/10/2023,36024.48077426664,37060.33307575622,37677.051041545456,35582.95128078773,6487301.730287821,992950505165.3236,finance,NASDAQ,Global,USDT,2023-10-29 01:00:00
stock,AMZN,AMZN Inc,2023-11-22,27675.85076234553,24971.309436961266,28639.67220558593,24192.256761463996,9426154.491876397,1915961682366.527,RETAIL,NASDAQ,Global,USDT,2023-11-22 22:00:00
crypto,BNB,BNB Coin,02-09-2024,29388.8465318703,27932.229391041154,29688.197492215797,27011.003289851174,4766202.867856605,328103984575.4961,Crypto,COINBASE,US,USDT,2024-02-09 14:00:00
crypto,BNB,BNB Coin,24/04/2023,25751.325474670215,24027.894457458147,27010.19551786145,22956.15972538859,9319509.452404067,121945876465.38411,crypto,BINANCE,US,$,2023-04-24 13:00:00
crypto,BNB,BNB Coin,2023-03-11,26272.770486156707,27454.573676542423,28053.149682703388,25786.76965455463,3406418.798273766,365863314504.0645,Crypto,COINBASE,Global,USD,2023-03-11 22:00:00
stock,GOOGL,GOOGL Inc,2023-12-12,28915.70701061399,28904.89065195191,29753.592203230783,27873.940757170636,3670211.3603381356,910465469158.4816,finance,NYSE,Global,$,2023-12-12 03:00:00
crypto,ADA,ADA Coin,17/02/2024,2623.2958498875637,2493.944872177935,2633.034423785014,2382.188048692107,8129471.125533977,38139694448.419174,Crypto,COINBASE,Global,USDT,2024-02-17 16:00:00
crypto,BNB,BNB Coin,2023-03-26,32950.55026879779,31451.680802616458,34386.445756984125,30641.787888798794,3056459.0168189295,20355110321.592274,crypto,COINBASE,US,$,2023-03-26 22:00:00
crypto,BNB,BNB Coin,02/03/2023,19104.08137207299,19349.763926425665,19460.573124622228,19101.206688115086,4256133.221089479,209467379597.32663,blockchain,BINANCE,US,usd,2023-03-02 04:00:00
crypto,ETH,ETH Coin,07-22-2024,35513.39031733008,34546.71161741977,36993.01009912449,33604.05402208459,7195864.574241084,142551102684.4106,Blockchain,BINANCE,Global,usd,2024-07-22 14:00:00
crypto,ETH,ETH Coin,12/07/2023,42307.498085900035,44302.02574078546,44770.99984924437,40499.45756056643,3163607.194907518,47444020494.54519,crypto,BINANCE,Global,usd,2023-07-12 04:00:00
stock,AAPL,AAPL Inc,2024-03-23,12849.01041260726,12736.26602279229,12868.296922248805,12352.412496059282,5713628.834315594,2928451052235.394,RETAIL,NASDAQ,Global,$,2024-03-23 13:00:00
crypto,ADA,ADA Coin,2023-06-18,25841.63488655382,27490.88588909547,28242.93706852704,24602.25071352832,3150767.7436225507,381484221940.64624,Crypto,BINANCE,Global,usd,2023-06-18 14:00:00
crypto,ADA,ADA Coin,07-28-2024,47530.19235689691,50944.099372932455,51525.767927987166,45676.77586707479,2012528.4981718936,232342055593.2858,crypto,COINBASE,US,USD,2024-07-28 03:00:00
stock,AMZN,AMZN Inc,18/04/2023,42634.78099355502,44978.69998012726,45861.93572384489,41578.249987134914,4643853.1162067335,2768271699944.4844,Technology,NYSE,Global,$,2023-04-18 20:00:00
crypto,BTC,BTC Coin,2023-11-09,25256.35202697686,22884.76313391452,25422.804486669815,22754.994622484755,7517045.990547201,105092252485.9522,crypto,BINANCE,US,usd,2023-11-09 04:00:00
stock,GOOGL,GOOGL Inc,27/10/2023,25862.34661057102,25189.919836358335,26820.261894903128,24918.10445361822,7633088.616841388,1274376543086.6704,ai,NYSE,US,USD,2023-10-27 02:00:00
crypto,BNB,BNB Coin,04/01/2023,10233.171891252863,9901.555680457774,10473.572346178284,9570.24615760119,7549647.061383131,290431631309.6076,blockchain,COINBASE,Global,USDT,2023-01-04 18:00:00
stock,MSFT,MSFT Inc,2023-06-20,6920.222018399005,6780.489521058418,7259.2832900933845,6518.044372675396,6121974.430773348,994767037507.3645,finance,NYSE,US,usd,2023-06-20 20:00:00
stock,GOOGL,GOOGL Inc,28/06/2024,3560.518136789838,3551.8850239451663,3685.5215781477973,3465.4356900545245,8721188.531402064,1304589419020.722,Retail,NASDAQ,Global,USD,2024-06-28 02:00:00
crypto,,BNB Coin,08-11-2024,4321.596073485206,4698.928120117188,4787.783993203379,4230.0658682058,7920239.258175829,119130121579.74515,Crypto,COINBASE,US,USD,2024-08-11 11:00:00
crypto,BTC,BTC Coin,01-09-2023,35811.065263498785,33199.85739089575,36332.642233100065,31780.083145484874,8112494.353455177,133103897230.85432,blockchain,BINANCE,US,USD,2023-01-09 06:00:00
stock,GOOGL,GOOGL Inc,2023-05-08,35873.003734706464,39053.492746703,40084.06015364214,35047.97700951205,4610874.647410023,675721213328.0883,RETAIL,NYSE,US,USD,2023-05-08 02:00:00
stock,MSFT,MSFT Inc,06-09-2023,23787.994995936606,24277.112008557862,25473.96340041192,23713.972178361208,8621667.429972924,984411528746.9918,AI,N/A,US,USD,2023-06-09 17:00:00
stock,GOOGL,GOOGL Inc,2023-02-07,23397.78 USD,24134.550239863234,25214.651879499925,22687.600429853992,9617663.020976342,2668500301757.5264,finance,N/A,US,USD,2023-02-07 13:00:00
stock,AAPL,AAPL Inc,14/04/2023,30058.12244300685,31319.389595139033,32807.98767531667,28922.851616707267,7461563.651408184,1253200325586.8572,Finance,NYSE,Global,$,2023-04-14 08:00:00
stock,MSFT,MSFT Inc,2024-08-22,13435.171459625846,14178.4235235398,14569.905591911782,13207.427717182172,3229687.7847104324,1567238602570.8057,Finance,NASDAQ,US,usd,2024-08-22 10:00:00
stock,GOOGL,GOOGL Inc,2024-04-11,30871.539006893472,30284.429105613024,31177.742286983714,30226.344316062856,5115163.932886131,1449009115964.539,finance,NASDAQ,Global,$,2024-04-11 15:00:00
stock,AMZN,AMZN Inc,02-14-2024,20558.249205867345,19962.6017464326,20976.77846164831,19372.90314090446,5442256.979303594,2204421907160.2246,finance,NYSE,Global,usd,2024-02-14 17:00:00
stock,MSFT,MSFT Inc,2023-09-05,24862.719255984754,23046.67555640624,25479.408523571605,22089.205915001807,1262231.7271713559,1634974911244.276,TECHNOLOGY,NASDAQ,US,USDT,2023-09-05 07:00:00
crypto,ADA,ADA Coin,2023-08-08,30251.451157253734,31216.412297938423,31843.540141529833,30113.77815212302,6379666.965307075,373395058349.7612,crypto,COINBASE,US,USD,2023-08-08 18:00:00
stock,,GOOGL Inc,06-26-2023,18434.437826695415,20130.449909995692,20956.262655226812,18299.81892779283,1722770.479990117,2309817909875.5264,ai,NASDAQ,US,$,2023-06-26 17:00:00
crypto,SOL,SOL Coin,22/04/2024,14288.473718182018,13633.802209639021,14899.597570309295,12973.847648725508,761923.7898187622,112030467109.13171,crypto,COINBASE,US,$,2024-04-22 04:00:00
crypto,ETH,ETH Coin,04-20-2023,10001.650002725688,9465.280744017793,10400.6874277742,9258.524272097438,58700.842268386965,113196373898.81197,Blockchain,Unknown,US,USDT,2023-04-20 07:00:00
stock,AMZN,AMZN Inc,30/05/2023,20400.167493249442,18825.051260270924,21089.83778008219,18544.649475304177,7209211.297301925,1293675069455.5437,Automotive,NASDAQ,US,$,2023-05-30 02:00:00
stock,AAPL,AAPL Inc,19/01/2024,12.640818345517088,13.78840443045259,14.349736419001085,12.58013084895411,157417.3097790339,2188128127220.1902,finance,NASDAQ,US,USD,2024-01-19 00:00:00
crypto,SOL,SOL Coin,2024-04-23,40491.328549118356,43222.21877123691,43423.82315878938,39962.46731635309,9599206.979731267,373874224335.36707,Crypto,COINBASE,Global,$,2024-04-23 09:00:00
crypto,SOL,SOL Coin,29/04/2023,28532.364617184077,31075.338307138605,31763.559352472996,27960.709513660033,4763906.596650167,273026199860.17346,blockchain,BINANCE,Global,$,2023-04-29 11:00:00
crypto,BNB,BNB Coin,2024-08-10,3813.475491007708,3814.3294813386533,3945.3426288113556,3773.7975252294204,5830603.455793919,373474257437.3182,Crypto,BINANCE,Global,USDT,2024-08-10 13:00:00
crypto,ETH,ETH Coin,2024-04-27,47100.152429724745,42996.02623006813,48047.738117006214,40896.65715422745,3294837.1570870546,364022508927.9743,Crypto,COINBASE,US,USDT,2024-04-27 20:00:00
crypto,ETH,ETH Coin,09-01-2023,45540.638576192345,48697.099605475174,49007.542949946,43475.439781016874,5893084.120227913,217062946098.38785,crypto,COINBASE,US,$,2023-09-01 13:00:00
crypto,ADA,ADA Coin,2024-01-04,13326.22 USD,14390.858095768936,15058.138015836135,12928.171776103543,8903135.26857809,215186599121.21915,crypto,BINANCE,US,USD,2024-01-04 00:00:00
crypto,BNB,BNB Coin,2023-05-11,36843.47342316671,36666.19896948656,37069.29288661172,36534.080023669645,4541511.837181988,156659813233.87418,crypto,COINBASE,Global,$,2023-05-11 02:00:00
stock,MSFT,MSFT Inc,03/05/2023,18365.018983420294,16597.866623773505,18457.331080709577,16179.782529419434,6899953.606906498,2206116250563.987,TECHNOLOGY,NYSE,Global,usd,2023-05-03 03:00:00
stock,AAPL,AAPL Inc,27/01/2024,34777.468074290744,36159.0766482683,37431.76026969507,33895.027823280645,9148946.615064919,1010858626472.0444,Finance,NASDAQ,Global,USDT,2024-01-27 01:00:00
crypto,ETH,ETH Coin,05-16-2023,22518.75702289694,21164.84296427255,22865.157530848715,20151.400960365023,6335719.400868086,198232624602.34317,crypto,COINBASE,US,usd,2023-05-16 04:00:00
crypto,BNB,BNB Coin,2023-05-24,15214.7211717284,16038.794659003934,16301.206327244077,14638.232261437879,1691408.4335879239,103171618851.20169,Crypto,BINANCE,Global,USD,2023-05-24 07:00:00
stock,TSLA,TSLA Inc,2023-09-29,6494.015836921444,6433.951074254991,6658.616447022331,6333.385173900056,6333201.539847622,2326826622524.0483,Finance,NYSE,US,$,2023-09-29 21:00:00
crypto,ETH,ETH Coin,11/02/2024,2247.124181972645,2155.6395880100367,2278.5989895974326,2063.5955997201886,2892493.360310575,325234665813.34406,blockchain,BINANCE,Global,USD,2024-02-11 17:00:00
crypto,ETH,ETH Coin,17/03/2023,26099.00425175464,26953.50903006017,27467.108836810003,25732.926870469848,3362317.22045722,127357299086.44685,Crypto,BINANCE,US,USDT,2023-03-17 21:00:00
crypto,BNB,BNB Coin,03/03/2024,27063.990912292647,24485.963693021098,27171.961518139167,23773.38486182246,9429184.201206174,119662052539.33034,blockchain,BINANCE,US,USD,2024-03-03 09:00:00
crypto,BTC,BTC Coin,05-22-2023,4415.447209332882,4721.276989947886,4894.146728847562,4329.554955464508,8203109.313131164,289997153038.15234,Blockchain,BINANCE,US,USDT,2023-05-22 23:00:00
crypto,BNB,BNB Coin,2023-01-30,11082.8375321841,11109.488185799823,11414.35573578179,10827.004841588692,5651172.841009573,164623389858.46805,Crypto,BINANCE,Global,$,2023-01-30 04:00:00
crypto,SOL,SOL Coin,2023-06-11,45113.258698580605,48503.22267213011,50446.78757376459,44985.65157698013,985847.9221523531,379738442704.47644,Crypto,BINANCE,Global,usd,2023-06-11 17:00:00
stock,TSLA,TSLA Inc,2024-08-06,24757.846723272698,26473.736296287956,27142.417487926934,24445.940858124177,1390460.0925839134,802718551722.7611,automotive,NYSE,Global,USDT,2024-08-06 15:00:00
crypto,SOL,SOL Coin,24/07/2024,36591.48699093324,34137.9107604758,37234.318796538886,32883.11425608706,3499267.0805305624,104703456125.74127,Crypto,COINBASE,Global,$,2024-07-24 11:00:00
stock,TSLA,TSLA Inc,04-06-2023,18398.680585328624,18602.035029478116,18694.9818433545,18219.30972623029,3699516.3678556005,2127888906743.131,Automotive,NYSE,Global,usd,2023-04-06 19:00:00
stock,AMZN,AMZN Inc,08-03-2023,36272.226187075015,34165.977246252776,37876.68274488877,33510.37357188975,4287822.692373063,1949117135509.6938,TECHNOLOGY,NYSE,Global,usd,2023-08-03 14:00:00
crypto,ETH,ETH Coin,11/01/2024,47115.62388568132,49519.16339989369,50034.22351555265,45555.415383599684,8096932.9066226445,77022397513.39671,Crypto,COINBASE,US,$,2024-01-11 05:00:00
stock,TSLA,TSLA Inc,12-10-2023,38291.55679285906,37841.25652606486,39663.306367943966,36680.46410539198,2113417.906465026,2090076213013.8635,finance,NASDAQ,US,USDT,2023-12-10 18:00:00
stock,GOOGL,GOOGL Inc,18/08/2024,48800.93614068372,46952.36616067491,49925.72352230178,46187.045811004595,5415521.314942756,1901704334175.6663,Technology,NASDAQ,US,USD,2024-08-18 02:00:00
stock,AAPL,AAPL Inc,06/02/2024,38089.517896411104,34724.66858473519,39990.98706929592,34294.781447885936,8639169.259624839,2531849109170.057,AI,NASDAQ,Global,USDT,2024-02-06 08:00:00
stock,MSFT,MSFT Inc,2023-09-07,42815.693551057644,39496.47519893264,43560.125381228434,39252.42834213101,2017350.4574576553,1957081159165.0857,TECHNOLOGY,NASDAQ,Global,USD,2023-09-07 10:00:00
stock,TSLA,TSLA Inc,06-13-2024,39408.065807861494,42052.23790770499,42394.23239648187,39121.068653077586,6867991.188176099,243943874754.26797,tech,NASDAQ,Global,usd,2024-06-13 17:00:00
stock,AAPL,AAPL Inc,2023-09-16,41514.207137141435,40843.74645909101,41916.882401242015,39383.281661220324,5052135.018914855,1565047222817.586,Retail,NASDAQ,US,USD,2023-09-16 23:00:00
crypto,BTC,BTC Coin,11-08-2023,40280.98551379727,42628.18048196629,43867.31040830109,39839.47667534881,1918542.809478416,214875663105.90442,Blockchain,COINBASE,US,USDT,2023-11-08 11:00:00
stock,AAPL,AAPL Inc,11-12-2023,43682.95479350866,39974.74802125489,44221.758769738095,39365.770610474065,4095069.928335464,159692936008.95007,AI,NYSE,Global,USD,2023-11-12 01:00:00
stock,GOOGL,GOOGL Inc,2023-09-18,14906.009935166854,13450.799823929625,15130.088733429973,13167.038421222815,3760007.81565753,2630178770047.371,Technology,NYSE,US,usd,2023-09-18 14:00:00
crypto,ADA,ADA Coin,01-08-2024,43831.139960562585,47447.077989284895,48078.06259872344,42652.39015080113,5491891.0083992705,216274738524.7083,Blockchain,COINBASE,US,$,2024-01-08 07:00:00
crypto,SOL,SOL Coin,07-04-2024,49930.87978502759,47288.6100150109,51745.81701314272,45818.00768803564,82073.86066524604,379899420470.8576,blockchain,BINANCE,Global,usd,2024-07-04 23:00:00
stock,GOOGL,GOOGL Inc,05-24-2023,23033.694718037164,22979.956707493664,23059.687893074733,22620.236987052176,2940739.8825609363,37665042083.34804,Artificial Intelligence,NASDAQ,Global,USD,2023-05-24 17:00:00
crypto,BTC,BTC Coin,05/07/2023,15052.944467539284,14050.822732854938,15359.402651327744,13511.463189923945,5348474.9682147615,226157775106.7,Blockchain,BINANCE,Global,USD,2023-07-05 18:00:00
crypto,ADA,ADA Coin,10-18-2023,25425.214772464908,23682.969803440923,26278.19857724333,23391.595483983998,1104831.9482650878,83537269463.15958,crypto,BINANCE,Global,USDT,2023-10-18 09:00:00
stock,AMZN,AMZN Inc,07/02/2024,3552.8763157371304,3622.6423328145975,3670.5344429475,3468.9617217655696,5175092.632833527,1408729211991.6443,Technology,NYSE,US,usd,2024-02-07 00:00:00
crypto,BNB,BNB Coin,08-11-2023,27458.670296210457,27914.475874144846,28475.07269859108,27388.759976832698,7772081.908486657,370119966746.55115,blockchain,BINANCE,US,USD,2023-08-11 12:00:00
crypto,BTC,BTC Coin,06/08/2023,42212.03719295384,41641.29972130463,43961.023607124785,41272.541169684155,1889512.997441781,117735089669.62242,crypto,COINBASE,Global,$,2023-08-06 02:00:00
stock,AAPL,AAPL Inc,12-02-2023,14539.24203563349,13950.38141864019,14754.675856461552,13758.960037643963,2299030.591883568,2106411982836.895,Technology,NYSE,US,$,2023-12-02 08:00:00
crypto,SOL,SOL Coin,09/11/2023,35764.69030559683,33412.69514469839,35951.52933112541,32138.863073931505,3799625.322704717,5357804922.205639,Crypto,BINANCE,US,$,2023-11-09 10:00:00
stock,TSLA,TSLA Inc,06/11/2023,2238.06 USD,2448.690260879281,2536.361092133479,2162.319844733497,3187653.8755966877,1432959919144.87,Artificial Intelligence,NYSE,US,USD,2023-11-06 07:00:00
stock,TSLA,TSLA Inc,28/03/2023,31315.978689924017,29101.143987747404,31611.804791011746,28896.613265514472,2563292.9839668367,1351142222611.6936,Technology,NASDAQ,US,$,2023-03-28 16:00:00
stock,TSLA,TSLA Inc,2024-04-07,43564.87982899635,44986.38294542933,45755.00201848271,42875.90026497816,197812.4705987557,1146783043945.7808,Technology,NYSE,Global,USDT,2024-04-07 12:00:00
stock,,TSLA Inc,04-27-2023,24355.931865406812,25881.500473551245,27116.87321567501,24265.557413799645,9092741.169509953,2209571553433.982,Artificial Intelligence,NASDAQ,Global,USDT,2023-04-27 16:00:00
stock,AMZN,AMZN Inc,2024-06-04,18013.504285805513,17887.53702024235,18634.87651642778,17783.787317209997,2070656.0436981954,1541388168242.3225,tech,NASDAQ,Global,usd,2024-06-04 02:00:00
stock,AMZN,AMZN Inc,01-28-2024,40760.85979617476,44664.57637562175,46630.380003497565,39293.34111873039,1060453.157529133,2755397543800.492,Retail,NYSE,US,$,2024-01-28 07:00:00
crypto,ADA,ADA Coin,14/07/2023,14568.253695728023,14900.945187513975,15500.201842132841,14494.866341345058,6237910.090307958,49335223436.677505,crypto,BINANCE,Global,$,2023-07-14 05:00:00
stock,TSLA,TSLA Inc,26/02/2024,9323.975658161491,8577.547031787273,9493.357086472479,8363.687766564246,434928.3886070299,26837625116.68065,AI,NYSE,Global,$,2024-02-26 09:00:00
crypto,ETH,ETH Coin,29/02/2024,8967.191934519877,9230.953216256892,9445.237042298579,8740.912758224438,4277490.1885465775,142648800439.28384,crypto,BINANCE,Global,USD,2024-02-29 08:00:00
crypto,ADA,ADA Coin,2023-05-07,10744.608904826946,10780.419095769115,11177.147880406284,10506.532231584037,9290279.836282294,382627785642.194,Blockchain,COINBASE,US,usd,2023-05-07 11:00:00
stock,AMZN,AMZN Inc,29/05/2023,23189.15353060117,21280.789689220775,23895.26222491031,20523.41911908276,1603930.0861161728,1140125383367.4397,Finance,NASDAQ,Global,USDT,2023-05-29 09:00:00
crypto,BNB,BNB Coin,01-04-2023,26620.19006636173,24362.11456173175,27549.521470326425,23903.82931209808,1890983.8101822257,220089860697.2807,Crypto,COINBASE,Global,USDT,2023-01-04 12:00:00
stock,AMZN,AMZN Inc,18/04/2024,36018.94259476321,36230.99144452133,36947.43951130176,34798.50998591015,6104328.272573892,1413610237840.591,Automotive,NASDAQ,Global,$,2024-04-18 06:00:00
crypto,BNB,BNB Coin,2023-07-31,33590.5245754694,30733.622940524725,34364.25707163445,30565.85444170689,945529.7955850677,375947935832.54504,Crypto,COINBASE,Global,$,2023-07-31 14:00:00
stock,TSLA,TSLA Inc,2023-03-18,47453.97898833461,43451.46820227682,49668.68779313685,42067.827002106445,8447246.96159155,2966738379291.2544,finance,NYSE,Global,usd,2023-03-18 20:00:00
crypto,ADA,ADA Coin,08-12-2023,22048.347083998768,22640.314736699103,23517.03536314284,20983.17947618786,5931966.7992758155,170261418396.74225,Crypto,COINBASE,Global,usd,2023-08-12 05:00:00
stock,AAPL,AAPL Inc,10-19-2023,17304.016397981515,16777.865859210087,17709.847788922994,16219.277361106393,1074503.823388227,568331652351.1393,Retail,Unknown,US,usd,2023-10-19 20:00:00
crypto,BTC,BTC Coin,03-02-2024,1681.56 USD,1671.559279439175,1761.8131852408726,1597.649215141727,9462698.665537817,62523351717.55332,blockchain,COINBASE,US,USDT,2024-03-02 11:00:00
stock,TSLA,TSLA Inc,04-26-2024,31878.565158678815,32804.81443651657,34160.84679127546,30455.059493914338,5048038.481331851,2202750929048.96,Finance,NASDAQ,US,USDT,2024-04-26 11:00:00
crypto,BNB,BNB Coin,2023-03-25,29345.154049227447,31298.244669934924,31411.34355150251,28891.332767069303,5340743.276116793,280350999612.99963,Crypto,COINBASE,Global,USDT,2023-03-25 12:00:00
crypto,SOL,SOL Coin,07-15-2023,17020.3463618792,17431.669014206105,18208.245837405477,16591.5833497186,8247406.917605124,154768541272.07764,Crypto,BINANCE,US,USD,2023-07-15 05:00:00
crypto,BTC,BTC Coin,21/12/2023,5128.699195030896,4678.918159740847,5141.863122475154,4533.9068218854945,3373040.2706075846,163851770828.36716,Crypto,BINANCE,Global,USDT,2023-12-21 13:00:00
crypto,BTC,BTC Coin,10/11/2023,37143.64686422744,33807.06254980567,37554.313083738205,32580.30879848275,5476572.2294439515,288585124330.915,Blockchain,COINBASE,US,usd,2023-11-10 15:00:00
stock,MSFT,MSFT Inc,21/01/2023,6705.721557806019,7300.9065021013375,7594.477013846296,6431.006553489522,4066271.511247004,442100519481.7813,tech,NASDAQ,US,USD,2023-01-21 00:00:00
crypto,BTC,BTC Coin,2023-05-18,39552.29366252971,39633.08251686843,39886.436475669536,39036.12053421495,3969482.8942709644,145470689706.7384,Blockchain,COINBASE,US,$,2023-05-18 18:00:00
crypto,ADA,ADA Coin,2023-06-30,18781.1761148158,18772.749240015546,19103.38176189349,18061.17359844363,3985621.786010999,108855077814.69809,crypto,BINANCE,US,$,2023-06-30 11:00:00
crypto,BTC,BTC Coin,17/01/2023,38627.167326354735,36085.07399520347,38711.96286921021,35460.25858064568,7739587.352107898,12573299746.209805,Crypto,BINANCE,Global,usd,2023-01-17 07:00:00
crypto,BTC,BTC Coin,09/02/2024,24680.524041203393,23226.19052099095,25590.282311813637,22877.464456942176,2463461.070297629,326462506979.17303,blockchain,BINANCE,US,USD,2024-02-09 23:00:00
stock,GOOGL,GOOGL Inc,16/06/2023,5227.5291895606215,5732.182561944878,5978.737436996692,5145.953242517645,9387560.132910049,2711189190029.751,Finance,NYSE,Global,usd,2023-06-16 16:00:00
crypto,ETH,ETH Coin,02-09-2024,9530.945281531996,9420.68394502814,9565.01985215044,9133.191718887269,7416288.59435235,290312911487.86456,blockchain,BINANCE,US,usd,2024-02-09 20:00:00
stock,GOOGL,GOOGL Inc,20/02/2023,16521.405831652024,16836.487949644677,17570.731001750446,15734.64260181042,3855318.8765626545,1165465619283.144,Artificial Intelligence,NYSE,US,usd,2023-02-20 06:00:00
crypto,ADA,ADA Coin,2023-03-27,34770.758994086165,32028.907736778885,35926.55251163578,30885.7653852808,1989969.2205585097,67505093017.02877,crypto,BINANCE,Global,usd,2023-03-27 14:00:00
stock,GOOGL,GOOGL Inc,10/08/2023,936.0435915303339,924.3949543512732,937.0557819152307,900.5267553150593,5010972.730566388,2809694147896.7065,tech,NASDAQ,Global,USD,2023-08-10 05:00:00
crypto,ADA,ADA Coin,01-24-2024,6616.767258475933,6453.18427986431,6839.177628977562,6382.972282519902,5307975.2732790345,132056676200.92508,crypto,BINANCE,US,USD,2024-01-24 04:00:00
stock,AMZN,AMZN Inc,23/05/2023,10038.812392521388,9611.822215259854,10120.074375345808,9251.040233663627,2249642.9154750924,1773604839374.8691,Finance,NYSE,US,$,2023-05-23 12:00:00
stock,GOOGL,GOOGL Inc,2024-06-23,28138.810901978562,30642.869169142446,30942.51145676527,27634.66993031099,8172775.430606241,1563151871309.8003,Technology,NASDAQ,Global,USDT,2024-06-23 21:00:00
crypto,SOL,SOL Coin,2023-07-17,12757.632588528775,12151.773203801675,12782.671389981666,11729.768991982979,7446292.186354797,226295378194.30573,blockchain,BINANCE,Global,$,2023-07-17 01:00:00
stock,GOOGL,GOOGL Inc,11/12/2023,10972.571172416485,11425.151326057536,11872.246953098875,10673.743296821462,6981045.3104480095,152078094049.26004,finance,NASDAQ,Global,usd,2023-12-11 14:00:00
crypto,BTC,BTC Coin,27/07/2023,8004.063118756135,7841.019542252148,8236.168070743804,7820.653780644781,688440.7699346845,158241106618.68234,Crypto,BINANCE,US,usd,2023-07-27 22:00:00
stock,GOOGL,GOOGL Inc,2023-07-30,16452.69971275411,16480.049674761845,16499.80550294884,15887.570335285578,8198861.607122523,1527108340596.4321,tech,NYSE,Global,$,2023-07-30 02:00:00
stock,MSFT,MSFT Inc,04-11-2024,22534.62 USD,21567.996664986204,22870.432547979,20902.73335383855,8355871.528935639,1666285784225.3662,Finance,NASDAQ,US,USD,2024-04-11 07:00:00
crypto,BNB,BNB Coin,03-26-2024,21938.382513705223,21470.449270194742,22866.980250565728,20855.219258179903,5520629.704784216,387049216689.266,crypto,COINBASE,Global,USDT,2024-03-26 13:00:00
stock,AMZN,AMZN Inc,07-23-2024,37177.69176359597,37415.54213093736,38929.065445932436,36770.099214754,2150832.6779320156,700515577150.2458,Technology,NYSE,Global,USDT,2024-07-23 16:00:00
crypto,SOL,SOL Coin,27/04/2024,40004.719853489056,38773.43250949291,40349.978813779795,36839.86376935424,4509585.6272783885,287676042470.31616,blockchain,COINBASE,Global,$,2024-04-27 20:00:00
stock,MSFT,MSFT Inc,06-20-2024,27749.94259293219,26018.574238529185,28942.72607277551,25052.966687262127,2265069.621271412,1063773867301.1364,Finance,,Global,USDT,2024-06-20 04:00:00
crypto,ETH,ETH Coin,05-16-2023,24947.56267697627,23525.97685448022,25286.675802946425,22549.302088178723,7184883.323053344,194882052311.3206,Blockchain,BINANCE,US,USD,2023-05-16 05:00:00
crypto,ETH,ETH Coin,17/04/2024,23121.80158798954,24111.81712020682,24999.05409934099,22125.570474362103,9661814.070320534,309185167345.36237,blockchain,COINBASE,Global,usd,2024-04-17 12:00:00
crypto,ETH,ETH Coin,29/02/2024,10232.128225179216,9589.888306021068,10296.417272903876,9176.745638656252,7481869.828487933,329307619103.0903,Crypto,COINBASE,Global,USD,2024-02-29 23:00:00
stock,GOOGL,GOOGL Inc,2023-10-29,39148.879295265964,41076.9999222229,42318.78374150435,38534.95950216517,184538.88806703876,1414266228285.3545,tech,NYSE,Global,USDT,2023-10-29 12:00:00
crypto,BTC,BTC Coin,2023-06-06,31894.730741177915,28764.868622106642,31947.320278149076,28551.84748582691,6840564.592059026,128152170487.98367,crypto,BINANCE,US,$,2023-06-06 09:00:00
crypto,ADA,ADA Coin,23/01/2023,34401.262377534265,36413.43809935817,36972.009831221505,32743.18582259494,9327858.467752658,109821044582.53586,crypto,COINBASE,US,USD,2023-01-23 13:00:00
crypto,BTC,BTC Coin,29/09/2023,5333.02 USD,5324.337847607526,5537.936181371921,5117.127214529091,2695631.0112835,141346036126.77405,crypto,COINBASE,Global,USD,2023-09-29 06:00:00
crypto,ADA,ADA Coin,23/08/2023,49583.73591105559,46582.96524018035,51010.55803353168,46408.895510185044,1469818.7922089146,100872419785.44035,blockchain,,US,USD,2023-08-23 03:00:00
crypto,ETH,ETH Coin,25/07/2024,47374.38694743728,51018.15937224588,51565.47331222431,46507.56607853758,7609153.83813944,388487408157.7416,Crypto,BINANCE,US,USDT,2024-07-25 19:00:00
crypto,BNB,BNB Coin,2023-09-07,9029.386865847708,9509.79701846668,9670.893536247973,8657.20748763007,4214348.035197335,394481031637.5897,crypto,COINBASE,Global,USDT,2023-09-07 11:00:00
crypto,ADA,ADA Coin,2024-03-20,23247.841687165568,23422.307905791993,24587.754411844675,22549.37109340662,6154392.146337689,318565185298.7035,crypto,COINBASE,Global,USDT,2024-03-20 11:00:00
stock,TSLA,TSLA Inc,07/10/2023,19645.35445997196,20414.040849622168,21371.344001738646,19195.82842832136,7684230.88955885,1102080162829.962,TECHNOLOGY,NASDAQ,US,USDT,2023-10-07 02:00:00
crypto,ADA,ADA Coin,11/03/2023,10565.790291222029,10570.294785408423,10580.871276304439,10171.081410645756,5174495.496959836,40236590732.70071,Crypto,BINANCE,US,$,2023-03-11 09:00:00
crypto,ETH,ETH Coin,10/05/2023,13234.668848439826,13271.807498326902,13652.143822677797,13185.536260691308,6453810.886882828,10909673311.238781,blockchain,BINANCE,Global,USD,2023-05-10 14:00:00
crypto,SOL,SOL Coin,02/08/2024,46518.25534488206,49168.707217811105,49660.41622196825,44496.67049639554,6758440.545791587,168820641999.34753,Blockchain,BINANCE,US,usd,2024-08-02 01:00:00
stock,MSFT,MSFT Inc,2023-01-09,39485.78395349986,41371.6648763822,42664.9669791623,39458.89842205099,5336363.711373976,1684050665075.1816,TECHNOLOGY,NASDAQ,US,usd,2023-01-09 19:00:00
crypto,BTC,BTC Coin,2023-01-24,41415.39550515126,39359.97727680608,43025.00929977046,39275.56409046737,6968258.344129448,49676773818.17934,crypto,COINBASE,US,usd,2023-01-24 14:00:00
crypto,ADA,ADA Coin,07-27-2023,23024.70492199528,22400.32035683735,23431.096433354727,21993.051962707592,7512979.896260521,240431913575.17145,Crypto,BINANCE,Global,$,2023-07-27 09:00:00
stock,AAPL,AAPL Inc,2023-09-20,9928.5209586662,9916.581277072995,10321.511711085679,9656.620120979189,5366696.174075203,2038766037758.399,Finance,NASDAQ,Global,usd,2023-09-20 05:00:00
crypto,ADA,ADA Coin,2024-01-22,33066.652660191925,32467.1206575791,34547.06771562093,31107.668856362452,9955168.969454657,309598739027.47473,blockchain,COINBASE,US,USD,2024-01-22 20:00:00
crypto,BNB,BNB Coin,31/03/2024,757.3490555009026,816.4251447834062,826.4244549600502,747.1134689081642,8110342.733945761,51946768498.11369,blockchain,BINANCE,US,$,2024-03-31 16:00:00
crypto,BTC,BTC Coin,2024-07-27,49579.79584085169,47537.5020153438,51340.48183535558,45434.91796435638,4068686.104277137,344299624457.68616,blockchain,COINBASE,US,USD,2024-07-27 14:00:00
crypto,BNB,BNB Coin,2023-10-21,18389.225722494826,18724.26042548402,19195.899683271167,18063.69186194061,9728970.999487562,339948818858.4732,Blockchain,BINANCE,US,usd,2023-10-21 10:00:00
stock,TSLA,TSLA Inc,05/01/2024,28702.33625990647,30786.291078719478,31527.290492927,27379.91513173311,5605832.984815292,176649224239.19235,Artificial Intelligence,NYSE,Global,USD,2024-01-05 18:00:00
stock,MSFT,MSFT Inc,16/04/2023,7755.539849043415,8296.930064335706,8513.31379837965,7729.665976910151,8060359.029526087,1002900933563.2231,Finance,NYSE,US,USD,2023-04-16 17:00:00
stock,MSFT,MSFT Inc,27/10/2023,261.22491323194356,257.4540509765326,263.8043300713961,256.3057790187307,1746665.2627789264,2081985663383.2654,Automotive,NASDAQ,US,USDT,2023-10-27 22:00:00
stock,MSFT,MSFT Inc,2023-07-14,25846.67001904761,24623.417528195958,26117.88517216198,24129.84029292943,890206.2980274836,865319554461.2637,Artificial Intelligence,NYSE,US,USDT,2023-07-14 20:00:00
crypto,BNB,BNB Coin,2024-02-03,18618.54230635171,19440.23240270424,19979.511018676065,18081.282361959587,5657949.890681599,27976264694.765266,Blockchain,BINANCE,Global,$,2024-02-03 23:00:00
stock,AAPL,AAPL Inc,14/07/2024,46807.95530825132,42641.15691341738,48383.95922102062,42409.36526600295,8039043.202643799,1102699939113.288,Automotive,NYSE,US,usd,2024-07-14 07:00:00
crypto,ETH,ETH Coin,2023-02-17,14803.358185524616,15445.965861546827,15511.047870558805,14664.104253234917,7189350.539103298,77696208754.47147,crypto,COINBASE,US,usd,2023-02-17 14:00:00
stock,GOOGL,GOOGL Inc,2023-03-19,5021.066099676894,5239.744117561684,5417.847768693341,4978.618632199283,416917.9666084385,2191523881213.6743,Retail,NASDAQ,Global,USDT,2023-03-19 13:00:00
stock,AMZN,AMZN Inc,05-26-2023,18656.62492292925,17346.13987157632,19177.503410969923,17274.455995826153,3915405.8236098234,79100898718.69867,TECHNOLOGY,NYSE,US,USDT,2023-05-26 04:00:00
stock,TSLA,TSLA Inc,02-07-2023,22.041317148145033,20.580042373448624,22.07484589245928,19.88870439876258,9081987.767369332,2536401628045.0864,Technology,NYSE,Global,USDT,2023-02-07 05:00:00
stock,MSFT,MSFT Inc,15/08/2023,30324.42473942258,30030.253190676824,31747.350173233957,28712.70457469766,2121066.477171787,299886849560.9734,tech,NASDAQ,US,usd,2023-08-15 16:00:00
stock,GOOGL,GOOGL Inc,03-24-2024,21702.423129072373,20738.110245270975,22646.376462061304,20328.47119680537,6141293.289019041,98330486148.36488,Automotive,NYSE,Global,usd,2024-03-24 18:00:00
stock,,TSLA Inc,09-09-2023,4601.598358087757,4550.997971148776,4831.564430080903,4513.5044129955495,8934697.082616992,1600412983675.0942,ai,NASDAQ,US,USD,2023-09-09 06:00:00
crypto,BTC,BTC Coin,21/12/2023,5161.0542546148245,4879.723385022512,5161.859805215545,4709.789488469328,1086965.4160625793,330174411902.3673,crypto,BINANCE,Global,$,2023-12-21 10:00:00
stock,GOOGL,GOOGL Inc,2024-01-13,33859.60315380936,36395.72328760728,37759.138318755984,33755.62978606599,539929.0056474941,1423652102451.7332,finance,NASDAQ,US,usd,2024-01-13 06:00:00
crypto,SOL,SOL Coin,2024-05-08,33070.292310672274,31677.056836974494,33489.45994585579,30617.280449300633,2698690.782865749,9811034989.533869,blockchain,BINANCE,US,USDT,2024-05-08 09:00:00
crypto,BTC,BTC Coin,2024-02-22,22013.020876734383,22067.738868918765,22810.00228452671,21338.465431697798,2513825.5637344257,207017380489.12698,Blockchain,BINANCE,US,$,2024-02-22 12:00:00
crypto,BNB,BNB Coin,02/03/2023,17480.21123543595,18325.57688851581,19018.92958912407,17189.083025328655,2341047.724893439,70649212039.45447,Blockchain,COINBASE,Global,$,2023-03-02 09:00:00
stock,MSFT,MSFT Inc,08-19-2024,28538.77618222663,28448.971492098222,29323.56254209348,27726.069801872894,5654998.204375008,1768377875105.5461,Finance,NASDAQ,US,usd,2024-08-19 16:00:00
crypto,BTC,BTC Coin,08-28-2023,5490.313438227952,5764.418162538262,5803.583392129906,5234.08819606829,9760820.782528454,287624852075.3459,blockchain,COINBASE,Global,usd,2023-08-28 19:00:00
stock,AAPL,AAPL Inc,02/06/2023,3031.222881578797,2996.820588248408,3059.4503775064222,2919.7041378426743,8301942.252752874,2871405388922.62,Finance,NASDAQ,US,USDT,2023-06-02 06:00:00
stock,AAPL,AAPL Inc,24/05/2024,31716.290146042353,30789.57609656186,32673.05258066781,29730.41668956641,9098326.584679771,2852329206481.2417,AI,NYSE,Global,USD,2024-05-24 13:00:00
stock,TSLA,TSLA Inc,10/05/2023,27916.00519648025,26937.822318746086,28325.518581888657,25635.941602989467,8158392.689401927,2612497384686.4526,AI,NASDAQ,US,$,2023-05-10 14:00:00
crypto,BNB,BNB Coin,02-29-2024,16263.395090729218,16169.426348588731,16929.1680614569,15461.70204383502,8576702.22643003,182901369150.40814,Crypto,COINBASE,Global,$,2024-02-29 12:00:00
crypto,ETH,ETH Coin,14/12/2023,47335.92867254407,46365.42845679171,47849.8558064168,44913.35786580986,3329788.0502178012,359515989867.7998,Crypto,BINANCE,US,USD,2023-12-14 18:00:00
stock,MSFT,MSFT Inc,04-14-2024,30367.260838373382,30225.288795343302,31681.70923047047,28762.55042273451,6439035.407623708,536700198383.5516,Automotive,NASDAQ,US,USD,2024-04-14 08:00:00
crypto,BTC,BTC Coin,02-25-2023,37976.73359372347,40909.09923289522,42400.30491937226,37839.65669087583,3327233.341609094,306364807012.06665,crypto,BINANCE,US,USD,2023-02-25 09:00:00
stock,AAPL,AAPL Inc,06-05-2024,713.84 USD,643.4514548790845,722.4129952739897,614.5221090182016,2602853.4679896003,1514596156087.1138,Technology,NYSE,US,usd,2024-06-05 09:00:00
crypto,ETH,ETH Coin,2024-03-12,1435.7160416840254,1553.244947468616,1553.8835743327245,1416.7704867309208,1522326.7213082458,74932101338.71698,blockchain,BINANCE,Global,USD,2024-03-12 16:00:00
stock,TSLA,TSLA Inc,03/06/2024,44640.86902009839,46014.925203520994,47561.56540963736,42420.7427659609,9848730.789569907,2737566569778.804,finance,NASDAQ,US,$,2024-06-03 04:00:00
crypto,BTC,BTC Coin,22/04/2024,44756.3602242473,46181.80139704576,46977.94547021683,44518.36525566521,2915877.764583772,351743878412.44666,Blockchain,COINBASE,US,usd,2024-04-22 13:00:00
stock,AAPL,AAPL Inc,2024-05-14,4995.551307470681,5417.131507431537,5455.260111536938,4801.947918692773,5581783.447124022,1692507514593.1865,ai,NYSE,Global,USD,2024-05-14 20:00:00
crypto,BNB,BNB Coin,17/10/2023,30971.371783755585,29312.135748770335,30972.832149791924,28956.21399094341,9852088.051785026,306816735084.1277,Crypto,COINBASE,US,USDT,2023-10-17 06:00:00
stock,,AMZN Inc,08-10-2024,23015.7288416492,24874.32840234863,25384.062683152843,22469.029426701098,4771820.544189436,2431640229715.2104,Artificial Intelligence,NYSE,US,$,2024-08-10 22:00:00
stock,AAPL,AAPL Inc,2023-10-26,38761.78655700235,38969.308690991194,39586.421055787345,37324.030818788466,378435.4223573664,1348395379269.9197,tech,NYSE,US,$,2023-10-26 13:00:00
stock,MSFT,MSFT Inc,10/03/2024,11505.7711558977,10696.07304173715,11881.912052831209,10525.582588568635,7521796.767684402,1753753534030.3076,automotive,NYSE,US,usd,2024-03-10 02:00:00
crypto,ADA,ADA Coin,14/04/2024,44703.78971414229,48605.02465238313,50567.138873994714,43889.27209660385,3037905.8149582953,203912874053.74362,crypto,BINANCE,Global,$,2024-04-14 10:00:00
crypto,ADA,ADA Coin,2023-07-19,13714.066997924998,12898.510419286506,14017.253554918865,12290.242833000777,9784966.152253237,393263244039.98737,Blockchain,BINANCE,Global,usd,2023-07-19 04:00:00
crypto,BNB,BNB Coin,12-02-2023,27852.03506229212,28719.88375236046,29433.60682167724,26504.085019294394,6123500.577115127,237431254784.4878,Crypto,BINANCE,US,$,2023-12-02 18:00:00
stock,AMZN,AMZN Inc,07/08/2024,20843.28554059642,21915.862555998618,22164.609019815318,20031.727822118708,1615008.459888052,2151359892099.7275,RETAIL,NYSE,Global,USDT,2024-08-07 23:00:00
stock,,MSFT Inc,2024-05-14,42352.13164910029,45129.68661419332,45993.523440879304,41482.046779804594,7208442.3484326815,1122264331769.594,AI,NYSE,US,$,2024-05-14 03:00:00
stock,GOOGL,GOOGL Inc,01/07/2023,8415.372883878406,9209.945647851713,9494.329112306408,8407.553202351035,3378222.1153351585,731208256137.7887,AI,NASDAQ,Global,USD,2023-07-01 00:00:00
crypto,ADA,ADA Coin,30/05/2023,11137.955790696473,10606.007403661064,11423.032950489713,10245.200643752154,1677048.0168420041,282697521489.7819,Crypto,COINBASE,US,USD,2023-05-30 14:00:00
stock,AAPL,AAPL Inc,02-27-2024,1797.0622393485735,1870.5346335461893,1916.5606960873931,1715.6771601789444,1717768.2372917836,796013298948.0847,AI,NYSE,Global,USD,2024-02-27 09:00:00
stock,AAPL,AAPL Inc,08-15-2024,30633.514485711064,28147.361944825443,31788.83042447858,26768.86026108078,2494508.5041709254,316578268956.8056,Retail,NASDAQ,Global,usd,2024-08-15 16:00:00
crypto,BTC,BTC Coin,07-19-2024,35929.38059293108,32860.783934621715,37404.50820907302,32027.82076794626,8467983.488661123,356813336977.30334,Crypto,COINBASE,US,USDT,2024-07-19 19:00:00
crypto,ETH,ETH Coin,2024-05-26,34094.833271322605,37460.00395548845,37895.16847895416,33453.757624849924,4603753.579183926,242292210907.9054,Crypto,COINBASE,US,USDT,2024-05-26 19:00:00
stock,TSLA,TSLA Inc,2023-11-22,733.39 USD,677.5367784480102,757.1891529110625,662.8736320975829,5534742.1820761105,127961339238.8474,Finance,NASDAQ,US,$,2023-11-22 17:00:00
stock,GOOGL,GOOGL Inc,03-11-2024,23470.456788036754,25463.67508751425,25969.882596392436,23030.294739787074,7798406.937555812,105251719959.49765,TECHNOLOGY,NASDAQ,US,$,2024-03-11 00:00:00
crypto,BNB,BNB Coin,2024-04-22,25968.811318939614,27827.92862521975,28372.490707599794,25824.28607375105,2403031.4367890577,314650485261.0456,Blockchain,BINANCE,US,$,2024-04-22 20:00:00
stock,AMZN,AMZN Inc,2023-08-30,2665.500003708065,2823.074680987964,2881.943584887064,2562.7605202841823,2318670.98588818,847847056901.8074,Technology,NYSE,US,$,2023-08-30 09:00:00
stock,AMZN,AMZN Inc,03-03-2024,41697.49085704723,42143.91157759739,43442.17753233354,40601.52562125909,3917273.76224521,2705185824275.407,automotive,NYSE,Global,USD,2024-03-03 20:00:00
stock,TSLA,TSLA Inc,28/06/2023,6289.3790489799,6186.795238552739,6397.733071238675,6031.553301831673,4576861.113577206,2747275874842.811,TECHNOLOGY,NYSE,US,usd,2023-06-28 07:00:00
stock,GOOGL,GOOGL Inc,2023-11-26,7004.549671577434,7022.959731599207,7108.084610004803,6718.880092499396,649277.3536431261,1561479699636.7334,AI,NYSE,US,USD,2023-11-26 18:00:00
crypto,BTC,BTC Coin,30/01/2023,21377.82162361943,21919.294837938818,22716.711488639736,21035.046067289717,4705536.690177733,306247760708.67566,blockchain,BINANCE,US,USDT,2023-01-30 20:00:00
crypto,ETH,ETH Coin,07-04-2024,18804.23588293678,19330.93800545564,19809.179955497177,18662.388243139158,8747145.141282795,158219918935.9333,Crypto,COINBASE,Global,usd,2024-07-04 06:00:00
stock,AMZN,AMZN Inc,07-17-2023,6820.320240770825,6998.1954558225425,7103.597288885852,6485.6371411862465,8886538.050960189,519975530239.49023,TECHNOLOGY,NASDAQ,Global,USD,2023-07-17 12:00:00
stock,MSFT,MSFT Inc,02-26-2023,46464.7397777736,48485.34681352983,50334.2227613752,44609.54558774843,2342710.0617425125,688433294058.9867,finance,NASDAQ,US,USDT,2023-02-26 22:00:00
crypto,BNB,BNB Coin,12-08-2023,8613.27163396661,8278.097697510182,8751.71381610123,7930.264421780344,2052623.1511182124,210900762760.50598,crypto,BINANCE,Global,usd,2023-12-08 18:00:00
crypto,ADA,ADA Coin,03-24-2024,8368.120768817946,7578.935670279255,8631.446677136517,7569.834550622985,3312806.932416591,316477977593.26135,Crypto,Unknown,Global,USD,2024-03-24 01:00:00
crypto,BNB,BNB Coin,2023-12-02,28523.662395122865,30841.804461148608,32050.89846609511,27985.300898677273,3151249.909579386,51869002762.51965,crypto,BINANCE,US,usd,2023-12-02 19:00:00
stock,TSLA,TSLA Inc,02/08/2023,4571.329616799726,4734.933320360729,4906.5973853776995,4563.337017907561,2604713.1900919713,1630221718095.8977,Retail,NYSE,Global,USD,2023-08-02 02:00:00
crypto,ETH,ETH Coin,2024-05-23,27284.967136713258,28413.421560043545,29536.33060086721,26185.026800911786,2618266.9375011995,12290285521.993944,blockchain,BINANCE,Global,usd,2024-05-23 23:00:00
stock,AMZN,AMZN Inc,2024-04-18,16536.73449040039,17729.071037287613,18149.03740830112,16371.01875296583,5806616.9850630555,1542646866549.216,Artificial Intelligence,NYSE,US,USDT,2024-04-18 22:00:00
crypto,SOL,SOL Coin,2024-01-18,16640.32259665089,17743.298497213425,17986.88942490807,16262.669483559408,2140857.1246255683,310370605938.7592,Blockchain,BINANCE,Global,usd,2024-01-18 03:00:00
stock,AMZN,AMZN Inc,2024-01-30,15915.57872334007,15172.968740224354,16685.085032275852,14535.760273146614,7873471.048736495,1431824299662.318,ai,NYSE,US,$,2024-01-30 13:00:00
crypto,BTC,BTC Coin,2023-12-06,1004.8751721664908,1044.8747135567712,1058.0877710760587,956.6656740302938,4029492.899987351,393745158995.8699,blockchain,COINBASE,Global,$,2023-12-06 20:00:00
crypto,SOL,SOL Coin,27/11/2023,598.1370674062143,608.6506054137835,623.9093689262527,594.3503861756999,840933.1434917359,374411035017.4956,Blockchain,BINANCE,Global,USDT,2023-11-27 06:00:00
crypto,ETH,ETH Coin,07-02-2023,34008.68382467953,35158.72159158771,36815.28539926623,33707.85581014714,420685.28970881656,274202781805.2269,Crypto,COINBASE,US,USD,2023-07-02 19:00:00
stock,AMZN,AMZN Inc,05-29-2023,19903.67327950466,19147.919742981718,20352.8362153301,18558.349726766774,4323906.6648867745,1418537723606.4944,tech,NASDAQ,US,$,2023-05-29 05:00:00
stock,GOOGL,GOOGL Inc,03-10-2024,4440.762407731542,4815.767802564266,4931.403227681419,4357.218843141386,8301999.483210321,2937992978169.841,AI,NYSE,Global,USD,2024-03-10 15:00:00
crypto,BTC,BTC Coin,08/09/2023,21526.791185317463,21137.2358290834,21930.129008956854,21058.530614548334,8289469.982038928,147382896513.95593,Blockchain,COINBASE,Global,USD,2023-09-08 07:00:00
crypto,ETH,ETH Coin,17/07/2024,5415.086390330031,5336.967828640537,5441.798301232605,5235.323433828283,1437772.3810100774,48054995995.87556,crypto,COINBASE,Global,USDT,2024-07-17 12:00:00
stock,AMZN,AMZN Inc,01/06/2024,370.92515071585046,357.31934529447517,383.4845042779332,348.1012018907137,9782716.590503883,1571896059260.735,tech,NYSE,US,usd,2024-06-01 11:00:00
crypto,ADA,ADA Coin,01-19-2024,17959.94824436713,16327.340606061878,18719.318473574203,16254.87522358066,8206453.306796948,350270999446.15326,crypto,BINANCE,US,$,2024-01-19 12:00:00
stock,GOOGL,GOOGL Inc,02-05-2024,49895.77756927026,47486.65197264726,51702.51593147322,47268.296181593905,2357635.4561927635,392570323350.0969,Automotive,NASDAQ,US,usd,2024-02-05 13:00:00
stock,GOOGL,GOOGL Inc,05-12-2024,15480.9841439514,16956.053252290676,17194.50624645626,15444.941181021393,536392.9642758564,2725693078484.4277,RETAIL,NYSE,Global,USD,2024-05-12 02:00:00
stock,AAPL,AAPL Inc,2024-07-30,26610.235580511817,26492.496342613093,26907.597398174457,26102.521219483282,1908904.1049716247,2130723314892.741,TECHNOLOGY,NASDAQ,Global,usd,2024-07-30 03:00:00
stock,AAPL,AAPL Inc,08-15-2024,12669.735698382137,13824.256190454535,13844.046438385667,12162.774139488121,2423863.7532680896,1662996969994.457,tech,NASDAQ,US,USD,2024-08-15 10:00:00
stock,TSLA,TSLA Inc,04/02/2024,11644.18 USD,11624.038232779727,12152.142279917587,11456.688942871948,5800039.843370575,1248062799045.771,finance,NASDAQ,US,USDT,2024-02-04 19:00:00
stock,GOOGL,GOOGL Inc,07-16-2023,34702.66549837989,32387.402797060866,36067.1177160731,31172.96710520761,4171070.234480688,276119502168.21216,Retail,NASDAQ,Global,USDT,2023-07-16 12:00:00
crypto,BNB,BNB Coin,2023-11-15,42942.10759459609,39734.7139874507,44156.606764581105,38030.21715906901,7048253.5654857345,143435729915.5815,blockchain,BINANCE,Global,USDT,2023-11-15 12:00:00
stock,AMZN,AMZN Inc,2023-04-22,21736.036616824,21684.271203443182,22743.961453477405,21164.92357157758,4876496.78205756,2716183602105.4985,finance,NASDAQ,US,USDT,2023-04-22 15:00:00
stock,AAPL,AAPL Inc,2023-04-18,34464.59452078397,31754.873505383053,35879.55659055188,30858.60018300073,724412.7504649579,1739204017085.8694,RETAIL,NYSE,US,USDT,2023-04-18 02:00:00
crypto,SOL,SOL Coin,01-29-2023,18853.72908459674,17346.816488421413,19451.184000148958,17242.84951768631,8877647.34063045,315542154333.2942,Crypto,BINANCE,US,USDT,2023-01-29 14:00:00
stock,AMZN,AMZN Inc,2024-01-25,43386.59593373673,39066.51378087683,44211.46442596425,38712.068340738624,3663163.8069787435,2873413789678.8296,TECHNOLOGY,NYSE,Global,$,2024-01-25 16:00:00
crypto,ADA,ADA Coin,08-21-2024,30319.784199252856,29501.303468472324,31690.956913703823,28768.53290160736,4648377.275169071,242611660019.98392,Blockchain,BINANCE,US,USD,2024-08-21 16:00:00
stock,MSFT,MSFT Inc,2023-08-04,24680.083199990106,23092.65162005713,25313.213002172135,22877.90928336717,7768826.408655916,2992566099529.069,Automotive,NYSE,Global,USD,2023-08-04 03:00:00
stock,AMZN,AMZN Inc,23/06/2024,35404.10896205561,33663.7692099249,36930.17490753269,33484.414480455765,1942332.813488872,2367859477674.328,Finance,NASDAQ,US,USDT,2024-06-23 17:00:00
crypto,ADA,ADA Coin,2024-07-28,48780.49237976971,52373.89724019638,54713.01014945652,48503.361584570135,5417326.55351325,56529976437.8006,Blockchain,COINBASE,US,usd,2024-07-28 16:00:00
stock,AMZN,AMZN Inc,10/07/2023,27272.688978160746,24824.72704737966,28289.282667115014,24210.727184803705,6477443.038827508,1942741192630.7412,Automotive,NASDAQ,US,$,2023-07-10 20:00:00
stock,GOOGL,GOOGL Inc,05-01-2023,24595.65 USD,22981.136096098962,24938.405224459177,22014.610057933798,1957467.289957799,1512893016876.8506,Retail,NASDAQ,Global,USDT,2023-05-01 13:00:00
crypto,BTC,BTC Coin,2023-05-21,7664.141154152199,7310.472346839693,7890.459279206747,7167.983409908307,1540587.3233085468,389326065266.02045,crypto,COINBASE,Global,usd,2023-05-21 08:00:00
stock,AMZN,AMZN Inc,12-15-2023,39262.29136696212,37199.589600064246,39828.9763911355,37084.248302307715,8256888.788348801,2383215103097.7847,Automotive,NYSE,US,USDT,2023-12-15 03:00:00
crypto,SOL,SOL Coin,09-13-2023,4120.83874331492,4053.474634887496,4236.078384498058,3888.7842482498127,4482817.594500137,280629828059.6969,Crypto,BINANCE,Global,USD,2023-09-13 11:00:00
stock,AAPL,AAPL Inc,05-09-2024,16375.560238968807,17295.686000278783,18022.493603433308,15821.746545051285,8386732.887770079,1807067373691.183,Automotive,NASDAQ,US,usd,2024-05-09 14:00:00
crypto,ETH,ETH Coin,06/08/2023,41888.07764014659,38978.95426438374,42061.76059028678,38280.79325805018,4719901.720187188,45912743610.69093,blockchain,BINANCE,US,$,2023-08-06 14:00:00
stock,AAPL,AAPL Inc,20/05/2023,18165.827912581553,17392.516841786648,18620.641119323463,16919.393585443806,3444936.034125665,2724592895234.37,tech,NYSE,US,$,2023-05-20 15:00:00
crypto,SOL,SOL Coin,08-10-2024,37980.49607735628,40661.79732758003,42639.702232056516,36587.85799645303,7161218.731417125,279027812985.8398,blockchain,BINANCE,Global,$,2024-08-10 13:00:00
crypto,SOL,SOL Coin,2024-02-04,33857.32777783589,33694.68862133269,35539.652861696435,33237.960715310735,9524960.513042811,160732003020.81937,blockchain,BINANCE,US,usd,2024-02-04 10:00:00
crypto,BTC,BTC Coin,22/03/2024,45146.02154805692,47984.97671857221,49086.61372763261,43457.08281767159,3703831.4343297714,334812972045.06836,crypto,COINBASE,Global,usd,2024-03-22 13:00:00
crypto,ADA,ADA Coin,2024-04-30,26204.41844155871,26230.925784494637,26919.816082556626,26170.393609196373,9114628.580544937,12993311892.780426,blockchain,BINANCE,Global,usd,2024-04-30 22:00:00
crypto,SOL,SOL Coin,17/08/2024,18450.4372525789,18169.828904727012,18783.036751494452,17986.76421148057,5240852.661006002,68876547440.39267,blockchain,COINBASE,Global,USD,2024-08-17 10:00:00
stock,AMZN,AMZN Inc,05-05-2024,42652.1478138064,45261.846377781745,45561.05325954499,42042.039941454444,4354925.852891454,1720578452745.159,RETAIL,NYSE,Global,USD,2024-05-05 01:00:00
stock,TSLA,TSLA Inc,03-30-2023,2510.4408569002953,2504.0390119698513,2555.0559951668897,2410.3269845398,6947022.624239978,891000220156.8763,Technology,NYSE,Global,USDT,2023-03-30 16:00:00
stock,GOOGL,GOOGL Inc,2024-02-10,12247.028056280946,11143.44207951748,12766.762963114279,10591.819265503462,9371187.826720798,2310761308073.605,RETAIL,NYSE,US,$,2024-02-10 23:00:00
stock,AAPL,AAPL Inc,12/11/2023,16099.113293714001,15282.817122477336,16106.362454177948,14698.60959654086,1378145.286869894,1886583423208.2908,finance,NASDAQ,US,usd,2023-11-12 20:00:00
crypto,SOL,SOL Coin,01-02-2024,8335.613973804127,8383.343428571727,8630.700860139417,8043.051302389764,351614.42523816833,246805657185.64252,blockchain,COINBASE,US,USD,2024-01-02 21:00:00
stock,MSFT,MSFT Inc,2023-09-04,1327.1031363739412,1390.5717555221984,1412.6825211970342,1313.5866032698862,4317896.505604649,121389103036.44633,Finance,NASDAQ,US,USDT,2023-09-04 09:00:00
crypto,BNB,BNB Coin,05/07/2023,25649.00129945359,26741.8101197315,27107.508204992526,24522.48093879004,5561017.294579424,183934249827.83572,crypto,COINBASE,Global,USD,2023-07-05 03:00:00
crypto,SOL,SOL Coin,2024-03-04,22130.14077026519,22780.531038511523,23343.353377661333,21709.97660871469,5442455.821134165,134156161180.882,Blockchain,BINANCE,Global,usd,2024-03-04 15:00:00
stock,MSFT,MSFT Inc,2023-08-23,35299.77151940388,35541.150593227365,36747.60031835596,35076.60566187392,4323280.606593898,2221991152088.9365,TECHNOLOGY,NASDAQ,Global,USD,2023-08-23 14:00:00
stock,GOOGL,GOOGL Inc,13/08/2023,38214.63858641048,38845.59159570673,38983.50661495936,38008.493570001396,308800.23927416373,1244161587518.893,finance,NYSE,US,$,2023-08-13 15:00:00
stock,TSLA,TSLA Inc,07/12/2023,37942.1191937886,41380.51815494739,41492.523648432376,37177.313941774955,4278977.865699902,2247705105067.132,AI,NYSE,US,usd,2023-12-07 22:00:00
crypto,ETH,ETH Coin,2024-02-19,4525.024829350661,4581.727118785418,4691.468812976718,4322.429163840762,6125282.5814637365,135600017169.5191,Crypto,BINANCE,Global,$,2024-02-19 09:00:00
stock,AAPL,AAPL Inc,2023-01-08,38366.24 USD,41476.771459773,42325.94767881223,38276.221193267476,8654428.621421779,2216479829556.286,Artificial Intelligence,NYSE,US,USD,2023-01-08 15:00:00
stock,MSFT,MSFT Inc,03/01/2023,7972.55903709943,7869.536666341019,8132.7670959050765,7702.592042165182,5834278.937045152,896539697361.5778,Technology,NASDAQ,Global,$,2023-01-03 22:00:00
crypto,BNB,BNB Coin,2023-02-08,25499.39851079845,23484.04151857919,26593.694150980158,22673.565659275548,9713003.305605615,301244858830.0902,Crypto,COINBASE,Global,usd,2023-02-08 01:00:00
stock,TSLA,TSLA Inc,2024-06-03,47912.98 USD,43993.80779550676,48466.457547686405,41896.57885669547,7051426.35324331,362401724952.51276,Technology,NYSE,Global,$,2024-06-03 13:00:00
crypto,SOL,SOL Coin,2023-05-15,21709.21337998086,23569.78881300652,24265.450035896185,21307.600677697774,8454346.597805997,340868000945.8577,Blockchain,BINANCE,US,$,2023-05-15 05:00:00
crypto,ETH,ETH Coin,07-23-2023,17719.743409168015,19158.4161780857,20021.467859004384,17698.907450597188,9018481.32610027,122236080995.47636,Blockchain,BINANCE,US,$,2023-07-23 03:00:00
stock,TSLA,TSLA Inc,12-25-2023,41187.97706398799,40445.26292485274,43228.432240171474,39378.07616744417,5538806.988939703,390842387739.7491,RETAIL,NASDAQ,Global,USDT,2023-12-25 14:00:00
crypto,ETH,ETH Coin,2023-06-13,16093.634122615307,14725.746320305167,16814.348282793242,14580.459023925254,1396128.278816133,214261091526.43542,crypto,BINANCE,Global,$,2023-06-13 19:00:00
stock,AAPL,AAPL Inc,15/05/2023,31296.074835869993,30727.38627334324,31693.568080469413,30511.877880725307,7002182.4046812365,2332537131336.718,RETAIL,NYSE,US,USD,2023-05-15 13:00:00
crypto,SOL,SOL Coin,29/01/2023,30482.33100958422,27989.27980982742,31204.63996078812,26860.892404037273,2084628.406409245,221357264240.30905,crypto,COINBASE,US,usd,2023-01-29 23:00:00
crypto,ADA,ADA Coin,2024-05-01,45563.7 USD,44686.65414042867,46036.98625610968,43901.83793385507,8711999.276456827,266215065103.31235,blockchain,BINANCE,US,usd,2024-05-01 19:00:00
crypto,BTC,BTC Coin,2024-07-22,43439.17395452399,43756.754897101695,45401.7381239925,41571.42969474062,3483397.8790165517,300585926443.38385,Blockchain,BINANCE,US,$,2024-07-22 22:00:00
crypto,BTC,BTC Coin,07-04-2023,25569.67435483927,27763.942915864605,28977.638905341868,24463.17928861025,1728723.7291727494,158871919970.20135,crypto,COINBASE,US,usd,2023-07-04 05:00:00
crypto,BNB,BNB Coin,01-12-2023,14544.285855874788,14878.138166005967,15549.719504586054,14516.863726019878,6536375.9223997295,146268017087.61996,Crypto,BINANCE,US,USD,2023-01-12 18:00:00
stock,AAPL,AAPL Inc,17/12/2023,26264.857989537548,24732.70772551837,26953.901321157104,24182.50712648634,7424833.184571352,2516096012189.249,Retail,NYSE,US,usd,2023-12-17 03:00:00
crypto,BTC,BTC Coin,2023-10-11,18421.83600051572,17920.86326797485,19305.567944772964,17422.61395120219,7551184.579014166,91853780934.4029,crypto,COINBASE,Global,USDT,2023-10-11 00:00:00
crypto,ADA,ADA Coin,2023-06-06,13284.553798314037,13475.505149299417,14078.064311496857,12935.965591846434,9451229.955918118,301570495642.90344,Crypto,COINBASE,Global,$,2023-06-06 05:00:00
stock,MSFT,MSFT Inc,29/09/2023,3717.2136976437964,4008.237237493672,4178.122604653442,3715.8364469097987,6794255.487636148,651230105679.2432,Technology,NASDAQ,US,usd,2023-09-29 22:00:00
crypto,ADA,ADA Coin,2023-10-23,41349.1817639547,44197.53117444968,45455.26378959107,40072.24583872494,9345646.167360274,374991731033.52405,crypto,COINBASE,Global,USDT,2023-10-23 23:00:00
stock,AMZN,AMZN Inc,04/03/2023,26945.580168810957,26655.18391734892,27706.548026792316,25949.494692210836,480627.6182361793,1302030355091.5244,RETAIL,NASDAQ,Global,USDT,2023-03-04 02:00:00
stock,MSFT,MSFT Inc,07/12/2023,22225.247007599333,22620.60591916592,22778.031540913067,21117.74944513128,2453655.646342786,2647324076163.019,Artificial Intelligence,NASDAQ,US,USD,2023-12-07 08:00:00
crypto,ADA,ADA Coin,24/02/2024,4968.734560342801,5375.065191610472,5432.853208008325,4771.126400433511,1815898.1082533337,283311482692.67334,crypto,COINBASE,Global,$,2024-02-24 23:00:00
stock,MSFT,MSFT Inc,2024-04-04,38592.555369226946,41487.263551717886,42761.26004707157,37026.08351143898,2853494.6914118566,51805321784.38059,finance,NASDAQ,US,$,2024-04-04 13:00:00
crypto,ADA,ADA Coin,2024-07-26,47717.75412164881,45306.58909789425,49463.379089016846,44036.75464712613,2979175.636251858,192991045459.1605,crypto,COINBASE,US,usd,2024-07-26 07:00:00
crypto,BNB,BNB Coin,11-30-2023,3569.6238098862145,3782.864120083282,3828.883026768975,3520.6150387383905,684415.366110499,185086795123.73492,Crypto,BINANCE,US,$,2023-11-30 01:00:00
crypto,ETH,ETH Coin,02-28-2023,9658.819120430873,10398.186417203346,10819.039083869007,9643.297361440147,4779428.71879655,382263929685.446,Crypto,COINBASE,Global,USD,2023-02-28 19:00:00
stock,AMZN,AMZN Inc,12-03-2023,18541.825745318823,17371.347919253465,18952.597582338654,16646.744713970118,9820464.183241053,2184917908599.395,Artificial Intelligence,NASDAQ,US,$,2023-12-03 14:00:00
stock,MSFT,MSFT Inc,03-25-2024,29464.694055396492,30209.937816221835,31022.705292742146,28967.014579141713,1162691.5693438975,297777008510.74194,AI,NASDAQ,US,USD,2024-03-25 20:00:00
stock,GOOGL,GOOGL Inc,28/07/2023,14367.756430656804,15632.624923479794,16228.28393963176,14348.011169371839,376523.14133215527,1669505387373.8203,Technology,NASDAQ,Global,USD,2023-07-28 16:00:00
stock,GOOGL,GOOGL Inc,04-23-2023,9779.18 USD,8823.074127957587,9897.66239349009,8681.36496250361,2311658.132423551,862548193790.319,RETAIL,NASDAQ,Global,usd,2023-04-23 21:00:00
stock,AMZN,AMZN Inc,22/05/2023,44392.02756710028,46112.28895539632,47022.15144048163,42999.158758949015,4557902.404270839,1531920301993.0286,Technology,NYSE,US,USDT,2023-05-22 04:00:00
crypto,BNB,BNB Coin,2023-08-23,31703.698363125244,30842.326753807545,33054.85505953443,30466.90263351544,6105521.127757508,74931369218.66302,Crypto,BINANCE,Global,$,2023-08-23 00:00:00
crypto,BNB,BNB Coin,21/07/2023,10504.492265357485,11084.659289469797,11354.243246350507,10097.311903973252,1952550.9757850221,148859877946.55884,crypto,COINBASE,Global,USD,2023-07-21 07:00:00
crypto,SOL,SOL Coin,2023-07-17,38860.28819831769,36753.96098138426,39883.56170521787,35746.06879893954,5796529.381383611,70333357278.0368,crypto,BINANCE,US,$,2023-07-17 04:00:00
stock,AMZN,AMZN Inc,03-09-2023,43388.69203018572,42964.1429796861,43422.028106225094,41732.02546277733,6062329.18070398,2632693152109.8706,Artificial Intelligence,NASDAQ,US,USDT,2023-03-09 01:00:00
crypto,BTC,BTC Coin,2023-07-01,32570.291928952272,30316.921053220143,33623.1837744324,29077.946735844023,7505489.282986793,225317079843.7344,blockchain,BINANCE,US,usd,2023-07-01 20:00:00
stock,AMZN,AMZN Inc,02-11-2024,35497.67271473887,32287.728916117772,36221.57679983143,31811.540646879035,2269478.29279861,1023871963655.4132,finance,NASDAQ,Global,$,2024-02-11 06:00:00
crypto,ETH,ETH Coin,05/02/2024,31542.678857915547,32095.065429745762,32662.424110160755,30726.435504757806,5973895.6604775535,319138382694.9029,crypto,BINANCE,Global,USDT,2024-02-05 09:00:00
crypto,SOL,SOL Coin,27/06/2023,34918.6830637886,34455.63990798955,35271.838720066306,33101.41918180742,59031.88466056799,191622534996.38174,blockchain,COINBASE,Global,USD,2023-06-27 16:00:00
stock,AMZN,AMZN Inc,10-26-2023,37448.392847521194,39651.576983849554,40052.984850456574,37371.70602279001,5024525.532007787,909863569520.4307,ai,NYSE,US,$,2023-10-26 15:00:00
stock,AAPL,AAPL Inc,2023-11-18,35341.19644026294,36913.40909984598,37070.37159907615,33962.87409978875,89139.51811143187,2751766459565.3228,Retail,NASDAQ,Global,USDT,2023-11-18 09:00:00
crypto,SOL,SOL Coin,2023-03-18,17228.470038541214,18216.186895479972,18524.89317188099,17072.839886766476,1307851.8392293819,287870417988.3113,crypto,COINBASE,Global,usd,2023-03-18 15:00:00
stock,TSLA,TSLA Inc,2024-02-08,17050.418213800986,16738.35255552215,17347.694651661022,16540.544590663638,970416.9748745203,528385738704.9495,Finance,NASDAQ,US,usd,2024-02-08 10:00:00
crypto,SOL,SOL Coin,2024-01-02,41863.62757577781,38236.53841133084,43836.12345845811,38210.37858202812,886593.1700769758,143730722757.2028,crypto,BINANCE,Global,usd,2024-01-02 11:00:00
stock,AMZN,AMZN Inc,26/10/2023,18626.309295107454,19655.939518912204,20241.61458774544,18295.101572178737,7575340.718362241,880904841544.6536,Artificial Intelligence,NYSE,Global,$,2023-10-26 20:00:00
stock,AAPL,AAPL Inc,09/02/2024,41662.14075094402,43375.452995530955,44627.575938711656,41432.447650837814,7003363.232484188,362757208316.7069,tech,NASDAQ,US,USD,2024-02-09 19:00:00
crypto,ETH,ETH Coin,2024-02-02,21492.97 USD,21467.364301619073,21552.3111441508,21418.673650302724,1286644.030707988,84671485239.25504,blockchain,COINBASE,US,$,2024-02-02 07:00:00
crypto,BTC,BTC Coin,2023-07-25,25316.4894941831,22914.62426174704,26487.057482057728,22744.869068980264,5243055.021110452,280497200554.5571,Blockchain,COINBASE,US,USD,2023-07-25 03:00:00
stock,TSLA,TSLA Inc,04-12-2023,6089.928305097911,5923.542303858804,6167.705301031166,5777.435526873555,9664126.551938167,694537585056.9413,Automotive,NYSE,US,$,2023-04-12 14:00:00
stock,AMZN,AMZN Inc,27/11/2023,44497.65348394599,45840.40432973554,46929.678976488525,44174.17236931215,4714209.733619802,1729110944756.6277,RETAIL,NASDAQ,US,USD,2023-11-27 00:00:00
crypto,ETH,ETH Coin,10-16-2023,14585.922711092506,13503.101947600297,15209.70024463637,13224.543192333218,8891034.890091352,348108127351.5926,Crypto,COINBASE,Global,USD,2023-10-16 19:00:00
crypto,BNB,BNB Coin,09/04/2024,2690.88 USD,2691.4048902930167,2741.863961346302,2640.5446663329385,7936118.380826033,375441746761.9914,Crypto,BINANCE,Global,USD,2024-04-09 02:00:00
stock,AMZN,AMZN Inc,2024-05-07,27844.35123481485,29006.73361313808,29201.70394359517,27585.49191597141,6061489.888929877,848964745763.3632,tech,NASDAQ,US,USD,2024-05-07 16:00:00
crypto,BTC,BTC Coin,07-22-2024,16983.050667343356,15652.07520424507,17413.147445357372,14936.627276639338,9695295.706716744,380067287659.89246,Blockchain,BINANCE,US,USD,2024-07-22 20:00:00
crypto,ETH,ETH Coin,11-20-2023,37677.660016354326,37866.81994091405,38564.744534646794,35917.815949991505,6222047.074811904,20280558511.59066,blockchain,BINANCE,Global,usd,2023-11-20 18:00:00
crypto,SOL,SOL Coin,01-15-2023,14051.35482064931,15204.188956978662,15435.376257746095,13664.749645421438,5438080.7967306385,236162030109.42734,Blockchain,COINBASE,Global,USD,2023-01-15 23:00:00
crypto,ETH,ETH Coin,14/02/2024,46608.76434348948,45439.221362682096,46797.01531065556,44047.1707631703,6002425.268378714,44591591879.633,Crypto,COINBASE,Global,usd,2024-02-14 20:00:00
crypto,BNB,BNB Coin,2024-05-26,34730.15328212333,31642.53111645399,35224.2602326102,31356.531011591964,799856.9842258173,207892805369.42517,crypto,,US,$,2024-05-26 05:00:00
crypto,BTC,BTC Coin,05-28-2024,4603.8856429345415,4911.843434566306,5000.4502415216175,4514.618386628029,1529718.2693643337,342916952104.90326,crypto,COINBASE,Global,usd,2024-05-28 18:00:00
stock,AAPL,AAPL Inc,2024-03-30,10804.750818966553,10000.561465821294,10973.524212906754,9757.739456216337,5888005.87618653,207844477958.29074,Technology,NYSE,US,$,2024-03-30 22:00:00
stock,GOOGL,GOOGL Inc,04-22-2024,32815.43226348545,33529.22255376124,34219.559115921715,31952.072080476297,4145793.7730724206,2371705641065.431,Finance,NASDAQ,Global,USD,2024-04-22 13:00:00
stock,AMZN,AMZN Inc,29/01/2023,11507.72262289451,10370.117339270959,11882.483058697095,9956.589302362396,8901261.247961784,2528076429883.5356,finance,NYSE,Global,USDT,2023-01-29 03:00:00
stock,GOOGL,GOOGL Inc,12-18-2023,3845.6013226910122,3542.8666689377837,3940.8129491961517,3473.643068785248,2749808.4664849252,2578548525822.902,Automotive,NASDAQ,US,USDT,2023-12-18 17:00:00
stock,AAPL,AAPL Inc,05/07/2024,29749.851885734388,28707.560527947957,29787.591786303365,28348.93173182228,2148321.904585002,2153225172931.1182,AI,Unknown,Global,USD,2024-07-05 14:00:00
stock,TSLA,TSLA Inc,01-17-2023,21020.31 USD,21344.34844928088,22275.974543291235,20876.97575955295,3715824.2328604893,2505076492953.259,automotive,NASDAQ,US,USDT,2023-01-17 20:00:00
stock,GOOGL,GOOGL Inc,11/03/2024,38759.55242565245,38240.79615429301,39131.725511516306,38058.0536041947,1981843.8382166328,634577789217.381,Artificial Intelligence,NASDAQ,US,$,2024-03-11 10:00:00
stock,,TSLA Inc,02/02/2023,1023.7958886333241,1048.8410804442433,1083.5406797235426,988.5282551431999,3200789.8814813867,87163432891.78093,tech,NASDAQ,Global,USDT,2023-02-02 03:00:00
crypto,BTC,BTC Coin,08-14-2024,34011.12575247634,31005.45231264504,35591.14040797969,29800.147978202975,9996732.37921568,139100096448.67737,blockchain,BINANCE,Global,usd,2024-08-14 09:00:00
crypto,SOL,SOL Coin,2023-11-17,38579.60740104575,36445.48031531186,38735.559294397106,36217.574562037866,8587653.840649728,72751464045.93886,Blockchain,COINBASE,US,usd,2023-11-17 18:00:00
stock,TSLA,TSLA Inc,14/08/2024,35122.78316559594,35523.64604155588,37038.65159511225,33919.926132086424,5237200.327589853,1216675473424.308,RETAIL,NASDAQ,US,USD,2024-08-14 07:00:00
stock,MSFT,MSFT Inc,2023-03-04,17701.75225458037,19087.640368895907,19245.95127745077,16948.992886687087,5769518.443692191,1461263389901.606,TECHNOLOGY,NASDAQ,Global,$,2023-03-04 20:00:00
stock,AMZN,AMZN Inc,13/12/2023,9739.016523685013,9526.15559655846,10199.946569059653,9167.313613799215,6683938.660471823,1975907747654.9766,ai,NASDAQ,US,usd,2023-12-13 10:00:00
crypto,BTC,BTC Coin,12-06-2023,22411.95 USD,24373.116116621815,25270.847123900774,21804.50522573236,5693782.682559163,297359010510.54834,Crypto,BINANCE,Global,usd,2023-12-06 19:00:00
stock,TSLA,TSLA Inc,2024-07-15,29613.58711965662,31856.505897784016,32424.967186523412,28576.94238812805,2139175.0560631477,2080914195841.051,automotive,NYSE,US,USDT,2024-07-15 00:00:00
crypto,BTC,BTC Coin,2023-12-04,2160.27 USD,2320.1517636139665,2398.850516366831,2123.6010300134835,6146813.546529925,19924272385.515076,Crypto,BINANCE,Global,USDT,2023-12-04 22:00:00
crypto,SOL,SOL Coin,26/12/2023,24018.543614024715,25797.88934219163,26261.53549269416,23930.5246638441,6986871.143832319,340441562154.17145,Crypto,COINBASE,Global,USDT,2023-12-26 03:00:00
crypto,ETH,ETH Coin,22/01/2024,28208.60523521437,28394.954449158304,28590.735987239575,27632.08185977566,3148541.4515458625,106584968729.64877,Blockchain,BINANCE,Global,USD,2024-01-22 12:00:00
crypto,ETH,ETH Coin,2024-08-05,47433.32132375118,48775.59295175968,50914.20499539089,46665.034343495885,3570479.9377089893,25677762889.79296,Crypto,COINBASE,US,USD,2024-08-05 04:00:00
stock,MSFT,MSFT Inc,2024-08-21,33790.58054975538,36901.01920334166,37369.05228245921,33579.35066119893,9240853.9751374,1542937336263.1462,finance,NASDAQ,Global,usd,2024-08-21 13:00:00
crypto,ETH,ETH Coin,07/08/2023,46564.01870379288,45612.98203124057,48782.8318561011,44935.1340670803,421015.6684207002,269814128290.28784,blockchain,COINBASE,Global,usd,2023-08-07 00:00:00
crypto,ADA,ADA Coin,04-20-2023,24228.795723569296,24036.54984725811,24915.035907594505,23014.256810139035,4692191.319625419,363214768568.5258,Blockchain,COINBASE,US,USDT,2023-04-20 19:00:00
stock,MSFT,MSFT Inc,05-27-2023,783.9681322843917,748.3629903455239,784.0643481618872,726.4999887500394,7283426.789426853,2495070377986.0596,Technology,NASDAQ,Global,USD,2023-05-27 02:00:00
crypto,ETH,ETH Coin,19/06/2024,47260.03615873906,48285.62254521693,48900.36338387058,47080.797625413354,7753382.223049881,320514872500.27826,blockchain,BINANCE,Global,USDT,2024-06-19 18:00:00
crypto,BTC,BTC Coin,2023-07-16,34785.05438378961,37737.02788076257,39081.20954649115,33686.498028596965,7130568.994688678,231899250786.2421,Crypto,COINBASE,Global,usd,2023-07-16 21:00:00
stock,MSFT,MSFT Inc,07-06-2023,19326.913935910758,18964.81659565125,19488.137345804294,18038.466361103026,1334678.9851407905,130431706578.80972,Finance,NYSE,Global,USD,2023-07-06 00:00:00
crypto,SOL,SOL Coin,20/09/2023,40116.41793002074,44033.41299984697,44795.99135886948,39312.84440245956,9371512.523184404,263575490839.83676,crypto,COINBASE,Global,USDT,2023-09-20 13:00:00
stock,AAPL,AAPL Inc,2023-09-03,35885.1 USD,37715.09047457271,37882.876493839496,35636.14885703517,8131237.366061328,509454926201.07635,tech,NASDAQ,Global,USDT,2023-09-03 15:00:00
crypto,BTC,BTC Coin,2024-07-15,4563.3098998537735,4151.815158117547,4639.686823482376,4049.9480877800347,5323944.931818333,18194187598.08661,Crypto,COINBASE,Global,usd,2024-07-15 09:00:00
crypto,ETH,ETH Coin,05-23-2024,45580.7283591481,44379.79276122004,45684.53882343678,42827.003972734354,5311563.116019011,110728370108.92986,Blockchain,COINBASE,US,USD,2024-05-23 08:00:00
crypto,BTC,BTC Coin,10-01-2023,13699.387529771966,12689.258394832854,14260.490126644476,12686.812693896072,3296091.793105297,166247619922.35165,blockchain,BINANCE,Global,USDT,2023-10-01 19:00:00
crypto,SOL,SOL Coin,13/02/2024,30905.695858601084,32255.91301481727,32888.17654351047,30758.78488693657,5600479.888299955,155740312449.75854,Blockchain,BINANCE,US,$,2024-02-13 11:00:00
stock,MSFT,MSFT Inc,2023-05-02,32337.170930463657,35265.65001822471,36666.670175037376,30785.007956019334,3323766.7974888566,1356666328453.7336,automotive,N/A,US,USDT,2023-05-02 22:00:00
crypto,ADA,ADA Coin,2024-05-16,15732.733434733173,16362.632941032176,17038.629881517183,15521.399634563984,9893343.534995925,190865150555.73297,crypto,COINBASE,Global,USDT,2024-05-16 16:00:00
stock,TSLA,TSLA Inc,05-27-2024,43750.72485627083,46083.71182916974,46918.23890386756,43169.112659445855,1041655.4882260513,824917467200.157,finance,NYSE,US,$,2024-05-27 12:00:00
crypto,ETH,ETH Coin,06-01-2023,26621.21 USD,25515.309569020264,27494.085982371333,25058.100735212876,2095652.7409732775,316786725524.5182,blockchain,BINANCE,US,$,2023-06-01 21:00:00
crypto,BNB,BNB Coin,2023-02-28,21686.79311921468,21988.29102517515,22952.04362392602,21608.955744103434,5288523.376349507,17006978850.552824,Blockchain,BINANCE,Global,USDT,2023-02-28 06:00:00
stock,GOOGL,GOOGL Inc,07-23-2023,21970.770583676567,23052.09350503645,23288.148700180034,21279.860962495797,6342645.7601373345,2263872416467.949,tech,N/A,US,USD,2023-07-23 23:00:00
crypto,ADA,ADA Coin,05/11/2023,36125.84090384431,38550.14133112541,39319.48970344101,35128.66368350338,8512970.839953093,12172396414.796139,crypto,BINANCE,Global,USDT,2023-11-05 15:00:00
crypto,BNB,BNB Coin,10/02/2023,14414.592956778417,13907.130401861867,14903.880626134802,13603.397347456596,1623133.481393873,311383580953.7832,crypto,COINBASE,Global,USDT,2023-02-10 22:00:00
stock,,TSLA Inc,14/01/2024,45000.16401116392,46693.740114205975,48995.681541670434,44475.94029299335,9419802.347003758,936690428595.2075,Automotive,NYSE,US,USD,2024-01-14 04:00:00
crypto,BNB,BNB Coin,2023-06-12,38576.52889209812,34874.86035290992,39870.30855995909,33949.42503104137,3468253.9591287663,90394486678.83778,Crypto,COINBASE,Global,USDT,2023-06-12 16:00:00
crypto,ETH,ETH Coin,24/07/2023,42714.84195594996,38633.88052037372,44016.58770478843,37412.72580465299,4157194.354002991,345649719155.7702,blockchain,COINBASE,US,USDT,2023-07-24 17:00:00
crypto,ADA,ADA Coin,10/01/2024,15498.89 USD,16872.243150641083,17023.784430472624,15237.51877267143,6721378.565070634,333656091991.4165,crypto,BINANCE,US,$,2024-01-10 14:00:00
crypto,ADA,ADA Coin,17/06/2023,16244.282942270427,17331.995230693265,17992.17548297308,15699.365124905331,5340031.512802404,104617088764.0277,Blockchain,COINBASE,Global,$,2023-06-17 01:00:00
crypto,,ADA Coin,2023-10-29,10445.206661107475,10415.585222499047,10490.10733272841,10333.995962037485,7180344.094866371,29363717019.972706,blockchain,COINBASE,US,USD,2023-10-29 15:00:00
crypto,BTC,BTC Coin,26/01/2024,34676.41062914172,37730.71839438193,38776.826248628175,33983.26144890653,9769733.575207982,377735299906.15546,crypto,BINANCE,US,$,2024-01-26 23:00:00
crypto,ETH,ETH Coin,10-16-2023,1549.0205773487226,1618.3555986024148,1691.6241149664045,1533.1880573744688,5838748.892981601,258641013011.38284,blockchain,COINBASE,Global,USDT,2023-10-16 15:00:00
crypto,BTC,BTC Coin,2023-04-24,49509.68754469107,45456.44912507126,51161.44169376321,43827.739313088234,6401263.875465115,270164887671.93893,Blockchain,COINBASE,US,USD,2023-04-24 06:00:00
stock,TSLA,TSLA Inc,2024-06-29,7681.31 USD,7230.793226342048,7920.053419701261,6915.613776743862,2652543.570428098,1826794491892.977,Automotive,NASDAQ,Global,USDT,2024-06-29 14:00:00
crypto,BTC,BTC Coin,02-03-2023,16361.304385021915,16322.234101505586,17131.218559639048,15691.501426627323,3896870.547562746,334921991356.5109,Crypto,,US,USD,2023-02-03 09:00:00
stock,TSLA,TSLA Inc,15/10/2023,37769.39308590357,40803.43401531089,42671.15609737367,37347.58464437064,2284080.0350965112,1823308748875.2014,tech,NYSE,US,USD,2023-10-15 21:00:00
crypto,SOL,SOL Coin,23/06/2023,19194.858778477632,17818.774941623276,19876.648307005285,17516.863051225653,440672.4445729269,14799685366.813492,Crypto,COINBASE,US,usd,2023-06-23 22:00:00
stock,AMZN,AMZN Inc,07-09-2024,12444.6758818962,12275.99346607976,12860.286824312745,11925.77090385628,4413436.740196634,2511415399601.544,Finance,NASDAQ,US,USD,2024-07-09 10:00:00
stock,GOOGL,GOOGL Inc,08/05/2023,20078.16302750759,21141.694863020144,22109.113806352918,19489.368022600513,4236434.68296391,206227706053.8637,Automotive,NASDAQ,Global,USDT,2023-05-08 16:00:00
crypto,SOL,SOL Coin,06-20-2024,47139.17233525278,44943.06143891907,48176.57401547053,44484.58208640845,6097326.000171011,282537706997.8426,crypto,COINBASE,Global,usd,2024-06-20 07:00:00
crypto,ADA,ADA Coin,2023-11-18,31390.359450757664,29423.730105602615,32191.152529168925,28730.95318760414,8762157.418887623,48681605865.762115,blockchain,BINANCE,Global,$,2023-11-18 03:00:00
crypto,BNB,BNB Coin,09/02/2023,13979.326687572351,13227.144825924617,14590.39931714203,12678.886851538136,4259259.740270554,187685238234.91306,Blockchain,BINANCE,US,USDT,2023-02-09 08:00:00
stock,GOOGL,GOOGL Inc,18/07/2024,38667.468965317625,38469.279935628736,39346.360853166254,37240.37809684302,8522289.85302307,569647613631.5715,Retail,NASDAQ,US,USD,2024-07-18 11:00:00
stock,TSLA,TSLA Inc,2024-04-29,35896.213878051865,38746.64977748366,40493.62322304906,34691.0147479187,9524560.180200707,1665784123340.3699,RETAIL,NASDAQ,US,USDT,2024-04-29 14:00:00
stock,AAPL,AAPL Inc,2024-06-05,18848.00969519812,20340.01383593312,20619.319732699867,18162.961301599964,3026920.2285338053,84378887223.67027,Technology,NYSE,US,USDT,2024-06-05 08:00:00
crypto,BTC,BTC Coin,2024-07-06,21922.26 USD,22916.36325348623,23941.768121707362,21565.14122649969,2045462.7352555573,246863787014.53427,crypto,COINBASE,Global,USD,2024-07-06 19:00:00
stock,MSFT,MSFT Inc,04-11-2023,13231.99873864045,12305.479090118724,13291.521084660808,12036.840477636806,1138510.8623440375,2798718888057.9014,Artificial Intelligence,NASDAQ,Global,USD,2023-04-11 17:00:00
stock,TSLA,TSLA Inc,2023-01-09,15008.523724968876,14353.110528083622,15461.960876288053,14221.596765157537,7613735.212372721,424939893496.7659,Automotive,NASDAQ,Global,USDT,2023-01-09 06:00:00
stock,,TSLA Inc,15/04/2023,12273.071794319136,13416.410372356853,13421.935412213033,12199.261867662415,1998085.4627049272,794828519602.2655,Finance,NASDAQ,US,USD,2023-04-15 23:00:00
stock,AAPL,AAPL Inc,07-26-2023,17121.941168527712,16917.682484886358,17727.30504607816,16568.89828159299,3180075.3577385214,2842380126038.406,Finance,NASDAQ,US,$,2023-07-26 11:00:00
stock,GOOGL,GOOGL Inc,07-17-2024,36538.03714930068,33193.60059959039,36558.49718087465,32294.165120783993,1319234.3414173385,1665954438444.7922,Automotive,NYSE,US,$,2024-07-17 04:00:00
stock,TSLA,TSLA Inc,2024-01-26,10710.482286809434,10566.64288056067,10816.33984020988,10328.092245355654,1161418.5403863045,1996389431479.496,Automotive,NYSE,US,USDT,2024-01-26 12:00:00
crypto,ETH,ETH Coin,2023-05-25,2566.070588953792,2799.202434265077,2819.116830739982,2528.667319920492,680194.1160240397,14127206851.054703,crypto,BINANCE,US,USDT,2023-05-25 13:00:00
crypto,ADA,ADA Coin,29/12/2023,25448.72 USD,25269.925808726162,26659.549031753708,25200.225608254263,7796306.8167821085,47723339132.89696,crypto,BINANCE,Global,USD,2023-12-29 02:00:00
stock,TSLA,TSLA Inc,20/01/2023,22753.466266476622,22098.978892965923,23830.942494052044,21660.21340322049,5791146.204332259,1810284472080.7756,Finance,N/A,US,USDT,2023-01-20 03:00:00
stock,MSFT,MSFT Inc,10-06-2023,2344.4239160768025,2553.1660667873107,2593.216977629156,2279.083534836709,1147284.7959134828,703384354089.0554,Artificial Intelligence,NYSE,US,$,2023-10-06 08:00:00
stock,GOOGL,GOOGL Inc,03-08-2024,1391.315324467972,1484.252617575814,1494.663537447674,1383.4240700459268,7297996.600724238,2512403746428.783,ai,NYSE,Global,USD,2024-03-08 02:00:00
crypto,ETH,ETH Coin,09-18-2023,28295.24146304481,27235.054498665646,28547.398891565314,27043.29547499461,4035824.1423057867,70044753690.38551,crypto,BINANCE,US,usd,2023-09-18 08:00:00
stock,TSLA,TSLA Inc,04-24-2023,8502.63 USD,8303.784901496554,8873.186863282837,8039.362791594914,9516084.02143538,1201645705952.4937,Automotive,NYSE,US,$,2023-04-24 18:00:00
stock,AMZN,AMZN Inc,29/03/2023,7253.483978774228,6785.360448233381,7566.353606177043,6579.343646065891,44735.44884781036,2839463608633.0786,Artificial Intelligence,NYSE,US,USDT,2023-03-29 09:00:00
crypto,SOL,SOL Coin,2023-09-16,29885.47336984604,31674.214381085618,31885.463363776045,28556.37875148088,9221004.443069743,113179368783.62155,blockchain,COINBASE,US,USD,2023-09-16 16:00:00
stock,TSLA,TSLA Inc,04-04-2023,29493.08224289614,31080.911870106367,31747.37110055049,29136.8880174006,3718658.109754083,2255933619789.522,TECHNOLOGY,NYSE,US,USDT,2023-04-04 15:00:00
stock,GOOGL,GOOGL Inc,11-09-2023,36453.3809304355,35867.73762378354,38242.106601456035,34701.11288371572,9217352.477890128,739842771752.8811,tech,NYSE,Global,USDT,2023-11-09 22:00:00
stock,GOOGL,GOOGL Inc,2024-03-14,12100.22882376666,12821.937731228469,13099.580448125778,12050.330340125893,4501792.602079753,2799558020215.568,AI,NYSE,Global,USD,2024-03-14 23:00:00
crypto,SOL,SOL Coin,2023-09-06,23353.700784098255,22082.32884315033,23586.47894723054,21447.937977577953,7555191.075485135,298999968348.25964,Crypto,COINBASE,Global,USDT,2023-09-06 04:00:00
stock,MSFT,MSFT Inc,08-10-2024,34434.578202128156,32935.47814247545,35263.47935561045,31361.813199303007,8175506.627165249,1819163740690.4927,tech,NYSE,US,usd,2024-08-10 19:00:00
stock,MSFT,MSFT Inc,2023-10-03,20349.8843406073,18359.51772118206,20522.64736944471,18040.545773903275,6121181.102720388,2969777565097.225,tech,NASDAQ,Global,USDT,2023-10-03 04:00:00
crypto,SOL,SOL Coin,23/04/2024,12701.661707943798,13371.37438928318,13831.338985565064,12271.59264976566,5455335.992421563,316206564236.28986,Blockchain,COINBASE,US,usd,2024-04-23 13:00:00
crypto,ADA,ADA Coin,06-20-2023,22633.699526744775,24359.28073552415,24872.276688751626,22452.139578758706,5902943.399231684,63173154356.83906,blockchain,COINBASE,Global,USDT,2023-06-20 07:00:00
stock,AMZN,AMZN Inc,19/08/2024,29059.501172447843,29094.275684578806,29674.18472985242,27780.346158694334,4167669.929808451,583711372176.0468,AI,NYSE,Global,USD,2024-08-19 07:00:00
crypto,ETH,ETH Coin,03-24-2024,4947.464879423575,4864.264879372465,5023.00808726684,4846.156273333545,3757682.347997325,33741138614.65271,crypto,BINANCE,US,USDT,2024-03-24 05:00:00
crypto,BTC,BTC Coin,25/04/2024,26517.073843048474,27599.42479218782,27958.377367711793,26440.048336790478,5301354.880647325,304353958218.47955,Crypto,COINBASE,US,USD,2024-04-25 03:00:00
stock,AMZN,AMZN Inc,05-26-2024,18258.634216870912,16798.715268522363,18873.68694403993,15965.297111246457,4753454.472678517,2495658973142.8965,tech,NASDAQ,Global,usd,2024-05-26 00:00:00
stock,AMZN,AMZN Inc,04-05-2023,31372.501466723756,34380.621601362516,35178.94463100167,31086.224655982347,5078334.0853242595,586477688972.7131,AI,NASDAQ,US,USD,2023-04-05 13:00:00
stock,AMZN,AMZN Inc,2023-02-17,46521.8704240071,50150.25874713081,52120.66357977044,44884.89549121525,5450539.148823681,1492561693001.032,TECHNOLOGY,NYSE,Global,usd,2023-02-17 08:00:00
stock,MSFT,MSFT Inc,24/02/2023,22201.395735346523,22131.29734044357,23124.57421740446,22016.245982345343,4146786.003902382,679452727583.9982,Finance,N/A,US,USD,2023-02-24 05:00:00
stock,TSLA,TSLA Inc,25/07/2023,43090.07425106984,40283.00306536325,44429.92125104176,38319.148055031736,3995665.246130382,62936290768.97925,automotive,NYSE,Global,usd,2023-07-25 15:00:00
stock,TSLA,TSLA Inc,04-26-2023,5043.673119179117,4966.699759565378,5121.13131654563,4943.129819828008,8693531.738965644,2958021303324.896,tech,NASDAQ,US,$,2023-04-26 13:00:00
crypto,BTC,BTC Coin,10-08-2023,4068.577474651054,4172.03195589913,4242.199006646303,4001.8699715527223,322165.44092207693,98891010320.96039,Crypto,COINBASE,US,$,2023-10-08 03:00:00
crypto,BTC,BTC Coin,12-23-2023,34321.74791630444,32347.359543896542,35793.443317486766,30824.754592239504,2155604.3458729605,57692697895.10832,crypto,BINANCE,US,USDT,2023-12-23 01:00:00
stock,MSFT,MSFT Inc,2023-01-22,21659.474368313764,22538.700285752366,22744.54967132586,21236.972461570836,7261334.577625816,2995695142970.355,Artificial Intelligence,NASDAQ,US,$,2023-01-22 09:00:00
crypto,ETH,ETH Coin,2023-07-15,41446.56662767413,42303.82733899898,43126.896969618276,40529.85642679607,5768031.713511807,129218271167.27167,blockchain,,US,usd,2023-07-15 10:00:00
crypto,ETH,ETH Coin,2024-08-05,20142.591169649637,19511.84843861048,20546.35215163518,19278.789739057254,4825901.53625926,70386440614.07709,Crypto,Unknown,Global,USDT,2024-08-05 17:00:00
stock,AAPL,AAPL Inc,15/09/2023,14690.883903788226,14443.20611480405,15268.93846079038,14115.36309631803,5470734.436098053,2821545298185.4004,Retail,NASDAQ,Global,usd,2023-09-15 22:00:00
crypto,BTC,BTC Coin,05/06/2024,19935.997139295607,19021.866808380142,20932.134246793543,18364.04792212396,8845080.851403842,26069364387.04749,crypto,BINANCE,US,usd,2024-06-05 19:00:00
crypto,ETH,ETH Coin,2023-06-03,17052.4112955126,17200.884520618605,17923.782550940738,16952.968707908974,1604778.356186446,272112325340.9886,crypto,BINANCE,Global,$,2023-06-03 21:00:00
stock,MSFT,MSFT Inc,2024-07-13,16767.80677887645,15232.025904320544,17269.363537127672,15121.456668640001,3816362.303867352,1025323692212.4271,Finance,NASDAQ,US,usd,2024-07-13 00:00:00
stock,MSFT,MSFT Inc,08-08-2023,31388.743675900987,30608.097682424115,31610.12817036287,30163.24548701492,8545797.124243462,2222707475502.6895,TECHNOLOGY,NYSE,US,USDT,2023-08-08 23:00:00
crypto,SOL,SOL Coin,12/03/2024,903.745416900555,852.4547726682996,906.8850277957956,834.1434516772551,7565020.310725284,275912524498.5893,blockchain,COINBASE,Global,$,2024-03-12 20:00:00
crypto,BNB,BNB Coin,04-26-2023,41918.507651463326,42383.87835858252,43846.05649267283,41858.56806006752,837726.2014887255,48678778892.120476,blockchain,COINBASE,Global,USDT,2023-04-26 03:00:00
stock,AMZN,AMZN Inc,2023-03-29,6313.873772410591,6178.704855741755,6582.667595089617,6149.743485608107,5064210.3637779085,2704659828703.59,Artificial Intelligence,NYSE,US,USDT,2023-03-29 00:00:00
crypto,SOL,SOL Coin,05-26-2023,35410.285256581876,37766.90113088407,37996.35614719542,35074.01025785273,4813280.228965656,239671332118.79294,Blockchain,BINANCE,US,usd,2023-05-26 14:00:00
stock,MSFT,MSFT Inc,04-24-2023,21200.748602329943,21239.807102936,22243.441675767215,20721.827690704205,9531822.205093129,1357364041073.4253,AI,NYSE,US,usd,2023-04-24 22:00:00
crypto,SOL,SOL Coin,01-07-2024,36209.55758184333,38470.768692359656,39777.09910148945,35497.89906542949,5648562.998080737,76214601593.17802,Crypto,,Global,USD,2024-01-07 05:00:00
stock,,GOOGL Inc,2024-04-25,41084.113392253355,37980.5267905435,42827.28696848951,36867.82766570538,2537714.603128112,2584182142910.301,Automotive,NYSE,Global,usd,2024-04-25 23:00:00
crypto,ETH,ETH Coin,08-20-2023,21606.919733690745,22939.481955561725,23241.599075736267,20530.818773635096,4955096.4698365405,348558584365.50073,crypto,COINBASE,Global,usd,2023-08-20 16:00:00
stock,AAPL,AAPL Inc,11-15-2023,37721.25401669023,36031.908682094516,38557.99752313667,34387.11252147259,2867305.825224079,309682487362.22394,tech,Unknown,Global,$,2023-11-15 17:00:00
crypto,BNB,BNB Coin,07-12-2024,7587.87971599695,7811.205525775,8169.515620320769,7466.411708174837,8110405.871232976,313688646087.1359,Blockchain,N/A,Global,USD,2024-07-12 16:00:00
crypto,BNB,BNB Coin,06-27-2024,12544.083981842703,13533.909681163865,14017.818420523889,12318.01062819986,6638003.594480879,48043793575.04674,Crypto,BINANCE,US,USDT,2024-06-27 03:00:00
stock,TSLA,TSLA Inc,04-08-2023,2237.3860145664844,2364.667120204639,2444.913663890946,2178.409018619681,8997696.394067205,1248459657370.8838,Technology,NASDAQ,Global,USD,2023-04-08 12:00:00
crypto,ETH,ETH Coin,28/01/2024,14723.143994119484,15820.890789044128,16451.343521352046,14366.092889725509,1308216.6598390418,137783067669.11404,Crypto,N/A,Global,USDT,2024-01-28 10:00:00
stock,TSLA,TSLA Inc,03/08/2024,32814.837240536246,32060.366626608164,34187.27382256578,31980.143589176427,8056563.615823908,653063699680.5068,Automotive,NYSE,Global,usd,2024-08-03 23:00:00
stock,AAPL,AAPL Inc,2023-11-20,39436.43459727889,38264.71245166797,39765.926181397335,36415.36589818615,3857781.4108974393,1138860814756.7158,automotive,NYSE,Global,USDT,2023-11-20 07:00:00
stock,GOOGL,GOOGL Inc,2023-02-08,11956.939521906268,11255.098654424219,12536.743945717008,10706.414909547997,7858035.721787149,2711642318054.873,Artificial Intelligence,NASDAQ,US,usd,2023-02-08 05:00:00
stock,AAPL,AAPL Inc,06-14-2023,1884.0229639142701,2041.4528799415846,2055.7065417999897,1841.8000577961254,2741268.020088048,970896167665.2024,automotive,NYSE,US,USDT,2023-06-14 06:00:00
stock,AAPL,AAPL Inc,2023-06-03,2505.6250583123206,2312.9709045331247,2514.5660072292285,2285.2797989266746,4856176.456632008,204926478532.2262,AI,NYSE,Global,usd,2023-06-03 01:00:00
crypto,BNB,BNB Coin,10-21-2023,20924.26181749904,22719.340577675663,23753.924608442336,20626.798828959632,8846939.091839455,140442376082.847,crypto,BINANCE,Global,$,2023-10-21 23:00:00
crypto,BTC,BTC Coin,2023-07-09,19061.65520715406,19495.163687825763,20103.048183952542,18567.672258073017,4007177.8265310945,131260970897.11179,blockchain,BINANCE,Global,USDT,2023-07-09 07:00:00
stock,AMZN,AMZN Inc,2023-08-05,41057.970069625044,40524.05385181593,42551.02770774333,39044.0377879126,1002593.0930470615,2958679131709.9985,finance,NASDAQ,US,USD,2023-08-05 02:00:00
stock,TSLA,TSLA Inc,2024-03-30,20154.610278168475,18205.809110479997,20975.701040705488,17622.48898083806,5804601.23963569,1063768766402.6945,Automotive,NASDAQ,Global,USDT,2024-03-30 11:00:00
crypto,BNB,BNB Coin,29/07/2024,8758.091469241694,9440.686127523357,9728.00752254734,8736.320627437337,9987501.593878778,34215458972.027607,Blockchain,BINANCE,Global,USD,2024-07-29 04:00:00
crypto,BTC,BTC Coin,2023-10-29,14947.165173522899,16018.44660300192,16818.25679405927,14670.374491253422,7951612.0843927115,151884745556.57227,crypto,BINANCE,Global,usd,2023-10-29 20:00:00
crypto,ETH,ETH Coin,2024-08-08,17773.43201389515,18037.43992472425,18788.750651320643,17496.267673077582,212616.97600640057,313789614232.03345,Blockchain,BINANCE,US,USD,2024-08-08 23:00:00
crypto,ADA,ADA Coin,18/01/2023,7232.340072764321,6846.092918538399,7559.780464440668,6516.41701680916,2198787.3189072753,137998739214.52576,Crypto,BINANCE,Global,USD,2023-01-18 02:00:00
stock,AMZN,AMZN Inc,01-15-2024,30848.03475760008,31058.428781812418,31397.384141234663,29558.95872723633,2368743.547926592,935612363192.312,TECHNOLOGY,NASDAQ,Global,$,2024-01-15 21:00:00
stock,AAPL,AAPL Inc,02/05/2023,13566.17750770306,14780.62850564352,15123.439481374915,12927.750492177427,7292934.791960497,1512563583837.9502,Finance,NASDAQ,US,USD,2023-05-02 03:00:00
stock,GOOGL,GOOGL Inc,06/09/2023,32677.911713591795,31237.43257334771,33610.447393764116,30881.56403494356,9280159.409003764,993247411744.8789,Retail,NYSE,Global,$,2023-09-06 12:00:00
stock,AMZN,AMZN Inc,04-21-2024,16749.498980439068,16629.79506904145,17525.984680406455,16547.79925092381,899692.9227262797,790770161854.9004,automotive,NYSE,Global,$,2024-04-21 07:00:00
crypto,BNB,BNB Coin,01/07/2023,24780.503774758607,22830.86925572611,25208.687181583693,21858.714151417036,6360767.510963727,57112281172.75529,Crypto,COINBASE,US,USD,2023-07-01 19:00:00
stock,AAPL,AAPL Inc,07/01/2024,49836.72117701613,48593.20659819382,51329.36246588563,48243.985817836445,1175503.2658910435,2848991340900.0938,AI,NYSE,US,USDT,2024-01-07 21:00:00
crypto,BTC,BTC Coin,2023-07-07,20448.09 USD,19246.344424086117,20859.87185546772,18357.12509515577,6954376.078744468,277377942365.5261,Blockchain,COINBASE,Global,$,2023-07-07 19:00:00
crypto,BTC,BTC Coin,2024-05-01,15577.16819579345,14396.672125828565,16250.61521824788,14032.036294597106,5721896.6309862165,104833354155.63896,crypto,Unknown,US,usd,2024-05-01 10:00:00
crypto,SOL,SOL Coin,21/02/2023,20530.550795921674,19268.044758056953,21295.450083059233,18427.048810539265,1039634.0289978262,229925909822.46756,crypto,,Global,USD,2023-02-21 13:00:00
stock,AAPL,AAPL Inc,2023-03-22,10449.762652394671,10045.926875127041,10698.063364198017,9769.338054826043,7086082.671524927,2133333662413.5452,Artificial Intelligence,NASDAQ,Global,usd,2023-03-22 20:00:00
crypto,ETH,ETH Coin,05-08-2024,32223.364152470465,33602.87428149529,34094.5057161341,31131.529129077862,4380539.4812076455,251255558410.1276,Crypto,BINANCE,Global,USDT,2024-05-08 16:00:00
crypto,BTC,BTC Coin,2024-01-20,49247.044069853466,52340.269881993176,52771.173423025975,46798.46664842319,428789.89920443133,126447558348.2428,Crypto,COINBASE,Global,USDT,2024-01-20 17:00:00
crypto,ETH,ETH Coin,01-08-2024,5723.421378984459,5761.582994886697,6008.753529134696,5648.08690830255,2156875.021758822,101405063161.95547,Crypto,BINANCE,US,usd,2024-01-08 10:00:00
stock,TSLA,TSLA Inc,2024-04-05,25399.631534468568,26975.454389912873,28107.23871652192,25284.97545387595,5092943.259778249,1203904775517.0999,tech,NYSE,Global,USDT,2024-04-05 15:00:00
stock,TSLA,TSLA Inc,09/03/2024,5598.900557984519,5672.009836847835,5742.538956331023,5439.812525508634,6340871.032558887,2085881491843.2302,Artificial Intelligence,NYSE,US,USD,2024-03-09 23:00:00
stock,TSLA,TSLA Inc,06-26-2023,2618.7310392600866,2362.2178788198667,2621.6325324373884,2245.093179840797,1104440.210522197,778387954182.8055,Technology,NASDAQ,US,USD,2023-06-26 21:00:00
stock,AAPL,AAPL Inc,07-22-2024,11068.863493973136,12146.5205040348,12332.365975598814,10585.940482139495,5456079.879133412,726071256564.6884,automotive,NASDAQ,Global,USD,2024-07-22 01:00:00
stock,TSLA,TSLA Inc,01/05/2024,33906.238235615885,32523.420382359385,34858.35280115892,32059.727431329466,7281316.819185056,2575292791638.55,Finance,NYSE,Global,USDT,2024-05-01 19:00:00
stock,AAPL,AAPL Inc,2023-04-30,43541.81313453314,46764.82567599109,48118.519039897415,42300.55876273295,6416061.385355433,2002949981340.0896,AI,NASDAQ,US,$,2023-04-30 07:00:00
crypto,BTC,BTC Coin,07-12-2024,292.54872101082435,321.33534015651355,324.27385178370906,284.7998219258563,8720425.318693824,328193740541.33295,Crypto,COINBASE,Global,USDT,2024-07-12 21:00:00
stock,GOOGL,GOOGL Inc,08/05/2023,23844.993242780158,22092.778156608798,24316.022858243356,21183.80996409895,3636913.8599627987,682870793142.1561,RETAIL,NYSE,US,USDT,2023-05-08 23:00:00
stock,TSLA,TSLA Inc,29/05/2024,49658.60777202065,54572.95300055693,54886.16431007966,48978.20732678957,518403.0512113424,1126658008210.2388,Automotive,NASDAQ,Global,$,2024-05-29 23:00:00
crypto,BNB,BNB Coin,24/02/2024,5275.641373305766,5766.788451464062,6038.076503584194,5063.013986245866,1617561.6832015614,16925846058.189508,Crypto,BINANCE,Global,USDT,2024-02-24 15:00:00
crypto,ETH,ETH Coin,06-16-2023,25782.194233816357,26141.621906243086,26431.262490015855,25468.454306338874,3096222.140857105,100011359173.79907,crypto,COINBASE,US,USDT,2023-06-16 19:00:00
crypto,ADA,ADA Coin,02-08-2023,32839.56809577196,32421.528237995743,34136.58654425137,32126.35393332804,2905525.5744838277,369241873584.11707,Blockchain,BINANCE,US,$,2023-02-08 03:00:00
crypto,BTC,BTC Coin,15/05/2024,46798.39813489289,43660.48166189961,46897.02673462204,42468.67128311874,8012297.792536045,139187244815.2533,crypto,BINANCE,Global,usd,2024-05-15 12:00:00
crypto,ADA,ADA Coin,19/03/2024,45977.3361393525,46282.63176050154,46514.19457781902,45031.78687511375,7784177.747917763,309808901992.74457,crypto,COINBASE,US,$,2024-03-19 17:00:00
crypto,ADA,ADA Coin,04-13-2024,8641.143480868512,7798.270206085839,8897.635336707892,7754.106415252716,6706962.496704993,41864607506.58143,Crypto,COINBASE,Global,USD,2024-04-13 01:00:00
stock,GOOGL,GOOGL Inc,20/06/2024,3161.0522884630805,3415.833788957329,3554.8698870860317,3052.66636791518,9735291.99182068,2946299861897.036,Artificial Intelligence,NASDAQ,US,usd,2024-06-20 14:00:00
stock,MSFT,MSFT Inc,17/04/2024,44466.34314417264,47852.44252013993,49665.23089756192,43495.7995589726,1200907.4934192637,870933867032.531,RETAIL,NYSE,US,usd,2024-04-17 04:00:00
stock,GOOGL,GOOGL Inc,26/04/2023,17846.24482019018,18889.240163054186,19605.264395861417,17766.483266325606,149286.794154647,1600595486144.5298,Technology,NASDAQ,Global,USDT,2023-04-26 22:00:00
crypto,SOL,SOL Coin,2024-02-14,46923.71803570219,49638.72857601277,49961.86294879305,44768.228023804484,209431.5528372004,324595770645.1032,crypto,BINANCE,Global,usd,2024-02-14 00:00:00
stock,AMZN,AMZN Inc,16/01/2023,31487.335866475765,34553.65899799218,35241.35140321575,30435.51130659006,6244624.84691674,1889948225225.9324,RETAIL,Unknown,US,usd,2023-01-16 20:00:00
crypto,BTC,BTC Coin,05-14-2024,46839.329736654865,49678.956290816575,50738.79219248864,45984.31111093602,8563136.967834454,331115425640.49963,crypto,COINBASE,Global,USD,2024-05-14 08:00:00
crypto,BNB,BNB Coin,11-08-2023,10842.165318832582,10125.982705394796,10842.250833472253,9983.326845901953,1111860.991251059,198790826883.1371,Crypto,COINBASE,Global,$,2023-11-08 10:00:00
stock,AAPL,AAPL Inc,05/09/2023,14900.83781282444,15080.779913436243,15380.855219128633,14658.456308766616,557330.9546276984,739078908090.8618,Finance,NASDAQ,Global,$,2023-09-05 17:00:00
crypto,ADA,ADA Coin,2023-04-03,24965.583061628004,24151.529235431983,25334.840715553433,23024.89430418386,8957296.028305266,53955981734.45358,Crypto,BINANCE,Global,USDT,2023-04-03 14:00:00
crypto,SOL,SOL Coin,02-02-2023,6089.691659414272,5559.944458734941,6386.525316205688,5471.311313161117,4175143.254866321,278268341519.395,crypto,COINBASE,US,USD,2023-02-02 02:00:00
stock,TSLA,TSLA Inc,2023-08-17,37819.026006143155,39936.60556871883,40890.845442024234,36740.9620662918,111269.81460473449,2108175811859.7966,automotive,NASDAQ,Global,usd,2023-08-17 17:00:00
stock,TSLA,TSLA Inc,2023-09-18,30169.360840663263,28378.229644054056,31556.553210204922,28257.525542706782,9891852.459496593,2780405774274.0957,RETAIL,NASDAQ,US,USDT,2023-09-18 05:00:00
crypto,ADA,ADA Coin,2023-10-27,49889.24 USD,47341.759060917975,51990.201197073555,46922.851502638274,2310172.651848117,350252342439.89667,Blockchain,BINANCE,US,USDT,2023-10-27 01:00:00
crypto,ETH,ETH Coin,13/05/2024,48971.231478743204,46973.44569805028,51103.66365194001,44634.46674694752,211227.04738880243,43882831855.39136,blockchain,COINBASE,Global,$,2024-05-13 14:00:00
crypto,SOL,SOL Coin,25/03/2023,11943.347049913828,12396.815116409183,12747.37493543431,11392.451685937664,1627120.334860855,189019166935.06552,Blockchain,COINBASE,US,$,2023-03-25 19:00:00
crypto,BTC,BTC Coin,06/06/2023,9288.347157132104,9831.199678786828,10035.723157093036,8867.321180014102,4843944.679818977,158279461673.07364,blockchain,BINANCE,US,usd,2023-06-06 22:00:00
crypto,BNB,BNB Coin,10-15-2023,6455.575897936661,6119.382199452982,6733.013214816887,6096.315963067809,8262751.035591359,40881081519.2586,blockchain,BINANCE,Global,USDT,2023-10-15 20:00:00
stock,GOOGL,GOOGL Inc,2024-02-19,13629.597591030493,13763.592047986509,14260.356668992883,13625.081279504127,1316575.5480773833,1008890880079.3633,Automotive,NASDAQ,US,USDT,2024-02-19 17:00:00
stock,AMZN,AMZN Inc,2023-10-09,34720.8508908736,37027.883269102145,38594.8084603942,34162.64993244997,9540204.025387751,157383077081.17526,tech,NASDAQ,Global,USD,2023-10-09 23:00:00
stock,AMZN,AMZN Inc,15/03/2024,45691.60176882726,49966.61894203541,52083.09863393432,44114.68992623075,1962960.2960517823,1537904242998.315,finance,NASDAQ,Global,$,2024-03-15 19:00:00
crypto,ETH,ETH Coin,2023-04-03,22656.20737150562,24367.921638912572,24489.799835011265,21815.367616781255,7518237.646242566,221507425667.81827,Crypto,BINANCE,US,USDT,2023-04-03 09:00:00
stock,AAPL,AAPL Inc,04-07-2023,16045.013056944792,15682.894421782867,16544.489336695853,15022.748580066422,8606184.299006745,294010068482.16327,Artificial Intelligence,NYSE,US,USD,2023-04-07 02:00:00
crypto,ADA,ADA Coin,2023-03-03,45851.91537690902,45557.270176687074,46482.47151081871,43602.47338122109,38447.20201813685,181779183009.17834,blockchain,COINBASE,US,USD,2023-03-03 00:00:00
stock,AMZN,AMZN Inc,2024-07-16,5366.763279376902,5250.5489869128605,5524.8873818659495,5060.396652901649,1753067.6993687863,1601150880104.6584,finance,NASDAQ,US,USD,2024-07-16 22:00:00
crypto,ADA,ADA Coin,07-13-2023,47340.09070235821,43557.05333047604,47708.373705797996,43469.96678944667,378804.43390065053,311015040930.68994,blockchain,BINANCE,US,USDT,2023-07-13 05:00:00
crypto,ADA,ADA Coin,2023-07-23,242.17770941858865,260.2765532400212,264.2760301815891,241.43408893561855,3170135.9410672192,391164772937.4365,blockchain,BINANCE,US,usd,2023-07-23 16:00:00
stock,GOOGL,GOOGL Inc,2023-01-09,4010.828162599173,3804.133992822457,4165.982908183188,3714.486884556532,9279762.64880866,1966375901386.8274,TECHNOLOGY,NYSE,Global,$,2023-01-09 22:00:00
stock,AMZN,AMZN Inc,2023-09-02,43491.92016703801,43047.914959406444,45621.38956508882,42961.46265271479,3292037.918855247,1291966710940.6494,Finance,NASDAQ,Global,usd,2023-09-02 16:00:00
stock,TSLA,TSLA Inc,01-09-2024,42382.092597040304,39929.698558919874,43705.0292757123,38078.32277857716,8367270.495114033,2658911774546.2417,Finance,NYSE,US,usd,2024-01-09 11:00:00
crypto,ADA,ADA Coin,2024-05-13,3550.0269222743677,3479.1819428411463,3652.4313784786095,3453.9434279415805,9742451.012691844,73945623983.88113,crypto,COINBASE,US,USDT,2024-05-13 23:00:00
crypto,BNB,BNB Coin,2024-05-27,3031.74 USD,3182.7924968493485,3272.733956815822,2948.049138946539,3093379.5190431047,178599542465.09613,Blockchain,BINANCE,Global,USD,2024-05-27 16:00:00
crypto,BNB,BNB Coin,2023-09-14,16940.593426806976,17811.38013828144,18295.755007433716,16836.2798374239,5435895.602579772,203447418498.1966,Blockchain,BINANCE,US,USDT,2023-09-14 15:00:00
crypto,ETH,ETH Coin,23/03/2023,42556.08319278491,43043.086880035844,43488.240718794346,41754.98154473807,3577809.932659333,99113653269.27237,Blockchain,BINANCE,US,USDT,2023-03-23 03:00:00
stock,AAPL,AAPL Inc,03-18-2024,22670.453934940677,23697.159610528593,23810.356448575618,21985.83382319176,9832431.123287514,2534772780753.277,Finance,NYSE,US,USD,2024-03-18 02:00:00
stock,GOOGL,GOOGL Inc,03-30-2023,8005.440710322763,7649.621365200353,8137.4567554791,7515.892811278159,7570190.600137066,2427296265536.6733,finance,NASDAQ,US,usd,2023-03-30 02:00:00
stock,AAPL,AAPL Inc,11-26-2023,25498.604074757077,27083.70204128469,27675.586669393662,24381.612945370653,5644853.974696479,2251084560335.6504,tech,NASDAQ,US,usd,2023-11-26 08:00:00
stock,MSFT,MSFT Inc,07-14-2024,39651.75263311164,40275.87635598333,41578.40959611185,39514.08576674513,4283999.60155517,2857381139957.309,Automotive,NASDAQ,Global,USDT,2024-07-14 18:00:00
stock,AMZN,AMZN Inc,31/12/2023,48862.30583437245,52414.03974296937,53260.6407071149,47552.26001206869,4151366.211948983,1000868475438.4857,Finance,NASDAQ,US,USDT,2023-12-31 19:00:00
crypto,ADA,ADA Coin,06-05-2023,47891.38799742482,46974.86590082786,49987.424233526915,45070.87177592576,5479160.235561561,63892793075.2164,Blockchain,N/A,Global,USDT,2023-06-05 22:00:00
crypto,ETH,ETH Coin,18/04/2024,38213.381987277004,38831.78072762994,40046.41860416928,36401.53438000216,2111172.2637559455,14464747124.086578,blockchain,BINANCE,Global,$,2024-04-18 02:00:00
stock,MSFT,MSFT Inc,2024-06-04,14452.82664703255,14821.197424252545,15240.775136873175,14172.550077370433,5492963.4625075655,232249308337.20468,Retail,,US,USDT,2024-06-04 01:00:00
stock,TSLA,TSLA Inc,08-14-2024,12232.93 USD,11344.965110233175,12752.26101231466,11127.413695412983,1865923.6140280936,826356099070.8195,TECHNOLOGY,NYSE,US,$,2024-08-14 13:00:00
crypto,BTC,BTC Coin,03/08/2024,43653.04972029157,45772.23821319347,47281.34680134294,42358.44019006775,2620493.667220897,74997705029.38962,Blockchain,COINBASE,Global,USDT,2024-08-03 14:00:00
stock,AMZN,AMZN Inc,31/08/2023,39864.00635538978,38283.63149365663,41553.372776662305,37822.18347145016,2971508.4182301057,2938557781707.3433,automotive,NYSE,Global,USDT,2023-08-31 07:00:00
stock,GOOGL,GOOGL Inc,2023-08-09,9305.812735097423,8581.918111819183,9642.10714157965,8267.6104489158,8200773.59809679,1285393034182.5027,Artificial Intelligence,NASDAQ,Global,$,2023-08-09 03:00:00
crypto,ETH,ETH Coin,19/01/2024,3840.224498343137,3819.5142636934706,3994.2295128165943,3779.2090106434466,7600211.586151354,398265441048.1983,Blockchain,,US,USD,2024-01-19 06:00:00
crypto,BNB,BNB Coin,2023-05-24,22698.124251695765,23129.244966678994,24255.570483701802,21934.953471814264,9231515.73328086,142852999444.25482,blockchain,BINANCE,US,USDT,2023-05-24 09:00:00
crypto,ADA,ADA Coin,20/06/2024,49453.83252903049,51137.870899859896,52323.02041201882,48497.86627779736,2726039.1592330276,111395982681.29518,Crypto,BINANCE,Global,usd,2024-06-20 08:00:00
stock,GOOGL,GOOGL Inc,30/06/2024,5686.591646736257,5247.643976110492,5785.445007778425,5185.421474966256,6080103.704814027,829779833959.2852,Retail,NASDAQ,US,usd,2024-06-30 08:00:00
crypto,ETH,ETH Coin,2023-11-04,42613.30388354579,43477.225782122114,45565.99252491627,41910.579538425,1752573.462178106,45520901330.75322,Crypto,COINBASE,US,usd,2023-11-04 07:00:00
crypto,BTC,BTC Coin,11/07/2023,32428.394901384734,29368.871188729914,32452.570698089534,28090.448632094143,2517392.6860196623,192144428111.58978,crypto,COINBASE,Global,USDT,2023-07-11 11:00:00
crypto,ETH,ETH Coin,2023-04-07,24377.14928325182,22612.378280584522,25197.917635761383,22155.76433448212,2945346.5243127607,174671903790.66684,crypto,BINANCE,US,USD,2023-04-07 03:00:00
crypto,BNB,BNB Coin,02-22-2024,3891.619288511004,3807.322748377298,3921.5797662576206,3688.6903038845203,6282197.862499041,10395653956.940342,blockchain,COINBASE,US,usd,2024-02-22 07:00:00
stock,TSLA,TSLA Inc,20/03/2024,11566.482398038337,11205.197516873313,11921.591450473472,11127.240172160666,7532381.173950033,1646239909359.0579,AI,NYSE,US,$,2024-03-20 08:00:00
crypto,BTC,BTC Coin,20/02/2023,18121.026985841145,17631.9450975672,18917.82422639699,16784.944871597796,9879838.46155819,223593010599.1989,blockchain,COINBASE,US,USDT,2023-02-20 19:00:00
crypto,ETH,ETH Coin,2024-07-04,34060.073576628805,30912.908045836386,35091.292159408775,30116.557623255314,1058683.2900337758,267428287286.3671,crypto,COINBASE,US,$,2024-07-04 08:00:00
crypto,ADA,ADA Coin,09-03-2023,44516.81966612043,44961.88472502037,45891.28414483947,42452.757604039914,7141501.152495653,114779194253.89684,Blockchain,BINANCE,US,USD,2023-09-03 11:00:00
crypto,ETH,ETH Coin,05-23-2023,30706.03991255845,30769.064957450395,31436.421979902767,30081.58820994335,2334721.1218323386,282626075241.43286,Crypto,COINBASE,Global,USD,2023-05-23 16:00:00
crypto,BNB,BNB Coin,05-29-2024,29443.838513719675,28331.9946779997,30105.853559336483,28056.727801629986,1616998.9912422441,376797330350.17084,crypto,COINBASE,Global,$,2024-05-29 09:00:00
stock,AAPL,AAPL Inc,2023-07-07,33978.60605660041,32724.722143374158,35325.011178958615,31301.938742231116,7627099.0183756305,885578511156.1786,Retail,NASDAQ,Global,usd,2023-07-07 14:00:00
stock,MSFT,MSFT Inc,10-16-2023,639.5047072480643,690.4378702140755,710.5068007546082,618.7792197268358,2326713.7750015403,214371627403.19305,Retail,NASDAQ,Global,USD,2023-10-16 22:00:00
stock,AAPL,AAPL Inc,2023-11-29,25455.02 USD,27957.745313535932,29332.17042068905,24990.49632200303,4429262.190552799,1854488491949.84,Technology,NYSE,US,USDT,2023-11-29 18:00:00
stock,TSLA,TSLA Inc,2024-04-19,34127.128521180726,31407.7051741829,34687.414192337455,29955.52633313581,734534.2344096787,1478511497712.6396,Retail,NASDAQ,Global,$,2024-04-19 13:00:00
stock,MSFT,MSFT Inc,2023-04-03,24267.81019711541,25649.980032113603,26272.628027817496,23461.48382279278,824447.5503772446,595559333263.7589,RETAIL,NASDAQ,US,USDT,2023-04-03 01:00:00
stock,AAPL,AAPL Inc,2024-06-20,13570.716638294007,13882.664470407783,14560.96294575637,12967.711562107095,2122041.8618206773,1655383614317.5574,finance,NASDAQ,US,USD,2024-06-20 06:00:00
crypto,ADA,ADA Coin,2024-03-28,48431.00462914302,51063.808735698716,53357.1589217231,46817.56166625311,9920392.699312167,191872342549.25302,crypto,BINANCE,US,$,2024-03-28 12:00:00
stock,MSFT,MSFT Inc,01-06-2023,2658.1155732445804,2847.1621494163796,2979.165821463221,2537.2491120624127,1135160.8400316692,317470120031.8306,Retail,NYSE,US,$,2023-01-06 18:00:00
stock,TSLA,TSLA Inc,07-29-2024,5234.333056509778,4930.134364811986,5488.218262195171,4848.259678199128,7785751.702159902,109190731689.7637,AI,NASDAQ,US,usd,2024-07-29 23:00:00
crypto,BTC,BTC Coin,02-13-2024,26758.33675146294,28350.398800561612,29194.967858143318,25841.25643406625,5611539.977575239,311575064458.15125,Crypto,COINBASE,Global,$,2024-02-13 13:00:00
crypto,ETH,ETH Coin,2024-04-29,41174.41815742844,45141.38573468582,46069.13728463787,40687.30560013839,998530.2773772973,215735891523.1328,blockchain,BINANCE,US,usd,2024-04-29 14:00:00
stock,AAPL,AAPL Inc,10-23-2023,18577.131430541674,16865.76953410194,18914.535030581254,16537.429052632568,1193382.4266469842,2332725794650.383,Artificial Intelligence,NYSE,US,usd,2023-10-23 23:00:00
crypto,BTC,BTC Coin,07-07-2024,3892.8439395092005,4227.633750159355,4377.109672000796,3762.377644725919,3908112.726743223,369993624509.95056,blockchain,COINBASE,Global,$,2024-07-07 19:00:00
stock,MSFT,MSFT Inc,02-15-2024,30077.540333051555,31110.059711640337,31715.40643450994,29307.274800102696,9898684.972894896,2225020000550.9053,AI,NYSE,US,USDT,2024-02-15 13:00:00
crypto,BTC,BTC Coin,2023-12-31,20898.63076424135,20028.50869692767,21698.119911749018,19792.18493796671,2925162.164512961,89499533847.38849,Crypto,COINBASE,Global,USD,2023-12-31 16:00:00
stock,MSFT,MSFT Inc,10/08/2023,581.5195068434803,573.0817208173628,593.4504726183541,572.7490434009645,4698550.954901098,253357046732.6189,Finance,NASDAQ,US,usd,2023-08-10 17:00:00
crypto,BTC,BTC Coin,12-16-2023,44562.55975716306,44482.95275169978,45897.59975961843,42471.586450404495,3829781.156890411,106285255982.29115,blockchain,BINANCE,US,USD,2023-12-16 08:00:00
stock,GOOGL,GOOGL Inc,01-18-2023,29479.374154929515,28562.576556398955,30401.58800064445,28434.63205077248,2740632.0141254277,2833228786676.6226,ai,NYSE,Global,USDT,2023-01-18 19:00:00
stock,AMZN,AMZN Inc,2023-03-16,47934.94578904865,44794.211166794266,49659.798352039266,43930.760210426,6797071.636275208,1520298988227.3164,Automotive,Unknown,Global,$,2023-03-16 01:00:00
stock,AAPL,AAPL Inc,2023-10-03,15700.82988045341,16279.278820501886,16454.723282307077,15245.234774308556,1882558.285883127,1060146695696.0333,tech,NYSE,Global,USDT,2023-10-03 23:00:00
crypto,ETH,ETH Coin,2024-03-29,48503.16742830309,47840.64305608667,50853.99376054138,45784.26927436165,5874080.427795403,8280412243.715248,blockchain,,US,USD,2024-03-29 23:00:00
stock,MSFT,MSFT Inc,07-23-2024,39505.8056068941,41747.38863171129,41982.44135239395,39332.10737536404,1947101.842385043,610912358045.8064,Automotive,NASDAQ,US,USD,2024-07-23 09:00:00
crypto,BTC,BTC Coin,2023-07-05,49281.82466818432,53050.86446419976,55588.19163047181,47661.928063510444,1056650.8465524141,247126049927.79733,blockchain,BINANCE,Global,$,2023-07-05 11:00:00
stock,TSLA,TSLA Inc,29/05/2024,25029.739804879926,26497.63231492991,26696.568117646464,24603.898244314,3236452.462791079,573157151135.4558,finance,NYSE,Global,usd,2024-05-29 14:00:00
stock,AMZN,AMZN Inc,27/03/2024,33099.26733059474,32880.808323607795,34443.15268295527,31493.104238943703,7899692.749400618,1030194196452.539,TECHNOLOGY,NASDAQ,Global,$,2024-03-27 20:00:00
stock,AMZN,AMZN Inc,16/02/2024,9710.753473477793,10014.01974997663,10442.081870429809,9347.901278441252,3272588.8666833006,202063391691.6884,automotive,NASDAQ,Global,USDT,2024-02-16 17:00:00
stock,GOOGL,GOOGL Inc,2023-02-26,10586.52 USD,11245.337279724237,11680.327529976441,10134.105080699153,4638833.488434505,1615991037377.3525,RETAIL,NASDAQ,Global,USDT,2023-02-26 20:00:00
crypto,ETH,ETH Coin,08-19-2023,16873.103259859705,17322.288292721332,17365.77860101961,16542.97151234308,1527377.1470260695,311056967828.57544,blockchain,COINBASE,Global,USD,2023-08-19 11:00:00
crypto,BTC,BTC Coin,24/03/2023,17778.918684388118,17002.1714620933,18526.42352136571,16194.69075289194,3966691.3845441137,333080413420.20825,blockchain,BINANCE,Global,$,2023-03-24 08:00:00
stock,AAPL,AAPL Inc,20/05/2023,14247.170708735046,15420.437560352288,15999.419780578302,13580.348384922547,7147159.806900106,1116310586319.3438,RETAIL,NASDAQ,Global,USDT,2023-05-20 22:00:00
crypto,,BTC Coin,01-11-2023,45044.386041134945,43359.236076565605,46337.52477916315,42276.892581441316,4896119.501369829,213283157585.8736,Blockchain,BINANCE,Global,USD,2023-01-11 15:00:00
crypto,BNB,BNB Coin,06-21-2024,10289.42 USD,10815.638711214337,11059.713084587383,10268.075313598702,2608823.46350057,185161632809.29898,Crypto,BINANCE,US,USDT,2024-06-21 03:00:00
stock,AAPL,AAPL Inc,09/02/2024,47036.44681115903,48574.14655443657,50690.21344961245,46630.712678143944,3601817.0371745494,2051404080484.8528,automotive,NASDAQ,US,USD,2024-02-09 02:00:00
stock,GOOGL,GOOGL Inc,03-17-2024,7821.504377169666,7877.077546570956,7967.830133591721,7721.286195991823,5281056.160499354,1804370580419.0947,TECHNOLOGY,NYSE,Global,USDT,2024-03-17 18:00:00
stock,GOOGL,GOOGL Inc,2024-03-07,13447.166837387207,14788.38317476151,14841.407307786914,12804.09688247822,2173356.7475381517,1239569814268.6648,Automotive,NASDAQ,Global,$,2024-03-07 23:00:00
stock,TSLA,TSLA Inc,07-10-2024,48962.11603431602,50479.23397968544,52700.58949873511,47037.81118721672,9720448.89967206,2913506651297.1807,Artificial Intelligence,NASDAQ,US,usd,2024-07-10 17:00:00
stock,AMZN,AMZN Inc,10-20-2023,5065.2481572010975,4672.399199958777,5210.399915060941,4621.230448216003,3667305.1115684565,436926701917.29834,Artificial Intelligence,NYSE,Global,$,2023-10-20 20:00:00
stock,AMZN,AMZN Inc,2024-01-25,21726.66270453529,20207.745417488924,22232.857823003756,19883.44865500798,8322425.579263282,2933909003480.518,AI,NYSE,Global,USD,2024-01-25 06:00:00
stock,TSLA,TSLA Inc,2023-05-25,29684.405234197882,28303.158465366774,30643.087630062222,28283.306550700054,491486.6723053508,1381717186970.213,Retail,NYSE,Global,usd,2023-05-25 08:00:00
stock,AMZN,AMZN Inc,02/03/2024,28118.502313348465,26724.379430432535,29461.005739342865,26034.027648624822,3317570.826482183,2660726705408.4517,RETAIL,NASDAQ,Global,USDT,2024-03-02 16:00:00
stock,GOOGL,GOOGL Inc,09-03-2023,12230.165990730538,13044.325796434323,13445.054013140492,12177.114967026493,2320452.5531257004,552677908529.8151,automotive,N/A,Global,USD,2023-09-03 05:00:00
stock,AMZN,AMZN Inc,2024-06-02,314.31567346974435,314.8099057993675,330.523751334988,309.52181362159774,3084637.5250594956,372204335808.2154,Artificial Intelligence,NYSE,Global,usd,2024-06-02 11:00:00
crypto,BTC,BTC Coin,19/01/2023,39088.29607673811,35299.97698419867,40684.78029257681,34065.407515671475,1497584.9723714273,351359140295.3378,Blockchain,COINBASE,Global,USDT,2023-01-19 06:00:00
stock,MSFT,MSFT Inc,2024-03-28,23434.3044207132,23082.17084694371,23772.798066553867,22126.820941404363,7622545.6656320505,686729210813.853,Finance,NYSE,US,USDT,2024-03-28 14:00:00
stock,AMZN,AMZN Inc,08/09/2023,38891.801105180326,37304.525331932644,39367.85417698065,35845.29517471597,1367814.0498158738,2970428253367.4023,Artificial Intelligence,NASDAQ,Global,usd,2023-09-08 13:00:00
stock,TSLA,TSLA Inc,13/05/2024,30273.964593947676,31518.240648523246,32590.197084394775,29202.77078002152,3303779.7429630687,1658478343579.9807,automotive,NYSE,Global,USDT,2024-05-13 03:00:00
crypto,BNB,BNB Coin,08-17-2023,17478.88756277358,16474.282171415074,17806.0365398309,15874.687622159889,884038.8994645595,274198241499.72345,Blockchain,COINBASE,US,$,2023-08-17 05:00:00
crypto,BTC,BTC Coin,01-21-2023,42657.038343960245,40266.11390562729,42795.1878538987,39740.29369779518,2116074.7300082734,332904866399.27814,Crypto,BINANCE,US,usd,2023-01-21 07:00:00
crypto,ETH,ETH Coin,26/06/2023,3216.121259346789,3040.0512177891446,3343.6247530428113,3010.3189768011785,2071641.1640522163,160407018327.55978,Blockchain,BINANCE,US,USDT,2023-06-26 11:00:00
crypto,ADA,ADA Coin,02/03/2024,6720.578570496241,6148.217311368655,7053.976968614966,6042.343149813827,5421422.995473989,137685968817.14236,Blockchain,COINBASE,US,$,2024-03-02 20:00:00
crypto,BTC,BTC Coin,04-02-2024,42005.457212789326,44582.19602591601,44619.06427443611,40297.531910872465,6549398.115876192,307371907660.0933,blockchain,COINBASE,Global,usd,2024-04-02 17:00:00
stock,AAPL,AAPL Inc,28/10/2023,49124.31 USD,50749.38691314612,53176.60044666843,47162.88828795739,8639706.324122116,1133520449933.849,Retail,NYSE,US,$,2023-10-28 14:00:00
stock,GOOGL,GOOGL Inc,2024-08-02,49478.34476380796,46090.945183863616,50755.726742396204,45613.54562209107,4326992.163559754,970843394387.5238,TECHNOLOGY,NASDAQ,Global,USD,2024-08-02 13:00:00
stock,MSFT,MSFT Inc,2023-01-27,49317.926217331995,48581.196790835245,50807.50538169667,46284.61705070172,8422258.59202239,1409571339961.0637,TECHNOLOGY,NASDAQ,US,USDT,2023-01-27 13:00:00
stock,TSLA,TSLA Inc,10-01-2023,20206.96494211205,18251.615913299058,20804.756497865732,17350.586408823572,13034.93547627007,1948022466448.835,RETAIL,,US,USD,2023-10-01 22:00:00
stock,AMZN,AMZN Inc,2023-08-11,9458.963196054367,8876.078330561833,9767.926780966403,8456.105436347782,3134742.2091840887,1852134700826.5703,Artificial Intelligence,NYSE,US,usd,2023-08-11 18:00:00
crypto,BNB,BNB Coin,25/11/2023,29013.016726128728,29951.675754090873,31031.63711717328,27932.617268096717,893408.2666142033,64025601346.097534,Blockchain,BINANCE,US,usd,2023-11-25 18:00:00
crypto,BTC,BTC Coin,02/08/2024,21313.31590705168,23213.80045420097,23466.516371905785,20521.250854492835,1009787.1322564834,36080044492.04964,Blockchain,,Global,$,2024-08-02 06:00:00
stock,AAPL,AAPL Inc,18/03/2024,33996.84496861927,34968.686993623036,36474.31669011181,33123.84990529393,1345435.9506298774,1820655118942.8516,TECHNOLOGY,NYSE,US,usd,2024-03-18 02:00:00
crypto,ADA,ADA Coin,2023-03-23,33124.874371333375,33874.30460509867,34773.67269325736,32599.78618122438,6374271.11288262,119315026628.243,Crypto,COINBASE,Global,$,2023-03-23 06:00:00
crypto,BTC,BTC Coin,07-18-2023,29304.958710140047,30937.83897280179,31322.562069935495,28833.41640659898,9022038.989708375,353123331338.65594,Blockchain,BINANCE,US,$,2023-07-18 06:00:00
crypto,SOL,SOL Coin,2023-12-02,38957.41832505894,40708.860493392596,40830.022675600456,38142.250532682134,1302763.302658823,157364269520.43414,crypto,COINBASE,Global,usd,2023-12-02 14:00:00
crypto,ADA,ADA Coin,12-25-2023,40572.2610600058,37405.38349574409,40819.248751662744,36646.94044701688,3449546.85255766,387091073031.0835,blockchain,COINBASE,Global,USDT,2023-12-25 11:00:00
crypto,BNB,BNB Coin,2023-03-13,27086.658976574323,26479.07866910209,27223.55020054541,26216.830393292155,9150852.576022781,18787814333.878166,Blockchain,BINANCE,Global,USDT,2023-03-13 20:00:00
crypto,BNB,BNB Coin,12-03-2023,41122.8912777137,38791.14576200935,41664.8353679323,37256.039584465834,7650869.250224275,303854603935.58136,blockchain,BINANCE,US,USD,2023-12-03 01:00:00
stock,MSFT,MSFT Inc,2023-01-12,35844.69196462779,38579.40370099795,39811.43521224595,34747.234852524816,4258190.387688122,2844272066014.146,Finance,NYSE,Global,USDT,2023-01-12 12:00:00
stock,AAPL,AAPL Inc,2023-06-09,1582.5451903488438,1644.4149857968357,1680.4629378083102,1547.1131958308022,5577054.81497654,235211082180.54047,Finance,NYSE,US,$,2023-06-09 19:00:00
crypto,ETH,ETH Coin,10/08/2023,23799.86661636624,23660.68605152608,24262.09241913568,23448.538878793202,4512188.872872272,114563446266.65405,Crypto,COINBASE,Global,USDT,2023-08-10 04:00:00
crypto,ADA,ADA Coin,02/07/2024,44777.050817837495,48056.82312622844,50196.36624396253,43142.69964933482,350789.90059232025,243439587179.8652,blockchain,,US,usd,2024-07-02 04:00:00
crypto,ADA,ADA Coin,2024-08-10,13942.580207579225,15084.088045411965,15573.749772660556,13302.409397701807,1354650.5815150002,108121385958.65504,Crypto,BINANCE,US,usd,2024-08-10 02:00:00
crypto,ETH,ETH Coin,20/01/2023,31524.78319096447,33009.05841380856,34427.86021675496,31431.21219769942,2017843.8693070314,66492069589.080284,crypto,BINANCE,US,USDT,2023-01-20 04:00:00
crypto,ETH,ETH Coin,02-12-2024,12023.74 USD,11684.097947438751,12573.625617343168,11435.876628212935,7382180.781347666,127360131465.99937,crypto,BINANCE,Global,$,2024-02-12 04:00:00
stock,GOOGL,GOOGL Inc,2023-03-20,1452.6070876728652,1325.9965424969846,1491.6766280649754,1307.3523041199403,2154089.944759786,1475456516019.0781,TECHNOLOGY,NYSE,Global,USDT,2023-03-20 14:00:00
crypto,BTC,BTC Coin,08/02/2024,40535.18201644078,39820.93166630094,42047.993989636176,38634.327535144315,6783827.943920745,290154281726.9601,Crypto,BINANCE,Global,usd,2024-02-08 02:00:00
stock,AMZN,AMZN Inc,29/07/2024,49596.41164922246,48062.85749109491,50615.71903712227,46057.72328219505,2041526.5109596672,2294351177465.4336,tech,NYSE,US,USD,2024-07-29 14:00:00
stock,GOOGL,GOOGL Inc,2024-08-11,45853.109051822255,44886.570922822415,46265.43040347799,43282.09932163709,4551061.996376578,2083251057769.1494,Automotive,NASDAQ,US,$,2024-08-11 21:00:00
crypto,BTC,BTC Coin,07-30-2024,11686.618365262095,12238.190497307189,12242.990879336145,11417.376516193015,7937874.303490509,119806880099.32051,Crypto,COINBASE,Global,$,2024-07-30 18:00:00
crypto,BTC,BTC Coin,2023-02-17,30168.54261549475,31187.636622318118,32209.07023282443,29332.64716919135,3466433.3007699163,110160173095.39993,Crypto,,US,usd,2023-02-17 10:00:00
stock,TSLA,TSLA Inc,2024-05-25,37924.71339042322,36568.94412676356,38120.062061569864,34871.793226289155,943665.5030114616,2509412978353.162,Technology,NYSE,US,USDT,2024-05-25 15:00:00
crypto,,BNB Coin,05-03-2023,2592.5921696911946,2508.0357482801332,2690.2291521610236,2419.545747069191,7633317.463724118,235233397670.8569,crypto,COINBASE,Global,USD,2023-05-03 09:00:00
stock,GOOGL,GOOGL Inc,03-24-2023,12298.9 USD,12861.75050744465,13342.636335282225,11928.365714052494,2104994.4169314406,2238946444239.095,tech,NASDAQ,Global,usd,2023-03-24 09:00:00
stock,AAPL,AAPL Inc,10/03/2023,46070.66542412982,47357.11257762737,47766.5680869943,45339.88544519361,4272603.069791064,1568599712606.6887,Finance,NASDAQ,Global,usd,2023-03-10 04:00:00
stock,GOOGL,GOOGL Inc,11/04/2024,36705.86111080516,36815.59219253788,38313.957295495486,36195.935175004364,6151118.326845088,1778671104092.5652,AI,NASDAQ,Global,$,2024-04-11 23:00:00
stock,MSFT,MSFT Inc,14/06/2023,41799.0960544693,45443.18794076184,45754.39453389162,40729.543145092364,2589628.5309630744,460870519338.73096,Retail,NYSE,Global,$,2023-06-14 00:00:00
crypto,ETH,ETH Coin,23/10/2023,36084.26550387495,33492.586172728996,37666.60974939215,32121.01966110385,7972792.9974554265,303036706433.098,Crypto,BINANCE,US,USD,2023-10-23 07:00:00
stock,MSFT,MSFT Inc,12/01/2023,16420.33195497198,15297.967003758902,16557.94604128765,15039.34764686666,5504753.449083258,1376371275287.7346,AI,NYSE,US,usd,2023-01-12 06:00:00
crypto,SOL,SOL Coin,21/08/2024,5643.766043311876,5161.0102322756975,5853.648488273425,5086.661256964018,585251.477554897,53223741552.236916,crypto,COINBASE,US,$,2024-08-21 00:00:00
stock,TSLA,TSLA Inc,2024-06-29,4242.961000582068,4585.576512350806,4793.559328917641,4178.94171780781,9261963.02547306,1685207526034.9492,Artificial Intelligence,NASDAQ,US,USDT,2024-06-29 23:00:00
crypto,ETH,ETH Coin,06-16-2024,41428.6434105932,42006.223747429336,42649.04330544071,39808.36733382859,3272673.0203672526,325523947013.4078,blockchain,BINANCE,Global,USDT,2024-06-16 06:00:00
crypto,ADA,ADA Coin,2023-11-14,8641.100226261622,8223.977445100885,8843.328267631927,7908.60851053809,5886848.0534909,253255694885.1795,crypto,BINANCE,Global,USD,2023-11-14 02:00:00
crypto,ETH,ETH Coin,2024-08-13,37406.98739149929,38652.09104291496,39778.2612200343,36449.2710863887,1866452.0324869624,369654531240.2503,blockchain,BINANCE,US,usd,2024-08-13 16:00:00
crypto,ETH,ETH Coin,2023-04-15,12434.314740621689,11417.955931043469,12900.61098056036,10947.31665608129,3719588.099412219,358410629893.6119,crypto,Unknown,US,usd,2023-04-15 17:00:00
crypto,ETH,ETH Coin,2023-08-21,6862.026447596999,6413.529381856168,6880.694634378941,6303.4273470184025,8370240.95023537,16172546674.936993,crypto,BINANCE,US,USDT,2023-08-21 18:00:00
stock,TSLA,TSLA Inc,2023-04-29,43730.07807114285,41223.002736373615,44441.545502439614,39472.54417336476,6205971.394994567,1126213065034.1636,tech,NASDAQ,US,USD,2023-04-29 17:00:00
crypto,ADA,ADA Coin,10/04/2023,30668.034508626515,32273.045514360594,33153.62042804835,30097.042252334668,9352567.893628934,170848488393.7712,Crypto,BINANCE,Global,USD,2023-04-10 20:00:00
crypto,SOL,SOL Coin,2024-04-22,17964.605292311317,18746.79628509482,19319.797284904416,17226.738685783042,3762096.9527948913,123130402295.49303,crypto,COINBASE,US,usd,2024-04-22 03:00:00
crypto,ADA,ADA Coin,2024-03-27,20975.298000039784,19625.64164612676,21944.807832808736,19392.409305676676,4814076.965246415,189796015184.26242,crypto,COINBASE,US,$,2024-03-27 02:00:00
crypto,ETH,ETH Coin,2024-06-11,44865.160780054735,41600.53966027685,45426.8121388028,40649.3459152721,7990304.703152234,273624106181.20044,Crypto,BINANCE,Global,USD,2024-06-11 08:00:00
stock,GOOGL,GOOGL Inc,11/08/2023,49201.067328316065,48757.33867478693,50084.79510512393,47033.0949687546,1744392.7198010655,118402137370.16687,AI,NYSE,Global,USDT,2023-08-11 21:00:00
stock,MSFT,MSFT Inc,2023-05-05,47771.154095657366,46946.09615100762,50046.06588430539,46532.49544661644,4811030.223635706,2376805987700.783,tech,NASDAQ,Global,usd,2023-05-05 03:00:00
crypto,BTC,BTC Coin,04-19-2024,21754.86 USD,22010.363011235124,22074.24405869761,21424.47185155932,529193.620196883,271240340754.82242,Crypto,BINANCE,US,USD,2024-04-19 16:00:00
stock,TSLA,TSLA Inc,09-26-2023,41249.097003733266,39080.0321097176,41916.636876305456,38066.511756671636,5967032.406417882,2453083991289.752,Artificial Intelligence,NYSE,Global,USDT,2023-09-26 00:00:00
stock,AMZN,AMZN Inc,2023-08-25,29628.395367549932,28430.146458991585,29710.60041870612,27012.232066637185,1012409.4281263676,869187448608.5702,AI,NASDAQ,Global,USD,2023-08-25 15:00:00
stock,TSLA,TSLA Inc,2023-11-29,48071.951306043025,47369.775843673335,49304.23720832479,45349.09529409277,5510762.49544889,2378829593490.4146,Automotive,NYSE,US,USD,2023-11-29 13:00:00
stock,AAPL,AAPL Inc,05-31-2024,30564.604416629514,33213.080373566474,33538.06793930954,30204.803575484177,236000.7257604221,442518157000.8607,AI,N/A,Global,USDT,2024-05-31 06:00:00
crypto,BTC,BTC Coin,2023-06-10,5546.317906447147,5382.674286463451,5594.442452688288,5214.009530707425,4175810.5382691957,153321410322.04028,Crypto,BINANCE,US,usd,2023-06-10 16:00:00
stock,TSLA,TSLA Inc,18/07/2023,32834.531254161724,35585.09340774781,36297.8545980602,31508.579560593796,2707956.8592016376,908767457114.9459,AI,NYSE,US,$,2023-07-18 08:00:00
crypto,BNB,BNB Coin,02/08/2024,28586.269766274694,28329.05641287879,28800.147550674446,27549.621106630675,2785641.5415705093,342330325281.06573,Crypto,COINBASE,Global,$,2024-08-02 22:00:00
crypto,SOL,SOL Coin,06-24-2024,44204.664769692405,40525.975039691286,45346.58948443666,38955.71173234681,4108360.1181533816,377549435502.07294,blockchain,BINANCE,US,$,2024-06-24 08:00:00
crypto,BNB,BNB Coin,03-24-2023,26380.450849228357,25505.755788271075,26654.660274608053,25251.112519622737,6245555.635628107,351354959309.3253,Blockchain,BINANCE,Global,USDT,2023-03-24 23:00:00
stock,TSLA,TSLA Inc,09/01/2024,10882.042849610272,10521.2952378302,11404.29571454454,10268.831465127472,4007592.1131512863,1409515726674.4314,Technology,NYSE,US,$,2024-01-09 16:00:00
stock,AAPL,AAPL Inc,29/12/2023,38951.63540992144,37706.03172779247,39299.680193325854,36923.51113324404,6652375.830707191,1569051906621.4885,finance,NYSE,US,$,2023-12-29 01:00:00
stock,AMZN,AMZN Inc,12/02/2023,44100.559662398824,42964.30098707668,44266.71931724863,42874.824787605765,4350684.262447314,2141026828846.0632,AI,,Global,USDT,2023-02-12 21:00:00
crypto,BTC,BTC Coin,2023-10-07,33318.60310318333,33628.55746299783,33973.68319467029,32910.68852667152,8037715.991066513,251186716320.88687,Blockchain,COINBASE,Global,$,2023-10-07 11:00:00
stock,TSLA,TSLA Inc,11/05/2024,24433.17241763623,22546.62943053626,24535.73268864479,21802.100096037357,3109150.7090184153,1663397002192.145,Artificial Intelligence,NASDAQ,Global,$,2024-05-11 22:00:00
crypto,ETH,ETH Coin,11-24-2023,39183.30089474705,40436.57325105028,41483.16899454161,37552.03646583336,9784588.265170654,381694298130.4921,blockchain,COINBASE,Global,$,2023-11-24 08:00:00
crypto,ADA,ADA Coin,08-04-2023,5355.21 USD,5348.569222128502,5589.233048785167,5318.427628180966,110648.19464841612,153141075804.88297,blockchain,BINANCE,Global,USD,2023-08-04 22:00:00
crypto,SOL,SOL Coin,03/10/2023,13581.496032817928,12329.20703086147,14157.20904249768,12245.286283401261,5962714.567343658,355086819176.8029,crypto,BINANCE,Global,USD,2023-10-03 12:00:00
stock,MSFT,MSFT Inc,01/05/2023,40657.882428344754,42986.03045478606,44899.13550425505,39748.66534377524,9676503.280235354,1727556934316.1116,Artificial Intelligence,NYSE,US,USDT,2023-05-01 00:00:00
crypto,BTC,BTC Coin,04-15-2023,5836.065053831643,6244.057077815392,6400.103013122629,5657.354919289718,6131110.026517267,398477998218.6687,blockchain,BINANCE,US,USDT,2023-04-15 23:00:00
stock,TSLA,TSLA Inc,04-12-2023,25327.991327166324,27206.773955358967,27497.153916247025,24601.571738643575,9394869.39626104,177337016213.401,tech,N/A,Global,$,2023-04-12 11:00:00
crypto,ADA,ADA Coin,12-19-2023,17924.797940296594,17711.624226848355,18390.352234264356,17385.722675599805,8007127.316366394,174282715933.25043,Blockchain,BINANCE,US,USD,2023-12-19 13:00:00
stock,MSFT,MSFT Inc,19/05/2024,40875.87194515611,41151.54423222284,41847.9940169305,40176.794037719235,7177504.82518017,1361785595235.2996,Technology,NYSE,US,USD,2024-05-19 23:00:00
stock,TSLA,TSLA Inc,12-24-2023,2840.1825070048235,2652.663930358633,2880.697386812862,2557.5162713758655,6734534.581668459,1678566437132.1677,Technology,NYSE,US,USD,2023-12-24 10:00:00
crypto,BTC,BTC Coin,09-08-2023,37786.5320347055,36013.153216127,38372.26455588067,35163.080431222836,2160040.083788636,12247721361.08487,Blockchain,BINANCE,US,usd,2023-09-08 18:00:00
stock,AMZN,AMZN Inc,02-26-2024,4277.585278534998,4230.003440885426,4459.259088288999,4148.7543584636605,2924002.828910492,2654569227590.827,RETAIL,NYSE,Global,usd,2024-02-26 18:00:00
crypto,ADA,ADA Coin,04-01-2024,35337.65207332231,38682.43677111338,40409.87587119066,34175.80804171155,9981980.594999287,171200282071.702,Crypto,BINANCE,US,usd,2024-04-01 18:00:00
crypto,ADA,ADA Coin,2023-05-29,1391.2114928626704,1481.3176221748172,1496.0910018234242,1325.878063449822,2372243.5842917855,6384342094.768017,blockchain,COINBASE,US,USDT,2023-05-29 13:00:00
stock,GOOGL,GOOGL Inc,03-12-2024,36531.00785896591,37439.42827848406,37884.24840509904,35623.706300755,9262214.83988029,1284039460402.772,Artificial Intelligence,NYSE,Global,USDT,2024-03-12 00:00:00
stock,AMZN,AMZN Inc,2024-01-19,16166.257343741352,17725.539945069897,18353.573905760117,15408.423094287285,352571.9721730981,2446873253181.4355,RETAIL,NYSE,Global,$,2024-01-19 20:00:00
crypto,BNB,BNB Coin,11-09-2023,36395.51484382684,34093.41792002153,37326.3060588849,32547.72483665028,9208940.69214412,71521139858.96184,Blockchain,COINBASE,US,usd,2023-11-09 23:00:00
stock,TSLA,TSLA Inc,16/04/2023,45407.521507465935,49447.66156310609,49462.81392701642,44190.90685684755,247535.90101322197,1038442234614.867,TECHNOLOGY,NYSE,Global,USDT,2023-04-16 11:00:00
crypto,ADA,ADA Coin,08/01/2024,25925.193161281448,23721.261446251316,26068.140435369653,22990.0642657882,9402401.694536021,363933642689.6478,Blockchain,COINBASE,US,USDT,2024-01-08 05:00:00
crypto,BNB,BNB Coin,28/06/2023,43382.26712079473,42223.584432657575,43476.00253365252,42169.364361961096,172712.73363303312,278699114869.39197,crypto,COINBASE,US,usd,2023-06-28 08:00:00
crypto,BTC,BTC Coin,19/07/2023,18440.184418218745,16633.379762288474,19075.593740526198,16617.195736633217,9656291.602653088,379322402967.03015,blockchain,BINANCE,Global,usd,2023-07-19 23:00:00
crypto,ETH,ETH Coin,02-09-2023,9070.577825247088,9189.47299037506,9482.297764829997,8952.396320549136,1811322.554361003,68570119424.955284,Crypto,BINANCE,US,USDT,2023-02-09 23:00:00
stock,MSFT,MSFT Inc,12-24-2023,31940.575421899,34157.55107932352,35079.91719212405,31005.158695603608,9771851.883043364,2877431189425.659,ai,NASDAQ,Global,usd,2023-12-24 12:00:00
stock,AMZN,AMZN Inc,2023-05-25,43345.01040413095,47274.60313145302,48870.959229694265,42367.4475205055,36104.99825559555,1750542898751.3098,finance,NASDAQ,US,USD,2023-05-25 19:00:00
crypto,ADA,ADA Coin,11/04/2023,10050.552290395306,9419.394555520397,10178.575620025014,9092.039811050323,3601294.870013732,20807758091.907364,Crypto,BINANCE,US,USDT,2023-04-11 04:00:00
stock,TSLA,TSLA Inc,07-14-2023,4952.328259416173,4499.053472021201,5119.207966437222,4394.975703887549,4441997.877998976,1267407693305.941,AI,NYSE,Global,USDT,2023-07-14 00:00:00
crypto,ETH,ETH Coin,07-31-2024,41385.69356610499,40787.197744910336,42712.3522521003,40692.514800545745,8396405.334119746,255603776761.49918,Crypto,BINANCE,Global,USD,2024-07-31 22:00:00
stock,TSLA,TSLA Inc,13/07/2024,32239.394722359,30157.1871192231,33142.939520832595,30129.03280832442,5183632.836910021,1283742423402.2043,tech,NASDAQ,Global,USD,2024-07-13 20:00:00
stock,,AMZN Inc,21/06/2023,20372.672675958,22405.233152023466,23054.111148803302,19397.095661355634,5867961.21211719,2783638514578.5405,Artificial Intelligence,NASDAQ,US,usd,2023-06-21 20:00:00
stock,AAPL,AAPL Inc,2023-07-20,1633.7412885743765,1738.579546865418,1762.5484422313866,1617.121937200657,2882887.6119757136,830972360081.9939,RETAIL,NYSE,US,usd,2023-07-20 05:00:00
crypto,BNB,BNB Coin,13/01/2024,48697.03934948033,47349.54676578068,50161.30140110478,46426.18678850563,5605174.348252844,81758909780.14084,Blockchain,COINBASE,US,USDT,2024-01-13 14:00:00
stock,GOOGL,GOOGL Inc,06/02/2024,33725.30915762975,33075.982317982256,35179.511411607586,31721.624864563255,5442823.339346564,2744940273128.4316,tech,NYSE,US,usd,2024-02-06 22:00:00
stock,AMZN,AMZN Inc,2023-12-22,31273.62751772183,33256.178168725986,34342.924765366624,31022.454728611363,9444934.31057259,2852145612111.8315,finance,N/A,US,$,2023-12-22 08:00:00
crypto,ADA,ADA Coin,25/05/2024,8491.357452023376,8464.16939973036,8789.345689438827,8137.1101923974065,42010.402851240586,112804082375.43103,Crypto,COINBASE,Global,USDT,2024-05-25 21:00:00
crypto,ETH,ETH Coin,2024-06-11,48443.278180034744,50332.25076607155,51342.231410234286,46487.56514376293,3561540.647873715,140459370755.4986,blockchain,BINANCE,US,USD,2024-06-11 23:00:00
crypto,ADA,ADA Coin,2024-01-08,5324.228007434441,5757.345833806666,6044.536734768759,5101.705741848734,546171.0662239189,72086576153.99295,blockchain,COINBASE,Global,usd,2024-01-08 02:00:00
crypto,ADA,ADA Coin,11-27-2023,23088.342446263152,21725.304820188438,23436.312525535144,20857.238477296854,7742831.423756081,135243787322.75388,Blockchain,COINBASE,Global,USD,2023-11-27 22:00:00
crypto,BTC,BTC Coin,2024-02-15,31751.23 USD,31035.032005007528,33194.38450384101,30987.754077578935,1737219.4869414945,286468287582.668,Blockchain,BINANCE,Global,usd,2024-02-15 06:00:00
stock,GOOGL,GOOGL Inc,01-03-2024,26286.29508973848,24137.393459016577,26859.92565988389,23632.670019513673,5221213.637802194,676807797821.5154,automotive,NASDAQ,US,$,2024-01-03 18:00:00
crypto,ADA,ADA Coin,2023-07-22,27126.86584579957,29616.032233020487,29921.10313732332,26658.69867404843,434923.54486636247,135708890315.8203,blockchain,BINANCE,Global,USD,2023-07-22 15:00:00
crypto,BTC,BTC Coin,2023-08-10,27595.892928937013,25415.481712919413,27626.726907973672,24362.661900036004,5648926.860824745,31234479770.166798,Crypto,BINANCE,US,usd,2023-08-10 20:00:00
stock,AMZN,AMZN Inc,2023-05-31,10131.903421427585,10472.861094934982,10568.413558370761,9936.082820345477,4120184.8392780926,2112989454011.608,AI,NASDAQ,Global,$,2023-05-31 07:00:00
stock,GOOGL,GOOGL Inc,26/08/2023,49752.68709643757,54109.20119178308,54120.78531659349,49467.7006309344,665841.4609524905,1964860532907.5142,Technology,NASDAQ,US,USDT,2023-08-26 09:00:00
crypto,ETH,ETH Coin,2024-03-11,14098.465698193238,13765.84011878759,14163.063602808938,13154.824554890763,7267678.911727967,381453401533.13873,Crypto,BINANCE,Global,USDT,2024-03-11 11:00:00
stock,MSFT,MSFT Inc,03-31-2023,30541.317262765933,31859.786023841396,33073.595674816715,29415.58610664289,453251.07957122906,2833553384887.392,Automotive,NASDAQ,US,USDT,2023-03-31 10:00:00
stock,AAPL,AAPL Inc,02-25-2024,17538.957654871392,16632.068064094707,17593.60705191067,15949.76099989924,1245864.4837812101,15599504318.314068,TECHNOLOGY,NASDAQ,Global,usd,2024-02-25 04:00:00
stock,MSFT,MSFT Inc,24/02/2024,7021.9580008238545,7074.831187407258,7284.637412840483,6861.67810807869,991465.2857256638,2745486358045.9375,automotive,NYSE,US,usd,2024-02-24 01:00:00
crypto,SOL,SOL Coin,01/03/2024,2573.003919833032,2519.315575835693,2597.267209304938,2464.096276493878,6928391.130097156,130925352891.46773,Crypto,COINBASE,Global,usd,2024-03-01 23:00:00
crypto,ADA,ADA Coin,15/07/2023,21717.492463603674,21228.125346914716,22631.464195119872,20399.557718684766,7342449.176949159,215187344780.85907,Blockchain,BINANCE,US,$,2023-07-15 14:00:00
stock,AMZN,AMZN Inc,11/06/2024,20965.808363464017,20115.85700505917,21459.072494638993,19203.818055013096,460254.3922586707,2274872150972.956,finance,NYSE,US,$,2024-06-11 04:00:00
stock,MSFT,MSFT Inc,22/08/2023,9365.380122796685,9373.203624830765,9771.160154632866,9007.455117266818,9351684.945457034,343693566361.15643,tech,NYSE,US,USD,2023-08-22 23:00:00
crypto,SOL,SOL Coin,2023-06-26,47945.64119621181,51182.573547812426,52113.64864327069,45722.60297228467,5688618.498933182,382188624029.32635,blockchain,BINANCE,US,$,2023-06-26 18:00:00
stock,AMZN,AMZN Inc,08-29-2023,42500.28859780868,46716.241159236655,47903.201123241255,41108.837715134134,1859831.2138511138,1680457517372.3289,tech,NASDAQ,US,$,2023-08-29 05:00:00
crypto,BNB,BNB Coin,10-14-2023,25460.59348751907,25743.301128295843,26805.13311320874,24829.905266277292,9164767.0183119,6895930802.861441,blockchain,BINANCE,Global,usd,2023-10-14 18:00:00
stock,AAPL,AAPL Inc,12/04/2023,42018.40854867195,39062.8482701305,43815.401697146095,38428.357953956525,1703160.0913508672,1887969594948.592,automotive,NYSE,Global,usd,2023-04-12 07:00:00
stock,TSLA,TSLA Inc,28/01/2024,46325.76594602063,41991.669601036694,47397.13022226927,40550.25366113496,6651109.322544282,577393038856.5725,Technology,NASDAQ,US,USD,2024-01-28 12:00:00
crypto,SOL,SOL Coin,20/06/2024,18025.302296612914,17761.77990196146,18910.270541415837,17569.87853218518,8972144.105186982,336653608089.75183,Crypto,BINANCE,Global,USDT,2024-06-20 21:00:00
crypto,BTC,BTC Coin,2024-07-04,11711.469437165919,11505.02777088106,12130.793867660186,10992.726374667842,2705420.5870594718,178311077157.39374,blockchain,COINBASE,Global,USD,2024-07-04 11:00:00
crypto,SOL,SOL Coin,07/03/2024,21623.063439523197,23039.139423940906,23067.55093161123,21272.03844066473,9325026.249262882,23421180682.3282,Crypto,BINANCE,US,USDT,2024-03-07 14:00:00
stock,AAPL,AAPL Inc,2023-06-27,34684.80568797513,37980.56911230474,39807.962530748504,33357.9890741088,1004210.2010674749,718414305918.435,Retail,NYSE,US,$,2023-06-27 20:00:00
stock,AMZN,AMZN Inc,2023-10-28,35104.76 USD,36689.805434053276,37926.68584718646,33939.4225227398,1698599.6206414632,453364788308.7887,Artificial Intelligence,NASDAQ,Global,usd,2023-10-28 00:00:00
crypto,SOL,SOL Coin,09/04/2023,24189.185483435747,25296.24780937279,25854.48550555258,23389.297128605212,2935492.295012785,234400631321.13998,Blockchain,BINANCE,US,USD,2023-04-09 21:00:00
stock,AAPL,AAPL Inc,02-09-2023,13294.661345571205,12217.34292495093,13525.22867035304,11628.815075620352,1864952.0578161017,642296256948.7421,Retail,NYSE,US,USDT,2023-02-09 13:00:00
crypto,ETH,ETH Coin,2024-04-15,16280.194743944367,16827.981023850654,17431.166689013146,15939.275534847391,9587018.71591262,299974325624.6745,blockchain,BINANCE,US,usd,2024-04-15 18:00:00
crypto,SOL,SOL Coin,2023-04-06,36935.24600290122,40324.32551425811,42062.851809066626,35398.541596451534,3268876.242211069,13468747316.129738,Crypto,COINBASE,US,USD,2023-04-06 16:00:00
crypto,BNB,BNB Coin,04-21-2024,30069.405107097056,31345.47838489681,31842.419834096185,29377.066938295993,6909514.780141879,73118476751.20383,blockchain,,Global,usd,2024-04-21 17:00:00
stock,GOOGL,GOOGL Inc,06-26-2023,42702.23636746841,45021.39427191463,45166.96091918984,41893.29651587454,2354020.184046536,1269806051667.0347,Artificial Intelligence,NASDAQ,US,USDT,2023-06-26 23:00:00
crypto,ETH,ETH Coin,05-11-2023,47844.85324722198,51472.08644310203,52513.15160654177,46149.982473461736,2344823.038338182,225219714543.57373,Blockchain,BINANCE,Global,$,2023-05-11 11:00:00
crypto,ADA,ADA Coin,2023-04-20,5721.280178370236,5777.663403828873,5778.048669832866,5527.85789310966,2200123.203991982,215343373553.82544,crypto,COINBASE,US,USD,2023-04-20 05:00:00
stock,TSLA,TSLA Inc,04-03-2023,36364.84355530325,35271.37729559136,36533.658407631476,34419.22186890774,2135265.365379097,2913944181982.7383,TECHNOLOGY,NYSE,US,$,2023-04-03 13:00:00
crypto,ETH,ETH Coin,23/04/2024,41769.764085402836,42737.089602227155,44091.40322597459,40811.211257993236,9272729.06068146,216889670629.85132,blockchain,BINANCE,US,$,2024-04-23 15:00:00
stock,AAPL,AAPL Inc,08-05-2023,25641.032821666875,24644.92734857671,26230.247096775194,23642.56629076603,6363806.808865575,2796389026417.604,Artificial Intelligence,NYSE,Global,$,2023-08-05 03:00:00
stock,TSLA,TSLA Inc,08-14-2024,5173.99 USD,4861.117360922966,5298.07145438366,4833.795205484194,5664340.815590343,1505276083988.8774,AI,,Global,$,2024-08-14 15:00:00
crypto,ADA,ADA Coin,2023-07-17,16958.037201698047,17200.236613671892,17584.98855394976,16669.012820563923,506705.0852240247,274206325082.34598,Blockchain,BINANCE,US,usd,2023-07-17 00:00:00
crypto,SOL,SOL Coin,05-06-2024,14806.671330946909,14291.947196933574,15518.070760209803,13707.903067908133,3113141.2805333906,199853585414.38885,crypto,COINBASE,US,USDT,2024-05-06 07:00:00
crypto,BTC,BTC Coin,12/02/2024,43152.71713799969,42433.53467229398,44757.70754074698,42128.80693813189,3100853.5418626675,206407567413.69434,Blockchain,BINANCE,US,USDT,2024-02-12 01:00:00
crypto,BNB,BNB Coin,05-13-2024,17834.24562218093,19021.49207171326,19063.669245866047,17217.556213733442,6794406.167393703,160136322497.79044,Blockchain,COINBASE,US,usd,2024-05-13 01:00:00
stock,GOOGL,GOOGL Inc,06-01-2023,21820.105071091777,21994.43997416667,22211.728089807744,21199.013914504812,5017528.138779314,1700676063700.3745,RETAIL,NASDAQ,US,$,2023-06-01 11:00:00
crypto,SOL,SOL Coin,10-27-2023,13049.149788570778,14009.119632821947,14460.382375651347,12409.963826713494,7246588.737657037,360969703172.0676,blockchain,COINBASE,Global,USD,2023-10-27 17:00:00
crypto,BNB,BNB Coin,2024-03-18,49869.082529422514,53585.692475815114,54382.36100657948,48017.47149708537,3815029.3799739834,19042991631.876762,blockchain,BINANCE,Global,USD,2024-03-18 06:00:00
crypto,ADA,ADA Coin,16/04/2024,18623.1675410852,17946.314275532884,19201.541116140277,17196.39492841528,8459966.943167686,145685951299.205,Crypto,COINBASE,Global,$,2024-04-16 18:00:00
crypto,SOL,SOL Coin,01-17-2023,23829.39556068497,25510.46393443081,25825.703204209818,22658.854492259397,6192460.042373201,325898981192.36957,Blockchain,BINANCE,US,$,2023-01-17 01:00:00
crypto,BNB,BNB Coin,19/03/2023,28362.555669330573,30627.81291317898,32113.147863523256,27844.163510659037,7640791.842934531,185874215751.06256,Crypto,COINBASE,US,USDT,2023-03-19 20:00:00
stock,AMZN,AMZN Inc,30/05/2024,8044.1720887263655,8419.360005318287,8600.95105887774,7821.334553326468,3086768.2086727307,260587216126.62115,Retail,NYSE,Global,$,2024-05-30 08:00:00
crypto,ADA,ADA Coin,20/01/2023,9266.400620355967,9501.612038229478,9584.180503888812,8832.652469719616,3304246.529301911,244905771473.7088,Blockchain,COINBASE,US,usd,2023-01-20 14:00:00
stock,TSLA,TSLA Inc,2024-08-22,44450.692011431056,40494.16662086369,44843.22205411175,39580.455446651235,4811190.841283889,701109622609.4446,Technology,NASDAQ,US,USDT,2024-08-22 04:00:00
crypto,ETH,ETH Coin,2024-04-01,372.54887647707227,408.91470916149296,422.38506915562965,360.7280148294791,4704852.04438475,23111547258.00711,blockchain,BINANCE,Global,USD,2024-04-01 06:00:00
stock,TSLA,TSLA Inc,19/05/2024,17250.240446823555,17764.45102635264,18548.584374675924,16546.54278306386,8403774.692347802,806984860158.318,automotive,NASDAQ,Global,$,2024-05-19 04:00:00
stock,TSLA,TSLA Inc,03/03/2024,10757.461257183677,9761.697475649053,10833.200164734544,9721.334391840668,4594928.027437167,373454322259.6245,tech,NASDAQ,Global,USDT,2024-03-03 07:00:00
stock,TSLA,TSLA Inc,2023-01-18,47986.74463356767,51624.06605166785,53572.05506693466,47827.123426367834,2202074.0789368055,242220926717.27713,automotive,NASDAQ,US,$,2023-01-18 10:00:00
stock,GOOGL,GOOGL Inc,2024-02-09,34502.65990575177,37054.19543271976,38530.641277700866,33375.27697665478,7744210.971635538,2510744186100.158,RETAIL,NYSE,Global,$,2024-02-09 20:00:00
stock,AAPL,AAPL Inc,14/07/2023,16436.32222977246,15147.404634537525,17204.78325826147,14610.431687582419,5206704.029249347,794744345924.822,Finance,NYSE,Global,USD,2023-07-14 18:00:00
stock,TSLA,TSLA Inc,10-18-2023,47996.80674796924,46413.38413489264,49865.19241473243,46077.852857152495,4356629.368312178,1180085181033.916,tech,NYSE,US,$,2023-10-18 21:00:00
stock,GOOGL,GOOGL Inc,04/01/2023,37389.813588422076,40477.434335433856,42005.319318092195,35944.933532525756,8883189.166629616,1140733725214.2644,tech,NYSE,Global,USDT,2023-01-04 23:00:00
crypto,BNB,BNB Coin,21/08/2023,28815.708294778935,30725.818719586572,31015.24789312988,28505.23364123908,5962031.816308864,158094758637.54907,Blockchain,COINBASE,US,usd,2023-08-21 07:00:00
crypto,ETH,ETH Coin,01-06-2023,8606.800388158712,8470.26595755391,8965.206100906791,8054.897541830992,1122901.4662896628,357869948521.9053,Blockchain,COINBASE,Global,USDT,2023-01-06 03:00:00
crypto,ADA,ADA Coin,08-22-2024,14026.904987731623,15360.984826917294,15501.17804619119,13578.81161052813,7528941.575591203,396273259038.9102,blockchain,BINANCE,US,usd,2024-08-22 12:00:00
stock,AMZN,AMZN Inc,17/01/2023,29060.30877245349,29234.084628640572,30466.945094106235,27948.67722290994,4425266.799008191,1976757437642.1536,Technology,NYSE,US,USDT,2023-01-17 19:00:00
crypto,SOL,SOL Coin,2023-01-05,29801.12037057791,28314.309242697473,30298.56374779089,27565.750706628667,268679.08644557535,66403655401.80063,crypto,BINANCE,US,USDT,2023-01-05 00:00:00
stock,AAPL,AAPL Inc,01-10-2024,34299.6017432039,33812.34146856358,35782.69975350457,33296.14874492885,82001.31553157714,284894428403.30457,AI,NASDAQ,Global,USDT,2024-01-10 19:00:00
stock,TSLA,TSLA Inc,06-02-2023,4695.306054325224,4959.119506311453,5204.969762191437,4585.247797341584,6828112.22244111,1853969868993.7332,Automotive,NASDAQ,Global,$,2023-06-02 02:00:00
crypto,BTC,BTC Coin,2024-05-16,21885.51121025214,23444.176887367707,23640.431547466087,21081.80477340859,4454891.319185016,98739093553.42686,crypto,COINBASE,US,USD,2024-05-16 14:00:00
stock,AAPL,AAPL Inc,2023-05-12,18800.438900235735,20408.749818579516,20505.137334976716,18208.98103821859,7089832.28016079,2139624186613.6018,finance,NYSE,Global,$,2023-05-12 13:00:00
stock,GOOGL,GOOGL Inc,09-27-2023,32824.092580141354,30619.73785014394,32915.96768278949,29274.024433766288,9299917.846558213,685700429327.8624,Artificial Intelligence,NYSE,Global,$,2023-09-27 23:00:00
crypto,BTC,BTC Coin,2024-02-10,39819.32531622765,38486.60834249401,40999.28869130896,37514.72937127859,9457433.856063537,222941598761.12277,Crypto,COINBASE,Global,USD,2024-02-10 12:00:00
crypto,BTC,BTC Coin,2024-03-01,36529.82614851399,33215.498908432484,37533.79302090479,32330.29166937701,9278494.82379534,300291981241.3736,Crypto,COINBASE,Global,usd,2024-03-01 23:00:00
stock,TSLA,TSLA Inc,09-22-2023,13498.974330021805,13259.627387900053,13663.236405720678,12682.292549237707,8574291.051661357,779452544686.7014,Technology,NASDAQ,US,USDT,2023-09-22 08:00:00
crypto,SOL,SOL Coin,2024-01-19,43069.522320638775,45921.88555457757,46569.481391487316,42095.58570881553,833093.8096979645,225519227139.54675,Blockchain,COINBASE,US,USD,2024-01-19 20:00:00
crypto,BNB,BNB Coin,03/09/2023,20219.093126107004,19789.138898212812,20525.16507775468,19255.488894774717,2518342.106067935,366524494192.1496,blockchain,BINANCE,Global,usd,2023-09-03 05:00:00
crypto,BTC,BTC Coin,01-03-2023,39999.352958758245,42673.353732020405,43322.37805536661,38937.39899834193,8738323.943024242,153066647754.7378,crypto,COINBASE,Global,$,2023-01-03 23:00:00
crypto,ADA,ADA Coin,13/07/2024,44458.35665016931,41961.43614738146,45966.69363619026,41085.59963053194,5529854.541144332,25805966072.73037,blockchain,COINBASE,US,$,2024-07-13 16:00:00
stock,MSFT,MSFT Inc,31/05/2024,5087.591460796617,4931.939678377719,5224.511964599315,4885.404078928936,2165214.3910333035,2579487072010.936,TECHNOLOGY,NASDAQ,US,$,2024-05-31 08:00:00
crypto,SOL,SOL Coin,30/01/2024,19987.927739871848,18744.33426817611,20746.456046228195,17892.30952445975,5148158.973380354,322157287342.8391,Crypto,COINBASE,Global,USDT,2024-01-30 07:00:00
stock,TSLA,TSLA Inc,2023-08-26,17827.3285793378,18187.714440864733,18693.43797409955,17296.658405190698,4291050.891727185,200988593747.04636,Retail,NYSE,US,$,2023-08-26 01:00:00
stock,AMZN,AMZN Inc,09-20-2023,22799.570595320904,24866.373811456735,25923.75781958953,21825.15441811821,298778.0924218884,688040964518.792,RETAIL,NYSE,Global,usd,2023-09-20 03:00:00
stock,TSLA,TSLA Inc,2023-07-24,26342.219996538573,26541.566448856414,27577.640376899548,25439.589305721816,4819593.780791186,2801237695022.7256,RETAIL,NYSE,US,$,2023-07-24 21:00:00
stock,MSFT,MSFT Inc,02-28-2023,33610.71285975103,31283.137598580648,33834.60515833806,30038.482845725226,7667350.032532754,2906302110308.7456,ai,NASDAQ,Global,$,2023-02-28 13:00:00
crypto,SOL,SOL Coin,2023-04-02,1079.2284452872386,1175.1015668397717,1185.0730919157413,1025.782796341694,2372078.8922308465,121673916517.04333,blockchain,BINANCE,US,$,2023-04-02 11:00:00
stock,AAPL,AAPL Inc,09-18-2023,21106.04 USD,22880.59561895975,23886.409347859342,20532.90215982917,4109588.1500130733,712736073483.2197,automotive,NYSE,US,usd,2023-09-18 05:00:00
crypto,SOL,SOL Coin,10-14-2023,12180.26605846857,11089.364869903582,12752.266051823599,10638.415284615581,1984808.8917279183,224228589157.56625,crypto,BINANCE,US,USD,2023-10-14 04:00:00
crypto,BTC,BTC Coin,24/01/2024,24585.751108568133,22217.81977602844,24767.630027709638,21527.017567537983,6837623.20441188,191621829897.3093,Blockchain,COINBASE,Global,USDT,2024-01-24 16:00:00
stock,AMZN,AMZN Inc,2023-02-23,21156.492167625715,21399.1362501309,22349.891843295278,20443.592960673304,1336449.1003689717,692971185927.4882,tech,NASDAQ,Global,USD,2023-02-23 03:00:00
crypto,ETH,ETH Coin,2023-05-26,37338.61286818626,34425.153769044635,38131.46749258538,32734.50889173066,336558.2572908641,198262529229.55524,crypto,COINBASE,Global,USDT,2023-05-26 22:00:00
stock,MSFT,MSFT Inc,2024-04-13,14916.882934564963,15946.467970390493,16426.579688184403,14509.602030359742,4079945.775171909,1454030556017.83,ai,NYSE,US,$,2024-04-13 07:00:00
stock,GOOGL,GOOGL Inc,23/01/2024,2031.5371723209405,2191.1320332427963,2300.502734413599,1948.3952057272984,1204709.2647814227,1496763985766.7942,RETAIL,NASDAQ,Global,usd,2024-01-23 10:00:00
crypto,BNB,BNB Coin,2023-05-15,33054.742641136014,34122.01971448793,35568.66396357066,32644.57689809144,4497447.044020028,61713098062.195114,crypto,BINANCE,Global,usd,2023-05-15 23:00:00
crypto,ADA,ADA Coin,16/04/2023,34417.35067169672,34505.02178452197,35325.63916353862,33806.61038831683,5575188.015207562,247077867818.30093,Crypto,BINANCE,Global,USDT,2023-04-16 21:00:00
stock,AAPL,AAPL Inc,23/10/2023,30646.610150428558,31990.136457703917,33018.30505577668,29910.696910929993,6818286.316032581,1935387492954.3718,RETAIL,NYSE,Global,$,2023-10-23 23:00:00
stock,TSLA,TSLA Inc,12/01/2024,12091.144586370327,10885.459708672188,12429.674959686525,10662.664406786827,9720517.598792369,1353951075904.43,Finance,NASDAQ,US,USDT,2024-01-12 05:00:00
crypto,SOL,SOL Coin,03-16-2024,19712.720808987306,18537.0524893624,19782.241952460907,18326.475737303936,2497560.962328911,147783941967.23883,blockchain,BINANCE,US,USD,2024-03-16 12:00:00
crypto,BTC,BTC Coin,05-05-2023,34391.774046918625,34193.929776617326,35898.739239757175,33242.98776917075,2849801.3217946095,245517420106.865,blockchain,COINBASE,US,$,2023-05-05 23:00:00
crypto,SOL,SOL Coin,24/06/2024,43079.598569655325,40184.99372657767,43135.51808211265,38356.54749111839,2866187.438139617,358926131569.8408,Crypto,COINBASE,US,usd,2024-06-24 04:00:00
crypto,BTC,BTC Coin,2023-09-02,27930.222496509643,27222.25689186069,29171.324409447803,26477.913728394808,3153071.04538181,389042621687.9757,blockchain,COINBASE,Global,$,2023-09-02 14:00:00
stock,AAPL,AAPL Inc,03/06/2023,42477.38813297197,45397.01512731588,46559.825038803065,42030.18279000118,1794354.2392862542,2824246390949.5156,Automotive,NASDAQ,US,usd,2023-06-03 07:00:00
stock,MSFT,MSFT Inc,2023-06-21,49192.45768314881,47135.80397099598,51146.26485025016,45934.96847515447,399017.0265376512,1723936643093.1685,RETAIL,NYSE,Global,usd,2023-06-21 22:00:00
stock,TSLA,TSLA Inc,04-04-2023,8436.771528161718,8658.614017740008,8695.700677309684,8414.35814676056,2917947.1479164287,2291427999468.8457,Technology,NASDAQ,US,USD,2023-04-04 12:00:00
stock,MSFT,MSFT Inc,2023-02-22,6465.53 USD,7042.25684795885,7292.927298223591,6382.0138905607455,4994546.209241065,687129428115.4108,RETAIL,NASDAQ,Global,usd,2023-02-22 03:00:00
crypto,BNB,BNB Coin,2023-12-07,5509.961937143918,5575.906368932875,5644.745531816459,5503.665519826125,7966012.819211458,192517475181.84094,crypto,BINANCE,Global,usd,2023-12-07 08:00:00
stock,GOOGL,GOOGL Inc,21/07/2024,7575.549521989737,8007.858393272724,8056.727857430358,7268.4874071803115,2115993.65692453,1244846259976.734,AI,NYSE,Global,USD,2024-07-21 04:00:00
stock,AMZN,AMZN Inc,07-17-2023,39354.96 USD,37893.43594968897,39521.57099970893,36878.91207789099,7481354.301358195,1675103008436.5522,ai,NYSE,Global,USDT,2023-07-17 06:00:00
stock,TSLA,TSLA Inc,2023-07-15,11004.03 USD,11988.287916741474,12560.221396618308,10998.78238884602,8076788.356146227,672774890831.291,Retail,NYSE,Global,usd,2023-07-15 10:00:00
crypto,SOL,SOL Coin,30/11/2023,10606.956224755075,10268.011450956516,10775.677116431318,10245.692772443223,7890950.754834054,79332746821.3385,crypto,BINANCE,US,usd,2023-11-30 16:00:00
stock,AMZN,AMZN Inc,2024-05-11,9306.30157066601,10068.535241930316,10485.307346520724,8917.131508381546,8711832.149277763,2174786288563.0461,Finance,NASDAQ,Global,$,2024-05-11 16:00:00
crypto,BTC,BTC Coin,18/01/2023,4052.678594146981,4179.788675085961,4316.426940636613,3869.2811105929286,3189199.2375568873,112537776866.33615,crypto,BINANCE,US,USD,2023-01-18 00:00:00
stock,TSLA,TSLA Inc,10/10/2023,33924.55 USD,35485.58834024485,35863.36309761868,32361.953941313073,2769739.9957196354,2978515242144.0605,TECHNOLOGY,NYSE,Global,USDT,2023-10-10 23:00:00
stock,AMZN,AMZN Inc,2024-08-10,11734.859596395174,11013.762617544211,12072.09346299869,10643.757176512649,8203629.8054602565,754206171727.6439,RETAIL,NYSE,Global,$,2024-08-10 03:00:00
crypto,ETH,ETH Coin,26/04/2024,23236.70727271854,20976.509174848983,23796.342828985267,19986.248263732665,9777257.395214563,77659230049.71667,crypto,BINANCE,Global,$,2024-04-26 06:00:00
stock,AMZN,AMZN Inc,28/08/2023,24510.672717056405,22484.06832490448,25236.734532152706,22212.86970932135,1907981.812794448,2373870464664.7344,tech,NYSE,US,usd,2023-08-28 16:00:00
crypto,SOL,SOL Coin,2023-08-17,40712.4 USD,42896.60512545296,44618.88670091986,40466.75114333684,9376883.339492543,229442294611.05887,blockchain,COINBASE,US,USDT,2023-08-17 15:00:00
stock,GOOGL,GOOGL Inc,11-09-2023,28442.767435118636,30096.19969554206,31145.262648353328,28436.396579836703,137762.83339533675,1222508254058.5725,Finance,NYSE,US,USD,2023-11-09 08:00:00
crypto,,SOL Coin,2024-07-30,14058.58603424742,13390.285420362465,14215.008738869568,13195.53968068932,848509.9732799432,145277620049.7373,Crypto,COINBASE,Global,USD,2024-07-30 19:00:00
stock,MSFT,MSFT Inc,17/07/2024,34674.35784239351,32946.21650589159,35112.70029599926,32334.834530436096,7621948.883731294,2227410413490.5815,Retail,NASDAQ,US,usd,2024-07-17 15:00:00
stock,AMZN,AMZN Inc,2023-05-05,42608.456797085244,46570.04619159128,47923.80226313702,42413.85451867108,8085324.219330847,2630691983131.2227,Artificial Intelligence,NYSE,US,usd,2023-05-05 19:00:00
stock,GOOGL,GOOGL Inc,14/04/2024,591.213798255478,646.3034537433936,661.6056627283612,585.2479481911768,1272913.989258471,2685056196698.9004,Finance,,Global,USD,2024-04-14 14:00:00
stock,AAPL,AAPL Inc,15/01/2024,13580.318544419337,13014.450491912687,13664.01107348548,12888.056642657291,93413.90349620051,1193863876483.7825,Artificial Intelligence,NYSE,Global,usd,2024-01-15 18:00:00
stock,TSLA,TSLA Inc,06-20-2024,8728.783055388587,8884.223374598954,8997.165131516758,8405.380968681991,4883893.1018091915,944391316385.7555,Technology,NYSE,Global,USD,2024-06-20 06:00:00
crypto,BTC,BTC Coin,01-03-2024,6074.022181212529,5679.832054157727,6149.089425277661,5672.376767411142,3972127.8469292605,262812170539.66565,crypto,BINANCE,US,USD,2024-01-03 17:00:00
stock,GOOGL,GOOGL Inc,10-01-2023,12084.725207671734,12061.666404307241,12129.510700425422,11479.535492806122,4687866.534687781,1800980370986.7693,tech,NYSE,Global,$,2023-10-01 20:00:00
crypto,BNB,BNB Coin,28/10/2023,6852.647181394465,7109.760462018314,7462.725761128092,6645.576226029809,6245961.800538028,162470418569.77277,blockchain,BINANCE,US,USD,2023-10-28 16:00:00
crypto,BTC,BTC Coin,24/06/2023,41578.433272619295,41275.344982350376,43111.616138563055,39476.01863276624,5121526.450782528,385375497233.97186,blockchain,BINANCE,US,$,2023-06-24 15:00:00
crypto,ETH,ETH Coin,16/05/2023,8066.572757929093,7947.640671259816,8119.414679713414,7828.022761413449,4562944.200489302,115228809486.07494,crypto,BINANCE,Global,usd,2023-05-16 10:00:00
crypto,ETH,ETH Coin,2024-03-09,7327.333174021169,6799.430562442733,7541.077137672045,6794.334303505374,963409.5817940185,214802129863.0422,Blockchain,BINANCE,Global,usd,2024-03-09 02:00:00
stock,MSFT,MSFT Inc,28/06/2024,43474.261235729,39755.22958031929,45378.18546889659,38809.62358304366,4083259.472490332,864336971411.686,TECHNOLOGY,NYSE,Global,USDT,2024-06-28 05:00:00
crypto,ADA,ADA Coin,06/01/2024,14862.886734810816,14285.619890561584,15520.423133556968,14088.33207287743,6697560.355303675,127323822918.82506,crypto,BINANCE,Global,USD,2024-01-06 19:00:00
crypto,,BNB Coin,04-13-2024,12863.162003577208,13166.842766610298,13469.723758139555,12723.237578994545,3093251.8486223817,320505913836.0403,blockchain,,Global,usd,2024-04-13 00:00:00
stock,GOOGL,GOOGL Inc,10/08/2024,44111.7984667475,43248.5347719162,44258.739471316876,42202.030130026644,3460378.905582452,1933104064440.9883,Artificial Intelligence,NASDAQ,US,USD,2024-08-10 00:00:00
crypto,ADA,ADA Coin,02/01/2023,47552.14 USD,47415.26486447057,48660.55296735397,46596.36720511377,1035871.5384320833,270529025316.1341,Crypto,COINBASE,US,USD,2023-01-02 08:00:00
crypto,BTC,BTC Coin,09/06/2023,45949.77648176492,47511.541501523345,47543.47886420666,44122.412394004794,6828689.823022962,105134944625.38078,Blockchain,BINANCE,US,USD,2023-06-09 02:00:00
stock,AAPL,AAPL Inc,15/09/2023,41994.58003797536,40249.09046515124,43949.48778317646,39349.41641899572,6965693.684856541,2295553615662.0967,RETAIL,NYSE,Global,usd,2023-09-15 05:00:00
crypto,SOL,SOL Coin,2023-09-22,6145.775333184277,6715.015063201004,6756.270631695444,5916.808928554343,8136465.174349579,240711850798.06363,Blockchain,BINANCE,Global,USDT,2023-09-22 20:00:00
crypto,BNB,BNB Coin,2023-06-22,41909.07677716408,42040.974602513634,42833.432754182046,41745.307629167444,363486.9228304337,249345799792.93506,Crypto,COINBASE,US,$,2023-06-22 22:00:00
stock,AAPL,AAPL Inc,2023-08-25,11548.581081537202,12354.063032966049,12440.04521977243,11306.187314821627,8881191.082195709,2569829358855.607,Technology,NYSE,Global,usd,2023-08-25 15:00:00
crypto,BNB,BNB Coin,2023-10-21,37330.86802343161,39605.59921476186,41064.063937483355,37191.492736531145,4468895.470968767,192048160525.06174,crypto,BINANCE,Global,USDT,2023-10-21 01:00:00
stock,GOOGL,GOOGL Inc,07-12-2023,2400.0750744869642,2278.3720050339243,2417.25931247655,2228.0141444186397,1850268.4267801084,527645063103.81573,Finance,NASDAQ,Global,$,2023-07-12 02:00:00
stock,AAPL,AAPL Inc,02-08-2023,1809.1315451447065,1929.1021129246421,1986.150478546436,1751.06613866287,8942386.199359728,126411784795.21982,automotive,NYSE,Global,usd,2023-02-08 02:00:00
stock,MSFT,MSFT Inc,12-07-2023,49016.300415664016,50156.33908106163,50616.43384762741,48229.758142803286,7634049.216575842,219887868109.0637,Artificial Intelligence,NYSE,Global,usd,2023-12-07 10:00:00
crypto,ETH,ETH Coin,16/08/2023,43083.013986214915,40073.513869939365,43683.67216187274,38257.166548875866,2109567.5282329144,174590399431.4559,blockchain,COINBASE,Global,USD,2023-08-16 22:00:00
crypto,BNB,BNB Coin,2023-06-27,45882.48321417629,42011.00818935655,46863.02656805117,41028.78806034335,8987031.844967807,99297880704.90228,crypto,COINBASE,US,USD,2023-06-27 13:00:00
crypto,BNB,BNB Coin,2024-01-06,37671.87186484259,41218.98743921036,42841.163023979585,37602.56059512812,7072999.988718607,399090006371.1793,Crypto,BINANCE,Global,$,2024-01-06 08:00:00
stock,GOOGL,GOOGL Inc,12-02-2023,20101.9901477639,20691.369578701142,21054.211893561598,19371.668681799718,5774415.272063777,248492642098.70248,TECHNOLOGY,NASDAQ,Global,usd,2023-12-02 08:00:00
crypto,ETH,ETH Coin,08-25-2023,1758.7438570725164,1853.4456021446654,1920.4223868967554,1755.5740224891738,9307181.512103103,373733241297.4618,blockchain,COINBASE,Global,USD,2023-08-25 17:00:00
stock,MSFT,MSFT Inc,2023-08-11,26025.234146483108,24485.93291212111,26734.728508205557,24198.65414537879,8956796.457166294,2289075360512.1367,Finance,NASDAQ,Global,USD,2023-08-11 10:00:00
stock,GOOGL,GOOGL Inc,2024-05-15,9771.394090200789,9966.208942545181,10131.734447688059,9287.321995887614,2003009.136950872,2371238907539.5415,finance,NASDAQ,US,USDT,2024-05-15 10:00:00
crypto,BTC,BTC Coin,2024-06-15,42137.528985738034,40102.33902573882,42737.35243154704,40022.00716672609,3791488.143765473,49722156723.71246,Crypto,BINANCE,US,USDT,2024-06-15 03:00:00
crypto,SOL,SOL Coin,11-05-2023,14199.47 USD,13118.320198480667,14272.46030486142,12513.2293427223,5933001.442283598,8786327857.03585,Blockchain,BINANCE,Global,$,2023-11-05 03:00:00
crypto,BTC,BTC Coin,08/08/2023,18068.52727411011,19376.752669631365,19787.867428787562,17992.36061705834,4979882.595902667,79792350833.79416,crypto,COINBASE,Global,$,2023-08-08 20:00:00
crypto,ADA,ADA Coin,07/01/2023,37521.942465264176,34318.88258791035,37689.812602171725,33721.688925441136,4869920.191679243,162540462861.70352,Crypto,COINBASE,Global,usd,2023-01-07 09:00:00
crypto,BNB,BNB Coin,10/08/2024,45814.37915880314,44791.498720195785,47180.58691340618,43673.27140234099,9816124.945768686,317214023876.088,blockchain,BINANCE,US,$,2024-08-10 07:00:00
crypto,BNB,BNB Coin,03/10/2023,45587.7680367849,43347.95061609509,47348.65580585608,41755.939097645016,2088216.5917504705,333278340905.8551,blockchain,COINBASE,Global,usd,2023-10-03 01:00:00
crypto,ETH,ETH Coin,2024-05-23,975.0277917261536,1065.7811757316038,1073.7352017348367,966.2251473072062,2759949.608127963,377985133063.94257,crypto,COINBASE,US,usd,2024-05-23 13:00:00
crypto,ADA,ADA Coin,2023-02-09,10845.717988986027,11031.21022675562,11223.20598493347,10659.9270652508,157457.53210271767,143527419335.13733,blockchain,COINBASE,Global,USDT,2023-02-09 23:00:00
stock,AMZN,AMZN Inc,07-07-2024,4992.06102503512,4911.183331766215,5195.436635879303,4883.724392632567,2448862.5898689465,202480901709.96844,AI,NASDAQ,Global,usd,2024-07-07 11:00:00
crypto,SOL,SOL Coin,2023-03-02,38420.5659847031,36797.90742034289,39206.2814215796,35922.06975937959,1349613.589234069,231876041074.41052,Crypto,COINBASE,Global,usd,2023-03-02 02:00:00
crypto,ADA,ADA Coin,2024-08-14,7648.762407820979,7842.817049728977,7871.685777565365,7338.871408648228,3379201.003067342,15263006021.683224,Blockchain,BINANCE,Global,$,2024-08-14 15:00:00
stock,GOOGL,GOOGL Inc,08-30-2023,9593.046565370105,10382.112612699857,10392.130900905253,9426.814380896802,3844704.900220934,242831492276.03534,RETAIL,NASDAQ,Global,USD,2023-08-30 22:00:00
crypto,BTC,BTC Coin,04/01/2024,29438.699100966594,27810.73170664738,30685.73635997445,27104.256221135725,8225537.653115803,270696252075.7866,Blockchain,COINBASE,Global,USD,2024-01-04 11:00:00
crypto,BNB,BNB Coin,2024-04-30,49234.4308402228,51897.90876305247,54404.44854378168,48038.83787097079,4737437.631774714,165374951794.3466,blockchain,BINANCE,Global,USD,2024-04-30 11:00:00
crypto,BNB,BNB Coin,2023-09-03,44015.760238041374,48101.70625130404,48882.281273667846,43572.75167730353,2107245.3307577316,303404254683.47687,blockchain,COINBASE,US,$,2023-09-03 20:00:00
stock,GOOGL,GOOGL Inc,03-29-2023,9000.608938975865,8725.905604987625,9419.748561239287,8353.34900753757,6324376.550456829,1641267296768.8813,Finance,NASDAQ,US,$,2023-03-29 00:00:00
stock,AAPL,AAPL Inc,01/10/2023,6045.7102519222335,5835.294196094993,6215.891404596761,5598.141598823427,8006435.940471741,1782933276052.936,automotive,,Global,usd,2023-10-01 07:00:00
crypto,SOL,SOL Coin,08-19-2023,10745.82240412398,10072.944719480662,10990.254978471115,9945.907398495563,2816724.5017422787,389001821266.2262,Blockchain,COINBASE,US,USDT,2023-08-19 19:00:00
stock,AAPL,AAPL Inc,01-13-2024,27065.61919536437,29537.254613679794,30115.11681880954,26280.898328312847,9689048.269423265,69440927004.86841,AI,NYSE,Global,USDT,2024-01-13 13:00:00
crypto,SOL,SOL Coin,17/06/2024,35961.40442287784,36412.374857532726,38186.766653810555,35401.96451372362,8950432.48330009,279370006592.55774,blockchain,COINBASE,Global,USD,2024-06-17 11:00:00
stock,MSFT,MSFT Inc,07-04-2024,36758.44008377139,35217.60657164197,37316.21026065349,34835.46851008005,2967766.185409826,2101142808542.3313,finance,NYSE,Global,USD,2024-07-04 18:00:00
stock,AMZN,AMZN Inc,2024-07-03,12475.12202222603,13266.003293148207,13339.2988576124,12368.738323212336,6027695.275275511,1692682511696.5796,automotive,NASDAQ,US,USDT,2024-07-03 07:00:00
crypto,BTC,BTC Coin,07-14-2023,27106.348921450848,25927.216437603372,27544.74984344568,25086.56279664166,634129.1504762371,78829266256.69553,crypto,COINBASE,US,USD,2023-07-14 18:00:00
stock,GOOGL,GOOGL Inc,2023-06-03,1586.4160602798925,1637.9735901528536,1668.3766443009156,1558.3373122990943,3563126.2826227504,2958025436360.2383,Artificial Intelligence,NASDAQ,US,usd,2023-06-03 12:00:00
crypto,BNB,BNB Coin,01-07-2024,36464.483118323355,37854.16382612431,38069.86060173837,35838.92257568752,2800595.506991519,271131505272.2492,blockchain,BINANCE,US,$,2024-01-07 07:00:00
stock,TSLA,TSLA Inc,08-15-2023,20747.385287728808,20471.623917497505,21232.01737478501,20169.48748371477,3089129.2476154487,96116098002.30722,tech,NYSE,US,$,2023-08-15 17:00:00
crypto,BTC,BTC Coin,2023-07-24,3037.007289500617,3150.482768461012,3239.92908428286,2938.2172557448666,7052184.600194629,129535802676.04942,Blockchain,N/A,Global,USD,2023-07-24 23:00:00
stock,MSFT,MSFT Inc,04-13-2024,23467.55484406828,23520.706713958585,24269.07459507778,23068.609467868984,2890289.233588031,1616699670188.3628,ai,NASDAQ,Global,usd,2024-04-13 23:00:00
crypto,BTC,BTC Coin,18/07/2023,7840.142717714032,8058.711605519658,8410.42330942764,7608.661045058424,1696032.0831342943,60593628539.50552,Crypto,BINANCE,US,$,2023-07-18 10:00:00
crypto,SOL,SOL Coin,2023-01-11,41626.14882622823,44794.58510982881,46153.723214318576,41336.28214052049,155134.1695256284,303857986826.0726,Blockchain,COINBASE,Global,$,2023-01-11 19:00:00
stock,TSLA,TSLA Inc,01-02-2024,4637.877591934417,4835.084492143481,4851.906182270844,4521.0875723624995,4727596.279464255,330635047290.8753,Finance,NASDAQ,US,USD,2024-01-02 11:00:00
crypto,BNB,BNB Coin,2023-03-29,43521.55444540557,40652.90257585002,44288.540858466105,40193.87337542911,305192.72161844914,127727891805.50517,blockchain,COINBASE,Global,USDT,2023-03-29 11:00:00
stock,AAPL,AAPL Inc,2024-06-18,40821.722340814915,44350.905879598075,46294.13337085037,39432.52671064672,5864055.049088202,2022121696736.6423,finance,NYSE,Global,USD,2024-06-18 05:00:00
crypto,BTC,BTC Coin,06/09/2023,12900.92147736495,11853.94043155488,13104.231801411934,11779.96426471705,3472321.229903252,35530929794.43401,Blockchain,COINBASE,Global,USD,2023-09-06 09:00:00
crypto,SOL,SOL Coin,11/08/2023,21674.708597265893,21496.614124468342,22725.468181646425,20740.099334520186,6273617.37076219,226949750685.56342,crypto,BINANCE,Global,USDT,2023-08-11 17:00:00
crypto,ADA,ADA Coin,2024-03-21,3066.6975905738336,3060.1537679835574,3191.411491948431,2922.2560430449207,696848.8821156934,170924754483.8816,Blockchain,COINBASE,US,USD,2024-03-21 15:00:00
crypto,BNB,BNB Coin,04-30-2024,38222.361568351414,39934.688080835804,41062.87849890557,37206.07943558772,8883369.821211519,65684450555.34033,blockchain,COINBASE,Global,usd,2024-04-30 09:00:00
crypto,ADA,ADA Coin,02-11-2024,40598.993142577245,43142.61994744988,44529.045044494575,39498.79011503854,8646912.848103918,307845640414.2256,blockchain,BINANCE,Global,usd,2024-02-11 02:00:00
crypto,ETH,ETH Coin,30/01/2024,1200.0641024845672,1092.4315227791044,1257.5917731904433,1052.9488962119594,8733821.027054537,370772929953.284,Blockchain,Unknown,Global,usd,2024-01-30 11:00:00
stock,TSLA,TSLA Inc,01-12-2023,5963.811879891687,5463.380314515504,6010.481063283332,5258.4743768682165,4885695.020954331,1172497405694.5938,AI,NASDAQ,US,$,2023-01-12 00:00:00
crypto,ADA,ADA Coin,2023-11-03,49320.06483850014,48743.08659578152,50597.910586234975,47577.67766197057,5394804.120523873,282091670723.4845,Blockchain,COINBASE,US,$,2023-11-03 13:00:00
stock,AAPL,AAPL Inc,04/02/2023,448.65000554527217,403.9397732805739,450.84090525371573,385.7939221847615,7049264.192639006,1558044564742.3423,TECHNOLOGY,NASDAQ,US,USDT,2023-02-04 20:00:00
crypto,BNB,BNB Coin,10-26-2023,44736.75809673309,48571.64963373625,50941.6870981451,44600.49285039119,2719611.3308633277,85941832843.81992,crypto,BINANCE,US,USD,2023-10-26 18:00:00
stock,AMZN,AMZN Inc,01-31-2024,8780.99396014508,9318.75898666653,9732.71303348408,8715.702369948345,4334236.120019652,1534232765663.5022,Retail,NASDAQ,US,usd,2024-01-31 17:00:00
crypto,ADA,ADA Coin,22/04/2024,4887.982687117709,4438.527566812722,5072.073014740101,4310.9987440119385,9955497.098130953,304676184451.2785,blockchain,COINBASE,Global,USD,2024-04-22 21:00:00
crypto,BNB,BNB Coin,27/08/2023,42782.82779994633,42611.55158783514,44552.21901889305,42221.927075344414,9160004.021619411,43415415262.935295,Blockchain,BINANCE,US,$,2023-08-27 14:00:00
crypto,SOL,SOL Coin,03-23-2024,47490.47 USD,44181.969748060066,47685.10646691427,42926.35244722399,8283401.363449784,122650754458.0106,Crypto,BINANCE,Global,$,2024-03-23 23:00:00
crypto,SOL,SOL Coin,17/10/2023,41466.0410097504,43370.88151144345,43825.03619746167,41360.05717783687,608750.9051254047,192001346600.211,Blockchain,BINANCE,US,USDT,2023-10-17 05:00:00
stock,AAPL,AAPL Inc,24/12/2023,15229.128015028797,15229.5790505223,15551.191112143899,14598.51613751203,3582110.5171505297,2695856325555.947,Retail,NYSE,US,$,2023-12-24 10:00:00
crypto,ETH,ETH Coin,2023-05-10,10202.284908271587,9563.737844480624,10451.739640241216,9467.111273094899,5690131.367578649,81209102335.65413,crypto,BINANCE,US,USDT,2023-05-10 03:00:00
crypto,ADA,ADA Coin,04/05/2023,31830.858983950442,33036.2306880917,34138.99201060666,30954.649644616507,6893698.883178628,357816602477.5825,Blockchain,COINBASE,US,USD,2023-05-04 11:00:00
crypto,BTC,BTC Coin,10/03/2024,42993.98 USD,45382.82475555295,45939.28616651495,42495.31473699323,127413.37139878492,32534559855.23966,Blockchain,COINBASE,US,$,2024-03-10 10:00:00
crypto,ADA,ADA Coin,2023-09-19,3266.210561158088,3449.266584073715,3579.62715664495,3235.775361794194,45812.45156196282,90812396129.94777,Crypto,Unknown,US,USD,2023-09-19 00:00:00
crypto,BTC,BTC Coin,26/06/2023,35244.76151389165,32815.70050678172,36389.84747514768,31312.92207286975,1814077.2351870274,202986927037.97116,crypto,COINBASE,US,USD,2023-06-26 08:00:00
crypto,SOL,SOL Coin,30/04/2024,32681.721982528292,30367.000634863736,32984.39285267302,29159.071751044477,2387769.346185086,192939741922.8674,blockchain,COINBASE,Global,usd,2024-04-30 21:00:00
crypto,ADA,ADA Coin,27/01/2024,19763.50393379686,20371.388407654624,20817.554187111116,19542.126907012123,7192965.790980199,94488770167.88504,blockchain,BINANCE,Global,USD,2024-01-27 01:00:00
crypto,,BNB Coin,13/09/2023,2451.592749803989,2636.9045094341923,2647.429854404821,2347.1964753120055,222310.62230562247,54978131049.384895,blockchain,COINBASE,US,USD,2023-09-13 07:00:00
stock,TSLA,TSLA Inc,21/07/2023,29122.704452285845,31958.694767151515,33375.95485380146,28264.81245137228,3716486.8232844374,1888725732242.9749,Retail,NASDAQ,Global,USDT,2023-07-21 13:00:00
stock,MSFT,MSFT Inc,2024-01-12,7628.82193269369,7076.62286503071,7679.280375343776,6763.169076776444,2405879.9120129636,897587582497.1554,Technology,NYSE,Global,USDT,2024-01-12 09:00:00
crypto,SOL,SOL Coin,03-16-2023,48079.332762235405,48833.921071806224,51245.32977697778,46570.76424049587,4576808.699261821,126134108973.68098,Crypto,COINBASE,US,USD,2023-03-16 00:00:00
crypto,ETH,ETH Coin,04-21-2024,9152.55366831867,8499.362835755494,9585.048072256057,8493.757795708063,450050.05559080676,133208570370.28528,blockchain,BINANCE,Global,usd,2024-04-21 09:00:00
crypto,BTC,BTC Coin,2024-07-06,21181.96937412812,19853.15443457572,21567.354541810633,18988.6452013821,4565661.05546118,64386620519.047775,Blockchain,BINANCE,Global,USD,2024-07-06 06:00:00
crypto,ADA,ADA Coin,11/07/2023,17601.733737375456,16173.573599460546,17978.523535080534,16160.034386393352,3289001.6357650217,112319373386.8574,crypto,COINBASE,Global,usd,2023-07-11 22:00:00
crypto,BNB,BNB Coin,07-05-2023,42161.52508976802,45973.41955878377,47789.62136402583,41443.9292439382,8565987.85783035,351189563562.76184,Crypto,BINANCE,US,$,2023-07-05 21:00:00
stock,MSFT,MSFT Inc,2024-06-07,23146.9045533684,25411.858044840963,26389.70653464046,23103.01267312865,7796563.926978657,236177595165.47543,AI,NASDAQ,US,$,2024-06-07 19:00:00
crypto,BTC,BTC Coin,12-05-2023,35329.41631883652,37170.09307202613,38142.42183797472,35195.58442837603,8250564.067322993,350578377139.647,blockchain,COINBASE,Global,USDT,2023-12-05 16:00:00
crypto,ADA,ADA Coin,29/07/2024,33653.724957142986,32338.402414775777,33713.678723859935,32234.361898851737,5861617.367706164,338334561437.92474,Crypto,BINANCE,Global,usd,2024-07-29 07:00:00
crypto,ETH,ETH Coin,2024-01-10,7465.264041298415,7957.259528935937,8290.079943356704,7396.026691525288,6451181.836975896,122766473603.5154,blockchain,BINANCE,Global,$,2024-01-10 19:00:00
stock,MSFT,MSFT Inc,19/10/2023,15210.473536165047,13715.450603446625,15844.451821713781,13089.6370154543,6307919.225409635,1104386008899.709,finance,NYSE,US,USDT,2023-10-19 03:00:00
crypto,BTC,BTC Coin,06-01-2024,26339.201052728295,28587.056137596937,28632.245142697026,26040.76766494758,521471.931274704,204109604001.8349,Crypto,COINBASE,US,USD,2024-06-01 02:00:00
crypto,ADA,ADA Coin,09-12-2023,21496.58673008768,19618.108248234712,22344.78179966229,19156.654140596132,291358.7878150846,20070674344.47399,crypto,,Global,USDT,2023-09-12 08:00:00
crypto,BNB,BNB Coin,08-31-2023,30637.3 USD,32512.987707763918,33224.69624670399,29954.977526495346,7998494.711044966,20997771160.358208,blockchain,,Global,USD,2023-08-31 00:00:00
crypto,SOL,SOL Coin,07-17-2024,11245.764280564386,11500.035567438072,11861.297373715108,11096.255769721463,6209121.001380456,246149938746.5186,blockchain,BINANCE,Global,USD,2024-07-17 02:00:00
crypto,ETH,ETH Coin,04-22-2023,9872.442552766253,10763.115916789104,11052.826433650223,9710.512844878667,995516.5129244464,387850641530.925,Blockchain,COINBASE,Global,usd,2023-04-22 12:00:00
stock,MSFT,MSFT Inc,13/12/2023,38471.263531694,40063.28916959072,40143.69496534878,37599.10895290503,883693.651491126,1147922064720.54,finance,NASDAQ,Global,USDT,2023-12-13 05:00:00
crypto,SOL,SOL Coin,2023-06-18,44865.86 USD,40568.43119167849,46792.0588986371,40405.00045638688,3536128.6774119874,398363289525.3741,Crypto,COINBASE,US,usd,2023-06-18 17:00:00
stock,GOOGL,GOOGL Inc,07-05-2024,22110.77 USD,22797.22810981352,23185.1427845898,21361.829553799118,4244914.454686933,2161309948592.8198,Retail,NASDAQ,Global,usd,2024-07-05 08:00:00
stock,TSLA,TSLA Inc,2024-08-22,41558.63683212478,40301.0549884044,42390.12033159027,40087.56944444147,4966741.516817651,445247598370.97845,Artificial Intelligence,NASDAQ,US,$,2024-08-22 12:00:00
crypto,ETH,ETH Coin,04-09-2024,47825.34 USD,51524.40550705301,51960.98907848869,46565.65770942991,9712990.978058027,219980294193.59085,blockchain,BINANCE,Global,USDT,2024-04-09 22:00:00
stock,AAPL,AAPL Inc,06-04-2024,18584.939694724842,17451.370744542288,18691.174103805697,17224.768875687347,7700534.656546463,1123375231703.522,Automotive,NYSE,Global,$,2024-06-04 15:00:00
stock,MSFT,MSFT Inc,01-08-2024,38673.176363159095,36688.10151087838,38750.748138521005,36661.38777485289,3405166.504740514,2907348760873.9697,RETAIL,NYSE,Global,$,2024-01-08 12:00:00
stock,GOOGL,GOOGL Inc,07/07/2023,45298.70093537163,46069.68390613559,46564.63625912409,45047.511128681326,9933615.189692378,942794911872.9381,TECHNOLOGY,NYSE,US,usd,2023-07-07 20:00:00
crypto,BNB,BNB Coin,2023-06-14,43113.95889884134,42169.89855682067,44243.7007947766,41990.288473788045,9733818.578555398,39238031654.57814,Blockchain,COINBASE,US,USD,2023-06-14 00:00:00
stock,MSFT,MSFT Inc,12-31-2023,10650.41004028609,9756.875909063945,10949.578914816291,9275.668933522247,4119571.0778017556,793870092122.3102,finance,NASDAQ,Global,USD,2023-12-31 13:00:00
stock,TSLA,TSLA Inc,15/02/2024,20267.236888637406,18402.376227639266,21113.614192349243,17675.242210060504,3283758.7948687617,229418209789.50558,Technology,NYSE,Global,USDT,2024-02-15 04:00:00
stock,AMZN,AMZN Inc,2023-05-02,37315.84040599693,35218.97647456246,37449.98976759229,34718.29254636081,3907634.8043304053,2611443509853.112,ai,NYSE,US,USD,2023-05-02 15:00:00
stock,GOOGL,GOOGL Inc,05/08/2024,22270.28567103677,21584.371619885223,22772.70933789711,21313.011805196973,9022300.6451172,2300579197363.4814,Automotive,NASDAQ,Global,usd,2024-08-05 08:00:00
stock,AMZN,AMZN Inc,07-29-2023,26210.335945935487,23761.427876785416,26824.19452270405,23625.13568765327,3616541.0739366766,158803917799.84085,TECHNOLOGY,NASDAQ,Global,USD,2023-07-29 05:00:00
crypto,BNB,BNB Coin,01-15-2024,31534.117497813964,34272.25862250846,35569.749142831955,30120.498457848666,2312282.5242592082,373317916326.85406,crypto,COINBASE,US,USDT,2024-01-15 17:00:00
crypto,ETH,ETH Coin,12/10/2023,8513.64303178368,8504.978875676452,8714.296042493317,8486.378145837338,4337845.101076881,160697329560.48495,Blockchain,BINANCE,US,USDT,2023-10-12 05:00:00
crypto,BNB,BNB Coin,05/03/2024,47096.10813712548,50647.04948713334,51175.46946238341,45909.356607219794,3478050.083176961,315322587693.75916,blockchain,,Global,$,2024-03-05 23:00:00
stock,TSLA,TSLA Inc,06-08-2023,18046.733244025105,19224.67676557691,19659.288124968032,17616.945177595237,9824491.1231137,1205577498460.2744,Finance,NASDAQ,US,usd,2023-06-08 13:00:00
stock,AAPL,AAPL Inc,12/08/2023,24403.002413139533,25740.588112330573,25935.1379975294,23929.012641437326,2395408.330565133,189338023852.63416,Retail,NASDAQ,Global,USDT,2023-08-12 06:00:00
crypto,BTC,BTC Coin,29/04/2023,16361.712273349964,15802.347272013112,16851.086079549415,15157.266149431029,2849601.5003917073,347624624723.70416,Crypto,BINANCE,Global,usd,2023-04-29 06:00:00
stock,AAPL,AAPL Inc,14/06/2024,17688.356778374116,17776.364199921343,18309.335279414503,17305.109744286696,6542028.951607331,1255729231857.0403,TECHNOLOGY,NASDAQ,US,USDT,2024-06-14 00:00:00
crypto,ADA,ADA Coin,15/06/2024,6330.047095479852,6660.231899502858,6943.551631696265,6094.88781839585,4071512.4696240393,126561059060.08899,crypto,N/A,US,USDT,2024-06-15 15:00:00
crypto,ETH,ETH Coin,2023-05-05,26671.00886921929,27521.761622745704,27579.011336302738,26299.584509385197,620648.0987871233,201934840700.60434,blockchain,BINANCE,US,USD,2023-05-05 21:00:00
crypto,BTC,BTC Coin,04-12-2024,41385.28006710402,40981.48648251212,41693.786117499425,40950.81971858295,8892965.335280558,189973984230.7828,crypto,BINANCE,US,$,2024-04-12 12:00:00
stock,AMZN,AMZN Inc,2023-12-24,20581.46502893153,19280.08140577649,21550.24609434203,18829.26598827303,8523702.248414464,2316227763342.792,Technology,NYSE,Global,USD,2023-12-24 19:00:00
stock,TSLA,TSLA Inc,06-07-2023,16771.062970802734,18399.668966054363,18879.746733446977,16050.490412926214,2197527.1052690796,1032864067220.683,Automotive,NASDAQ,Global,USDT,2023-06-07 07:00:00
crypto,ETH,ETH Coin,2023-11-22,2133.1208153156826,2117.136908184389,2177.8033868470325,2093.778141334893,3550064.7029279284,195367990360.1247,blockchain,COINBASE,US,usd,2023-11-22 06:00:00
crypto,ETH,ETH Coin,23/03/2024,9046.688265852148,9211.31390090215,9252.626319973815,8926.305787196034,9947542.126931652,393106760808.1417,Blockchain,BINANCE,US,USD,2024-03-23 07:00:00
stock,AAPL,AAPL Inc,19/11/2023,27789.62000060786,27704.813624690334,28949.878266244265,27616.122322178355,9892076.051455133,2459224526877.3804,Artificial Intelligence,NASDAQ,US,USDT,2023-11-19 02:00:00
stock,TSLA,TSLA Inc,02-21-2023,49545.96456497767,46136.47142147079,50174.08297566669,44034.99234513903,2718113.426328332,1195652290417.8076,tech,NASDAQ,US,USD,2023-02-21 18:00:00
stock,MSFT,MSFT Inc,12-11-2023,42647.69 USD,45026.51400521827,46447.24861016236,41611.2784225975,7087334.187847251,2306133279337.8535,tech,NYSE,US,USD,2023-12-11 19:00:00
crypto,BTC,BTC Coin,2024-03-30,42067.00449147009,43557.77578730318,45077.51681732049,41090.91535840164,8852404.613127515,159379251960.5526,crypto,BINANCE,Global,USD,2024-03-30 16:00:00
stock,AAPL,AAPL Inc,07/02/2023,19063.57 USD,20122.1429700883,20617.90115690169,18957.972364413392,3464646.7983087604,763524053700.367,tech,NASDAQ,Global,$,2023-02-07 16:00:00
stock,MSFT,MSFT Inc,12-23-2023,44437.9021114374,44121.24046663493,45584.67679894222,42649.275838448004,2767422.75184864,1114297204770.7378,Technology,NYSE,US,usd,2023-12-23 17:00:00
stock,AMZN,AMZN Inc,2023-03-06,6000.834670444781,6456.025153397095,6707.552905925168,5758.025376631188,6940505.438299829,1971286645406.7922,TECHNOLOGY,NASDAQ,US,USDT,2023-03-06 02:00:00
crypto,ADA,ADA Coin,03/01/2023,9234.90718632484,8816.018271962843,9423.754806446912,8683.444194887768,6387595.364761243,243040003907.82578,Crypto,BINANCE,US,USD,2023-01-03 01:00:00
stock,TSLA,TSLA Inc,2023-05-09,38422.843050270574,40404.98330739643,41653.212747706806,38013.620720557774,3343299.484417313,1601382194553.327,Finance,NASDAQ,US,USDT,2023-05-09 10:00:00
crypto,ETH,ETH Coin,05-18-2024,30749.355189239017,32731.84922649294,33625.8854911719,29547.729188880614,5424558.876654408,353093563687.4292,Blockchain,COINBASE,US,usd,2024-05-18 15:00:00
crypto,BNB,BNB Coin,2023-09-07,34877.97681149436,34709.12409738034,36336.07296259743,34150.43304137152,6845759.785880208,151589107191.7523,Blockchain,COINBASE,US,USDT,2023-09-07 08:00:00
stock,AAPL,AAPL Inc,2023-07-18,49212.64582689961,52575.59403924153,54649.714064523614,47564.551781677146,5356780.896819472,659294447138.2843,automotive,NYSE,Global,$,2023-07-18 13:00:00
crypto,BNB,BNB Coin,05-15-2024,26928.414073368673,25021.285873662546,27673.035676428426,24581.814360772205,3902569.476531774,59155759289.35981,blockchain,BINANCE,US,$,2024-05-15 23:00:00
crypto,ADA,ADA Coin,01/01/2024,43783.912849852546,40356.18541814204,45517.171049225464,38682.926263284644,368043.1200634793,201925226940.86084,blockchain,BINANCE,Global,usd,2024-01-01 21:00:00
stock,AAPL,AAPL Inc,03-09-2024,38254.50906662478,37528.637969080504,39923.401267750196,36636.78403826026,223481.26891138326,564868062207.6929,Automotive,NASDAQ,US,usd,2024-03-09 06:00:00
stock,GOOGL,GOOGL Inc,2023-07-05,5520.543106974423,5840.049655135826,5889.136017036685,5339.868534825095,7612953.024823978,2152973692709.761,automotive,NASDAQ,Global,usd,2023-07-05 15:00:00
stock,GOOGL,GOOGL Inc,29/08/2023,18577.98319283015,19801.90154374423,19990.804026557253,18398.872643409362,6575283.098503254,2863151758854.5005,Artificial Intelligence,NYSE,Global,USD,2023-08-29 15:00:00
stock,MSFT,MSFT Inc,10-06-2023,15132.172977967066,14017.751656112514,15421.929130781078,13459.598877125432,6440335.538351105,586303086564.9816,ai,NYSE,Global,USD,2023-10-06 21:00:00
stock,AMZN,AMZN Inc,2023-09-15,610.3380625823644,615.3330464949648,632.9828472520765,607.7199805277239,5060547.342334609,2983570261619.4707,ai,NYSE,Global,$,2023-09-15 00:00:00
stock,AAPL,AAPL Inc,07-23-2023,23587.92 USD,22497.710019594433,23654.004083956075,21832.517620196533,526862.1209355446,1635667244738.3032,Retail,NASDAQ,US,USD,2023-07-23 15:00:00
stock,TSLA,TSLA Inc,20/01/2024,15371.609225682234,15474.913822740902,15578.825520274464,15319.829933673464,8945317.9142558,1655972483703.0942,Technology,NYSE,Global,$,2024-01-20 14:00:00
stock,GOOGL,GOOGL Inc,2023-06-20,17178.779721867555,17568.71318740142,17652.767364008807,16624.392860545024,2511871.755903242,578089562514.8307,Retail,NYSE,US,USD,2023-06-20 03:00:00
stock,MSFT,MSFT Inc,2024-03-20,42627.00670809737,43307.612867599055,44434.360753314424,42479.35910706679,9324345.402005175,2747395018862.923,RETAIL,NASDAQ,Global,USD,2024-03-20 06:00:00
stock,AAPL,AAPL Inc,02-06-2023,6277.690416568301,5851.507820898099,6490.107590960441,5717.342833572513,185640.5830274664,2908297074801.465,RETAIL,NASDAQ,US,$,2023-02-06 13:00:00
crypto,BNB,BNB Coin,09/06/2023,44405.13830911767,47681.09004794181,48532.84339810204,44163.24268792303,5937157.06890462,29480139215.86015,Crypto,BINANCE,US,USD,2023-06-09 20:00:00
stock,TSLA,TSLA Inc,07/07/2023,21377.279247299113,19724.380864534953,21840.874474063847,19189.15959055649,5509890.99421219,2419657884586.5166,automotive,NYSE,Global,USDT,2023-07-07 19:00:00
stock,GOOGL,GOOGL Inc,08-16-2024,49570.17913385008,47033.542408578476,50062.29304438958,45920.73565939823,5372544.585769491,325692311584.23975,TECHNOLOGY,NASDAQ,US,USD,2024-08-16 21:00:00
crypto,BTC,BTC Coin,06-24-2023,38596.88839479947,38725.4500040403,39905.986547335684,38063.761898245684,251225.99053710228,178729191444.1315,crypto,BINANCE,Global,USD,2023-06-24 20:00:00
crypto,BNB,BNB Coin,30/09/2023,44210.88 USD,39943.547786023504,45106.554517923796,39796.21091762349,3532190.8684230954,230404452105.2927,blockchain,COINBASE,US,USDT,2023-09-30 03:00:00
stock,AAPL,AAPL Inc,06-15-2024,49077.2542382852,46125.98235475136,49237.381513637956,45801.76880008095,8684784.946782473,1381599184358.7202,Finance,NASDAQ,US,USD,2024-06-15 22:00:00
crypto,ETH,ETH Coin,13/11/2023,25715.21665211954,27442.283361696424,28455.671313034723,24770.37402136875,169916.65736011305,191470744698.6052,crypto,COINBASE,Global,$,2023-11-13 00:00:00
stock,AMZN,AMZN Inc,2023-12-10,42947.027181521116,46347.01170536132,48562.92304280441,42688.4071361262,5800855.509425686,1444303485975.3018,ai,NASDAQ,Global,USD,2023-12-10 13:00:00
stock,MSFT,MSFT Inc,2024-08-18,38744.74382823961,40603.10938583257,41695.624213675794,36976.680470776184,9260887.386522401,1339370741715.9417,RETAIL,NYSE,Global,usd,2024-08-18 03:00:00
crypto,,SOL Coin,05-13-2023,18173.055757994054,18643.982857358085,19272.1340271898,17455.845133280716,8369551.509254752,184963002313.15656,Crypto,BINANCE,US,USD,2023-05-13 09:00:00
stock,TSLA,TSLA Inc,2023-02-06,9342.329456456691,9167.44077409547,9683.58610463068,9151.607768926346,8093003.362449961,876911910050.5098,Artificial Intelligence,NYSE,US,USD,2023-02-06 02:00:00
stock,AMZN,AMZN Inc,04-07-2024,7038.884145785574,6435.196779420878,7235.165106116274,6206.843011847782,8280721.674719759,2821641649233.8735,RETAIL,NYSE,US,usd,2024-04-07 01:00:00
stock,MSFT,MSFT Inc,07-18-2024,48536.70091764986,46156.38689913163,49715.61883110013,45005.34002445255,2392528.7717789044,2019243735492.955,AI,NYSE,Global,USDT,2024-07-18 04:00:00
crypto,ETH,ETH Coin,08-09-2023,22169.866444101182,21933.63124649038,22571.957596097727,20855.515792833037,5221430.273910975,238086892797.76306,blockchain,BINANCE,US,USD,2023-08-09 01:00:00
crypto,ETH,ETH Coin,03-12-2024,75.98025052664046,73.06175348522764,77.03876305423947,70.84596640996843,1319388.044444326,137422895101.6308,crypto,BINANCE,US,USDT,2024-03-12 11:00:00
stock,TSLA,TSLA Inc,15/04/2023,34625.09 USD,35526.630715325984,36954.365975721325,33676.38001670433,5191398.211666943,1527974635658.9023,Retail,NASDAQ,US,USD,2023-04-15 05:00:00
stock,AMZN,AMZN Inc,05-08-2024,21390.781529253734,22253.255059282106,22736.820927304587,20768.02763647398,7602296.039667074,2433101803168.3604,ai,NYSE,US,USD,2024-05-08 17:00:00
crypto,,BNB Coin,2023-03-06,16935.912737359264,16001.633887047474,17240.00547022013,15385.870870909836,5794476.90523546,74060581609.15341,Crypto,COINBASE,US,USD,2023-03-06 06:00:00
crypto,ADA,ADA Coin,02-17-2024,39332.78693028291,38266.87599215067,41277.322048789865,37489.77975912285,3994603.6174811693,320277467034.0489,blockchain,COINBASE,US,usd,2024-02-17 04:00:00
crypto,BTC,BTC Coin,05-23-2024,36496.40189200562,38315.93246690514,38691.69557083043,35526.189404281235,8618419.480115203,335038015300.36304,Crypto,COINBASE,Global,USD,2024-05-23 01:00:00
stock,GOOGL,GOOGL Inc,2024-02-11,34175.802643618306,34776.84382479743,36241.569347359444,32953.26726642713,5755177.303585762,1517073642809.9844,RETAIL,NYSE,Global,USD,2024-02-11 06:00:00
crypto,ETH,ETH Coin,26/09/2023,34513.636727206394,36114.84746826656,36192.20063430105,33954.15508195532,4147486.8515036977,53677693863.872574,blockchain,COINBASE,US,usd,2023-09-26 15:00:00
stock,AAPL,AAPL Inc,2024-01-25,21001.178309446397,19716.884556522375,21437.54030106199,19109.938740937472,7384177.9777236385,381049659567.9502,finance,NASDAQ,Global,USDT,2024-01-25 02:00:00
crypto,SOL,SOL Coin,12/08/2023,30355.362432683487,27457.559652795397,31768.438368388637,27026.79623135471,342920.30376196717,310815145475.71173,Crypto,BINANCE,US,$,2023-08-12 23:00:00
stock,TSLA,TSLA Inc,2023-05-19,10021.305074352627,10180.085016161665,10417.603894039463,9730.606446636244,8897247.48752385,2458310368650.2124,automotive,NYSE,Global,USDT,2023-05-19 05:00:00
stock,AAPL,AAPL Inc,03-13-2023,3776.452437481805,4113.794419494741,4303.1390543558355,3716.866190550848,4679457.388792118,1317710261772.218,RETAIL,NASDAQ,Global,USDT,2023-03-13 15:00:00
stock,GOOGL,GOOGL Inc,09/09/2023,39539.498447688035,36182.420378959956,39675.120874476605,35345.49176461206,1602122.2736062177,287649824101.12854,tech,NASDAQ,US,$,2023-09-09 10:00:00
crypto,SOL,SOL Coin,04-05-2024,21161.440415479356,19626.03922807011,21331.27728529077,18720.209827310384,2051732.4434823757,8053455599.437849,Blockchain,COINBASE,Global,USDT,2024-04-05 02:00:00
stock,GOOGL,GOOGL Inc,07-07-2024,40448.276087817394,40064.2896335803,41472.737517722846,38126.49019010012,694093.2974517973,2149297697525.4243,Retail,NYSE,US,USDT,2024-07-07 04:00:00
stock,GOOGL,GOOGL Inc,2024-02-16,27199.482051450246,28502.615485534592,29364.823966779055,26372.791676557074,1184122.4059583787,780127499692.0555,AI,NASDAQ,US,usd,2024-02-16 07:00:00
crypto,BNB,BNB Coin,08-10-2023,18195.664719436863,19054.69666007805,19543.42947136385,17957.903836844103,9072988.324964266,313405427780.4398,crypto,COINBASE,Global,USD,2023-08-10 22:00:00
crypto,ETH,ETH Coin,2023-12-13,26759.987932230164,26821.580672679804,27177.87649245371,26674.088145553997,4579733.75282901,368806658841.2518,Blockchain,BINANCE,US,USD,2023-12-13 20:00:00
crypto,ADA,ADA Coin,07-26-2023,21640.91868218123,20026.7366253046,22184.681047892576,19587.425639552246,3378219.8591743596,55398539518.51397,blockchain,COINBASE,US,USDT,2023-07-26 16:00:00
stock,MSFT,MSFT Inc,04-06-2024,47175.74174630562,49754.86892375419,51841.78983391167,45682.31909017679,7608549.469164486,224235336552.13916,AI,NYSE,US,usd,2024-04-06 09:00:00
crypto,SOL,SOL Coin,2023-03-30,10062.163585418237,9306.340901334519,10235.761500038701,8905.029198322092,9982691.493064482,196722293591.83173,Blockchain,BINANCE,Global,USDT,2023-03-30 15:00:00
crypto,ADA,ADA Coin,12/04/2023,22062.768532460137,21851.37862711885,22394.407165148365,21383.05066533589,1500620.2644912952,24429651141.648712,crypto,COINBASE,US,$,2023-04-12 16:00:00
crypto,BTC,BTC Coin,20/01/2023,16629.061435199437,16932.849742681807,17538.740325396277,16536.80516311694,8358038.577085549,314645390331.9573,Blockchain,COINBASE,Global,usd,2023-01-20 11:00:00
crypto,SOL,SOL Coin,2023-01-10,19425.775087390506,19438.225727411616,20185.367749322235,19306.836449956103,1038715.499838542,245282066100.90604,crypto,BINANCE,Global,$,2023-01-10 13:00:00
stock,GOOGL,GOOGL Inc,2023-07-15,38808.068754690896,38277.5761353878,39452.72465019598,37150.9191208117,6028844.623116721,1160720224854.23,AI,NASDAQ,Global,USD,2023-07-15 05:00:00
crypto,SOL,SOL Coin,26/10/2023,24654.691530935543,23217.29577102232,24855.43813495431,22105.593313120604,5588613.531948296,399923031932.8516,blockchain,,US,usd,2023-10-26 01:00:00
stock,GOOGL,GOOGL Inc,07/01/2024,10269.643999747655,10670.83669313763,11066.248303805864,9889.204116272662,3441653.5405333354,1638270553551.6143,Automotive,NYSE,US,$,2024-01-07 21:00:00
stock,,GOOGL Inc,10-31-2023,18719.4807478582,19695.895122547718,20141.736748658415,18526.05687204311,7690463.364587696,2971510300318.2974,Automotive,,Global,USDT,2023-10-31 11:00:00
crypto,ADA,ADA Coin,20/12/2023,42740.369531316006,46494.84168652815,47843.15331979048,41110.826497095106,3986890.987479106,268763629953.42157,Crypto,BINANCE,Global,USDT,2023-12-20 08:00:00
stock,TSLA,TSLA Inc,2023-11-28,32547.665421342237,30450.283046426463,32631.051793421087,29967.587585764857,2511539.161269424,2277334083404.7466,Technology,NYSE,Global,USD,2023-11-28 05:00:00
crypto,BNB,BNB Coin,05-26-2023,37339.871157904585,37807.86506102221,37965.33970209848,35819.35470655692,2194062.5121251605,202369746272.9761,Crypto,COINBASE,US,$,2023-05-26 18:00:00
stock,MSFT,MSFT Inc,07-12-2023,28274.51556360571,28296.94166428469,28584.382051989982,26956.29380905966,1715150.612542706,781014118398.0862,finance,NASDAQ,Global,USD,2023-07-12 22:00:00
crypto,BTC,BTC Coin,07-24-2023,23432.6620200757,25154.238631331446,26221.72473560741,22860.342164406222,7067170.396896974,393830618484.3483,blockchain,COINBASE,US,USDT,2023-07-24 18:00:00
stock,,GOOGL Inc,01-18-2023,34422.95127929615,32855.912371608894,35855.05293019201,31350.65839206921,7731613.590179889,586328511134.0098,AI,NYSE,US,$,2023-01-18 02:00:00
crypto,ADA,ADA Coin,28/08/2023,44060.6499523465,42335.274714605584,45502.29980129341,41250.43812334459,3663665.1494781272,44475078094.60471,Crypto,BINANCE,US,usd,2023-08-28 11:00:00
crypto,,ETH Coin,2023-03-30,47376.67379775638,43030.0510897974,49553.28339882191,42188.98927197816,8073335.693389754,259949524107.4811,Blockchain,BINANCE,US,USDT,2023-03-30 20:00:00
stock,TSLA,TSLA Inc,18/11/2023,23597.43031213231,25338.216294373426,25863.791673789572,23048.388389879514,202929.03592024473,1157786110768.49,Finance,NYSE,US,usd,2023-11-18 07:00:00
crypto,BNB,BNB Coin,16/12/2023,32087.90853366024,33480.37552471119,34455.66043194087,30713.439073775593,4454608.88034977,67646212306.0267,Blockchain,COINBASE,Global,USD,2023-12-16 17:00:00
crypto,ADA,ADA Coin,2024-07-01,24788.110588314066,26624.06200083216,27656.891153177297,23652.802111332952,8903201.668547869,145262432713.46,crypto,BINANCE,US,$,2024-07-01 03:00:00
stock,MSFT,MSFT Inc,10-23-2023,37195.66862285106,34517.87232862748,38443.06168370482,33199.85227738492,4384370.590512174,1420583781937.9727,ai,NYSE,Global,usd,2023-10-23 22:00:00
stock,TSLA,TSLA Inc,2023-08-16,7589.015790144496,6969.874274385935,7679.986905845674,6656.236236298325,6919408.356168999,60419981545.49218,Retail,NASDAQ,US,USDT,2023-08-16 09:00:00
stock,TSLA,TSLA Inc,04-04-2024,30890.84762624365,28671.0796959897,32350.689554037694,28575.16643788963,2255805.5221071052,96829307605.56592,TECHNOLOGY,NYSE,Global,$,2024-04-04 13:00:00
crypto,SOL,SOL Coin,10-16-2023,1409.9859204281972,1531.7490736890695,1571.803339932759,1342.5338261535676,3425657.430088366,247696412798.09665,blockchain,BINANCE,Global,USD,2023-10-16 02:00:00
crypto,BNB,BNB Coin,28/06/2023,19653.29252427426,20321.214946289543,20798.651637409657,19047.698105451153,1192451.2983591075,35355537435.187515,Crypto,COINBASE,US,usd,2023-06-28 10:00:00
crypto,SOL,SOL Coin,11-24-2023,5016.162954040173,5324.655703270269,5360.6609793396765,4914.679297593401,3428061.3954748698,101750923048.99425,crypto,COINBASE,US,USDT,2023-11-24 09:00:00
crypto,BTC,BTC Coin,07-01-2024,31977.027290210266,31702.039624916353,32616.80041658088,31056.66853121075,4913185.017271517,94261461938.79749,crypto,COINBASE,Global,USDT,2024-07-01 21:00:00
stock,TSLA,TSLA Inc,12/04/2024,27957.47377538493,28905.224177161155,28943.80276380863,27210.82991879716,577775.1625508541,917417783569.1667,Automotive,NASDAQ,Global,usd,2024-04-12 02:00:00
stock,AMZN,AMZN Inc,21/05/2023,28029.831616557873,30082.67434350672,31410.532131287993,26726.36597706861,4191631.7577807796,567352188063.6521,automotive,NASDAQ,Global,$,2023-05-21 15:00:00
crypto,BNB,BNB Coin,2023-07-30,7362.0245284716675,7752.848226535992,8041.345376711028,7326.444237072278,85851.63482234674,235287560786.79776,blockchain,Unknown,US,$,2023-07-30 20:00:00
stock,AAPL,AAPL Inc,23/08/2023,41361.06 USD,42772.13831971511,44684.886646422194,39411.26121995087,5970042.693198712,657885889527.1179,Automotive,NYSE,Global,USD,2023-08-23 16:00:00
crypto,SOL,SOL Coin,05-03-2024,1793.3640738630131,1798.214075250785,1853.0164753982224,1720.8487854793264,2734022.5016635046,229773397083.00128,Crypto,BINANCE,Global,USD,2024-05-03 15:00:00
stock,AMZN,AMZN Inc,15/05/2023,23420.36437052192,25097.326432496615,25526.96977979998,22561.609470114352,9848674.537508084,1924638565430.2336,Automotive,NASDAQ,US,USD,2023-05-15 11:00:00
stock,AAPL,AAPL Inc,11/02/2024,1459.3473224990032,1538.364738473303,1546.8514947473093,1388.3854786481834,2737681.4641475226,2734295952688.949,automotive,N/A,US,USDT,2024-02-11 22:00:00
crypto,ADA,ADA Coin,2023-06-06,40967.744929724766,42693.857329091494,44789.2919712617,40376.81163394769,4183137.277007223,111391622229.1362,Blockchain,BINANCE,US,USDT,2023-06-06 20:00:00
stock,TSLA,TSLA Inc,2024-04-26,49972.95876864824,52073.24109522092,54056.401939605814,49818.95464091807,1137398.961855522,2099793706226.1985,AI,NYSE,US,USDT,2024-04-26 02:00:00
crypto,BNB,BNB Coin,01/09/2023,42541.78983879277,46407.80562236119,46897.336711822594,41486.60244386694,6805867.921597173,283389795911.8521,blockchain,,US,USD,2023-09-01 04:00:00
crypto,ETH,ETH Coin,14/06/2023,30027.6384338812,28571.771100310933,30528.284776169377,27773.93110195619,5292371.797366923,102749753153.02829,Crypto,COINBASE,Global,USD,2023-06-14 14:00:00
stock,AMZN,AMZN Inc,18/04/2023,24664.84403419858,23671.288651621937,24860.886496746076,22543.76596808841,1960591.2461941852,1353603956159.2004,automotive,NYSE,US,usd,2023-04-18 01:00:00
stock,AMZN,AMZN Inc,06-09-2023,39307.911235678584,36707.67401953816,39521.26545405282,36247.52563361245,3052278.1470423597,1750011488102.2913,finance,NYSE,Global,usd,2023-06-09 19:00:00
crypto,SOL,SOL Coin,2024-02-04,35718.75535081255,34481.14367790577,36235.860679414815,33659.9724590559,792367.5381138161,380842278494.8042,Crypto,BINANCE,US,USD,2024-02-04 12:00:00
crypto,SOL,SOL Coin,2023-04-24,8801.135486996463,9284.711400226053,9523.262264310857,8365.72884660892,6735491.758193618,51482222494.893105,Blockchain,COINBASE,US,USD,2023-04-24 11:00:00
crypto,SOL,SOL Coin,2023-12-07,25547.509724540258,24086.786114241033,26252.3428168266,24061.679541476995,735373.4653666088,172357620570.89633,Blockchain,BINANCE,US,$,2023-12-07 03:00:00
crypto,SOL,SOL Coin,08-13-2023,12157.44966711288,11546.049847452206,12387.654841148718,11441.044172846823,9128674.04095391,117147372867.4501,Crypto,COINBASE,Global,USDT,2023-08-13 13:00:00
stock,TSLA,TSLA Inc,08-03-2024,27152.067398026156,27895.48542181768,28623.31695700871,26383.767603681194,1920563.083086519,614623111502.3302,Retail,NYSE,US,$,2024-08-03 23:00:00
crypto,SOL,SOL Coin,30/11/2023,20066.72923728933,21252.9272308485,22064.368624770996,19197.838538120268,886102.0065781127,197846646883.69922,crypto,COINBASE,Global,USD,2023-11-30 22:00:00
stock,GOOGL,GOOGL Inc,2023-04-07,26780.06436433524,28696.450790344694,28779.88732883155,26146.067251082324,5394725.719247787,2725380290250.234,Automotive,NYSE,US,USDT,2023-04-07 05:00:00
crypto,ADA,ADA Coin,12-16-2023,4889.523811503078,4635.704292145498,4988.912749805021,4604.608329734314,9388894.2673906,344977302854.14923,crypto,COINBASE,US,$,2023-12-16 06:00:00
crypto,ETH,ETH Coin,06-18-2024,47960.08238806149,43221.06756922034,48074.48718739776,41379.00040598371,3489272.1056059613,397126224739.48303,crypto,COINBASE,US,USD,2024-06-18 20:00:00
crypto,BTC,BTC Coin,2024-03-23,44633.88320482067,41838.32389817749,46016.78407330109,41665.45209642042,4637853.627577277,332817622239.8487,Crypto,COINBASE,US,USDT,2024-03-23 05:00:00
crypto,SOL,SOL Coin,18/03/2023,22896.1043677304,22327.341791687042,23557.410256069466,21700.67882093515,174441.92261032568,45899710921.34966,Blockchain,COINBASE,Global,usd,2023-03-18 07:00:00
crypto,BTC,BTC Coin,06/07/2024,27181.57648415124,27038.224956826365,28478.97673898308,25897.0230930187,1893186.787849937,397629104698.4001,Blockchain,BINANCE,Global,USDT,2024-07-06 00:00:00
stock,AMZN,AMZN Inc,01-29-2024,13048.945690450188,13829.865342271929,14017.628917499063,12418.151585147718,5170630.224143273,2425964099697.7227,RETAIL,NYSE,Global,USD,2024-01-29 21:00:00
crypto,,ETH Coin,07-18-2023,37894.73618369423,38964.88075380756,40764.28414489047,37483.55623618398,1808578.7724524275,82691141480.11024,crypto,BINANCE,US,usd,2023-07-18 05:00:00
stock,TSLA,TSLA Inc,21/06/2024,32090.434870253022,33174.78120148135,34555.28815869001,31406.626322704935,4660569.140015776,2402473127627.741,AI,NASDAQ,Global,usd,2024-06-21 20:00:00
stock,,GOOGL Inc,09/11/2023,14904.89187362837,13958.720785323127,15364.40062648068,13423.995950565339,800071.1783567207,1913556695722.5967,Finance,NYSE,US,usd,2023-11-09 10:00:00
crypto,BTC,BTC Coin,2023-07-04,30419.886875989356,29581.203193539615,31564.147607161973,28657.051497458644,4860548.478934029,5218902911.175296,blockchain,BINANCE,Global,usd,2023-07-04 05:00:00
stock,GOOGL,GOOGL Inc,04-03-2023,32532.233807556215,31596.210924140214,34099.90953376032,31495.335260161475,8480430.998670157,1227184068718.001,RETAIL,NASDAQ,US,USD,2023-04-03 19:00:00
stock,MSFT,MSFT Inc,29/06/2023,22462.493026084958,22626.15653284925,23465.69169090379,22121.227023984182,8906895.277459102,2761697809012.5166,automotive,NASDAQ,Global,$,2023-06-29 03:00:00
crypto,ADA,ADA Coin,16/07/2023,49894.25656434074,48382.51846609831,51972.346717781256,47651.05902770812,6914173.065704971,287950755766.39465,Blockchain,BINANCE,Global,USD,2023-07-16 14:00:00
crypto,ETH,ETH Coin,2024-01-29,39282.233603226894,42427.76649102473,42891.39264564309,38546.667566750446,3921956.156198649,133705059963.77457,crypto,BINANCE,Global,USDT,2024-01-29 07:00:00
crypto,ETH,ETH Coin,2023-06-21,23946.852463425763,22645.67712035101,24404.066874086828,22253.72391756734,761817.6241244131,395871507121.47644,Blockchain,COINBASE,US,$,2023-06-21 07:00:00
stock,GOOGL,GOOGL Inc,12-12-2023,46561.92571135311,49824.6389295426,49993.229405996055,46546.53671259838,6987570.510115087,1814769741461.5005,RETAIL,NASDAQ,Global,$,2023-12-12 13:00:00
stock,MSFT,MSFT Inc,2024-06-08,630.6802975794805,589.2171846269189,657.1113495335824,560.3938385016437,2332239.8888772475,495219664698.93085,TECHNOLOGY,NASDAQ,US,$,2024-06-08 12:00:00
crypto,ADA,ADA Coin,14/02/2023,29309.665689547775,30967.043519378585,32122.347275579108,27918.33789206876,8925221.679522421,304135710157.27576,crypto,BINANCE,Global,USDT,2023-02-14 01:00:00
crypto,BNB,BNB Coin,2023-12-24,27674.08808708589,28472.696717820487,28712.761713150485,27641.19917229706,4882071.404917003,94677574541.49614,blockchain,N/A,Global,USD,2023-12-24 21:00:00
crypto,BNB,BNB Coin,08-19-2024,46863.72961844424,47672.296194079376,49338.90345563207,45751.12794860354,8347544.809814898,27768864760.970406,crypto,COINBASE,Global,usd,2024-08-19 09:00:00
stock,AAPL,AAPL Inc,2023-03-03,13426.234480204615,13344.732823445205,13477.659385937592,13148.502977295562,3937240.477142352,109069051957.70058,Artificial Intelligence,NASDAQ,Global,USD,2023-03-03 17:00:00
crypto,ADA,ADA Coin,2023-11-21,178.9085519525295,186.774456502621,194.56117052719875,173.49693086496944,5642615.552356622,112703856155.9169,blockchain,BINANCE,Global,usd,2023-11-21 07:00:00
stock,TSLA,TSLA Inc,04-06-2024,31113.660337543854,28077.82245486552,31873.83534956108,27578.325689300946,9181999.54052411,690783011529.4993,Retail,NYSE,US,usd,2024-04-06 23:00:00
crypto,ETH,ETH Coin,01-10-2024,38261.85824702168,39009.395705475836,40817.504822319024,37110.89884241355,3191634.303390007,155627647763.30228,crypto,COINBASE,Global,$,2024-01-10 17:00:00
stock,MSFT,MSFT Inc,2023-05-19,2471.727626400373,2291.9763724706636,2481.9116922753374,2273.9969588405247,107063.62627982358,2662554576095.4897,Technology,NASDAQ,US,USDT,2023-05-19 04:00:00
stock,MSFT,MSFT Inc,01/01/2024,22568.88 USD,20330.158586290807,23022.111122536367,19503.53519310117,6244380.474234158,2586354894936.174,Finance,NASDAQ,US,USDT,2024-01-01 05:00:00
stock,AMZN,AMZN Inc,12-15-2023,24381.50324454594,22140.938308286302,25181.373573171888,21966.0678309217,7203522.448986689,2041282781865.7231,Artificial Intelligence,NYSE,Global,usd,2023-12-15 16:00:00
crypto,ETH,ETH Coin,08-19-2023,10033.471082308864,10813.850261669262,10988.057848199142,9538.522369001475,8434073.071644379,332833377987.3508,blockchain,COINBASE,Global,USDT,2023-08-19 02:00:00
stock,GOOGL,GOOGL Inc,2023-07-21,32781.354288893264,31020.580095733778,33193.98051258893,30193.2501710725,8978412.964934593,2826045594204.5327,AI,NYSE,Global,USDT,2023-07-21 00:00:00
stock,GOOGL,GOOGL Inc,04-09-2024,41300.42374247851,39576.56725561003,42970.17131396497,39418.797640093435,4275511.226071208,457296991881.1995,tech,NYSE,Global,usd,2024-04-09 12:00:00
crypto,ADA,ADA Coin,2023-02-03,40113.04373537537,40349.57336544129,41730.4347202349,39356.570369701316,1529735.5676023185,149195008371.6847,blockchain,COINBASE,US,$,2023-02-03 09:00:00
stock,AAPL,AAPL Inc,2023-08-11,9796.797819542679,10643.793972834652,10777.145432904874,9666.442104504147,2847269.2795424266,2535923177265.7896,Artificial Intelligence,NYSE,US,$,2023-08-11 12:00:00
stock,GOOGL,GOOGL Inc,2023-07-21,15506.992620587442,16275.805291364093,16728.93601353198,15416.239850415905,3074419.8193212445,960178371674.723,Finance,NYSE,US,$,2023-07-21 22:00:00
stock,AAPL,AAPL Inc,06-19-2024,37649.9004971589,35025.56774397847,38404.007969324484,34119.83719959696,3557518.211553849,2079057640949.6655,tech,,US,USD,2024-06-19 06:00:00
crypto,SOL,SOL Coin,08-07-2024,34324.13050094212,32373.60273165442,35541.59152675013,32268.46006259633,5652410.014256334,132234475407.80956,Blockchain,COINBASE,US,usd,2024-08-07 21:00:00
crypto,BNB,BNB Coin,01-20-2024,3455.9457791832133,3707.8682625167735,3760.7884020549745,3389.4276641985607,9791142.585278278,246516523512.09225,Crypto,BINANCE,Global,USD,2024-01-20 22:00:00
stock,AAPL,AAPL Inc,01/05/2023,36238.22727834424,35841.92325784938,36347.60483620162,35479.20182870309,350953.4137985927,1790552775712.6953,finance,NASDAQ,US,usd,2023-05-01 16:00:00
stock,TSLA,TSLA Inc,07-28-2024,1155.8494417503507,1239.6035028384256,1249.373811948032,1127.7779907086026,5971909.89412699,2104966908374.6838,tech,NASDAQ,US,USD,2024-07-28 02:00:00
crypto,SOL,SOL Coin,04/05/2024,17044.76683255087,16935.047269163497,17310.16727819524,16459.276038579883,3589770.9969893084,185730435912.49777,Blockchain,COINBASE,US,$,2024-05-04 06:00:00
crypto,ADA,ADA Coin,2024-02-11,11903.828870626723,13067.205671868007,13394.454206653192,11424.201034230771,4771190.428923157,228650905285.3224,blockchain,BINANCE,US,USD,2024-02-11 05:00:00
stock,GOOGL,GOOGL Inc,19/01/2023,1100.1215882885358,1139.6278608277478,1170.8518292308856,1054.4422293777836,8174946.916609902,2600581237279.2246,RETAIL,NASDAQ,Global,$,2023-01-19 04:00:00
crypto,BTC,BTC Coin,2023-04-20,14697.163420487217,15661.665333907138,16161.683612945712,14622.398276798156,6299207.153008323,150709425837.73224,Blockchain,BINANCE,Global,$,2023-04-20 16:00:00
stock,,AAPL Inc,03-30-2023,41823.93035401805,38099.422662596546,43446.80123437111,37363.54466160482,696008.4573554171,2225044797217.025,Finance,NYSE,Global,USD,2023-03-30 16:00:00
crypto,ADA,ADA Coin,2024-01-24,4132.079318417855,4327.0698289136735,4445.307382796531,4122.487427123558,1832170.5803461266,205888279138.14246,Crypto,COINBASE,Global,USD,2024-01-24 13:00:00
stock,AAPL,AAPL Inc,2023-02-09,10586.990907178862,10828.511898406156,11219.772943425867,10439.992830161307,8150924.832835416,1822040023035.9316,Automotive,NYSE,Global,$,2023-02-09 09:00:00
stock,AAPL,AAPL Inc,2024-08-19,3872.8135960961804,3751.4141790872204,4005.868468047847,3657.3636535337514,1907568.79160116,2562115181595.3667,Finance,NYSE,US,USD,2024-08-19 12:00:00
stock,,GOOGL Inc,2023-03-23,20377.708281779527,19929.55470175501,21202.754533479052,19339.239631189892,265518.6002987612,1662601614798.427,RETAIL,NYSE,US,USD,2023-03-23 18:00:00
crypto,SOL,SOL Coin,2024-06-22,42813.6396441641,46757.639064101335,48367.058828219015,41452.95430402387,9386064.55763148,27935018861.981052,crypto,COINBASE,US,USD,2024-06-22 13:00:00
stock,TSLA,TSLA Inc,22/01/2024,42218.23412447489,44462.997087348,45305.880601992794,41117.82049782214,1862135.411526627,1991781228263.4502,AI,NASDAQ,US,USD,2024-01-22 13:00:00
stock,GOOGL,GOOGL Inc,07-11-2023,38908.5 USD,41974.32360226999,43494.76041439961,37868.03729819083,866006.1801285356,883122160317.7948,Technology,NASDAQ,Global,USDT,2023-07-11 10:00:00
crypto,SOL,SOL Coin,20/02/2023,18722.534974996564,18587.065147855028,19292.749082665574,17663.742948302202,9897239.181772597,27494439735.887043,Blockchain,COINBASE,Global,$,2023-02-20 21:00:00
stock,AAPL,AAPL Inc,11-28-2023,42406.25224341806,42702.81363153176,42981.32021738857,41977.02793131916,7098560.922123841,1098177261378.0883,finance,NASDAQ,Global,usd,2023-11-28 19:00:00
crypto,ETH,ETH Coin,02-13-2024,25732.509035775664,23609.472081284468,26576.340985539726,23504.69933041959,933355.9472943622,213337253547.04507,blockchain,COINBASE,Global,USDT,2024-02-13 18:00:00
stock,AAPL,AAPL Inc,02/03/2023,45116.37559237052,43170.451359700055,46591.5540088867,42166.345870513156,5963679.722433616,797899237440.2257,Finance,NYSE,US,USDT,2023-03-02 01:00:00
stock,AMZN,AMZN Inc,2024-02-05,15006.573612980019,13651.580411895362,15565.028948192808,13478.269135997289,6707586.675047154,1253208815715.9868,Technology,NASDAQ,Global,$,2024-02-05 17:00:00
stock,TSLA,TSLA Inc,20/03/2023,12193.419437054636,11028.569723290291,12686.469739026052,10747.969016361583,3069074.468895481,1934465026477.6655,ai,NYSE,Global,usd,2023-03-20 21:00:00
stock,AMZN,AMZN Inc,05-23-2024,3145.4523291604064,3050.375824771805,3272.0154328970507,3037.9796692637965,8967616.894766035,314776401273.9045,automotive,NASDAQ,US,$,2024-05-23 18:00:00
crypto,ETH,ETH Coin,2023-08-16,45387.18990303584,45634.32089722587,46134.96508021465,44928.88499821822,2137916.0355509375,368400329726.1137,Blockchain,COINBASE,Global,$,2023-08-16 01:00:00
crypto,SOL,SOL Coin,02/10/2023,11670.383547909198,11705.353627429131,11893.708866936802,11176.817381781651,4532280.94552693,110546874318.84479,Crypto,COINBASE,Global,usd,2023-10-02 21:00:00
crypto,ADA,ADA Coin,25/11/2023,28531.93721894911,30690.866769924654,30991.441126734542,27343.544762043155,5756195.679858504,350193359320.1409,Blockchain,BINANCE,US,USDT,2023-11-25 15:00:00
stock,GOOGL,GOOGL Inc,19/02/2024,33012.030355931376,34957.27606974073,36270.4588971069,32916.72656153641,3983165.8351609586,1395353415623.3564,Artificial Intelligence,NYSE,Global,USD,2024-02-19 14:00:00
crypto,ADA,ADA Coin,08/02/2024,27550.12287099481,25405.30789757223,27948.017067955374,24399.115505303005,3966240.604254012,86522763188.0314,blockchain,COINBASE,US,usd,2024-02-08 18:00:00
stock,TSLA,TSLA Inc,2024-07-07,1601.7688099594116,1651.9983592004148,1702.4048747423394,1578.411731961579,6604204.016273168,342537559256.62396,TECHNOLOGY,NYSE,US,USD,2024-07-07 23:00:00
crypto,BTC,BTC Coin,2023-05-27,14561.033279968558,13482.13820745181,15174.760739984766,13311.524212536926,2016068.5021795062,50146399051.241486,blockchain,BINANCE,Global,$,2023-05-27 17:00:00
crypto,BNB,BNB Coin,24/01/2023,48331.083463288065,49241.24822019428,51213.74330167949,46553.927859375915,2101319.148872873,139817149993.5079,crypto,BINANCE,US,USD,2023-01-24 20:00:00
stock,GOOGL,GOOGL Inc,15/09/2023,34296.76403701969,35538.155503836555,36520.13618912873,33548.3715070978,7357239.355557231,2353911617251.1797,automotive,NYSE,US,usd,2023-09-15 01:00:00
stock,AMZN,AMZN Inc,08-12-2023,17644.895608189217,18956.394012187407,19249.142534539402,17244.629595616872,7026692.000602834,817307418552.3739,RETAIL,NYSE,US,USDT,2023-08-12 13:00:00
crypto,ETH,ETH Coin,12-21-2023,21770.213661451646,21457.12697352058,22687.38011389801,21248.459751637987,7311027.741463751,399970306599.10474,crypto,COINBASE,US,USD,2023-12-21 16:00:00
crypto,ETH,ETH Coin,25/12/2023,16203.716616834183,16556.084202317485,17281.425533373455,16109.554760250372,1085874.9523593138,187975706776.5664,Blockchain,COINBASE,Global,$,2023-12-25 08:00:00
stock,AMZN,AMZN Inc,19/04/2023,23241.450590375483,25461.545383476954,26324.689245227273,22552.6279351019,261552.80196994438,1290767348601.3206,Artificial Intelligence,NASDAQ,Global,usd,2023-04-19 00:00:00
crypto,ETH,ETH Coin,14/03/2024,4812.8380221614225,5134.768716408139,5327.969180248642,4683.013920771336,4292678.584637456,228327138239.1824,Blockchain,BINANCE,US,USDT,2024-03-14 18:00:00
crypto,SOL,SOL Coin,28/06/2024,14430.032937402239,13705.702894716287,15107.665431922209,13574.981900346938,8206435.305078879,359448891399.66364,Crypto,BINANCE,Global,$,2024-06-28 02:00:00
stock,TSLA,TSLA Inc,2024-04-24,7173.366611632411,6493.373851183982,7258.385893914822,6420.060573361437,2401144.1492227335,593629504685.0173,ai,NYSE,US,$,2024-04-24 16:00:00
crypto,SOL,SOL Coin,01-10-2024,12602.894185717401,12338.970671961708,13222.428701074456,11873.058376986977,3764329.902355378,292995797019.9761,blockchain,COINBASE,Global,usd,2024-01-10 12:00:00
crypto,BTC,BTC Coin,2023-07-25,5490.153066636814,5479.056525322525,5594.106551967036,5395.469980149135,8176127.87496851,123929436283.7594,crypto,COINBASE,US,$,2023-07-25 18:00:00
crypto,ADA,ADA Coin,2024-07-24,1619.4991401459697,1658.0180708792227,1662.610012445918,1588.4336099432787,6850614.4627426155,219978637225.77722,blockchain,COINBASE,US,USDT,2024-07-24 23:00:00
crypto,BTC,BTC Coin,03/09/2023,40969.113974601336,44337.472696345576,46139.98374990312,39545.660935296124,5866843.481443899,83118212908.91978,Crypto,Unknown,Global,USD,2023-09-03 01:00:00
crypto,BNB,BNB Coin,02/02/2023,16040.029663880267,17066.68081636115,17074.766268407973,15240.95284172833,7597356.891729335,366351983930.535,crypto,BINANCE,Global,$,2023-02-02 03:00:00
stock,AAPL,AAPL Inc,07-01-2023,39450.96962073616,42843.96476426159,43096.543457717205,37936.02276945228,9037345.478817701,2286728270560.0923,Artificial Intelligence,NYSE,US,$,2023-07-01 21:00:00
stock,MSFT,MSFT Inc,02-03-2024,34114.64108615343,34322.48794871341,34465.25864727065,32895.49240394862,5204201.792193238,539936231339.3368,Retail,NYSE,US,$,2024-02-03 10:00:00
stock,AAPL,AAPL Inc,09/06/2023,35379.84909583754,36242.29066775737,37141.159076658594,34139.22635478005,1193329.8682812925,2558526848884.664,TECHNOLOGY,NASDAQ,US,USDT,2023-06-09 00:00:00
stock,AAPL,AAPL Inc,2023-11-10,1435.6395106255159,1352.6755942793031,1466.6840217300905,1313.3536654801958,443910.014538927,1233137343352.6257,Technology,NYSE,Global,usd,2023-11-10 01:00:00
crypto,ETH,ETH Coin,03-11-2023,27488.715950103277,25169.241760635225,28785.033012289146,24035.84913211636,8548486.678222124,237678760642.49005,Crypto,COINBASE,US,USDT,2023-03-11 04:00:00
stock,AMZN,AMZN Inc,20/02/2023,44115.2319413187,39877.696859189615,45786.78461906084,38604.981842719426,7382429.784563062,10926098425.86776,TECHNOLOGY,NASDAQ,Global,USDT,2023-02-20 11:00:00
crypto,SOL,SOL Coin,2023-05-23,3554.6870373687684,3744.86755387502,3758.209147344342,3540.8451635305387,510689.3838808221,163689356142.86652,crypto,COINBASE,Global,$,2023-05-23 01:00:00
crypto,SOL,SOL Coin,2024-01-01,36154.49119823128,35382.56724842001,36547.189485486946,34956.36823546215,7843162.753182475,194333484719.7486,Blockchain,BINANCE,US,USD,2024-01-01 23:00:00
crypto,ADA,ADA Coin,2024-05-28,18814.493870449573,18838.018514525498,19180.049530999753,18115.61239499842,7510578.582414548,369464518661.97504,Blockchain,COINBASE,US,USD,2024-05-28 19:00:00
crypto,ETH,ETH Coin,05-10-2024,21413.19060519768,21000.65973927804,22176.20813828306,20914.34243502154,6667893.857012466,139162478781.6974,crypto,COINBASE,US,USDT,2024-05-10 22:00:00
stock,GOOGL,GOOGL Inc,05-23-2023,38962.463685796785,40060.98170516628,40182.3872255483,37200.704952101805,380131.5237922597,1420031962321.7554,RETAIL,NASDAQ,Global,USD,2023-05-23 21:00:00
stock,AAPL,AAPL Inc,29/05/2023,41294.413182604854,39750.6890154872,42087.59664905116,39570.77164978467,8369197.549721232,1375880815356.8962,AI,NASDAQ,US,USDT,2023-05-29 04:00:00
stock,AAPL,AAPL Inc,2024-03-22,13347.521066791644,12325.211691286986,13358.238340493177,11774.897566376461,2926671.8397958037,1998493856023.8545,Artificial Intelligence,NYSE,US,USD,2024-03-22 11:00:00
crypto,SOL,SOL Coin,2024-04-11,3209.364136791821,2975.86863234665,3238.42183238443,2921.109985065008,6158282.200002264,222957075113.9008,Blockchain,COINBASE,US,USDT,2024-04-11 00:00:00
stock,GOOGL,GOOGL Inc,2024-03-24,12532.566220550021,12209.526019684787,12593.154734192469,11737.298550401421,8977154.559499333,1656789521852.7373,AI,,US,$,2024-03-24 22:00:00
stock,AAPL,AAPL Inc,01-07-2023,32386.502686158332,35086.3924195123,36213.96714660968,30820.933456171704,9967629.087279104,2939278321843.127,Retail,NYSE,Global,USD,2023-01-07 16:00:00
stock,GOOGL,GOOGL Inc,2023-06-03,34135.26365423859,32447.86337947364,34804.282586066634,31873.429419527583,4365437.005727762,305867382042.7394,Artificial Intelligence,NASDAQ,US,$,2023-06-03 07:00:00
stock,MSFT,MSFT Inc,04/07/2024,16728.964882047454,16198.81768455016,17531.38967749878,16035.706132595287,4586029.166022521,759132716204.0735,Artificial Intelligence,N/A,US,usd,2024-07-04 00:00:00
crypto,BTC,BTC Coin,08-11-2023,40552.69535203017,37772.260393989854,40979.435860773796,36574.905031504044,8803601.61032405,83929263534.83882,crypto,COINBASE,Global,usd,2023-08-11 01:00:00
crypto,ADA,ADA Coin,09-05-2023,6120.4873007977585,6113.112099284804,6205.075661126283,5981.291377385099,4516915.210147551,57055734110.47355,blockchain,BINANCE,US,usd,2023-09-05 23:00:00
stock,TSLA,TSLA Inc,02-13-2023,5607.528794644794,5204.963955090657,5837.7398829297545,5175.265143211022,2347600.645319617,1310527727990.1382,Finance,NASDAQ,Global,$,2023-02-13 04:00:00
stock,TSLA,TSLA Inc,21/05/2024,2680.299430006185,2738.353436482872,2836.2979328703223,2596.246578583974,6797078.999038905,349246899559.05945,AI,NASDAQ,US,usd,2024-05-21 17:00:00
stock,AAPL,AAPL Inc,03-31-2023,46767.7606470313,42697.783535643066,47217.413311355114,40709.18974811003,8680071.33942777,2141746858522.9832,TECHNOLOGY,NASDAQ,US,usd,2023-03-31 04:00:00
stock,GOOGL,GOOGL Inc,2024-03-08,28736.357110385732,26343.557725007846,29129.057187433486,25418.52983891796,5607871.216958156,2379835608500.37,Retail,NASDAQ,US,USDT,2024-03-08 11:00:00
crypto,SOL,SOL Coin,2023-10-09,3657.263597008612,3826.0553102346094,3883.2701818341234,3557.1229976508835,1277538.6831880712,106927338144.50261,Crypto,BINANCE,Global,usd,2023-10-09 21:00:00
stock,AAPL,AAPL Inc,01-01-2023,28280.93852743364,30552.38220910206,31309.274037527724,28198.111678703426,8918790.175608879,2409619427149.793,tech,NASDAQ,US,USDT,2023-01-01 15:00:00
stock,AAPL,AAPL Inc,16/04/2024,46695.33297311167,45043.14700275743,47549.02209993576,42893.41315492266,5892419.866731767,1733614970813.1094,finance,NYSE,Global,USD,2024-04-16 21:00:00
crypto,BTC,BTC Coin,2023-09-20,38678.22432020274,35969.32747188464,39537.18853184054,34488.943637967175,6621611.361193635,290159968121.9287,crypto,BINANCE,US,USD,2023-09-20 12:00:00
stock,AAPL,AAPL Inc,2024-06-30,45209.14256096419,42773.58721990863,45867.844890924855,42454.72364823807,4585217.633847092,482259653541.0867,AI,NASDAQ,Global,usd,2024-06-30 10:00:00
crypto,BNB,BNB Coin,14/03/2024,24734.366697620262,22679.155199684606,25952.960577399033,22212.09111875502,2566069.6434921734,14478398591.028845,blockchain,BINANCE,Global,$,2024-03-14 11:00:00
stock,AAPL,AAPL Inc,2024-07-25,3852.5864980539245,4083.65793599589,4272.594098523991,3828.4008053163316,3418234.2653833292,1695515861847.3772,finance,NYSE,US,USDT,2024-07-25 23:00:00
crypto,BTC,BTC Coin,14/02/2023,1764.029684702837,1817.444630107452,1866.0526214896786,1716.3432321967932,9076401.902393736,133678407259.13055,crypto,COINBASE,US,USDT,2023-02-14 05:00:00
stock,TSLA,TSLA Inc,2024-01-04,493.2166718422149,451.12718395925003,498.7251976997062,429.32162556657556,5028934.2627207115,511957914237.71045,ai,NYSE,Global,USDT,2024-01-04 18:00:00
stock,AAPL,AAPL Inc,2023-12-17,9032.345573325953,9484.114730790325,9581.066722532902,8891.262639167537,3493299.7935705413,949130461148.3983,tech,NYSE,US,USDT,2023-12-17 03:00:00
crypto,SOL,SOL Coin,04-05-2024,46694.01332216748,42373.43153668959,47861.98120100548,42065.001600496005,5880154.509455115,207171965461.70905,crypto,COINBASE,US,USDT,2024-04-05 19:00:00
crypto,SOL,SOL Coin,11-18-2023,19890.079945900266,20607.179499282134,21525.03552959314,18936.41662145067,716316.6800818738,114363854201.23686,Blockchain,COINBASE,Global,$,2023-11-18 11:00:00
stock,AAPL,AAPL Inc,07/11/2023,11646.656425029574,11099.10258416881,11775.509207587693,10652.821570250033,1307109.0447260486,981904055592.6667,Automotive,NASDAQ,Global,USDT,2023-11-07 07:00:00
stock,MSFT,MSFT Inc,2024-03-04,7218.031300668591,6791.306739448223,7306.908985867348,6768.560912270615,7557385.621877247,2802522854067.7617,automotive,NYSE,Global,USDT,2024-03-04 04:00:00
crypto,ETH,ETH Coin,2023-04-12,5246.865394329518,5599.779923327721,5714.0694945478435,5053.471976666378,5757925.0851195855,316931274974.6283,crypto,N/A,US,USD,2023-04-12 11:00:00
crypto,ADA,ADA Coin,2023-08-11,38934.82103223472,41971.717469698415,43919.4825639971,37451.6419923662,4239155.083798547,329762247797.6099,blockchain,COINBASE,US,$,2023-08-11 18:00:00
crypto,ADA,ADA Coin,06/10/2023,43967.289746660346,40929.78448612547,45861.125380846395,39557.38286688786,3681967.766221401,10778272986.002655,crypto,BINANCE,Global,USD,2023-10-06 08:00:00
crypto,ETH,ETH Coin,18/07/2024,16350.670700368326,17620.67203826148,17643.180157091167,15865.323500764898,314964.89849759865,20457240521.12445,Blockchain,COINBASE,Global,usd,2024-07-18 11:00:00
crypto,BTC,BTC Coin,01-05-2023,8640.305632606756,8212.123870146828,9019.441540946413,7980.562187300885,2738706.11602772,151514752918.08066,crypto,BINANCE,Global,usd,2023-01-05 07:00:00
stock,GOOGL,GOOGL Inc,2023-11-01,7113.926922030792,6771.592817703727,7308.2253281725325,6513.433643029416,6791598.246271332,1772121750072.138,RETAIL,NASDAQ,US,usd,2023-11-01 17:00:00
stock,AAPL,AAPL Inc,2023-05-11,38601.733622032,42062.33685513003,42305.888068390115,37317.5794193323,3196171.0797211872,1479558993755.9724,AI,NASDAQ,Global,USDT,2023-05-11 12:00:00
stock,GOOGL,GOOGL Inc,04-07-2023,40517.053835300205,42622.95772373775,43655.34004192157,39580.64552128297,596381.83588696,462036928818.3902,ai,NASDAQ,Global,usd,2023-04-07 03:00:00
crypto,BNB,BNB Coin,01/11/2023,39569.162785741624,40153.42184118482,40686.06977101476,38911.42095922144,3615522.8112225113,224425404169.183,blockchain,COINBASE,US,$,2023-11-01 04:00:00
crypto,ADA,ADA Coin,02-01-2023,24383.39251031345,23803.921192012727,25259.82670846203,23665.710998072816,53119.97225077251,220224947292.86542,Crypto,BINANCE,Global,$,2023-02-01 19:00:00
crypto,ADA,ADA Coin,06-28-2024,25580.641652800416,26607.611712773512,27745.91802420941,24899.05017854996,8349905.759575537,373778525095.99506,Crypto,COINBASE,US,USD,2024-06-28 10:00:00
crypto,BTC,BTC Coin,01-27-2023,7966.785048645925,8217.693158044527,8575.22156920667,7923.9341726243465,6437760.843314089,75159828684.80487,Blockchain,COINBASE,US,USDT,2023-01-27 09:00:00
crypto,ETH,ETH Coin,2023-04-10,16576.340453948844,18167.670515351136,18458.076810377705,16364.317544979891,5320286.017250102,212568245932.68042,crypto,COINBASE,US,USDT,2023-04-10 15:00:00
stock,GOOGL,GOOGL Inc,19/03/2024,19680.092723925423,21509.645165829155,22124.479364927713,19618.875463868117,76906.57032296731,1829451904150.7866,TECHNOLOGY,NYSE,US,USD,2024-03-19 02:00:00
stock,AAPL,AAPL Inc,03/01/2023,35862.17261736632,37619.994098028954,39322.255345602935,34076.956549592396,4301.262435504892,1722285043741.4517,RETAIL,NASDAQ,US,usd,2023-01-03 12:00:00
crypto,SOL,SOL Coin,04/06/2024,1474.3923132184789,1614.321743116827,1632.2459750993871,1435.5173597428059,612315.1624922239,191544067014.11005,blockchain,BINANCE,Global,$,2024-06-04 23:00:00
stock,GOOGL,GOOGL Inc,2023-11-10,19004.00669611895,17273.34992407338,19322.4418865353,16747.752995379513,9899224.991258126,1570924764352.063,automotive,NYSE,US,USD,2023-11-10 17:00:00
stock,AAPL,AAPL Inc,15/04/2024,27243.532972351284,29898.77241885775,31082.792521336058,27234.49833693089,9683014.848287033,631578757038.9326,TECHNOLOGY,NASDAQ,US,$,2024-04-15 23:00:00
stock,GOOGL,GOOGL Inc,2024-01-03,34821.82873502959,32108.81219178781,35589.909176651556,31802.202803864184,5053847.874450457,1473723230861.5212,TECHNOLOGY,NASDAQ,Global,$,2024-01-03 04:00:00
stock,GOOGL,GOOGL Inc,12-25-2023,37290.108985914005,35451.47646762532,38922.855238710246,34493.9718486772,2102640.851111816,2111070108123.5234,tech,NASDAQ,Global,$,2023-12-25 01:00:00
crypto,BNB,BNB Coin,05-25-2024,20896.76211725162,21942.906013213666,22544.177923008225,20250.91816967616,8098954.273970655,346839273306.4353,Crypto,COINBASE,Global,USD,2024-05-25 10:00:00
stock,AMZN,AMZN Inc,07/09/2023,19534.199500327315,18008.960883082058,20408.78987036492,17140.451357675815,8632010.296332194,1757565095617.393,Retail,NYSE,Global,USD,2023-09-07 23:00:00
crypto,ADA,ADA Coin,2023-07-15,31970.54478743528,34670.1358234616,34933.12027170349,31278.30332674693,7644564.19083955,147184802328.8464,blockchain,COINBASE,Global,usd,2023-07-15 11:00:00
stock,AAPL,AAPL Inc,2023-07-09,26286.339410829205,26942.128167034145,27962.59763532991,26077.399337286704,7618369.155661762,2275175659829.9814,Technology,NYSE,Global,USDT,2023-07-09 12:00:00
crypto,SOL,SOL Coin,2023-05-04,49836.35278887608,49183.523416370925,49897.31436675454,47616.0862120262,1278701.7627838587,144831952556.59085,Crypto,BINANCE,Global,USD,2023-05-04 05:00:00
stock,MSFT,MSFT Inc,07-15-2023,14083.936654943647,12825.890405233053,14568.784757329495,12232.044550970355,2033692.2648041258,373113421027.84125,Retail,NYSE,Global,usd,2023-07-15 03:00:00
stock,AMZN,AMZN Inc,2023-02-05,3167.7548678425233,3020.6137094354362,3258.336654778536,3015.2801448185487,8755690.986841714,287770146337.41693,Artificial Intelligence,NYSE,Global,USDT,2023-02-05 21:00:00
stock,MSFT,MSFT Inc,17/04/2024,8811.591131522504,8397.282793750635,8845.24846516156,8304.269593875573,699093.1985541339,2629042437081.521,Automotive,NASDAQ,Global,USD,2024-04-17 05:00:00
stock,TSLA,TSLA Inc,09/02/2023,12401.299860474297,11764.978335889618,13015.613784944824,11621.904320802198,8369556.64355221,1674520055754.3513,Retail,NYSE,US,$,2023-02-09 05:00:00
stock,AAPL,AAPL Inc,2023-11-30,43552.00422681352,44819.2851421604,46939.62659562448,41987.04697990411,5953600.138283167,1720228229178.598,Artificial Intelligence,NYSE,US,usd,2023-11-30 08:00:00
crypto,BTC,BTC Coin,16/10/2023,19652.935878340057,21145.411204476204,22181.328243640393,19155.490092054428,3907015.9073885866,277601882435.0724,Blockchain,COINBASE,US,USD,2023-10-16 02:00:00
stock,AAPL,AAPL Inc,2023-06-07,42638.31 USD,43878.81548127784,43977.04341489686,41662.25485670312,173983.9272869572,1421094406383.8115,AI,NASDAQ,Global,USDT,2023-06-07 05:00:00
crypto,ADA,ADA Coin,07-31-2023,16422.33055438776,16330.390078043998,17078.13834747613,15551.796939388812,1586256.8143805128,312521471546.34515,Crypto,COINBASE,Global,$,2023-07-31 14:00:00
stock,AMZN,AMZN Inc,06-18-2024,11503.958925642573,11131.003857684795,12078.106984909024,11033.838229241695,8839134.247786125,1199901525570.8933,Finance,NASDAQ,Global,$,2024-06-18 01:00:00
stock,GOOGL,GOOGL Inc,2023-02-14,17053.38465690664,16361.279718017351,17252.962542885936,16222.304481344923,6795839.070989564,2811793354361.6685,finance,NYSE,Global,USD,2023-02-14 14:00:00
stock,TSLA,TSLA Inc,2023-08-06,18855.92152223064,18881.23282102916,19379.829590204034,18751.01446132918,3806280.763339216,716154227623.8031,tech,NASDAQ,US,usd,2023-08-06 08:00:00
stock,MSFT,MSFT Inc,01/07/2023,22073.964340386283,23161.648667948688,24238.95985451546,21971.955809641277,570471.720089516,2726486851196.5317,Retail,NYSE,Global,$,2023-07-01 18:00:00
